amusement,http://farm8.staticflickr.com/7427/9535200766_b5f90ba896_z.jpg,2,3,Toilet seat toss A night at Coney Island with Eric and Jenny.  Deno's Wonder Wheel Amusement Park  Eric got 2 out of 3. So he got...light-up fake teeth. Hm.
amusement,http://farm4.staticflickr.com/3684/9459720903_721c6f1e4f_z.jpg,0,5,Flying Dutchman In Motion. Explore dccradio's photos on Flickr. dccradio has uploaded 68244 photos to Flickr.
amusement,http://farm8.staticflickr.com/7439/14103710793_931d1d0e2a_z.jpg,2,3,CarouseHorses02 Explore SpicaNio's photos on Flickr. SpicaNio has uploaded 1612 photos to Flickr.
amusement,http://farm6.staticflickr.com/5530/10290019525_83ff65186f_z.jpg,2,3,IMGP4086 Explore koichimura's photos on Flickr. koichimura has uploaded 13084 photos to Flickr.
amusement,http://farm8.staticflickr.com/7196/6975159441_ff0fd848c9_z.jpg,0,5,"Never Too Old To Ride 2012 Moomba Amusement Ride in Birrarung Marr. Taken from Federation Square Carpark Kudos to the Granny on this ride. It goes pretty high up, must be 60 metres up."
amusement,http://farm4.staticflickr.com/3695/13307783833_9e38c938de_z.jpg,0,5,Horizontal bar Explore markb120's photos on Flickr. markb120 has uploaded 2824 photos to Flickr.
amusement,http://farm8.staticflickr.com/7049/7142294897_18deb29f10_z.jpg,1,4, 
amusement,http://farm8.staticflickr.com/7246/6888614556_56b30c9ae2_z.jpg,1,4,Dadipark Abandoned amusement park in Dadizele Belgium
amusement,http://farm9.staticflickr.com/8205/8243652347_f2b6c59e7d_z.jpg,2,3,DSC_0678 Explore miansoca's photos on Flickr. miansoca has uploaded 16538 photos to Flickr.
amusement,http://farm8.staticflickr.com/7200/6973072961_d39bbc0b7d_z.jpg,0,5,Florida Vacation 2012 261 Explore Liblodgesr's photos on Flickr. Liblodgesr has uploaded 24393 photos to Flickr.
amusement,http://farm4.staticflickr.com/3716/10238444224_b77516735c_z.jpg,2,3,"Fairfield County Fair - Lancaster Ohio - October 12, 2013 Explore rbatina's photos on Flickr. rbatina has uploaded 18267 photos to Flickr."
amusement,http://farm6.staticflickr.com/5197/14213703232_d9bce45eb0_z.jpg,1,4,Rich's Tourist Pose Explore Matt D Gardner's photos on Flickr. Matt D Gardner has uploaded 3752 photos to Flickr.
amusement,http://farm8.staticflickr.com/7274/7596402222_186bf99580_z.jpg,2,3,"beaut, lgance, prix de diane, chantilly, #142, Best of, le Meilleur des Photos-Nature Adely et Yves 2006->2012! Diaporama / Slide Show  ce lien, Plein cran, (F11) full screem recomanded ! www.flickr.com/photos/natureboheme/sets/72157630634570828...   Merci de visionner notre important travail photographique ! Classeur Best of, le Meilleur des Photos-Nature Adely et Yves 2006->2012! Selection of our best photographys 2006->2012 ! Thank you to take an eye on it ! www.flickr.com/photos/natureboheme/collections/7215763007...   Lisez notre manifeste :  (Article paru sur le site des Vgtaliseurs)  Trucs et Astuces !    L'Art et la Manire de donner le got de la Nature et de la Randonne aux enfants.  www.les-vegetaliseurs.com/article-80507-commentdonnerlego...   (Franais, English, Viet nam, Spanish,)  Nous aimons la Vie ! Nous aimons la Nature ! Nous aimons la randonne ! Nous aimons la Lumire ! Nous aimons la Couleur ! Nous pratiquons la Joie de Vivre et la Bonne Humeur! Vive la Nature ! Vive la Vie ! Respectons et Aimons toutes les Formes de Vie !   We love the Life !  We love the Nature !  We love the Nature ! We love hiking ! We love the Light !  We love the Color !  We practice the Joy of Living !  Bravo the Nature ! Respect and Love all the forms of Life !  Live the Life you Love!  Chung toi yeu cuoc song! Chung toi yeu thien nhien ! Chung toi yeu thich di bo duong dai ! Chung toi yeu thich anh sang ! Chung toi yeu thich mau sac !  Chung toi thuc hanh niem vui duoc song ! Hoan ho Thien Nhien ! Hoan ho Cuoc song ! Hay Kinh Trong va Yeu thuong tat ca nhung hinh thuc cua Cuoc Song !   Nos Gusta la vida !  Nos gusta la naturaleza !   Nos gusta la caminata !   Nos gusta la luz !  Nos gusta el color ! Viva la Naturaleza !  Viva la Vida ! Respectomos e amenos todas las formas de vida ! Live the Life you Love!     [Mots Clefs :  ""me d'enfant"" ""bonne humeur""  Good mood  ""fou rire"" laughter ""joie de vivre"" exhilaration ""marche  pied"" walking allgresse  amusements amuser apaisement ardeur balade jaunt  bien-tre well-being bizarre odd  blague joke  bonheur happiness bucolique calme campagnard campagne countryside champtre champs contempler contentement ""coup de cur"" curieux curious distraction divertir divertissement gayer enchantement delightfulness enthousiasme espigle trange strange excursion pleasure trip  extraordinaire extraordinary fe ferie flicit ferveur flnerie force forestier fort forest  gaiet merriment gait guilleret herbages humour humor idyllique inaccoutum insolite unusual inspiration jeux joie, jouer jubilation liesse lyrisme malicieux muse nature observer paix pastoral pturages prairie pdestre ptillant plaire plaisanter plaisanterie posie poetry pote prairies prs prodigieux promenade outing quitude randonne ramble ravissement rcrer regarder  rjouir rigolo rire ritournelle romanesque romantique romantisme romanticism sentier srnit singulier *sourire smile sous-bois undergrowth surprenant  vif vire vitalit zen tamycoladelyves natureboheme clairefontaine yves-Noel-Marie Gonnet-Nguyen ] "
amusement,http://farm4.staticflickr.com/3798/9282083946_b39dc0f7f2_z.jpg,0,5,IMG_0118.jpg Explore invertalon's photos on Flickr. invertalon has uploaded 9725 photos to Flickr.
amusement,http://farm9.staticflickr.com/8381/8459990984_cb7110f0f2_z.jpg,1,4,First Drop of Infusion Explore CoasterMadMatt's photos on Flickr. CoasterMadMatt has uploaded 73333 photos to Flickr.
amusement,http://farm6.staticflickr.com/5331/9505763097_b383d2cab5_z.jpg,2,3,EPCOT ENTRANCE AT NIGHT Epcot Walt Disney World
amusement,http://farm4.staticflickr.com/3731/9287609070_e76dfcd9f5_z.jpg,2,3,"NYCConeyMermaid_20130622_451 Hungry March Band kids, Coney Island Mermaid Parade, Brooklyn, NY Linda Dawn Hammond / IndyFoto.com 2013 June 22, 2013"
amusement,http://farm3.staticflickr.com/2870/9438075933_778d7782d9_z.jpg,1,4,"Fun In The Park 2013 Wilsonville's Fun In The Park was held for the 13th time on Saturday. Once again, Town Center Park was packed with amusements, food, clowns, revelers, music and a whole lot more. This free celebration attracted over 10,000 people to the center of Wilsonville. "
amusement,http://farm9.staticflickr.com/8569/16315299430_1316ac6651_z.jpg,0,5,"Orlando's parks My photos and video can be bought on the site shutterstock, Dmitro2009 nickname. All footage is available for licensing in my portfolio. The prices of video in permission of full HD not high. www.pond5.com/stock-video-footage/1/artist:dmitro2009.html or to this address: www.pond5.com/artist/dmitro2009 Or in the search bar on the site pond5 write artist:dmitro2009 and any word to which it is necessary to find a story. For example the word nature in my portfolio: ""artist:dmitro2009 nature"""
amusement,http://farm9.staticflickr.com/8168/7595497018_7199b7191a_z.jpg,1,4,"pompier, grande chelle, vehicule, collection, remarquable, beau comme un camion, #112  Best of, le Meilleur des Photos-Nature Adely et Yves 2006->2012! Diaporama / Slide Show  ce lien, Plein cran, (F11) full screem reomanded !  www.flickr.com/photos/natureboheme/sets/72157630632277590...   Merci de visionner notre important travail photographique ! Classeur Best of, le Meilleur des Photos-Nature Adely et Yves 2006->2012! Selection of our best photographys 2006->2012 ! Thank you to take an eye on it ! www.flickr.com/photos/natureboheme/collections/7215763007...   Lisez notre manifeste :  (Article paru sur le site des Vgtaliseurs)  Trucs et Astuces !    L'Art et la Manire de donner le got de la Nature et de la Randonne aux enfants.  www.les-vegetaliseurs.com/article-80507-commentdonnerlego...   (Franais, English, Viet nam, Spanish,)  Nous aimons la Vie ! Nous aimons la Nature ! Nous aimons la randonne ! Nous aimons la Lumire ! Nous aimons la Couleur ! Nous pratiquons la Joie de Vivre et la Bonne Humeur! Vive la Nature ! Vive la Vie ! Respectons et Aimons toutes les Formes de Vie !   We love the Life !  We love the Nature !  We love the Nature ! We love hiking ! We love the Light !  We love the Color !  We practice the Joy of Living !  Bravo the Nature ! Respect and Love all the forms of Life !  Live the Life you Love!  Chung toi yeu cuoc song! Chung toi yeu thien nhien ! Chung toi yeu thich di bo duong dai ! Chung toi yeu thich anh sang ! Chung toi yeu thich mau sac !  Chung toi thuc hanh niem vui duoc song ! Hoan ho Thien Nhien ! Hoan ho Cuoc song ! Hay Kinh Trong va Yeu thuong tat ca nhung hinh thuc cua Cuoc Song !   Nos Gusta la vida !  Nos gusta la naturaleza !   Nos gusta la caminata !   Nos gusta la luz !  Nos gusta el color ! Viva la Naturaleza !  Viva la Vida ! Respectomos e amenos todas las formas de vida ! Live the Life you Love!   [Mots Clefs :  ""me d'enfant"" ""bonne humeur""  Good mood  ""fou rire"" laughter ""joie de vivre"" exhilaration ""marche  pied"" walking allgresse  amusements amuser apaisement ardeur balade jaunt  bien-tre well-being bizarre odd  blague joke  bonheur happiness bucolique calme campagnard campagne countryside champtre champs contempler contentement ""coup de cur"" curieux curious distraction divertir divertissement gayer enchantement delightfulness enthousiasme espigle trange strange excursion pleasure trip  extraordinaire extraordinary fe ferie flicit ferveur flnerie force forestier fort forest  gaiet merriment gait guilleret herbages humour humor idyllique inaccoutum insolite unusual inspiration jeux joie, jouer jubilation liesse lyrisme malicieux muse nature observer paix pastoral pturages prairie pdestre ptillant plaire plaisanter plaisanterie posie poetry pote prairies prs prodigieux promenade outing quitude randonne ramble ravissement rcrer regarder  rjouir rigolo rire ritournelle romanesque romantique romantisme romanticism sentier srnit singulier *sourire smile sous-bois undergrowth surprenant  vif vire vitalit zen tamycoladelyves natureboheme clairefontaine yves-Noel-Marie Gonnet-Nguyen ] "
amusement,http://farm8.staticflickr.com/7300/13132538135_02ef31f249_z.jpg,2,3,amusement 2 Explore tyrdhead's photos on Flickr. tyrdhead has uploaded 1293 photos to Flickr.
amusement,http://farm4.staticflickr.com/3687/11419668006_9b814cf14d_z.jpg,2,3,"Structures gonflables pour enfants. Structures gonflables pour enfants au Palais du Lac (Vichy (03200), Allier (03), Auvergne, France). / Inflatable structures (bouncy castle type) for kids in an indoor funfair (Vichy (03200), Allier (03), Auvergne, France).   Keywords = Palais du Lac; Centre Omnisports Pierre Coulon; Allier; Vichy; Auvergne; France; loisir; jeu pour enfant; jeux pour enfants; structure gonflable; structures gonflables; parc d'attraction en intrieur; toboggan; en salle; fte foraine; divertissement; divertissements; distractions; distraction; /; public; sports; sport; Vichy; Auvergne; French; complex; leisure; games for children; game for child; kid; kids; inflatable; inflatables; indoor; amusement park; indoors; fun fair; funfair; fairground; fair ground; inflated; bouncy; bounce; inflatable slide; inside; room; interior; inner; hall; play; device; pleasure; playing; having fun; on; bouncy castle; type; attraction; bouncing castle; colourful; inflatable structure; structures; amusement; entertainment"
amusement,http://farm4.staticflickr.com/3668/8756977143_2a6d9b396f_z.jpg,0,5,Gerstlauer Trains on Iron Rattler at Six Flags Fiesta Texas Diving down the cliff wall.
amusement,http://farm4.staticflickr.com/3879/14398709213_38e4aaa45a_z.jpg,1,4,"Counterpoint While the younger, braver souls in my family scrambled themselves on this compact rollercoaster, I found some wonderful visual abstractions. I like how the glimpses of track at the top right and bottom left are counterpoints to the smooth curve in the centre of the image."
amusement,http://farm8.staticflickr.com/7323/9233606908_8bc14f610d_z.jpg,2,3,DSC00762 Explore SteveLinn15's photos on Flickr. SteveLinn15 has uploaded 7394 photos to Flickr.
amusement,http://farm4.staticflickr.com/3798/9587401433_f271997af6_z.jpg,1,4,Tsnuami Explore CoasterMadMatt's photos on Flickr. CoasterMadMatt has uploaded 73334 photos to Flickr.
amusement,http://farm4.staticflickr.com/3679/9232476318_f7e2c6bf95_z.jpg,1,4,"Gyro Park, Victoria BC Explore SwellMap's photos on Flickr. SwellMap has uploaded 9623 photos to Flickr."
amusement,http://farm4.staticflickr.com/3790/10565598534_457e64d889_z.jpg,2,3,"Pizza Hut, Tidal Wave, Stealth & Swarm Explore CoasterMadMatt's photos on Flickr. CoasterMadMatt has uploaded 73334 photos to Flickr."
amusement,http://farm3.staticflickr.com/2813/10345971273_dc4f8e99c7_z.jpg,1,4,ride on-3345 Explore Justbecausephoto's photos on Flickr. Justbecausephoto has uploaded 5608 photos to Flickr.
amusement,http://farm8.staticflickr.com/7056/6942138791_dca26a5a0d_z.jpg,2,3, 
amusement,http://farm9.staticflickr.com/8541/8699462783_f165c639fa_z.jpg,2,3,Blue Fire Through the Arch of Scandinavia Explore CoasterMadMatt's photos on Flickr. CoasterMadMatt has uploaded 73334 photos to Flickr.
amusement,http://farm8.staticflickr.com/7255/7624141672_2487f5f3f3_z.jpg,2,3, 
amusement,http://farm9.staticflickr.com/8426/7641849682_51c6c751b2_z.jpg,1,4,"Calaway Park, Random Photos Just a few random action shots from super fun Calaway Park in Calgary"
amusement,http://farm9.staticflickr.com/8293/7726965688_ebd6b2c6fb_z.jpg,0,5,Disneyland Explore Syd Heresy's photos on Flickr. Syd Heresy has uploaded 1084 photos to Flickr.
amusement,http://farm6.staticflickr.com/5487/9727390955_a95c062039_z.jpg,1,4,Royal Adelaide Show '13                                
amusement,http://farm9.staticflickr.com/8523/8678600890_2c027c7b15_z.jpg,1,4,The Boomerang at Wurstelprater Amusement Park. #vienna #austria #wien #wurstelprater #prater #rollercoaster Explore dceej's photos on Flickr. dceej has uploaded 1841 photos to Flickr.
amusement,http://farm9.staticflickr.com/8288/7518630490_1e5f2a87e6_z.jpg,2,3,TKSFG 7-6-2012 8-12-41 PM Explore raptor2142's photos on Flickr. raptor2142 has uploaded 9237 photos to Flickr.
amusement,http://farm6.staticflickr.com/5540/9073898554_43d48293a7_z.jpg,1,4,Decaying Amusement Park (1) Darryl W. Moran Photography www.facebook.com/Subject.Matters.Photography/
amusement,http://farm9.staticflickr.com/8068/8173597932_1c099680eb_z.jpg,2,3,Rapids Illuminated Explore CoasterMadMatt's photos on Flickr. CoasterMadMatt has uploaded 73335 photos to Flickr.
amusement,http://farm8.staticflickr.com/7349/12707339163_939bd1a989_z.jpg,1,4,6M3C6244.jpg Explore invertalon's photos on Flickr. invertalon has uploaded 9725 photos to Flickr.
amusement,http://farm3.staticflickr.com/2936/13961394481_b4420b26cb_z.jpg,1,4,DSCN9999 Explore Metufer's photos on Flickr. Metufer has uploaded 4249 photos to Flickr.
amusement,http://farm6.staticflickr.com/5443/9098869807_bccf367c92_z.jpg,2,3,DSCN3725 Explore SteveLinn15's photos on Flickr. SteveLinn15 has uploaded 7394 photos to Flickr.
amusement,http://farm8.staticflickr.com/7289/9161308879_cc49f7b918_z.jpg,0,5,"Kings Island / Spirit Song - June 27, 2013 Sight seeing and people watching.  Let me know if you see yourself in any of these pics.  :-)"
amusement,http://farm9.staticflickr.com/8053/8140507002_2bfc56a212_z.jpg,1,4,Walt Disney World Orlando Florida theme park and rides in Disneys Magic Kingdom Walt Disney World Orlando Florida theme park and rides in Disneys Magic Kingdom amusement park 2012
amusement,http://farm6.staticflickr.com/5469/9122319766_0e99ca4848_z.jpg,1,4,ThomasAmusements2013_Flickr-14 Explore TP9_'s photos on Flickr. TP9_ has uploaded 6244 photos to Flickr.
amusement,http://farm9.staticflickr.com/8465/8084438986_6fd2aa7051_z.jpg,1,4,Dreamland Amusements Orient Express Coaster At Night. Explore dccradio's photos on Flickr. dccradio has uploaded 68244 photos to Flickr.
amusement,http://farm9.staticflickr.com/8159/7359809170_12591195e7_z.jpg,0,5,23/52: Upside Down Caught this shot of the Screaming Eagle at the local amusement park during my son's 5th grade field trip.
amusement,http://farm8.staticflickr.com/7493/16198110226_6f827d81bf_z.jpg,2,3,Spinning for fun Some Chicago style fun next to Lake Michigan.
amusement,http://farm9.staticflickr.com/8028/7485542096_f3815d5de4_z.jpg,1,4,"Clarence Pier, Southsea Southsea, Hampshire"
amusement,http://farm8.staticflickr.com/7332/10394644665_4d950cd58c_z.jpg,2,3,untitled-024.jpg Explore EntirelyAmelia's photos on Flickr. EntirelyAmelia has uploaded 1714 photos to Flickr.
amusement,http://farm4.staticflickr.com/3736/9539339220_2d2c8c7bb4_z.jpg,2,3,Water Spheres 5 Explore deepchi1's photos on Flickr. deepchi1 has uploaded 15974 photos to Flickr.
amusement,http://farm9.staticflickr.com/8168/7481341428_dd0c3e77b7_z.jpg,2,3,"27520010 Walt Disney World, FL"
amusement,http://farm4.staticflickr.com/3373/13019475513_f3256509bf_z.jpg,2,3,Flump_256 everland
amusement,http://farm6.staticflickr.com/5456/8877910323_9e08e2b5dc_z.jpg,2,3,"jumble May 29, 2013: Coney Island"
amusement,http://farm8.staticflickr.com/7110/7515994664_a12fb4bf47_z.jpg,2,3,IMG_8822 Explore Delphic Photography's photos on Flickr. Delphic Photography has uploaded 4472 photos to Flickr.
amusement,http://farm3.staticflickr.com/2900/14214122262_fa81b2c494_z.jpg,1,4,LegoLand CA 4-10 LegoLand Amusement Park
amusement,http://farm3.staticflickr.com/2863/11282346126_81af9fdd57_z.jpg,0,5,IMG_2444 Explore Coney Island Photo Diary's photos on Flickr. Coney Island Photo Diary has uploaded 9540 photos to Flickr.
amusement,http://farm8.staticflickr.com/7086/7345361476_ce623c9d00_z.jpg,1,4,IMG_1335_689 Explore Luna Park Coney Island's photos on Flickr. Luna Park Coney Island has uploaded 3491 photos to Flickr.
amusement,http://farm9.staticflickr.com/8289/7849068636_d19d9051ac_z.jpg,2,3,"This is so much fun. i really wanted cotton candy as opposed to a lollipop and i also wouldn't mind a more exciting background, so i will probably reshoot this the next time i go to a fair or amusement park. but for now this will do- it is growing on me."
amusement,http://farm8.staticflickr.com/7391/14155224626_682995a89b_z.jpg,2,3,"WVIA Day at Knoebels 2014 Pictures from WVIA's Member Day at Knoebel's Amusement Park on May 10th, 2014."
amusement,http://farm9.staticflickr.com/8191/8404481518_00130d3161_z.jpg,1,4,screenshots4_RGGKenzan Ryu Ga Gotoku Kenzan! - Copyright 2013 - Sega Corporation - Todos os direitos reservados. O site Tojo HQ no tem direito algum sobre as imagens acima.
amusement,http://farm9.staticflickr.com/8331/8126945031_4f773c6b4d_z.jpg,0,5,Disney Halloween 033 Explore danimaniacs' photos on Flickr. danimaniacs has uploaded 96650 photos to Flickr.
amusement,http://farm8.staticflickr.com/7059/13858669625_2ddc19e747_z.jpg,0,5,Story Land-2738 Follow me on twitter Visit my Website Find me on Facebook
amusement,http://farm4.staticflickr.com/3792/9009840477_3bc8163630_z.jpg,2,3,6M3C6686.jpg Explore invertalon's photos on Flickr. invertalon has uploaded 9725 photos to Flickr.
amusement,http://farm9.staticflickr.com/8318/7895548486_6c3bf49bd4_z.jpg,2,3,IMG_0685 Centreville Amusement Park
amusement,http://farm4.staticflickr.com/3728/14107434260_3fa4df2b79_z.jpg,1,4,"Woolpit Steam 2013 Woolpit Steam 1st & 2nd June 2013 Warren Farm, Wetherden  (Photos taken on first day)     Featuring:  Stationary Engines Vintage Cars Motorcycles Vintage Tractors Working Vintage Farm Machinery Steam & Traction Engines Military, Light & Heavy Commercial Vehicles Model Displays    To keep the kids happy there was a old traditional Fun Fair, including Savage Electric Yachts (1915), Dodgems, Childrens Car Ride & Roundabout plus Old Time Amusement Arcade."
amusement,http://farm8.staticflickr.com/7458/9198277872_09c89eb2f7_z.jpg,1,4,Cedar Point Park Explore BuLLNJ5's photos on Flickr. BuLLNJ5 has uploaded 8641 photos to Flickr.
amusement,http://farm8.staticflickr.com/7226/6928959040_8dd10bdea5_z.jpg,0,5,"Acrobats at Parc Asterix At the Parc Asterix north of Paris. || Photo info: Taken 2012-04-08 with Canon EOS 5D Mark II, EF24-105mm f/4L IS USM,  sec at f/4.0, focal length 67 mm, ISO 800. Copyright 2012 ."
amusement,http://farm9.staticflickr.com/8380/8565155116_dbbcaf710a_z.jpg,2,3,Spreepark Explore Johnstonebatt's photos on Flickr. Johnstonebatt has uploaded 78 photos to Flickr.
amusement,http://farm6.staticflickr.com/5538/10396700376_117f9c34df_z.jpg,2,3,untitled-182.jpg Explore EntirelyAmelia's photos on Flickr. EntirelyAmelia has uploaded 1714 photos to Flickr.
amusement,http://farm9.staticflickr.com/8468/8114174403_0fef9df486_z.jpg,0,5,Fair Games Explore Shallow Focus Studios' photos on Flickr. Shallow Focus Studios has uploaded 155 photos to Flickr.
amusement,http://farm8.staticflickr.com/7434/10752733665_2d1a37ac23_z.jpg,2,3,Our Lady Queen of Peace Fall Festival. JCJ Amusements.
amusement,http://farm8.staticflickr.com/7190/6984371290_30dd043e88_z.jpg,0,5,DSC_6011 Explore beltz6's photos on Flickr. beltz6 has uploaded 5153 photos to Flickr.
amusement,http://farm3.staticflickr.com/2861/10427088803_78b12e945b_z.jpg,0,5,_MG_1649 Linnanmen valokarnevaali 2013 
amusement,http://farm9.staticflickr.com/8351/8326135166_bd681dee75_z.jpg,1,4,Playing for Pegs All fun and games on the beach. But best not get on a losing streak or you'll be wearing pegs on your ears to the amusement of your mates. 
amusement,http://farm3.staticflickr.com/2926/14255026179_d6ea4c33ca_z.jpg,1,4,Clowning around. Explore Vector Collapse's photos on Flickr. Vector Collapse has uploaded 6731 photos to Flickr.
amusement,http://farm9.staticflickr.com/8384/8527649316_1c464a5c00_z.jpg,2,3,CONEY ISLAND POLAR BEAR CLUB 03/03 2013 PHOTOS BY GORDON GATTSEK Top88nynet1@Aol.Com swim 03/03/2013
amusement,http://farm9.staticflickr.com/8067/8235412099_73e9e00c86_z.jpg,0,5,"CU638 Fireball Hunterdon County Fair, 2012."
amusement,http://farm4.staticflickr.com/3697/9429939389_bf8173a785_z.jpg,2,3,"wave swinger Looks like they replaced the faded murals with pictures from around the region.  Lake Winnepesaukah Rossville, Georgia"
amusement,http://farm9.staticflickr.com/8477/8256579398_ca425baa2a_z.jpg,2,3,Phoenix Phall Phunfest 2012 Phoenix Phall Phunfest 2012
amusement,http://farm8.staticflickr.com/7225/7325043860_fa1a65608b_z.jpg,0,5, 
amusement,http://farm8.staticflickr.com/7492/15904793500_fdb54b25ba_z.jpg,1,4,Canada's Wonderland ad shoot trip Explore electrofreeze's photos on Flickr. electrofreeze has uploaded 30799 photos to Flickr.
amusement,http://farm6.staticflickr.com/5447/7151148625_637b2cf68a_z.jpg,2,3,"Disney Wonder in Honolulu IMG_9059 - For the first time ever, a Disney cruise ship sailed to Hawaii. This is the Disney Wonder, a 964 ft. long vessel that can carry up to 2,400 passengers and a crew of over 900 personnel. Disney operates these ships mainly as family friendly vessels and probably serves as a compliment to their amusement parks, resorts and other properties. Disney operates a resort here in Hawaii near Kapolei on Oahu.  Canon 600D - May 6, 2012."
amusement,http://farm6.staticflickr.com/5345/10236598094_295a72973b_z.jpg,1,4,"Goose Fair, Nottingham The 719th Goose Fair in Nottingham, UK."
amusement,http://farm9.staticflickr.com/8269/10279298175_421801e8a7_z.jpg,0,5,"Untitled Kennywood West Mifflin, PA"
amusement,http://farm9.staticflickr.com/8394/8918850902_a3196849b1_z.jpg,2,3,"Ferris Wheel Portland, Oregon"
amusement,http://farm9.staticflickr.com/8017/7293942334_85a2bab3ec_z.jpg,2,3,Park of amusement Park of my childhood.
amusement,http://farm9.staticflickr.com/8323/8140496865_2535ae579e_z.jpg,1,4,Walt Disney World Orlando Florida theme park and rides in Disneys Magic Kingdom Walt Disney World Orlando Florida theme park and rides in Disneys Magic Kingdom amusement park 2012
amusement,http://farm4.staticflickr.com/3739/8917782369_4f09218c90_z.jpg,0,5,Smile. Forever. Explore CoasterMadMatt's photos on Flickr. CoasterMadMatt has uploaded 73338 photos to Flickr.
amusement,http://farm4.staticflickr.com/3844/14390864321_a64d371f36_z.jpg,0,5,Wild River 05/31/2014 Luna Park visitors riding the Wild River log flume. Kodak Ektar 100. Canon A-1. Canon FD 50mm 1:1.4.
amusement,http://farm4.staticflickr.com/3749/9282387724_3e5d524ed8_z.jpg,0,5,Fiesta Texas 1992
amusement,http://farm8.staticflickr.com/7184/6920204779_8d0a728831_z.jpg,1,4,"Experience at amusement park 4 This ride was a mini rollercoaster for young children. It captures the speed, movement, colour and light, as the image was taken on a long shutter speed. "
amusement,http://farm8.staticflickr.com/7455/9364268008_066d98d177_z.jpg,0,5,Boardwalk Explore photoobsessed1's photos on Flickr. photoobsessed1 has uploaded 1357 photos to Flickr.
amusement,http://farm8.staticflickr.com/7339/9277934009_c56322d098_z.jpg,2,3,"Ocean County Fair July 13, 2013 - Full set: goo.gl/hIbs5"
amusement,http://farm3.staticflickr.com/2908/14109666678_8544ee2f1b_z.jpg,2,3,"DSC_7120.jpg And the gondola ride out to Vin Pearl.  Which, if you're ever there, Oh, I dunno.  Go or don't go, but be warned, it's a very surreal experience.  Amusement park, aquarium, water park, but nobody was there."
amusement,http://farm8.staticflickr.com/7456/16513330912_3805856bb3_z.jpg,2,3, 
amusement,http://farm8.staticflickr.com/7447/9192593997_d777cebca9_z.jpg,2,3,"2013-052688 Vienna (Wien), Austria-Prater (Black Mamba)                         "
