amusement,http://farm9.staticflickr.com/8297/7747037716_9ffece0b50_z.jpg,0,5,"Luna Park, Coney Island Luna Park In action, with Wonder Wheel in background.   Follow me on facebook. Or G+."
amusement,http://farm8.staticflickr.com/7137/7612566260_436d0d9a4b_z.jpg,2,3,"Disneyland (Anaheim, California) - Thursday July 12, 2012 Visit to Disneyland in Anaheim, California on Thursday July 12, 2012.  A wonderful day...even with the rain (though we were told repeatedly that it never rains in Southern California...never...never, ever.  I really love this park."
amusement,http://farm4.staticflickr.com/3824/10277665676_a7c420008a_z.jpg,0,5,"DSC_1856 This local tradition goes back to 18th century or earlier. First called Michaelmas Fair, and still held on the first Monday after old Michaelmas day  Name comes from""pact"" or    agreement made between farmer and       worker at these hiring fairs. It was    also a cattle and sheep fair.            In the 19th century, was announced     by urchins blowing cows horns after     clock struck midnight. Now a street     market and fun fair,"
amusement,http://farm3.staticflickr.com/2883/10287489515_cd6881008b_z.jpg,1,4,Untitled_HDR4 Explore alisebel's photos on Flickr. alisebel has uploaded 465 photos to Flickr.
amusement,http://farm6.staticflickr.com/5562/14226884935_5440ec67ea_z.jpg,1,4,Coney Island in May Explore TheLWeiss' photos on Flickr. TheLWeiss has uploaded 230 photos to Flickr.
amusement,http://farm8.staticflickr.com/7439/10595104056_8d5e427942_z.jpg,1,4,Heidepark Soltau - Aqua Spin Video vom Heidepark: www.youtube.com/watch?v=OnwPf4484QA
amusement,http://farm4.staticflickr.com/3790/9257416235_0d9424aeaf_z.jpg,1,4,"NYCConeyMermaid_20130622_125 Pre-Coney Island Mermaid Parade, Brooklyn, NY Linda Dawn Hammond / IndyFoto.com 2013 June 22, 2013"
amusement,http://farm8.staticflickr.com/7046/7006780210_aac9370921_z.jpg,2,3,John Marshall Carnival gamble amusements 052 Explore WillynWV's photos on Flickr. WillynWV has uploaded 25887 photos to Flickr.
amusement,http://farm8.staticflickr.com/7043/6826902894_e62c3ecc7c_z.jpg,2,3,Florida Vacation 2012 87 Explore Liblodgesr's photos on Flickr. Liblodgesr has uploaded 24393 photos to Flickr.
amusement,http://farm4.staticflickr.com/3707/10530777456_738702ca53_z.jpg,0,5,Around the Cobra Roll Explore CoasterMadMatt's photos on Flickr. CoasterMadMatt has uploaded 73325 photos to Flickr.
amusement,http://farm9.staticflickr.com/8457/8027913845_65fced6b05_z.jpg,1,4,Inflatable Water Balls Inflatable Water Balls - Mlnick vinobran
amusement,http://farm4.staticflickr.com/3777/9245661696_f374dd1a49_z.jpg,0,5,Kings Dominion A hot day at the amusement park.
amusement,http://farm9.staticflickr.com/8356/8275465527_84bec3dc19_z.jpg,1,4,IMG_3286.jpg Explore LarryClerk's photos on Flickr. LarryClerk has uploaded 240 photos to Flickr.
amusement,http://farm9.staticflickr.com/8265/8666991196_f1fdc09fb8_z.jpg,1,4,"The Smiler Construction (20/4/13): Station Building Whilst this bit of track hasn't changed since March, the station building has. It now looks a lot more complete from the outside"
amusement,http://farm6.staticflickr.com/5485/10043168985_db4b408ac4_z.jpg,1,4,"Lard Lad Donuts Universal Studios Orlando in Orlando, FL.  "
amusement,http://farm9.staticflickr.com/8004/7239428862_d53671c855_z.jpg,0,5,"Splish and Splash - U.S. Army Garrison Humphreys, South Korea - 19 May 2012 Click here to learn more about Camp Humphreys  U.S. Army photos by Rakendra Moore  United States Army Garrison Humphreys Public Affairs Office  CAMP HUMPHREYS - Splish & Splash made quite a wave on May 19, as the popular water park opened here for the season.  This is the first time I have ever been to Splish & Splash, and its fun, said Alex Bourque, age 8, who said his favorite amusements were the water slides.  OMyreonia Manning, age 7, said she was also happy to be there. Ive been enjoying the whole day at this water park, she said. I love being able to swim with my friends.  Also having a great time was Silas Angell, age 9. This is great, he said. We can go on the water slides.  Children werent the only ones impressed. I think its awesome, said Tiffany Stone, a mother of three. My children waited all week for this, and when we got up this morning, they reminded us that today was the day Splish & Splash opened.  Namsoon Toney said the park is wonderful. There is clear water here and a lot of animal play things for the children, she said.  The water park features two slide pools, an Olympic-sized pool and three diving boards. It can accommodate over 1,000 people and has sun beds for those wanting a tan, or umbrellas for those looking for shade. The park also offers a snack bar, a stage for bands to play and the option to rent the park for after-hour parties.    Were here for the Soldiers and their families, said Charles Rodgers, Splish & Splash manager. The best part of this job is seeing the smiles on peoples faces."
amusement,http://farm9.staticflickr.com/8360/8444138182_940395cdde_z.jpg,2,3,"Pattaya Situated on the east coast of the Gulf of Thailand, Pattaya receives millions of visitors annually. Family-friendly Jomtien Beach makes a pleasant contrast to crowded, polluted Pattaya Beach, with its jetskis and beach bars. Daytrips to nearby island groups are popular diversions, as are days spent at Pattaya's 21 golf courses and slew of amusement parks. Although more families are now visiting the city, most tourists flock for Pattay's legendary nightlife. Baht bus routes cover main streets. "
amusement,http://farm4.staticflickr.com/3828/10246560234_143d8788b0_z.jpg,2,3,Welcome to Fun City Explore CoasterMadMatt's photos on Flickr. CoasterMadMatt has uploaded 73325 photos to Flickr.
amusement,http://farm8.staticflickr.com/7239/7337777968_b32b18573a_z.jpg,0,5,Untitled Explore joyrex's photos on Flickr. joyrex has uploaded 2434 photos to Flickr.
amusement,http://farm8.staticflickr.com/7225/6984336218_19ab9694a6_z.jpg,1,3,DSC_5878 Explore beltz6's photos on Flickr. beltz6 has uploaded 5153 photos to Flickr.
amusement,http://farm6.staticflickr.com/5350/6934944492_ce44d82555_z.jpg,0,5,IMG_9099 (Large) Explore Coney Island Photo Diary's photos on Flickr. Coney Island Photo Diary has uploaded 9540 photos to Flickr.
amusement,http://farm8.staticflickr.com/7269/7130432897_064137c72e_z.jpg,1,4,DSC_5931 Explore beltz6's photos on Flickr. beltz6 has uploaded 5153 photos to Flickr.
amusement,http://farm3.staticflickr.com/2840/9328582412_547337c80b_z.jpg,2,3,"2013_Vidmpark_1240 The old wooden roller coaster in the Amusement Park of Budapest, Hungary. The historic ride was built in 1922 and still runs the old nicely carved wooden cars, and each train is driven by a driver sitting on the middle car. There is only one motorized slope at the beginning, a rattling chain pulling up the train to the top, the train has no engine and there is only coming down throughout the long ride after that. Although the theme park closed in September 2013, they kept this roller coaster as a heritage piece. Pictures taken during our last visit to the park in June 2013, together with our own and my sister-in-law's family.  A rgi nagy fa hullmvast a budapesti vidmparkban - 1922-ben plt, de mg a vidmpark 2013-as bezrsa utn is meghagytk emlkl. A faragott rgi kocsik mellett az is rdekessg, hogy minden szerelvnyt egy rajta utaz vezet irnyt. A szerelvnyben nincs motor, s a plyn is csak az els nagy emelkedn vontatja fel egy lncos emel, utna mr vgig a gravitci viszi elre a hossz plyn. Ezek a kpek utols ltogatsunkkor kszltek 2013. jniusban, amikor a gyerekekkel s sgornmk csaldjval tltttnk ott egy egsz napot."
amusement,http://farm6.staticflickr.com/5461/9068748194_c96776b9c5_z.jpg,2,3,Cedar Point 2013 Vacation Explore josephburkearts' photos on Flickr. josephburkearts has uploaded 15124 photos to Flickr.
amusement,http://farm9.staticflickr.com/8206/8211067422_c8a3ddabc1_z.jpg,1,4,Burn 'em and Buried Ringmaster You might remember this guy.
amusement,http://farm3.staticflickr.com/2864/9230977815_e647ac66b2_z.jpg,2,3,DSC00715 Explore SteveLinn15's photos on Flickr. SteveLinn15 has uploaded 7394 photos to Flickr.
amusement,http://farm6.staticflickr.com/5494/10010981054_0dcd69c4d6_z.jpg,0,5,DSC02195                                
amusement,http://farm8.staticflickr.com/7390/12553789614_0166110324_z.jpg,0,5,Abandoned roller coaster Explore the crazy french man's photos on Flickr. the crazy french man has uploaded 1575 photos to Flickr.
amusement,http://farm9.staticflickr.com/8054/8146922503_04422a6b69_z.jpg,2,3,Walt Disney World Orlando Florida theme park and rides in Disneys Animal Kingdom amusement park 2012 animal conservation Walt Disney World Orlando Florida theme park and rides in Disneys Animal Kingdom amusement park 2012 animal conservation
amusement,http://farm4.staticflickr.com/3927/15250591320_59060a0632_z.jpg,0,5, 
amusement,http://farm8.staticflickr.com/7397/8991093480_e753af3aa0_z.jpg,2,3,Station area of the Revolution Explore CoasterMadMatt's photos on Flickr. CoasterMadMatt has uploaded 73325 photos to Flickr.
amusement,http://farm9.staticflickr.com/8035/8073943466_9933d684af_z.jpg,2,3,Enterprise Explore trumpeterny's photos on Flickr. trumpeterny has uploaded 10187 photos to Flickr.
amusement,http://farm8.staticflickr.com/7512/16007806215_9827f0de48_z.jpg,1,4,0554J141A Stuffed animals prizes at a carnival booth game.
amusement,http://farm6.staticflickr.com/5481/9571748466_ff1ebdc392_z.jpg,2,3,"Denos D Vourderis Place, Coney Island #DidYouKnow there's a street in Coney Island named after the founder of Deno's Wonder Wheel Amusement Park? Tell your friends to meet you at Denos D Vourderis Place (W 12th St) and the Boardwalk and go for a spin on Deno's Wonder Wheel!"
amusement,http://farm8.staticflickr.com/7420/12135982065_b7dc274084_z.jpg,2,3,A&P Shows Funnel Force Swings At Night. Explore dccradio's photos on Flickr. dccradio has uploaded 68244 photos to Flickr.
amusement,http://farm6.staticflickr.com/5236/7415955802_7c6958ea9e_z.jpg,0,5,Foolin' around Explore AFRS02's photos on Flickr. AFRS02 has uploaded 149 photos to Flickr.
amusement,http://farm6.staticflickr.com/5518/9137644138_f2692f6900_z.jpg,1,4,Amusement Park Explore Science Museum of MN Youth Programs' photos on Flickr. Science Museum of MN Youth Programs has uploaded 53672 photos to Flickr.
amusement,http://farm6.staticflickr.com/5512/11719218144_f795c8696b_z.jpg,2,3,Happy new year 2014 Explore kana hata's photos on Flickr. kana hata has uploaded 4367 photos to Flickr.
amusement,http://farm8.staticflickr.com/7428/9653910687_39395508ef_z.jpg,1,4,What Kids? Explore subterraneancarsickblues' photos on Flickr. subterraneancarsickblues has uploaded 947 photos to Flickr.
amusement,http://farm8.staticflickr.com/7263/7869129614_f9e2d48d72_z.jpg,0,5,"Starship Ride At Hershey Park, Hershey, PA."
amusement,http://farm8.staticflickr.com/7158/6825226845_9fae0dd27f_z.jpg,1,4,"Enchanted Voyage (1983) Hanna-Barbera Land Kings Island Amusement Park Cincinnati, OH"
amusement,http://farm9.staticflickr.com/8487/8173568961_81e3ed25fc_z.jpg,1,4,Subtle Lights on the Black Widows Web Explore CoasterMadMatt's photos on Flickr. CoasterMadMatt has uploaded 73325 photos to Flickr.
amusement,http://farm9.staticflickr.com/8215/8257436194_863f30d02a_z.jpg,0,5,Untitled Explore FOTOGRAFIA.Nelo.Esteves' photos on Flickr. FOTOGRAFIA.Nelo.Esteves has uploaded 35835 photos to Flickr.
amusement,http://farm4.staticflickr.com/3794/9092172473_d75a881d20_z.jpg,2,3,Kings Dominion 2012 Photos from my trip to Kings Dominion
amusement,http://farm9.staticflickr.com/8483/8175350179_bf2c0bdbe2_z.jpg,1,4,Only Daddy was Going Explore YellowSubmarine 1926's photos on Flickr. YellowSubmarine 1926 has uploaded 11901 photos to Flickr.
amusement,http://farm6.staticflickr.com/5526/10597918364_532fab6644_z.jpg,0,5,YoYo Explore Guillermo Ledezma's photos on Flickr. Guillermo Ledezma has uploaded 24 photos to Flickr.
amusement,http://farm9.staticflickr.com/8044/8361689338_035025f267_z.jpg,1,4,San Antonio Texas SeaWorld marine mammal park A comical show called The Cannery Row Caper featuring sea lions and Walrus 2012 Shamu oceanarium Amusement Animals Marine life Sea World San Antonio Texas SeaWorld marine mammal park A comical show called The Cannery Row Caper featuring sea lions and Walrus 2012 Shamu oceanarium Amusement Animals Marine life Sea World
amusement,http://farm9.staticflickr.com/8448/7898019494_3aef1170d1_z.jpg,1,4,State Fair Holga 120 film
amusement,http://farm6.staticflickr.com/5573/14021046345_beb217cf54_z.jpg,2,3,IMG_8460s Explore 's photos on Flickr.  has uploaded 56122 photos to Flickr.
amusement,http://farm9.staticflickr.com/8007/7195421748_e0a9ae09f9_z.jpg,1,4,Leaving Luna Park                                
amusement,http://farm9.staticflickr.com/8150/7571866298_3dc9969e8f_z.jpg,2,3,untitled (27 of 328) The abandoned amusement park - Parque Rene Fraga
amusement,http://farm4.staticflickr.com/3682/9132356128_b69d2f3b34_z.jpg,0,5,IMG_9346 (Large) Explore Coney Island Photo Diary's photos on Flickr. Coney Island Photo Diary has uploaded 9540 photos to Flickr.
amusement,http://farm8.staticflickr.com/7361/10007624645_38cc1f5e04_z.jpg,0,5,Crazy Mouse Rounds the Bend Those Crazy Mouse cars sure are ugly!
amusement,http://farm9.staticflickr.com/8112/8617636110_dca78d8b9f_z.jpg,2,3,Mini Amusement Explore mikeslagter's photos on Flickr. mikeslagter has uploaded 10438 photos to Flickr.
amusement,http://farm8.staticflickr.com/7187/6882047296_d7a4ce71e2_z.jpg,1,4,The Swarm Explore CoasterMadMatt's photos on Flickr. CoasterMadMatt has uploaded 73326 photos to Flickr.
amusement,http://farm4.staticflickr.com/3770/9730634900_49dfd519e0_z.jpg,2,3,Royal Adelaide Show '13                                
amusement,http://farm9.staticflickr.com/8048/8381587717_1269a63239_z.jpg,2,3,CAL_1475.jpg Explore invertalon's photos on Flickr. invertalon has uploaded 9725 photos to Flickr.
amusement,http://farm8.staticflickr.com/7286/8743967841_2488310e5f_z.jpg,2,3,Games Amusement and Starbucks Coffee Universal Studios Florida
amusement,http://farm6.staticflickr.com/5503/14013579852_93b15d5498_z.jpg,1,4,DSC_0743_1364 On opening day of Coney Isalnd amusement park.
amusement,http://farm3.staticflickr.com/2913/14374218741_8f8f9f145c_z.jpg,0,5,Nimb Hotel At Tivoli amusement park
amusement,http://farm8.staticflickr.com/7102/7318742168_323e935c57_z.jpg,2,3,New Old Building This structure is actually part of an amusement park ride. Built to look like an old California mining and saw mill. Posted a similar picture as a monotone but thought I'd retake it when it was lit up.
amusement,http://farm8.staticflickr.com/7187/6958763431_0e972a6bb2_z.jpg,0,5, 
amusement,http://farm6.staticflickr.com/5515/9996412703_b52e672d06_z.jpg,1,4,Vidmpark Amusement park in Budapest
amusement,http://farm8.staticflickr.com/7358/10089475945_c5a6593c63_z.jpg,2,3,"Enter 277/365 A five stitch panorama of the entrance to Teignmouth Pier.  We  had a lovely afternoon wandering along the sea front, the weather was warm, the tide was in AND there were beach huts :-)) Heaven!! Too tired to process any more tonight...."
amusement,http://farm8.staticflickr.com/7270/7472633038_6f0debb688_z.jpg,2,3,DSC_2517 Explore johnjmurphyiii's photos on Flickr. johnjmurphyiii has uploaded 189249 photos to Flickr.
amusement,http://farm9.staticflickr.com/8482/8244629352_8c653b6442_z.jpg,2,3,DSC_0639 Explore miansoca's photos on Flickr. miansoca has uploaded 16538 photos to Flickr.
amusement,http://farm6.staticflickr.com/5536/10733910083_a5d4ac1df3_z.jpg,2,3,WORLD SHOWCASE LAGOON Epcot Walt Disney World
amusement,http://farm9.staticflickr.com/8170/8014815797_c22972ea3e_z.jpg,0,5,Let's Twist Again Explore CoasterMadMatt's photos on Flickr. CoasterMadMatt has uploaded 73326 photos to Flickr.
amusement,http://farm9.staticflickr.com/8385/8645284257_e8129cda04_z.jpg,1,4,Monster Cafe Explore LuanMarchesi's photos on Flickr. LuanMarchesi has uploaded 2342 photos to Flickr.
amusement,http://farm9.staticflickr.com/8538/8638769033_5d5745170b_z.jpg,2,3,RAINFOREST CAFE Animal Kingdom Walt Disney World
amusement,http://farm8.staticflickr.com/7362/12618832914_9191d475c5_z.jpg,2,3,Scott looking at the brown goat Scott*Herman Petting Kraal Nairobi Village T*photo
amusement,http://farm8.staticflickr.com/7290/9130147653_30790756b2_z.jpg,0,5,IMG_9350 (Large) Explore Coney Island Photo Diary's photos on Flickr. Coney Island Photo Diary has uploaded 9540 photos to Flickr.
amusement,http://farm8.staticflickr.com/7407/8765740715_ec7f1b3c11_z.jpg,1,4, 
amusement,http://farm9.staticflickr.com/8166/7595907832_03932c727e_z.jpg,2,3,"Picnik collage #127, Best of, le Meilleur des Photos-Nature Adely et Yves 2006->2012! Diaporama / Slide Show  ce lien, Plein cran, (F11) full screem recomanded !  www.flickr.com/photos/natureboheme/sets/72157630633319204...   Merci de visionner notre important travail photographique ! Classeur Best of, le Meilleur des Photos-Nature Adely et Yves 2006->2012! Selection of our best photographys 2006->2012 ! Thank you to take an eye on it ! www.flickr.com/photos/natureboheme/collections/7215763007...   Lisez notre manifeste :  (Article paru sur le site des Vgtaliseurs)  Trucs et Astuces !    L'Art et la Manire de donner le got de la Nature et de la Randonne aux enfants.  www.les-vegetaliseurs.com/article-80507-commentdonnerlego...   (Franais, English, Viet nam, Spanish,)  Nous aimons la Vie ! Nous aimons la Nature ! Nous aimons la randonne ! Nous aimons la Lumire ! Nous aimons la Couleur ! Nous pratiquons la Joie de Vivre et la Bonne Humeur! Vive la Nature ! Vive la Vie ! Respectons et Aimons toutes les Formes de Vie !   We love the Life !  We love the Nature !  We love the Nature ! We love hiking ! We love the Light !  We love the Color !  We practice the Joy of Living !  Bravo the Nature ! Respect and Love all the forms of Life !  Live the Life you Love!  Chung toi yeu cuoc song! Chung toi yeu thien nhien ! Chung toi yeu thich di bo duong dai ! Chung toi yeu thich anh sang ! Chung toi yeu thich mau sac !  Chung toi thuc hanh niem vui duoc song ! Hoan ho Thien Nhien ! Hoan ho Cuoc song ! Hay Kinh Trong va Yeu thuong tat ca nhung hinh thuc cua Cuoc Song !   Nos Gusta la vida !  Nos gusta la naturaleza !   Nos gusta la caminata !   Nos gusta la luz !  Nos gusta el color ! Viva la Naturaleza !  Viva la Vida ! Respectomos e amenos todas las formas de vida ! Live the Life you Love!     [Mots Clefs :  ""me d'enfant"" ""bonne humeur""  Good mood  ""fou rire"" laughter ""joie de vivre"" exhilaration ""marche  pied"" walking allgresse  amusements amuser apaisement ardeur balade jaunt  bien-tre well-being bizarre odd  blague joke  bonheur happiness bucolique calme campagnard campagne countryside champtre champs contempler contentement ""coup de cur"" curieux curious distraction divertir divertissement gayer enchantement delightfulness enthousiasme espigle trange strange excursion pleasure trip  extraordinaire extraordinary fe ferie flicit ferveur flnerie force forestier fort forest  gaiet merriment gait guilleret herbages humour humor idyllique inaccoutum insolite unusual inspiration jeux joie, jouer jubilation liesse lyrisme malicieux muse nature observer paix pastoral pturages prairie pdestre ptillant plaire plaisanter plaisanterie posie poetry pote prairies prs prodigieux promenade outing quitude randonne ramble ravissement rcrer regarder  rjouir rigolo rire ritournelle romanesque romantique romantisme romanticism sentier srnit singulier *sourire smile sous-bois undergrowth surprenant  vif vire vitalit zen tamycoladelyves natureboheme clairefontaine yves-Noel-Marie Gonnet-Nguyen ] "
amusement,http://farm9.staticflickr.com/8206/8187027886_534a8e0bd8_z.jpg,2,3,Christmas in Tivoli 2012_photo Connie Maria Westergaard (25) Explore Miss Copenhagen's photos on Flickr. Miss Copenhagen has uploaded 17496 photos to Flickr.
amusement,http://farm9.staticflickr.com/8009/7592489866_10d5d131de_z.jpg,0,5,Santa Cruz Boardwalk The Rock-O-Plane ride
amusement,http://farm3.staticflickr.com/2852/9272878174_276647fc3d_z.jpg,0,5,Liseberg's Rapids Ride: Kllerado Explore CoasterMadMatt's photos on Flickr. CoasterMadMatt has uploaded 73327 photos to Flickr.
amusement,http://farm3.staticflickr.com/2808/8886841907_212918bff1_z.jpg,1,4,Sky Lite Sky Lite20130411-DSC_5862.jpg
amusement,http://farm9.staticflickr.com/8439/7811131392_0bc7b7ca79_z.jpg,1,4,Wind Jammer Explore trumpeterny's photos on Flickr. trumpeterny has uploaded 10187 photos to Flickr.
amusement,http://farm3.staticflickr.com/2842/9341750372_0f8c216fdb_z.jpg,1,4,Fiesta Texas 1996
amusement,http://farm3.staticflickr.com/2878/9389917947_cc69e3008a_z.jpg,1,4, 
amusement,http://farm6.staticflickr.com/5335/9272966630_9f9d369578_z.jpg,0,5,Liseberg's Wheel Explore CoasterMadMatt's photos on Flickr. CoasterMadMatt has uploaded 73327 photos to Flickr.
amusement,http://farm8.staticflickr.com/7066/6895800167_90ce5c83a5_z.jpg,2,3,Ross and Castle Explore Mi-Wu's photos on Flickr. Mi-Wu has uploaded 5286 photos to Flickr.
amusement,http://farm8.staticflickr.com/7106/7537187052_5e0d280352_z.jpg,0,5,Nighttime @ Changzhou China Dinosaur Park Follow @tenaciouslibbs
amusement,http://farm4.staticflickr.com/3716/9344855238_c5678b9a40_z.jpg,0,5,20130721_144924(0) Explore SteveLinn15's photos on Flickr. SteveLinn15 has uploaded 7394 photos to Flickr.
amusement,http://farm9.staticflickr.com/8020/7160929213_6e9e81179b_z.jpg,0,5,Copenhagen Carnival  2012 Explore Ren Eriksen's photos on Flickr. Ren Eriksen has uploaded 7957 photos to Flickr.
amusement,http://farm3.staticflickr.com/2834/10289715223_348085d24b_z.jpg,0,5,IMGP4244 Explore koichimura's photos on Flickr. koichimura has uploaded 13084 photos to Flickr.
amusement,http://farm9.staticflickr.com/8176/8025159676_e326bd701b_z.jpg,2,3, 
amusement,http://farm8.staticflickr.com/7256/7697594196_5137bc6eb3_z.jpg,2,3,Paris Disneyland Explore desert_eagle2012's photos on Flickr. desert_eagle2012 has uploaded 6 photos to Flickr.
amusement,http://farm8.staticflickr.com/7277/13591170065_c45e123d05_z.jpg,1,4,"La Ronde La ronde au crpuscule, Montral (Qubec), octobre 2013. | La Ronde at twilight, Montreal, Quebec, October 2013."
amusement,http://farm8.staticflickr.com/7037/7033062361_7003b3c8d5_z.jpg,1,4,"Marvin's Marvelous Mechanical Museum (Farmington Hills, Michigan) Marvin's Marvelous Mechanical Museum is located in Farmington Hills, Michigan and contains a great array of historical arcade games.  It is an great location that has not only these arcade games, but also model airplanes, neon signs and other collectables.  Visited on March 31, 2012."
amusement,http://farm9.staticflickr.com/8034/8071947384_9c1e372307_z.jpg,0,5,Big Rock Amusements Paratrooper Night View. Explore dccradio's photos on Flickr. dccradio has uploaded 68244 photos to Flickr.
amusement,http://farm4.staticflickr.com/3685/9221623564_6454202110_z.jpg,2,3,186/365 fireworks...  the amusement park that i live near... has four days of fireworks this week.    i didn't get to shoot fireworks last night... but was able to get out tonight.    i was pleased with the photos i got... and wish there were more opportunities thru out the year.   
