anger,http://farm5.staticflickr.com/4104/4989219978_0622c85796_z.jpg,0,5,IMG_6440 Explore Robert Gim's photos on Flickr. Robert Gim has uploaded 4019 photos to Flickr.
anger,http://farm7.staticflickr.com/6202/6080653613_4f62ced739_z.jpg,2,3,anger and pain Explore reemalhamoud's photos on Flickr. reemalhamoud has uploaded 23 photos to Flickr.
anger,http://farm5.staticflickr.com/4081/4884251954_e3e566a24e_z.jpg,1,4,Anger Explore jake.fatheree's photos on Flickr. jake.fatheree has uploaded 1003 photos to Flickr.
anger,http://farm3.staticflickr.com/2914/14750027301_409797b1c5_z.jpg,0,5,"Image from page 134 of ""The boy hikers homeward bound"" (1919) Identifier: boyhikershomewar00fras Title: The boy hikers homeward bound Year: 1919 (1910s) Authors:  Fraser, Chelsea Curtis, 1876- Subjects:  Publisher:  New York, Thomas Y. Crowell Company Contributing Library:  New York Public Library Digitizing Sponsor:  MSN   View Book Page: Book Viewer About This Book: Catalog Entry View All Images: All Images From Book  Click here to view book online to see this illustration in context in a browseable online version of this book.   Text Appearing Before Image: s friends stepped aside. The next moment the two combatants weremixing matters again, Jack going after Gus withrenewed fire, but not without caution. So fastwere the blows given and exchanged for a fewseconds that it was impossible for the on-lookersto keep account of them. Once they saw Jack stagger back again, andnoted that his cheek was bleeding. Then theysaw him wipe off some of the blood on the backof his hand, look at it, give a queer, challengingsort of laugh, and sail in once more. Out of themix-up that followed, big Gus was the next oneto stagger. From a cut on his jaw, a crimsonfluid dripped down upon his collar, at sight ofwhich the burly chap roared his anger and, re-covering himself, renewed the attack. Here and there they fought, thrusting, parry-ing, blocking, ducking, countering and side-step-ping. Several hard body blows were deliveredby both boys, one of which all but brought Jackto his knees. But he was up and at it the nextmoment, and a few minutes later managed to  Text Appearing After Image: GUS STEPPED IN A LITTLE CLOSER AND ShTHE LADS STOMACH.- IS LEFT FIST HARD AT THE FIGHT 123 retaliate with a right hook under Guss sore jawagain. This time the blow was fairer. Its force alsocaught the big fellow at a time when he wasnot well braced to receive it. The consequencewas, he went to the ground. When he struggled to his feet, for an instantGus seemed dazed and bewildered. He couldnot conceive how a youth of Jacks size couldever have dealt him such a stiff jolt. He lookedat the nearest spectators suspiciously and darkly,as if he thought they might have thrown some-thing at him. But there was nothing in theirattitudes to warrant the continuation of such anidea. So Gus finally laid the blame where itrightly belonged. With temper fairly aflame now, convincedthat he never could vanquish his younger ad-versary by skill of fist, Gus rushed forward, in-tent on closing with Jack and bringing hisgreater brute strength to bear. This was a contingency that Jack knew hemust avoid, if pos   Note About Images Please note that these images are extracted from scanned page images that may have been digitally enhanced for readability - coloration and appearance of these illustrations may not perfectly resemble the original work."
anger,http://farm5.staticflickr.com/4100/4745606449_3ee201d56b_z.jpg,0,5,Ira 5 hrs  www.behance.net/gallery/Anger/559775   
anger,http://farm5.staticflickr.com/4023/4707260127_e9d84c3df1_z.jpg,0,5,"Anger Explore >WaEeL"" >>Back,'s photos on Flickr. >WaEeL"" >>Back, has uploaded 12 photos to Flickr."
anger,http://farm8.staticflickr.com/7047/6883393801_02095466d0_z.jpg,2,3,___Anger____by_t4m3r Explore daswillie's photos on Flickr. daswillie has uploaded 68 photos to Flickr.
anger,http://farm8.staticflickr.com/7032/13243523704_7e5fe68395_z.jpg,1,4,DRUNK BOi!S 2014/01/11 (sat) HARDCORE PUNKSDay1 at  ANTIKNOCK  DRUNK BOi!S ISTERISMO RAISE A FLAG DIGRAPHIA ESPERANZA LASTLY POIKKEUS ACROSTIX EXTINCT GOVERNMENT ANGER FLARES SKIZOPHRENIA TOM AND BOOT BOYS 
anger,http://farm9.staticflickr.com/8221/8297976952_a567418918_z.jpg,1,4,Not seen these shown in anger for a while. Terry doesn't like bath time! #toughlove Explore Gabaja's photos on Flickr. Gabaja has uploaded 1754 photos to Flickr.
anger,http://farm8.staticflickr.com/7025/6677327793_0fd944ae73_z.jpg,2,3,Anger 1 Explore Leah Chang's photos on Flickr. Leah Chang has uploaded 28 photos to Flickr.
anger,http://farm8.staticflickr.com/7461/16014214241_3a0f942501_z.jpg,0,5,Millions March NYC March for justice for victims of police violence.
anger,http://farm8.staticflickr.com/7257/7601105002_250ebc9d23_z.jpg,0,5,Clashes between Anger protesters and CSF around the Syrian Embassy In Cairo             photo by Mohammed Maree    
anger,http://farm5.staticflickr.com/4133/5214184702_a3cf5e3c6e_z.jpg,1,4,"Anti-Government protest march, Dublin, 27th November, 2010 Over 50,000 people attended a protest march in Dublin on Saturday, 27th November, 2010, to protest against the Irish government, their handling of the economy and the EU/IMF 'bailout'. The march was organised by the Irish Congress of Trade Unions but included many with no union affiliations looking for an outlet to vent their anger at the present government.   The route went from Wood Quay to the GPO in O'Connell Street where a series of speeches were held. The atmosphere along the route was peaceful and family-friendly. After the main speeches, Joe Higgins MEP and Richard Boyd-Barrett from a new grouping called the United Left Alliance, addressed the crowds from underneath the O'Connell monument.   Following the main march, a small group of protesters marched to the Dail (Irish Parliament) where they set fire to a poster of Taoiseach (Prime Minister) Brian Cowen. A heavy Garda (Irish Police) presence ensured that this later demonstration passed off without major incident. "
anger,http://farm6.staticflickr.com/5162/5374001017_425e68e2df_z.jpg,2,3,"Anger  Model: Vanessa Laxten Date: January 20th, 2011"
anger,http://farm8.staticflickr.com/7496/16096708896_e74f4c4e03_z.jpg,0,5,Anger and frustration with the political status quo is evident. Explore David Drissel's photos on Flickr. David Drissel has uploaded 17933 photos to Flickr.
anger,http://farm9.staticflickr.com/8539/8646581414_30d5157a9c_z.jpg,2,3,Untitled  
anger,http://farm8.staticflickr.com/7149/6771443011_c2fbbea463_z.jpg,0,5,"P1149362 Defective French PiP breast implant patients protest at private clinic - London, 14.01.2012  Around 60 breast implant patients gathered outside The Harley Medical Group (THMG) premises on Harley Street on 14.01.2012 to protest against the clinic's refusal to replace, free of charge, any of the 13,900 faulty French-manufactured PIP (Poly Implant Prothese) silicone implants bought and surgically implanted into women by THMG which were filled with substandard industrial-grade silicone provided by German chemicals supplier Brenntag to save money, and which allegedly are more prone to rupture and leak than proper surgical-grade implants.  Brenntag rejected accusations of negligence on Friday 13th January after a report it could face legal action over its role as silicone supplier to PIP, and has claimed the bulk silicone-gel it provided was clearly marked as unsuitable for use in implants.   The French government has advised the 30,000 women in France who have the implants to have them removed due to concerns they might rupture. Governments in several other countries, such as Britain and Brazil, have asked women to visit their doctors for checks, but as yet the NHS in Britain is not offering to remove the PiP implants, despite the risk of rupture and health risks caused by leaking silicone.  A French investigating judge visited PIP offices earlier in January as part of a probe into the death of a woman from cancer, which could lead to charges of involuntary homicide against the firm. French authorities ordered the company to withdraw its breast implants from the market in March 2010.  The average cost of a breast-augmentation proceedure from The Harley Medical Group is, like most of the very profitable high-end cosmetic surgery companies in and around Harley Street, somewhere in the region of 4,500 ( 5,450), and if this is accurate then Harley Street Medical has made somewhere in the region of 58.5 million ( 70.8 million) from fitting toxic PiP implants. The company issued a statement this week claiming that if they replaced the sub-standard implants for free they would go out of business, and the responsibility should fall on the NHS or PiP - who manufactured the lower-priced implants - to clean up the mess, but the demonstrators are angrily demanding that the private clinics foot the bill.   Several women at the protest still have leaking PiP implants in their breasts and are suffering a wide range of serious symptoms, but cannot afford to pay the same cosmetic surgeon to remove them, let alone replace them. This kind of luxury surgery is a once-in-a-lifetime purchase fore many women, and they are angered that their lives have been put at risk by cost-cutting, and that the culprits are attempting to walk away from the whole matter, leaving the UK taxpayer to foot the bill.  PIP implants were banned in France in 2010, with the French government advising 30,000 women to have their implants removed, but thus far the British government has offered very limited help to British patients, choosing instead to broadcast a public information video on national TV networks this weekend downplaying the risks, with Secretary of State for Health Andrew Lansley saying in press briefings that he expects private medical companies who have fitted the French implants to ""step up to their responsibilities"".    All photos  2012 Pete Riches Do not reproduce, alter or reblog my images without my written permission. Hi-Res versions of these files are available for license on application. NUJ rates apply. about.me/peteriches"
anger,http://farm4.staticflickr.com/3251/2647830042_ce276f47cd_z.jpg,0,5,Bygdalarm 2008 - The other Pez Explore Little Big Joe's photos on Flickr. Little Big Joe has uploaded 8048 photos to Flickr.
anger,http://farm4.staticflickr.com/3623/3371976269_87e7e64a38_z.jpg,0,5,anger Explore Aurora Negai's photos on Flickr. Aurora Negai has uploaded 65 photos to Flickr.
anger,http://farm8.staticflickr.com/7324/10509273776_4a3a3fd590_z.jpg,0,5,Sortie Opposito Angers_Septembre 2010 171 Explore Bagad Plougastell's photos on Flickr. Bagad Plougastell has uploaded 462 photos to Flickr.
anger,http://farm5.staticflickr.com/4015/4659528585_096496fa78_z.jpg,1,4,Crack head I love this photo! A quick snap shot of Ryan and he looks like a heroin addict. haha!
anger,http://farm6.staticflickr.com/5235/6933937402_1d84102e09_z.jpg,0,5,Anger Explore Mangoish's photos on Flickr. Mangoish has uploaded 12 photos to Flickr.
anger,http://farm7.staticflickr.com/6212/7002060015_dc8a754307_z.jpg,2,3,Zenzile SXSW 2012 Angers Loire Valley France Party 031412 (24) Explore nathan_malone's photos on Flickr. nathan_malone has uploaded 157001 photos to Flickr.
anger,http://farm4.staticflickr.com/3073/2640638697_1082793f7c_z.jpg,0,5,"Lotus Eater Here's a nice handsome flower eater we met last night ....  While I've been reminiscing over our recent camping trip to the Arctic, and working on my fossils, i've been continuing to amass hundreds of Bear photos ..... Last night, on our way home , we saw 12 bears and a wolf !!  I figured that , in order to avoid angering the Bear God, I'd better post at least a handful of these photos ..... Seen near Pine Valley, Yukon last night."
anger,http://farm5.staticflickr.com/4049/4719844344_bc3df0e9b5_z.jpg,2,3,Elliott Explore tyckedoff's photos on Flickr. tyckedoff has uploaded 23 photos to Flickr.
anger,http://farm4.staticflickr.com/3374/3217353793_e2469bf54b_z.jpg,0,5,Mtmli 21. Jan Explore HelgiR's photos on Flickr. HelgiR has uploaded 691 photos to Flickr.
anger,http://farm4.staticflickr.com/3748/9549217894_aa2bc80ec4_z.jpg,2,3, 
anger,http://farm3.staticflickr.com/2212/13129030984_ee8c210798_z.jpg,1,4,Berkin Elvan....Anger and Grief... Demonstration Berlin...Kreuzberg 2014 March 12th
anger,http://farm3.staticflickr.com/2431/3548695545_55887feb0a_z.jpg,0,5,"Wrath 4325Wrath  Seven Deadly Sins: Envy Wrath Gluttony Lust Pride Sloth Greed  I loved making this one.  So far, it's the best expression of what I had in my mind going into the shoot!  Models: Mark and Ben Hair: Serena Makeup: Megan  Speical thanks to Max F. Williams for the texture.  Strobist: Key: SB-28 in DIY beautydish over camera. Fill: 2x SB-28 left and right into reflective umbrellas, each gelled 1.5 CTO. Triggered with CTR-301 radios."
anger,http://farm6.staticflickr.com/5045/5330075595_cec801be0f_z.jpg,0,5,"The man of many faces Didn't fancy spending 300 on a sb900 so I brought a 10 strobe light off eBay :) to try out some stroboscopic stuff with after looking at some old work by Harold Edgerton (swinging a golf club). So this is my model Dom, been used for lots of horror stuff earlier in my stream, awesome model. Used my 50mm 1.8 for sharp results, really great cheap portrait lens!"
anger,http://farm5.staticflickr.com/4139/4758255296_1b6446890b_z.jpg,2,3, 
anger,http://farm3.staticflickr.com/2908/14192484773_79d1f1bafa_z.jpg,0,5,Random guy Explore Billy TZ's photos on Flickr. Billy TZ has uploaded 301 photos to Flickr.
anger,http://farm9.staticflickr.com/8211/8421876644_c495965f2d_z.jpg,0,5,5_57 Lioness vents her frustrations at a proposition
anger,http://farm9.staticflickr.com/8192/8139323587_a70da5afed_z.jpg,2,3,"Alt Rd 2012 10 01 Leaflet Produced By FRAGOFF Group To Save Formby Green Belt 1 October 2012 From their web site at www.fragoff.co.uk  On the 9th August 2012, speculative builders, David Wilson Homes (that's Barratt Developments to you and me) see yet another chance to boost their profits at the expense of the local community in Formby as they seek planning permission for the Greenfield farming site off Liverpool Road. They have swooped in like vultures, highlighting their plans at a so called public exhibition with only 2 days notice. Over 300 people turned out to object (very loudly) to this totally inappropriate development within our community which is neither wanted or needed They say they will be building affordable homes, at what cost you may ask, well let's start at 300,000.00. That should earn them a tidy profit. They say they will make our schools better, how much better can they make them, we are already in the top 10%. They say the land does not suffer any flooding, perhaps they would like to tell that to the ducks, birds and wildlife that go there. They say they are going to build here whether we like it or not. They say there is no problem. We Say FRAGOFF!  On Friday 17th August 2012, we held a public meeting where over 400 people attended to show their support and anger at their proposals. Thus our action group was formed, Formby Residents Action Group, Opposition From Formby (F.R.A.G.O.F.F.). Surely the council can have no doubt how the community feel about this issue.  The Government say building houses will boost our economic growth. How is that? What we need is Jobs, Export and Industry. If there are no jobs then who will buy these houses, banks are not lending, people cant afford them and developers cant sell the houses they already have empty. Why build then you may ask. A good question as THIS IS ALL ABOUT MONEY, MONEY FOR THE DEVELOPERS, VAST PROFITS AT THE EXPENSE OF COMMUNTIES, RIDING ROUGH SHOD OVER THE LOCAL COMMUNITY AND LINING THEIR OWN POCKETS, NOT TO MENTION A FEW MORE ON THE WAY TO GET WHAT THEY WANT.  You may ask why we think this, maybe it is because this piece of beautiful land has a value to them of 120,000,000. What do you think they would do to ensure they had this piece of land to build on? Who would they upset on the way to achieve their profit? US OF COURSE. What about the rest of our green belt land, are we going to join up with Hightown, Ince Blundell, Ainsdale?  What is going to happen to our countryside, will we all end up living in concrete land, surrounded by development. Where will the developers stop, we dont think they will, not until every inch of green land is built on. They have the money to help them get the answer they want to hear, go on BUILD, BUILD, BUILD until you can build no more, dont worry about the people, they dont matter. They are just a minor detail that can be hoodwinked, lied to, told what they want to hear and will sit back and take it until it is all to late. Well we wont sit back anymore, we wont be hoodwinked by all the spin and we will fight and come together as a country and say ENOUGH IS ENOUGH. We are fighting for all the children of the future, what future will they have when there is no green land anymore, all the farms have sold to the developers and we cant grow any food, we will import it of course from other countries who have kept their land, but at what cost.  STOP BUILDING ON GREEN BELT NOW."
anger,http://farm6.staticflickr.com/5045/5352819096_96b42c922d_z.jpg,1,4,"7 sins: Anger Stencil on paper, 50X70cm, 2010"
anger,http://farm9.staticflickr.com/8490/8288352606_14780b1a0a_z.jpg,0,5,"After my blog post failed to post for the 3rd time, my daughter caught my anger! After my blog post failed to post for the 3rd time, my daughter caught my anger!"
anger,http://farm4.staticflickr.com/3129/5825633206_61e960b398_z.jpg,2,3,"Defeat The buried pain Unresolved anger The burning soul ... dissolving life   Location: Khulna, Bangladesh  D E F I N I T E L Y  Title courtesy :  Picchi :P"
anger,http://farm5.staticflickr.com/4122/4943437801_6326e2c158_z.jpg,2,3,"alter/ego For more info, visit here www.facebook.com/epicpictures"
anger,http://farm4.staticflickr.com/3793/11116203453_eec38877ae_z.jpg,2,3,Dangerous Poppies Wearing new D'Anger collection 
anger,http://farm5.staticflickr.com/4042/4353113593_0ac675a689_z.jpg,2,3,2010 olympic protest selling copies of the downtown eastside calender  all copyrights reserved
anger,http://farm5.staticflickr.com/4022/4698600646_d6a164b516_z.jpg,0,5,Wrath Explore timeisgolden's photos on Flickr. timeisgolden has uploaded 48 photos to Flickr.
anger,http://farm4.staticflickr.com/3250/3030858572_8bb5941e64_z.jpg,0,5,Express scholastic gold key individual award!!
anger,http://farm6.staticflickr.com/5001/5371143356_5e0158d9b8_z.jpg,2,3,"Tunisia RevolutionDSC_5185 Ave Bourgiba, Tunis 19 Jan 2011 - "
anger,http://farm3.staticflickr.com/2863/11414509114_ccf11fbac7_z.jpg,2,3,"Star Spangled Burner Sign of the Times,  becoming more and more common."
anger,http://farm9.staticflickr.com/8357/8389751725_2986d647b1_z.jpg,2,3,017 - What Did You Say About My Momma!? Morning Beard... mourning beard. 
anger,http://farm3.staticflickr.com/2920/14264970464_d60b5bd098_z.jpg,2,3,"New Rapunzel(2014ver) & New Eugene(Flynn) OOAK doll ~Don't be angry.~ ""Don't be angry.""  Eugene angered her.   [New Rapunzel(2014ver) & New Eugene(Flynn)  OOAK doll]      ()"
anger,http://farm5.staticflickr.com/4091/5213578991_f77c38228c_z.jpg,0,5,"Anti-Government protest march, Dublin, 27th November, 2010 Over 50,000 people attended a protest march in Dublin on Saturday, 27th November, 2010, to protest against the Irish government, their handling of the economy and the EU/IMF 'bailout'. The march was organised by the Irish Congress of Trade Unions but included many with no union affiliations looking for an outlet to vent their anger at the present government.   The route went from Wood Quay to the GPO in O'Connell Street where a series of speeches were held. The atmosphere along the route was peaceful and family-friendly. After the main speeches, Joe Higgins MEP and Richard Boyd-Barrett from a new grouping called the United Left Alliance, addressed the crowds from underneath the O'Connell monument.   Following the main march, a small group of protesters marched to the Dail (Irish Parliament) where they set fire to a poster of Taoiseach (Prime Minister) Brian Cowen. A heavy Garda (Irish Police) presence ensured that this later demonstration passed off without major incident. "
anger,http://farm4.staticflickr.com/3137/2910965813_3b8b432801_z.jpg,0,5,Angers -v- Sledge -v- Kane Explore John Jewell's photos on Flickr. John Jewell has uploaded 28945 photos to Flickr.
anger,http://farm7.staticflickr.com/6027/5906916461_9cac2d7070_z.jpg,2,3,"KeepCalm-1 This has been my policy since college. I think I've mostly maintained my reputation for imperturbability, though some people consistently interpret that as some sort of barely controlled anger or boredom. Apparently, I am an enigma. Who knew?"
anger,http://farm6.staticflickr.com/5590/14578722149_a6bbcedb84_z.jpg,0,5,"Image from page 183 of ""The Metropolitan : a monthly magazine, devoted to religion, education, literature, and general information"" (1853) Identifier: metropolitanmont02balt Title: The Metropolitan : a monthly magazine, devoted to religion, education, literature, and general information Year: 1853 (1850s) Authors:  Subjects:  Catholic Church Publisher:  Baltimore, Md. : J. Murphy Contributing Library:  John M Kelly Library Rare Books - University of Toronto Digitizing Sponsor:  University of Toronto   View Book Page: Book Viewer About This Book: Catalog Entry View All Images: All Images From Book  Click here to view book online to see this illustration in context in a browseable online version of this book.   Text Appearing Before Image: Jesus is Stripped of his Garments. Now from His pure and vii-gin formThe garments oil they tear,For He beneath Gods anger-stormWill naked stand and bare! ELEVENTH STATION. TWELFTH STATION.  Text Appearing After Image: Jeiiii (5 .Willed lu liic CrOSS. See  see as His AltarThe Cross is displayed,And He, tiie great Sacrifice,On it is laid !   Note About Images Please note that these images are extracted from scanned page images that may have been digitally enhanced for readability - coloration and appearance of these illustrations may not perfectly resemble the original work."
anger,http://farm2.staticflickr.com/1303/561309845_5309a3a287_z.jpg,2,3,freedom anger is a gift
anger,http://farm3.staticflickr.com/2411/2403992761_421813f70d_z.jpg,1,4,"Angry Shivneil Note the emotional outrage felt throughout this image. Rule of 3rds, Diagonal lines, and Anger."
anger,http://farm3.staticflickr.com/2141/2538557734_96fb65bfae_z.jpg,0,5,Angers vs. Sharpe Explore John Jewell's photos on Flickr. John Jewell has uploaded 28945 photos to Flickr.
anger,http://farm4.staticflickr.com/3123/2433162689_27d05c9d8b_z.jpg,2,3,Abstract Explore G-G-G-G-Ghost!'s photos on Flickr. G-G-G-G-Ghost! has uploaded 22 photos to Flickr.
anger,http://farm5.staticflickr.com/4075/4751602720_8d5c354472_z.jpg,1,4,8: Cheetah Fight Explore SRP Austin Photography's photos on Flickr. SRP Austin Photography has uploaded 14863 photos to Flickr.
anger,http://farm9.staticflickr.com/8204/8249045725_3819006d38_z.jpg,0,5,"Untitled approx 50cm by 30cm  Acrylic displays how i feel wen i am pushed into a situation or place of discomfort. The fabric reprasents what is holding me down and forcing me to be there, cuting me of from looking back, while my expresion is that of pain and anger, but trying to cover it with a faulse smile."
anger,http://farm8.staticflickr.com/7124/7011544497_133679fefe_z.jpg,0,5,"16th Street Viaduct Mural/Aztec. 16th Street Viaduct Wall Mural Art. Many Contributing Artists, presently being restored and street cleaning. Possibly a group of Aztec indians from Mexico or could be you."
