anger,http://farm4.staticflickr.com/3916/14747385811_900ae70847_z.jpg,1,4,"Image from page 387 of ""The royal politician represented in one hundred emblems"" (1700) Identifier: royalpoliticianr02saav Title: The royal politician represented in one hundred emblems Year: 1700 (1700s) Authors:  Saavedra Fajardo, Diego de, 1584-1648 Astry, James, Sir Gilliflower, Matthew Meredith, Luke, d. 1700 Subjects:  Political science Kings and rulers Education of princes Publisher:  London, Printed for Matt. Gylliflower... and Luke Meredith... Contributing Library:  Getty Research Institute Digitizing Sponsor:  Sloan Foundation   View Book Page: Book Viewer About This Book: Catalog Entry View All Images: All Images From Book  Click here to view book online to see this illustration in context in a browseable online version of this book.   Text Appearing Before Image: bout theOrbs of his Realms^ He managd Peace with Moderationand Integrity, and pfofecuted War with Force and Stra-tagem, neither defiring the one, nor refufing the other.Whatsoever his Foot was fijccd on, his Arm and Conductjoind in the Defence thereof, encreafing his Strength bythe Spoils of his Enemies. He did as much by his Nego-tiations, as by his Arms, never committing to the Sword,what he could conquer by Addrefs. He placd the Often-tation of his Grandeur and Pomp in the Bravery of hisBattalions. He was always prefent, in time ot War,within his Kingdoms. The fame Orders which he gave,he obfervd himfelf ^ and made Leagues fo as to remainArbiter, not fubjecl. He was neither exalted when Con-queror \ nor when beaten, difpirited. He Signd Trea-ties of Peace under the Shield. Tn a word. He livd toall the World, and dyd to himfelf^ yet always remain-ing, in the memory of Men, as an abiblute Pattern forPrinces, and Immortalizing liimfelf in the Dejire of hisSubjeds. C c riiis 3^4 VoI.IL  Text Appearing After Image: THis naked SJdull of Death^ the difmal Scene^Which now thejlmple Spider meafures 6reWith its [light Wch \ which baffled heretoforeThe nicefi Snht ikies of Humane Brain^ Once wore a DPdem^ and triumphant flood^As Monarch of the Arts of Peace and War :His Smiles gave Life  his Anger dire Defpair ^ And all the World depended on its Nod. What once gave proudly Laws to War and Peace^Spiders and Ear-wigs do now pojfefs.Why then this Pride^ O Princes^ fince the GraveMales no DiJlinHion twixt the Bafe and Brave^Betwixt the mighty Prince and wretched Slave ? On On the Author anJ his Book, in Allufion to.the Emblem. W Hither [ofafi^ vain Man ? fore out of breathyStof^ and behold this lively Scene of Death,The Head thou feefl was Great Saavedraj once^jigreater Name no Rhetorick can pronounce.Here Piety with Policy were joind.Here Honour, Sence and Learning were combind, n     -r Falje Machiavilian Notions to convince^ And form at once a Wife and Vert nous Prince. Where now^ alas!   Note About Images Please note that these images are extracted from scanned page images that may have been digitally enhanced for readability - coloration and appearance of these illustrations may not perfectly resemble the original work."
anger,http://farm3.staticflickr.com/2745/4325199521_13fee421eb_z.jpg,1,4,"Anger One of the male lions in the Kristiansand zoo in Norway, just before it ate one of the tourists. Oh no, I lied again - I think it's a cheetah."
anger,http://farm4.staticflickr.com/3533/3265964418_26ef7b4a7d_z.jpg,1,4,Jamison Hadley Angerrrrrr
anger,http://farm3.staticflickr.com/2447/3638655646_c732559c18_z.jpg,1,4,So Full Of Hate View On Black
anger,http://farm6.staticflickr.com/5054/5424030371_a88b92d748_z.jpg,2,3,Hockey French Cup Rouen Vs Angers 198 Explore tsavoja's photos on Flickr. tsavoja has uploaded 48817 photos to Flickr.
anger,http://farm4.staticflickr.com/3086/5712788435_5182b40194_z.jpg,0,5,Anger  Explore mhs.journalism's photos on Flickr. mhs.journalism has uploaded 2778 photos to Flickr.
anger,http://farm9.staticflickr.com/8037/8062250412_0f8d267807_z.jpg,0,5,Anger Explore Leanne_Marie1993's photos on Flickr. Leanne_Marie1993 has uploaded 144 photos to Flickr.
anger,http://farm7.staticflickr.com/6122/5960792013_ecd6dcac76_z.jpg,2,3,Young Man in Car Download this: Young Man in Car stock photo for free at Pixmac.
anger,http://farm6.staticflickr.com/5235/7389015828_e6e469a268_z.jpg,2,3,return to joy 1 6x6 encaustic collage 1 of 3 www.etsy.com/listing/102340586/return-to-joy-tryptich amandajolley.com/return-to-joy/
anger,http://farm8.staticflickr.com/7550/15153204444_9899df857b_z.jpg,2,3,"Statue du Pape Gerbert par David d'Angers, Aurillac Statue rige pour commmorer le souvenir du pape Gerbert 1er, pape franais du 10e sicle. Inaugure le 16 juin 1851. Elle reprsente le pape Gerbert debout, coiff de la tiare, dans une attitude de la chaire.   Inscription aux Monuments historiques par arrt du 30 avril 1946. Cours Monthyon, Aurillac, Cantal."
anger,http://farm5.staticflickr.com/4075/4828487484_630969491a_z.jpg,0,5,Roar Camera: D80 50mm f1.4 1/125 sec ISO100 +1/3 EV dialled into the camera.  Strobist: Handheld SB-900 with difuser cap camera right. Metered via iTTL +2/3 EV dialled into the flash and triggered via CLS.
anger,http://farm4.staticflickr.com/3373/3605245818_403eaec99a_z.jpg,0,5,"This little piggy... ND3_7441_crop1  This is a crop of a shot I took at the G20 demos... This officer and his colleagues really roughed up this young female krishna protester who, like myself was swept back in the swell by riot police but unlike me, she ended up jammed between two of the parked police vans (which formed the new police line as they pulled back surrendering the RBS branch to the vandals). The officer grabbed her and, with his colleagues, shoved her into the open door of the van, shaking her and (in another of the four or five frames I shot) elbowed her in the head as she wriggled free and fled towards me... I have another shot of her taken shortly after with her bloodied ear where it appears her earing has been pulled and nearly ripped from her ear.  I wanted to post this to show something that only I witnessed.   I believe that the police strategy as a whole on the day was ill-considered and partially responsible for the the fracas that ensued. If you hem people in like animals and become heavy handed, they will respond like animals... This is not to say that there were no intentional troublemakers in the crowd (I saw plenty) but had the police maintained a much looser ring around the area, I believe the troublemakers would have had no justification to kick-off and the intended 'picnic at the bank' type protest would have been uneventful - as was the climate camp outside the climate-exchange (for the most part until the police tried to forcibly remove the campers)."
anger,http://farm8.staticflickr.com/7015/6507326349_e7a3b28707_z.jpg,1,4,anger Explore go_sleep_summer's photos on Flickr. go_sleep_summer has uploaded 296 photos to Flickr.
anger,http://farm8.staticflickr.com/7087/6865281972_f28300cf32_z.jpg,1,4,anger Explore hamid_sul's photos on Flickr. hamid_sul has uploaded 131 photos to Flickr.
anger,http://farm5.staticflickr.com/4009/4533394453_21ae7032fe_z.jpg,0,5,my poster :P Explore LINXBAS' photos on Flickr. LINXBAS has uploaded 410 photos to Flickr.
anger,http://farm4.staticflickr.com/3895/15135033351_17603e2b09_z.jpg,2,3, 
anger,http://farm4.staticflickr.com/3626/3452425701_b42b3039f5_z.jpg,0,5,this is Anger Explore chiif's photos on Flickr. chiif has uploaded 4286 photos to Flickr.
anger,http://farm4.staticflickr.com/3276/3004535214_16a66b37a4_z.jpg,2,3,Me as Angry Ryan Adams Explore Shawn M. Smith's photos on Flickr. Shawn M. Smith has uploaded 168 photos to Flickr.
anger,http://farm2.staticflickr.com/1421/5111363837_46a49ce40d_z.jpg,0,5,IMAG1075 Firey/anger
anger,http://farm4.staticflickr.com/3286/2653529669_e7de8b359d_z.jpg,0,5,Anger Warning sign with a knife in it on the side of the road leading up to Mt. Spokane.
anger,http://farm8.staticflickr.com/7579/16295178781_8db42b6d19_z.jpg,0,5, 
anger,http://farm4.staticflickr.com/3322/4603370605_60b8c6b549_z.jpg,0,5, 
anger,http://farm7.staticflickr.com/6050/6251421654_c38de28309_z.jpg,1,4,"Wake up, Political system A lot of anger against politicians - The slogan that stuck with me was ""Lets shut this country down and open it under new management"". Ironic play with the fact that there's anger about Corporations too.  - Seen at the Occupy Seattle protests"
anger,http://farm4.staticflickr.com/3371/3199599590_dcb3a2e261_z.jpg,1,4,IMG_1342EDIT-2 Explore chrisboakes' photos on Flickr. chrisboakes has uploaded 148 photos to Flickr.
anger,http://farm6.staticflickr.com/5057/5517920089_e3046a616d_z.jpg,1,4,"70/465 Rawr...It Means I Love You I took this a while back but it just seemed appropriate , after all the grrrrrrr, there is a rawr (For all those friends which have stuck by me) BeCauSE i LOvE You!!!...and you're awesome...and I couldn't live without you :)"
anger,http://farm7.staticflickr.com/6151/6135161099_6dfa910836_z.jpg,2,3,_MG_8333 Explore strictmachines' photos on Flickr. strictmachines has uploaded 3885 photos to Flickr.
anger,http://farm6.staticflickr.com/5256/5490059344_0f4bbfbedf_z.jpg,1,4,Studio Check out my Face book page and Twitter! :) facebook      Twitter
anger,http://farm6.staticflickr.com/5008/5374789657_b8eab61369_z.jpg,2,3,Tunisian Revolution -Jan20 DSC_6214 Outside RCD Ruling Party Headquarters
anger,http://farm8.staticflickr.com/7578/15407478943_9999d91e59_z.jpg,2,3,027 2014-12-13 National Day of Anger over Police Brutality -Oakland
anger,http://farm5.staticflickr.com/4053/4648608347_3928ca547a_z.jpg,1,4,"Screaming Hand A novelty concept - although not my own idea, i wish it was. i saw this idea here on flickr and did my own. Once again a special acknowledgement of my friendo natalie, who came in handy... but seriously a big thanks to her aggresive hand and big mouth."
anger,http://farm6.staticflickr.com/5255/5404547044_72b5f9d964_z.jpg,0,5,"Thousands march for Education in London and join the protest outside the Egyptian Embassy to show solidarity with the uprising. Thousands of university, college and school students  joined by workers  are marching in London and Manchester against Tory cuts to education, fee rises and attacks on jobs and services.  The revolution in Tunisia and uprising in Egypt have clearly inspired the marches. Marchers have chanted, Egypt, Egypt everywhere.  London  Aisha, an FE student from Camden in north London said, Ive been on all the demonstrations, but some of my friends are here who havent been out on the protests before.   I like the slogan This is only the beginning, because its going to be a long fight against this government.  Theo, a school student from south east London, took part in the Day X walkouts last year. He said, Lots of people who want to go to university wont be able to and people will definitely be affected by the cuts to EMA [Education Maintenance Allowance]. The government is making the wrong people pay  the bankers are getting hundreds of thousands in bonuses. For workers, the student protests have been an inspiration.  A GMB rep joining the protest in London said, Im here to show solidarity with the students. Ive got a daughter who has just gone through university and there is no way she would have been able to afford 9,000 a year fees.  Im also here to say that I dont believe in these cuts. Weve got to stick together workers and students. I think that the TUC demo on the 26 March can give people confidence to fight.  UCU lecturer Vicky Margree works at the University of Brighton. She said, We face 100 percent cut in arts and humanities funding which will hit universities hard. And the new fees will make university unaffordable for the majority of people.  Kelly Rogers, a Unison organiser, said, Unless we show solidarity with younger people we may as well give up. Students have led the way and enthused workers, showing us how to fight.  Solidarity with the Egyptian uprising  In London the mood was electric as up to a thousand students joined the many hundreds of people already protesting in solidarity with the Egyptian people outside the embassy off Park Lane.  Chants of Solidarity, solidarity, London and Cairo unite and fight and Hey ho Mubarak has to go are ringing through the air.  One man on the original protest said, I cant believe that all these young people have come to support us. This makes us feel even stronger. I cant wait to send the pictures of all you British people who have come to support us to people back home.  Before reaching the embassy, the protest stopped outside the Tory HQ at Millbank  a focus of student anger and protests last year  as students chanted, Tory scum, here we come.  Follow this link for live reports from Egypt with Judith Orr reporting from Cairo www.socialistworker.co.uk/art.php?id=23731"
anger,http://farm3.staticflickr.com/2536/4003995083_fb58a96508_z.jpg,1,4,A Tightly Wound Ball of Angst Explore A. Strakey's photos on Flickr. A. Strakey has uploaded 1765 photos to Flickr.
anger,http://farm3.staticflickr.com/2844/9217011086_fb9c20600e_z.jpg,0,5,The colors of anger Explore fe de erratas 11's photos on Flickr. fe de erratas 11 has uploaded 485 photos to Flickr.
anger,http://farm8.staticflickr.com/7466/16034628421_b69c7251ba_z.jpg,2,3,Million Marchers Day of Anger Protest in Baltimore Explore Social Justice - Bruce Emmerling's photos on Flickr. Social Justice - Bruce Emmerling has uploaded 989 photos to Flickr.
anger,http://farm4.staticflickr.com/3877/14417420174_7024097603_z.jpg,1,4,"Politicising the Law   This angers me to this day, still. Explore AlanWJ's photos on Flickr. AlanWJ has uploaded 476 photos to Flickr."
anger,http://farm4.staticflickr.com/3012/3114528352_8e879185e5_z.jpg,2,3,"Jerry Elliot Amateur Sparring 2008-12-13, Cologne, Germany at Jerry Elliot's Boxing Gym. For any usage, ask permission at www.evrim-sen.com."
anger,http://farm4.staticflickr.com/3748/12819212455_097a11f7d0_z.jpg,2,3,"Butcher Babies Fonte official FB Page: www.facebook.com/ButcherBabiesMusic  Taken at face value, GOLIATH is the monstrous debut from one of the most exciting bands to emerge from the Los Angeles metal scene since System Of A Down turned the city on end nearly twenty years ago. But scratch beneath the surface and the haunting story behind GOLIATH blurs in and out of horrific focus, examining the ruins of an American culture obsessed with apocalyptic carnage. GOLIATH was born in the bleak wasteland where the more savage your act, the more celebrated you become - and in a world where the miserable feel obliged to retaliate, the BUTCHER BABIES shatter the dementia with molten fury and unbridled sonic bliss.   Hailing from the City Of Angels, the BUTCHER BABIES offer redemption from the overplayed underground, exorcising demons with a visceral sound matched only in scope by their explosive stage show. Frontwomen Carla Harvey and Heidi Shepherd, guitarist Henry Flury [Amen], bassist Jason Klein [Azdachao] and drummer Chris Warner [Scars of Tomorrow] juxtapose brutal, aggressive riffs with beautiful melodies that wail with anguish and hope for redemption.    The band signed a worldwide deal with Century Media Records in December 2012, and a month later hit the road with Marilyn Manson on what proved to be one of the new year's most talked about tours. The run was a return to form for Manson and a call to arms for the BUTCHER BABIES, who honed their razor-sharp riffs and soul-searing vocals in front of live audiences as a source of manic pre-production. Only days after wrapping the tour in the City Of Sin, the band was in an L.A. studio with producer Josh Wilbur [Gojira, Lamb Of God, Hatebreed] recording the debut album that has the metal community buzzing.    The eleven-track opus chronicles the story of the forsaken as they transform into GOLIATH - monsters that society has built, and monsters that turn to society for retribution. Suddenly opening track ""I Smell A Massacre"" is more than just shock rock, casting a cautionary tale to anyone in screaming distance. And once it sinks in that GOLIATH is more than just a figment of our imagination, the rest of the album becomes all the more real.   ""Magnolia Blvd"" is about the demons that coexist around us all, while ""Grim Sleeper"" is unsettling and haunting, an angelic intro quickly pulverized by a repressed memory so real we feel the victim's cries. ""In Denial"" couples blood-curdling angst with more of the melodies that showcase the BUTCHER BABIES unique, two-frontwoman lineup at its most profound - singing and screaming trading hope and rage like caged souls fighting for freedom. ""Give Me Reason"" bounces hard and fast with hell-bent fury, ""The Mirror Never Lies"" assaults our reflection with an ominous and catchy chorus, and ""The Deathsurround"" showcases the band at perhaps its most intense with a song as heavy and brutal as the title suggests.   BUTCHER BABIES celebrate the July 9 release of GOLIATH as part of the 2013 Rockstar Energy Drink Mayhem Festival, where they are a mainstay on the Jagermeister stage and spend the summer alongside heavyweights including Rob Zombie, Five Finger Death Punch, Machine Head, Mastodon and Amon Amarth.    With an unrelenting delivery and uncompromising intent to melt faces, GOLIATH is more than just a record - it is the growing enemy that angers, drives and inspires the BUTCHER BABIES. GOLIATH is our common enemy, and BUTCHER BABIES have arrived to deliver the soundtrack that will lead us into battle...   "
anger,http://farm1.staticflickr.com/104/369218869_f2a84895b0_z.jpg,1,4,Don't Anger It #1 Explore THEfunkyman's photos on Flickr. THEfunkyman has uploaded 25286 photos to Flickr.
anger,http://farm3.staticflickr.com/2432/5843096541_fbdb2810d0_z.jpg,0,5,"Fight Club // Self-Portrait 2011  Website/Blog/Facebook/Vimeo/Tumblr  I am not a huge fan of taking self portraits, but I wanted to do something unique for my website. I have been working on completely redeveloping the current website layout with my web designer to create something even more amazing. Chances are the new website layout will be released in July or August.   I think it's been about a year since I originally wanted to do this image, but finally I got around to it. To spice up my portfolio I really wanted to mess around with more harsher lighting, partly due to one of my photographer inspirations Terry Richardson.   ___________________________________________________________________________  Make Up Artist:  Ashley Lindroth Photographer Assistant (button pusher):  Joshua Radabaugh Model, Photographer, & Everything Else: Jeff Thomas ___________________________________________________________________________  Lighting Setup:  -  AB800 shot bare above and left of the camera @ F10  ___________________________________________________________________________ Vertex Photography"
anger,http://farm4.staticflickr.com/3882/15137668742_7ac2f8249e_z.jpg,2,3, 
anger,http://farm9.staticflickr.com/8524/8644756671_e89a57a750_z.jpg,1,4,"Anger on the streets - Athens, Greece Explore anjin-san's photos on Flickr. anjin-san has uploaded 26043 photos to Flickr."
anger,http://farm3.staticflickr.com/2882/9909267973_1d966abe91_z.jpg,1,4,anger_management Try Me. 
anger,http://farm7.staticflickr.com/6058/7022154981_71271d1ce7_z.jpg,2,3,Anger Oil & Canvas 24 x 12
anger,http://farm9.staticflickr.com/8665/15828746788_c366de9f37_z.jpg,1,4,Millions March NYC March for justice for victims of police violence.
anger,http://farm8.staticflickr.com/7545/15482001128_43d6dcc53a_z.jpg,2,3, 
anger,http://farm6.staticflickr.com/5291/5566889680_a36a7ed706_z.jpg,2,3,Untitled Explore DMeltonPhoto's photos on Flickr. DMeltonPhoto has uploaded 176 photos to Flickr.
anger,http://farm9.staticflickr.com/8338/8193737183_f9777c0f26_z.jpg,1,4,"Demonstrations against the Gaza invasion in Beitunia, West Bank, Palestine Israeli army fired tear gas and rubber bullets at  demonstrators at the Beitunia Detention Centre, just outside Ramallah in the West Bank. Protests and demonstrations are being held all across the West Bank in anger of the Israeli attacks on Gaza."
anger,http://farm4.staticflickr.com/3725/10043875745_8714169350_z.jpg,0,5,"1/10/13 Anger pose, free                                "
anger,http://farm6.staticflickr.com/5242/5366908012_514fb56a7d_z.jpg,1,4,anger consumes me Explore yogamonkey47's photos on Flickr. yogamonkey47 has uploaded 13 photos to Flickr.
anger,http://farm8.staticflickr.com/7149/13162830263_a6ca894888_z.jpg,1,4,"The Calm and The Anger NIKON D600 + 24.0-70.0 mm f/2.8 @ 44 mm, 1 sec at f/11, ISO 100 www.rc.au.net/blog/2014/03/14/south-garie/  Rodney Campbell"
anger,http://farm4.staticflickr.com/3228/3106554051_986e73e488_z.jpg,1,4,"Jerry Elliot Amateur Sparring Aron  vs. Jorgo, 2008-12-13, Cologne, Germany at Jerry Elliot's Boxing Gym. For any usage, ask permission at www.evrim-sen.com."
anger,http://farm3.staticflickr.com/2617/3904366690_1f0c8e0859_z.jpg,1,4,"P1030685 Anger-less Rimmer (Red Dwarf episode ""Polymorph"")"
anger,http://farm7.staticflickr.com/6178/6247373511_ec17bba734_z.jpg,1,4,amendolaA_Roma15otct11_indignati_521 Game Over Rome - Il giorno della Rabbia e della Follia  www.facebook.com/media/set/?set=oa.10150320355536568&...
anger,http://farm6.staticflickr.com/5015/5416565687_afe32273e2_z.jpg,1,4,friday of anger.  Explore mohamed_samir_doody's photos on Flickr. mohamed_samir_doody has uploaded 123 photos to Flickr.
anger,http://farm9.staticflickr.com/8386/8477166425_bd887e13ec_z.jpg,0,5,Anger_Self Portrait_Hangers Explore shanbam1331's photos on Flickr. shanbam1331 has uploaded 454 photos to Flickr.
anger,http://farm5.staticflickr.com/4001/4356031019_ebf229c2f2_z.jpg,2,3,IMG_1575 Explore Vaillante Angers Tennis de Table's photos on Flickr. Vaillante Angers Tennis de Table has uploaded 5419 photos to Flickr.
anger,http://farm3.staticflickr.com/2574/3892828921_9e12864915_z.jpg,0,5,"Anger Management??? lol our original plan was to make a photoshoot about Movies. However, some movies that we like requires a whole lot of preparation (set-up,clothes,etc) so we decided to have the ""Executive/Corporate"" as the photoshoot theme. However, during the shoot, we were all having fun and started to let our goofy selves come out except for Kenji who was so funny the entire time; so this shot is one of the results.  Enjoy. =)"
anger,http://farm8.staticflickr.com/7358/9494108319_837cf0537c_z.jpg,1,4,"young woman screaming Beautiful young woman in blue shirt with dark hair screaming. Hands at her ears, mouth wide open, looking into the camera, dark background."
anger,http://farm3.staticflickr.com/2332/2346536358_0f3b5a8a33_z.jpg,2,3,18 mars 2008 - Bleus vs. Rouges Ligue d'improvisation de Qubec
anger,http://farm5.staticflickr.com/4046/4577658654_9c3f580677_z.jpg,1,4,Angry bottle (txt) fritsAhlefeldt.com
anger,http://farm6.staticflickr.com/5124/5318207653_9d69113710_z.jpg,2,3,Golden Got bored and painted my body gold. This is the first one I edited. I've got a lot more to look through and finish.
anger,http://farm7.staticflickr.com/6116/6252109337_47706843bc_z.jpg,0,5,DSC01906.jpg Explore photogDeAlpha's photos on Flickr. photogDeAlpha has uploaded 101 photos to Flickr.
anger,http://farm6.staticflickr.com/5303/5665105238_ff1e221bf2_z.jpg,2,3,"Tapisserie de d'Apocalypse, Angers Explore Martin Cassell's photos on Flickr. Martin Cassell has uploaded 1787 photos to Flickr."
anger,http://farm5.staticflickr.com/4013/4498998772_aa630863c9_z.jpg,1,4,Reflecting Anger Explore GretkinRB's photos on Flickr. GretkinRB has uploaded 107 photos to Flickr.
anger,http://farm8.staticflickr.com/7194/13233118253_5200475014_z.jpg,0,5,"Red Troop Oath:   ""With blood and anger of a red fiery ...  Dragged a corpse still hot ...  Added to our hatred that burns hellish Burning all ...  Here is the final destination!"""
anger,http://farm4.staticflickr.com/3146/2788911193_13e5e4252d_z.jpg,2,3,"Cane burn Burning sugar cane.  Hawaii 1993.  For days, the air was filled with the smoke and ash from burning fields.  You could barely breathe for the stench.  Slender cane, dancing in the night sky, A fiery image reflected in the clouds.  Leaves are gathered by the orange reaper Turning them black with anger and rage. Fields are scraped down to blood red earth, Ripping the flesh of topsoil and casting it off To some mechanical fuel factory.  The essence of life  Is packaged in sugar lumps And sent off to tea parties in Boston.  Meanwhile, the land lays barren, Waiting to be eaten by the housing machine Which has devoured so much of the island. Waikiki. Kailua. Waianae. Waialua. It is ravenous; a hungry people would sell their souls to the beast. "
anger,http://farm8.staticflickr.com/7150/6799853807_656d24b40c_z.jpg,2,3,"Scarlet Anger @ Desdemonia :15 Years on Stage Anniversary Party, Kulturfabrik, Esch s/Alzette, Luxembourg.  2012-01-28 These images are copyright protected Don't use them without my prior written permission"
anger,http://farm8.staticflickr.com/7053/6963032787_1bb221bfb0_z.jpg,1,4,Anger? Explore ayteguhpranoto1's photos on Flickr. ayteguhpranoto1 has uploaded 217 photos to Flickr.
anger,http://farm5.staticflickr.com/4146/5023235501_4bd245931d_z.jpg,2,3,"100925 Life Means Life 184 ""Families Fighting For Justice"", a group made up of people who have lost loved ones through acts of violence march in central London calling for 'life' prison sentences to be for the whole of the prisoner's life. Westminster September 25, 2010"
anger,http://farm6.staticflickr.com/5050/5234663641_379bc94dc9_z.jpg,0,5,Anger.  Explore kgear3's photos on Flickr. kgear3 has uploaded 136 photos to Flickr.
