contentment,http://farm3.staticflickr.com/2939/14781662462_a0a34e7363_z.jpg,2,3,"Image from page 198 of ""Taps"" (1916) Identifier: taps1916clem Title: Taps Year: 1916 (1910s) Authors:  Clemson University Subjects:  Clemson University--Students--Yearbooks Clemson Agricultural College of South Carolina--Students--Yearbooks. Publisher:  Clemson University Contributing Library:  Clemson University Libraries Digitizing Sponsor:  LYRASIS Members and Sloan Foundation   View Book Page: Book Viewer About This Book: Catalog Entry View All Images: All Images From Book  Click here to view book online to see this illustration in context in a browseable online version of this book.   Text Appearing Before Image: at Athens, on Thanksgiving Day: ScoreGeorgia, 13; Clem-son, o. Picking up a fumbled ball in midfield, Paddock scored for Georgia in the firsthalf. Georgia scored again in the fourth period, after most of our regulars had been with-drawn from the game. Thus fiercely contested, Georgia got her revenge for her disastrousdefeat under the Tigers paw in 1Q14. At a dinner held for the team in the Georgian Hotel, at Athens, on Thanksgiving night,everyone expressed satisfaction over the seasons success. The squad realized how aheavy schedule had placed a handicap on the success of a comparatively light team. Therewas left, however, a secret morsel of contentment in the bitter cup of defeat. The teamhad fought all the way through every game; fought with the doggedness and tenacity ofthe traditional Tigers at bay; fighting for the sacredness of their goal as the beast fightsfor its very existence.  ^~B^^n 4i 1 i-lj JM  Cj >4r*m 1 ** -.jm ^ 5 afcraB^^^ * V SOPHOMORE 1 ooTUAI.I SO  Text Appearing After Image: C. S. AndersonCaptain Baseball THE TEAM   Note About Images Please note that these images are extracted from scanned page images that may have been digitally enhanced for readability - coloration and appearance of these illustrations may not perfectly resemble the original work."
contentment,http://farm8.staticflickr.com/7439/9416363945_8c8e61a42e_z.jpg,2,3,"Facial Expressions ""Had we but world enough, and time, This coyness, lady, were no crime.""                                                                  Andrew Marvel, To His Coy Mistress  I don't know whether the facial expression in this duck is coyness, shyness, flirtatiousness, or contentment, but she sure is expressive!  Our Daily Challenge: Facial Expressions"
contentment,http://farm4.staticflickr.com/3078/3158230159_861c3b42f7_z.jpg,1,4,"Great Smoky Mountains Nat Park - Cades Cove - Carter Shields Cabin A wound sufferer in the Battle of Shiloh left George Washington ""Carter"" Shields crippled for life. Shortly after the war he married and moved to Kansas. He returned to Cades Cove in 1906 and bought this property in 1910. One would think that an old soldier could find contentment in such a lovely nook. But Shields lived here only 11 years before leaving again."
contentment,http://farm4.staticflickr.com/3928/15327602818_e6155ca6df_z.jpg,2,3,Fremantle Seafood lunch by the harbour with this view. Such contentment. 
contentment,http://farm9.staticflickr.com/8434/7781331394_4868f80bfb_z.jpg,1,4,Reminiscing The Past These pictures were taken with my Canon EOS 7D for wonderful and loving couple. It serves as my well wishes towards them.
contentment,http://farm4.staticflickr.com/3199/5738946445_98d6cd34e5_z.jpg,1,4, 
contentment,http://farm9.staticflickr.com/8646/15934520675_a66de7f64f_z.jpg,2,3,Contentment Explore dremmettbrown's photos on Flickr. dremmettbrown has uploaded 2782 photos to Flickr.
contentment,http://farm8.staticflickr.com/7219/6986642874_d3bd17e53f_z.jpg,1,4,Contentment Explore fear ciun's photos on Flickr. fear ciun has uploaded 989 photos to Flickr.
contentment,http://farm8.staticflickr.com/7320/12615783333_9022b9694f_z.jpg,2,3,Flatcoat near contentment Explore jones_in_chester's photos on Flickr. jones_in_chester has uploaded 2524 photos to Flickr.
contentment,http://farm4.staticflickr.com/3885/15322898325_a9ef04c89d_z.jpg,2,3,Filigree Beautiful lines and wiggly curves - branches of two birch trees.
contentment,http://farm4.staticflickr.com/3561/3337808773_e398592675_z.jpg,2,3,P1130970 Contentment. Camels on the beach with their masters.
contentment,http://farm3.staticflickr.com/2527/3825814481_563c9ec4db_z.jpg,2,3,Contentment www.wordpaint.com/prem/en/ocean_drop.htm
contentment,http://farm8.staticflickr.com/7255/7042175371_dcb4c0fbca_z.jpg,1,4,Content I've never seen such contentment. Something's not right.
contentment,http://farm8.staticflickr.com/7356/12940759954_22e3a29301_z.jpg,2,3,Contentment . 
contentment,http://farm7.staticflickr.com/6102/6247562953_1f7e9ff8a4_z.jpg,0,5,contentment is tummy time Explore Matthew.Stevens' photos on Flickr. Matthew.Stevens has uploaded 1137 photos to Flickr.
contentment,http://farm6.staticflickr.com/5218/5530855267_38cce4ab13_z.jpg,0,5, 
contentment,http://farm3.staticflickr.com/2838/9542294262_fe3311c52b_z.jpg,2,3,"Our Lady of Guadalupe ""Do listen. Do be assured of it in your heart, my littlest one that nothing at all should alarm you, should trouble you, nor in any way disturb your countenance, your heart. . .  For am I not here, I, your Mother? Are you not in the cool of my shadow? In the breeziness of my shade?  Is it not I that am your source of contentment? Are you not cradled in my mantle? cuddled in the crossing of my arms? Is there anything else for you to need?""  Our Lady of Guadalupe  ~  ""Feminine energy is powerful because it is pure presence -- gentle yet firm.  It is an energy that gives warmth, comfort, and spirit simply by its presence.  It receives rather than takes.  It invites rather than demands.  It unfolds rather than controls.  It empowers rather than overpowers.  It finds itself in being rather than in doing.  Feminine energy shows her best face in leisure.  She doesn't take time.  She has time.  She has time to be.  The world is starving for this energy.  It is part of the fire Christ came to cast on the earth - a slow ame that burns from within and gradually transforms what it touches, precisely because it touches rather than clutches.  MACRINA WIEDERKEHR, A Tree Full of Angels, Seeing the Holy in the Ordinary, Harper Collins Publishers  ~  I found this church/shrine a comforting place to be while I was in Santa Fe this summer.  A much smaller place than the St. Francis cathedral in the downtown, and less visited, but this place felt instantly homelike. The priest gave an inspiring talk about how the face of God looks different depending on your culture/background. It kind of felt like being in Divine Mother's womb, a good place to be as I prayed for my brother who was struggling with pancreatic cancer."
contentment,http://farm4.staticflickr.com/3913/14190845337_e1c738c388_z.jpg,0,5,"The Eastern Path Listen to the Rain  Omnibus Omnia Factus Sum has been my new adopted moto since my birthday and I've taken it to heart.  It is Latin meaning ""I Become All Things"". Society keeps bombarding us on how we should always strive for happiness at all times.  It's total bullshit IMHO.  I've learned that trying to be happy all the time is like constantly flexing a muscle.  At some point you'll damage yourself or the moment you stop being happy the smallest sense of misery will be overwhelming.    I've decided to adopt a bit of Eastern philosophy.  To strive for inner peace and contentment.  To let the chaos flow around me and not flow with the chaos or to fight it back.  A stone in a river letting the waves pass over me, not to be the leaf being tossed around nor the dam trying to hold the river back.   To redirect the energy.   Emotional Aikido.  Don't worry, my art isn't going to be bright and cheery all the time.  I'm sleeping better and I still embrace my Darker Half };-)  Copyright  2014 Vic Bonilla All Rights Reserved.  Do not reproduce this image without expressed permission from the photographer.  Twitter Facebook"
contentment,http://farm4.staticflickr.com/3494/3865768043_78125cdbc1_z.jpg,0,5,contentment Explore shari.dvorak's photos on Flickr. shari.dvorak has uploaded 18833 photos to Flickr.
contentment,http://farm8.staticflickr.com/7248/7775210638_e2780ea852_z.jpg,1,4,"Stranger #59 Gee,  what  a charming and care-free woman. Gee is her name, and she greeted us with a phrase in German, which I didn't quite get, but which meant something like ""life is beautiful"". Her exclamation was expressing, I guess, the contentment of having arrived in the resort of Ascona, Switzerland, situated in  the northernmost part of the Lago Maggiore. The place  is indeed a wonderful place (see comment photo), and we stopped to chat with her for a while.  Gee had just arrived from Basel, where she resides, and, after checking in, had moved herself onto the sea-front for a drink and taking in the view. I asked her about her country, and she was more than willing to impart her views and opinions of the Swizz  people.  When I asked her to get a stranger shot, she seemed to take it as a compliment - which it was - but also had doubts if she would still be an attractive subject: she had modelled in previous times she said. I took one or two, and she looked terrified in the shots, so I had to chat-and-shoot, and when I finally got her laughing I caught this.  Well, Gee, thanks for the photo; I cannot imagine that you ever looked better in your life!  This picture is #59 in my 100 strangers project. Find out more about the project and see pictures taken by other photographers at www.100strangers.com/  All my strangers can be seen in 100 Strangers set."
contentment,http://farm9.staticflickr.com/8301/7871604930_18629e2605_z.jpg,2,3,Sparkle           
contentment,http://farm7.staticflickr.com/6091/6254042381_ec315f5cdf_z.jpg,2,3,Happiness Is all around you.  Bright Smile
contentment,http://farm8.staticflickr.com/7376/10195861586_e581a8a9da_z.jpg,1,4, 
contentment,http://farm9.staticflickr.com/8169/8068996722_bcc6ec94bb_z.jpg,2,3,"Image ID# Whalen-120429-2983 | Silver Falls State Park Five The Silver Falls State Park is a unique wilderness area that provides easy access to a number of large waterfalls in a relatively small area just outside of Salem, Oregon."
contentment,http://farm6.staticflickr.com/5238/7183306597_3cee3d487b_z.jpg,2,3,contentment_0087 Explore mattia-candeloro's photos on Flickr. mattia-candeloro has uploaded 15 photos to Flickr.
contentment,http://farm3.staticflickr.com/2543/5830634940_574874c546_z.jpg,0,5,Contentment Explore Clivert9's photos on Flickr. Clivert9 has uploaded 193 photos to Flickr.
contentment,http://farm8.staticflickr.com/7383/9823909056_47669a002a_z.jpg,0,5,Contentment Explore Anthony Mark Images' photos on Flickr. Anthony Mark Images has uploaded 1877 photos to Flickr.
contentment,http://farm7.staticflickr.com/6123/6018571908_772895b178_z.jpg,1,4,Contentment There's something about walking on the beach for miles and miles.  We're Blessed with a huge beach and we love to make the most of it whenever we can.  Took this shot on a foggy eve.  The clarity's not too great but the view was perfect!  Enjoy!  Having a brilliant long weekend - hope you're having fun too.   www.youtube.com/watch?v=WbrSLLv0AlA&ob=av3e   x
contentment,http://farm7.staticflickr.com/6212/6343122964_7a6f4fd97c_z.jpg,0,5,rosey posey :: perfect contentment habit 11.13.11
contentment,http://farm9.staticflickr.com/8346/8198777035_43c33d830e_z.jpg,2,3,"Smile of Contentment! Chandni Chowk, Delhi, India  Press 'L' to see in Black"
contentment,http://farm9.staticflickr.com/8335/8355334667_8ef30fcd3a_z.jpg,1,4,little girl playing on the beach Asian little girl playing sand on the beach
contentment,http://farm4.staticflickr.com/3144/5790794899_de475ba912_z.jpg,2,3,"winding roads.  the winding roads that led me here burn like coal and dry like tears So here's my hope, my tired soul   there's a prominent contrast between contentment and sorrow. there's so much that I need to learn, so much that i take for granted.  there's so much that i wish I could tell you.  there's just so much I wish to know about you. So much. and life is just so fleeting, isn't it?  why do I sit here and mull over these things instead of just doing them -- life is too short for this, too short for pondering.   Today was my last day of school.  Tomorrow I walk across the stage and take in my hands a diploma that states I have graduated High School.   Is this for real?  icantbreatheicantbreatheicantbreatheicantbreathe.    +++  listen."
contentment,http://farm4.staticflickr.com/3071/2881876839_ae4a90f74e_z.jpg,2,3,Untitled Explore routemaster_fan's photos on Flickr. routemaster_fan has uploaded 4523 photos to Flickr.
contentment,http://farm6.staticflickr.com/5269/5656209684_3aa01a8af6_z.jpg,1,4,Contentment Explore Gretchen Fuss' photos on Flickr. Gretchen Fuss has uploaded 33 photos to Flickr.
contentment,http://farm7.staticflickr.com/6021/5917887275_36d3057a93_z.jpg,1,4,Lavender in Garden Explore jacobus.swart's photos on Flickr. jacobus.swart has uploaded 132 photos to Flickr.
contentment,http://farm7.staticflickr.com/6052/6345282958_db7652e8a1_z.jpg,1,4,"On the Chopping Block: Happy Monday Morning Oranges The Orange    By Wendy Cope    At lunchtime I bought a huge orange  The size of it made us all laugh.  I peeled it and shared it with Robert and Dave  They got quarters and I had a half.    And that orange it made me so happy,  As ordinary things often do  Just lately. The shopping. A walk in the park  This is peace and contentment. It's new.    The rest of the day was quite easy.  I did all my jobs on my list  And enjoyed them and had some time over.  I love you. I'm glad I exist.  Wendy Cope, ""The Orange"" from Serious Concerns, Published by Faber & Faber www.amazon.co.uk/Serious-Concerns-Wendy-Cope/dp/0571167055  Amazon.com Kindle version: www.amazon.com/mn/search/?ref%5F=nb%5Fsb%5Fnoss&url=s..."
contentment,http://farm3.staticflickr.com/2094/2255938129_f7b87d2d79_z.jpg,2,3,HPIM1393 Hpim1393.Jpg
contentment,http://farm4.staticflickr.com/3846/14781721961_3758d5683a_z.jpg,1,4,"Image from page 1142 of ""The ideal Holy Bible self-pronouncing, self-interpreting, self-explanatory.."" (1908) Identifier: idealholybiblese00unse Title: The ideal Holy Bible self-pronouncing, self-interpreting, self-explanatory.. Year: 1908 (1900s) Authors:  Subjects:  Publisher:  Chicago Contributing Library:  The Library of Congress Digitizing Sponsor:  The Library of Congress   View Book Page: Book Viewer About This Book: Catalog Entry View All Images: All Images From Book  Click here to view book online to see this illustration in context in a browseable online version of this book.   Text Appearing Before Image: ither for the body,what ye shall put on. (Lu. 12:22.) f. Thou wilt keep him in perfect peace, whose mind is stayed onthee: because he trusteth in thee. (Is. 26:3.) Peace I leave with you,my peace I give unto you: not as the world giveth, give I unto you.Let not your heart be troubled, neither let it afraid. (Jno. 14:27.) g. That which was lacking to me the brethren which came fromMacedonia supplied. (II Cor. 11:9.) h. But godliness with contentment is great gain (6). And havingfood and raiment let us be therewith content. (I Tim. 6:6, 8.) And Godis able to make all grace abound toward you; that ye, always havingall sufficiency in all things, may abound to every good work. (II Cor.9:8.) Let your conversation be without covetousness; and be contentwith such things as ye have: for he hath said, I will never leave thee,nor forsake thee. (Heb. 13:5.) i. Even unto this present hour we both hunger, and thirst, and arenaked, and are buffeted, and have no certain dwelling-place. (I Cor.-1:11.)  Text Appearing After Image: JESUS AND THE CHILDREN.F. Kircbbaeh. Ch. 4 PHILIPPIANS A. D. 64 999 things I am instructed both to be full and tobe hungry, both to abound and to suffer need. 13 I can do all things through Christ whichstrengtheneth me. 14 Notwithstanding ye have well done, thatfcye did communicate with my affliction. 15 Now ye Phi-lippi-an know also, that inthe beginning of the gospel, when I departedfrom Mac-e-doni-a, no church communicatedwith me as concerning giving and receiving,but ye only. 16 For even in Thes-sa-lo-nlca ye sentonce and again unto my necessity. 17 Not because I desire a gift: but I desirefruit that may abound to your account. 18 But I have all, and abound: I am full, 6. The measure of the blessingsthe Father confers upon his peopleif they will obey is according to thelimit of his riches or ability. having received of E-paph-ro-dltus the thingswhich were sent from you, an odour of a sweetsmell, a sacrifice acceptable, wellpleasing toGod. 19 But my God flshall supply all y   Note About Images Please note that these images are extracted from scanned page images that may have been digitally enhanced for readability - coloration and appearance of these illustrations may not perfectly resemble the original work."
contentment,http://farm9.staticflickr.com/8104/8563288655_3e330d4d8d_z.jpg,2,3,Golden rays bring joy I love how the light shines in the tall grass.  Creates a mood and feeling of contentment.  All feels right in a world with so much wrong.
contentment,http://farm9.staticflickr.com/8167/7172105483_01b23c1d15_z.jpg,1,4,Contentment.  No processing.
contentment,http://farm7.staticflickr.com/6197/6029768547_bc016f04aa_z.jpg,1,4,Contentment Explore Craig A Hunter's photos on Flickr. Craig A Hunter has uploaded 217 photos to Flickr.
contentment,http://farm3.staticflickr.com/2707/4261090584_e604c88e11_z.jpg,2,3,Contentment Monty (post the swim in the creek) all called up on the camp chair.  There was no chance anyone was going to move him.  100% off camera NO adjustments (I didn't feel it needed any).
contentment,http://farm4.staticflickr.com/3107/3249740327_32a7630d19_z.jpg,2,3,Sunset at our new home ...ahhh contentment!
contentment,http://farm9.staticflickr.com/8496/8327142917_3364db3a34_z.jpg,2,3,"Festivity Well, it's still Christmas...   Luminance HDR,  Reinhard05 operator."
contentment,http://farm6.staticflickr.com/5293/5478909343_0b01f1b1ec_z.jpg,0,5,It's a Dog's Life Contentment
contentment,http://farm4.staticflickr.com/3736/11619257494_1d33464282_z.jpg,1,4,Contentment Explore shelling1960's photos on Flickr. shelling1960 has uploaded 252 photos to Flickr.
contentment,http://farm4.staticflickr.com/3289/2729070260_1981b128c8_z.jpg,1,4,"Abundance Whatever we are waiting for - peace of mind, contentment, grace, the inner awareness of simple abundance - it will surely come to us, but only when we are ready to receive it with an open and grateful heart. ~ Sarah Ban Breathnach  Project 365 August 2, 2008  www.tyleredwards.theambientshowcase.com/music/Zombies-Tim...  The Zombies ~ Time of the Season   "
contentment,http://farm7.staticflickr.com/6182/6124093485_27f65b30ee_z.jpg,0,5,4_Contentment Explore Go2Cane's photos on Flickr. Go2Cane has uploaded 77 photos to Flickr.
contentment,http://farm4.staticflickr.com/3803/9253380579_ec9631573e_z.jpg,2,3,Realize Explore Ronnel Oares' photos on Flickr. Ronnel Oares has uploaded 343 photos to Flickr.
contentment,http://farm4.staticflickr.com/3511/3217189075_6ce28abd0d_z.jpg,1,4,man in chair This chap is relaxing in his chair after a nice round of golf. With a nice glass of red wine and his cat for company he is the picture of contentment. Handmade personalised cake toppers available for all occasions from www.nikkisnoveltygifts.com
contentment,http://farm5.staticflickr.com/4068/4574822953_83d189c270_z.jpg,2,3,Alang's Rawa Posted at thebookofshadow.blogspot.com/2010/05/rawa-island-and-godl...
contentment,http://farm4.staticflickr.com/3861/15179512207_bbf980d2ba_z.jpg,0,5,Quiet Contentment Explore Kristen Blume's photos on Flickr. Kristen Blume has uploaded 36 photos to Flickr.
contentment,http://farm3.staticflickr.com/2597/5806183583_fd3f6d687e_z.jpg,1,4,Contentment Explore The Drake Family's photos on Flickr. The Drake Family has uploaded 1744 photos to Flickr.
contentment,http://farm5.staticflickr.com/4019/4680161380_6600a768e9_z.jpg,2,3,Contentment Explore Thomas B. Norton Public Library's photos on Flickr. Thomas B. Norton Public Library has uploaded 121 photos to Flickr.
contentment,http://farm6.staticflickr.com/5015/5443731290_e3fa3ca8f7_z.jpg,2,3,contentment Explore clickinainteasy's photos on Flickr. clickinainteasy has uploaded 1318 photos to Flickr.
contentment,http://farm6.staticflickr.com/5460/9597973479_1e619c802d_z.jpg,0,5, 
contentment,http://farm4.staticflickr.com/3582/3647538755_621cbdc582_z.jpg,0,5,100_7841 Always with teh belly rubs...
contentment,http://farm4.staticflickr.com/3161/3017531082_660d188ac8_z.jpg,1,4,contentment Explore spin.the.tail.on.the.dreidel(and.other.games)'s photos on Flickr. spin.the.tail.on.the.dreidel(and.other.games) has uploaded 287 photos to Flickr.
contentment,http://farm3.staticflickr.com/2802/4274369086_d03ab37b0c_z.jpg,1,4,Hank goes for a swim Explore juliejordanscott's photos on Flickr. juliejordanscott has uploaded 40415 photos to Flickr.
contentment,http://farm4.staticflickr.com/3726/12610773204_4176899c27_z.jpg,2,3, 
contentment,http://farm5.staticflickr.com/4020/4406876297_d366057496_z.jpg,0,5,Contentment Photo's taken during a recent newborn Twin photo.  All rights reserved. 
contentment,http://farm6.staticflickr.com/5172/5451557144_dffd8062f8_z.jpg,2,3,"contentment Bright afternoon, 16 Feb 2011."
contentment,http://farm3.staticflickr.com/2889/11093154563_204b3de7ab_z.jpg,1,4, 
contentment,http://farm4.staticflickr.com/3635/3343828932_521b6e55a2_z.jpg,2,3,"Untitled ""... love must surely reside in the gap between desire and fulfillment, in the lack, not the contentment. Love was the ache, the anticipation, the retreat, everything around it but the emotion itself.""    - Kiran Desai, The Inheritance of Loss just started reading the book and am getting lost in her wonderful prose :)"
contentment,http://farm6.staticflickr.com/5285/5375285645_17157abdc1_z.jpg,1,4,laughing with my girl Explore Robin Norgren's photos on Flickr. Robin Norgren has uploaded 530 photos to Flickr.
contentment,http://farm3.staticflickr.com/2843/9165965297_9ac3cfb9f8_z.jpg,2,3,"Contentment personified Or cowified in this case! Many thanks,  Neil Good Pricing, Cressex This email message has been delivered safely and archived online by Mimecast. For more information please visit www.mimecast.com"
contentment,http://farm9.staticflickr.com/8270/8709070809_a7ebae5525_z.jpg,1,4,Contentment Explore Likeaword's photos on Flickr. Likeaword has uploaded 1446 photos to Flickr.
contentment,http://farm4.staticflickr.com/3048/2616750897_feb23aba9f_z.jpg,1,4,Content Mel (not short for Melanie) and Jon at the House Party.
contentment,http://farm5.staticflickr.com/4027/4682079494_8a53b2f5d2_z.jpg,0,5, 
contentment,http://farm7.staticflickr.com/6103/6278245638_2dab06144d_z.jpg,2,3,"The Creators Project - NYC - A Physical Manifestation of Ladies & Gentlemen, We Are Floating in Space A Physical Manifestation of 'Ladies and Gentlemen We Are Floating in Space' By Jonathan Glazer and J.Spaceman (2011)  Presented by The Creators Project Produced by Juliette Larthe   Architectural design by Undisclosable A/V Creative and Technical realization by One of Us Original music by Spiritualized courtesy Sony Music / BMG Chrysalis  A Physical Manifestation of Ladies and Gentlemen, We Are Floating in Space is sound proof and light proof, totally isolated from the world it inhabits. Overhead columns of light create individual protagonists of the participants, as a melody flows down in isolated soundscapes from focused speakers, and the reminder of the song loops from barely visible walls. In each luminescent column lies a place of intimacy, as materiality and sound foam at the edges. Participants arrive at a mutual suspension to find both containment and contentment, exploring a vast vessel filled with something extremely delicate, but also impenetrable. -J. Eischeid  Date of installation: October 12-16, 2011 Construction period: 5 days Area: 1000 s.f."
contentment,http://farm8.staticflickr.com/7222/7361353700_f4508b9b40_z.jpg,2,3,Curve The wild honeysuckle seems to be thriving at the moment.
contentment,http://farm4.staticflickr.com/3200/2988390630_c1f965884d_z.jpg,2,3,"DSC07284, Bellagio Hotel, Las Vegas, Nevada, USA Contentment and opulence are the hallmarks of the Bellagio luxury hotel experience. A retreat unto themselves, the 3,933 Guest Rooms and Suites are an extension of the AAA Five Diamond Award-winning Las Vegas hotel.   Grant yourself the luxury of discovery time as you explore the dramatic features which distinguish this exquisite Las Vegas resort from every other destination in the world. From dancing fountains to a breathtaking Conservatory & Botanical Gardens to serenity-splashed Pools & Courtyards, enjoy!  "
contentment,http://farm3.staticflickr.com/2244/2197622088_5eae7149da_z.jpg,0,5,Contentment Now Hans is sitting in Ashley's lap.  He really liked her.
contentment,http://farm6.staticflickr.com/5466/7422591068_6332fdf9ba_z.jpg,0,5,Contentment. Explore thebaldfatguy's photos on Flickr. thebaldfatguy has uploaded 1547 photos to Flickr.
contentment,http://farm8.staticflickr.com/7238/7306203818_16a34291d6_z.jpg,2,3,Tulips and roses A tulip a rose  Seasons of blooming/fading  Contentment with you
contentment,http://farm6.staticflickr.com/5096/5443943418_fb3ff89d2e_z.jpg,2,3, CONTENTMENT Explore Bill23 Cross' photos on Flickr. Bill23 Cross has uploaded 2115 photos to Flickr.
