contentment,http://farm4.staticflickr.com/3043/2927916433_6b864d5132_z.jpg,0,5,Contentment Bailey settling in for a nap.
contentment,http://farm3.staticflickr.com/2643/4081666086_1986bbcb13_z.jpg,0,5,"Contentment Tofu-- the cat from Wuhan, China"
contentment,http://farm6.staticflickr.com/5267/5640552585_8333c4c792_z.jpg,2,3,"Contentment Cherrry blossom, DC, 2011"
contentment,http://farm4.staticflickr.com/3278/2886250070_c6a8103672_z.jpg,0,5,the face of contentment Explore rufie c's photos on Flickr. rufie c has uploaded 10750 photos to Flickr.
contentment,http://farm7.staticflickr.com/6188/6057463652_75e658b43e_z.jpg,0,5,A quartz contentment Explore RenaudPhoto's photos on Flickr. RenaudPhoto has uploaded 199 photos to Flickr.
contentment,http://farm4.staticflickr.com/3872/14467829621_a1f9c0e870_z.jpg,0,5,"Happy Dreams The Harbour seal colony on Rathlin Island were all out sleeping on the rocks and seaweed on Monday, so I'd plenty of opportunity for photos, but it was still hard to get them in focus at such a distance.  I couldn't resist this one though, I just loved that wee happy smile on the seal's face - sheer contentment :)  Hope you are all having a lovely weekend :)  I'll catch up with you all very soon :)  Thanks for the great comments on my previous uploads :)"
contentment,http://farm3.staticflickr.com/2063/2179022163_b3337357ca_z.jpg,1,4,Half Moon Bay Graduated ND Filter Study #1 This is another filter test I did while out in Half Moon bay during a break in our nasty weather.  I just picked up some Graduated ND Filter's and a holder.  I noticed when shooting in the Marin Headlands a few weeks ago I was in dire need of them for blown out foregrounds due to city lights.  Since I am not the most avid day shooter....I never saw a need for the filters until then.  Now that I have them its going to take some serious practice to figure them out and apply them properly.  I think I took close to 45 shots out on the beach and maybe 2 came out as acceptable (not to be confused with contentment) to me.  This was shot at sunset (duh) with a .6 Grad ND filter with a soft edge.....I am not brave enough or good enough yet to try a hard edge....  I'm sorta kicking myself for not moving the camera around a little bit in the foreground pool.  I probably could have gotten an excellent reflection rather than a small shadow and black water.  Live and learn.  Shot was taken at an odd 13mm focal length 6 seconds @ f11 ISO 200 Canon 40d and a Sigma 10-20mm lense with a UV filter as well  View On Black  <-----------------------------------best choice
contentment,http://farm4.staticflickr.com/3345/3186600915_755f9d3170_z.jpg,2,3,"contentment [1000 things] 6.  contentment  [i guess contentment is something we choose to be. sometimes its good, sometimes not being content causes us to change for the good. molly looks pretty content, eh?]"
contentment,http://farm4.staticflickr.com/3293/2901146702_b36f371895_z.jpg,2,3,"Buddha says: ""Have compassion for all beings, rich and poor alike;  each has their suffering. Some suffer too much, others too little.""  ""Your work is to discover your world and  then with all your heart give yourself to it.""  ""Health is the greatest gift, contentment the greatest wealth, faithfulness the best relationship."""
contentment,http://farm4.staticflickr.com/3380/3563739269_6df4dc2da0_z.jpg,1,4,"Contentment Settling down after a big lunch, this lynx settled down to sunbathe! "
contentment,http://farm5.staticflickr.com/4030/4584420995_d183b666fb_z.jpg,1,4,"Contentment in the Roaring Fork Valley This pastoral scene is along Colorado Highway 82 at Basalt, Colorado, about midway between Glenwood Springs and Aspen.  The red ciiffs are a common feature of this part of the Rocky Mountains."
contentment,http://farm3.staticflickr.com/2693/4097573043_d33f87377b_z.jpg,0,5,contentment Explore JACK-DAWS' photos on Flickr. JACK-DAWS has uploaded 1577 photos to Flickr.
contentment,http://farm9.staticflickr.com/8183/8423518002_f42617217e_z.jpg,0,5,"Wise Advice HMM Budai is traditionally depicted as a fat bald man wearing a robe and wearing or otherwise carrying prayer beads. He carries his few possessions in a cloth sack, being poor but content. He is often depicted entertaining or being followed by adoring children. His figure appears throughout Chinese culture as a representation of contentment. Budai in folklore is admired for his happiness, plenitude, and WISDOM of contentment. One belief popular in folklore maintains that rubbing his belly brings wealth, good luck, and prosperity For Macro Mondays theme WISDOM Explore #145 28/01/2013"
contentment,http://farm9.staticflickr.com/8152/7446208290_e208c0205c_z.jpg,1,4,"Contentment At Foel Farm Park, Anglesey."
contentment,http://farm3.staticflickr.com/2834/9581274466_942c113889_z.jpg,2,3,"""oye photu studio, photu gheech"" This is a man who sits outside a temple in Khajuraho, Madhya Pradesh asking for alms from the tourists who visit the famous temples. He begs for a living, and spends his days and nights on the streets. Yet when i pointed my camera towards him, he gave me this beautiful smile... I don't know what help I could be to this man, but i draw some kind of contentment from the fact that i could make him smile, if only for an instance..."
contentment,http://farm4.staticflickr.com/3084/2404680324_ba95e0aa8a_z.jpg,1,4, 
contentment,http://farm4.staticflickr.com/3597/3537221448_c98a063328_z.jpg,1,4,Contentment Explore mouttethome's photos on Flickr. mouttethome has uploaded 741 photos to Flickr.
contentment,http://farm6.staticflickr.com/5494/9331184839_ec79d70b53_z.jpg,1,4,Be Happy #Cake#happy#appiness#contentment#coffee#tea#delicious# Explore RicoGin's photos on Flickr. RicoGin has uploaded 1265 photos to Flickr.
contentment,http://farm6.staticflickr.com/5494/14454546121_cfa8eb6e83_z.jpg,1,4,"All I want is a room somewhere My grandson eating popcorn and watching the movie ""Brave""."
contentment,http://farm7.staticflickr.com/6047/6285157244_39fd4586a7_z.jpg,2,3,"Vertical Emily Hurd promo photo A little over a year in the making, Long Lost Ghosts is the album Emily Hurds fans have been waiting for, featuring her signature voice and folk-pop songs that tell stories of old-fashioned love and its bittersweet triumph. Highlights include the irresistible blues-tinged hit, ""Irreparably Yours"" and the palpable nostalgia of the cross-country driving tune ""Long Lost Ghosts."" Emily's fervent crooning uplifts in ""My Favorite Part,"" ""Silent Conversations,"" and ""I Won't Tell a Soul.""  For the first time in a long time, she trades in her regular heartbreaker imagery for a welcome dose of contentment in ""Brand New,"" ""Skipping Stones,"" and ""Easy Call.""  The songsmith sings it like she feels it.  Over the course of her eight full-length studio albums, Emily's singer-songwriter stylings have effortlessly fused pure vocals and chillingly sparse music with chamber pop, indie soul, and gypsy jazz.  On Long Lost Ghosts, she does what she does best: combining acoustic instruments and vivid nature metaphorssinging of winter wheat, crickets, gravel roads, and skylarksto connect with her audience.    The lilt in her voice is as endearing as ever, and the support of her backing band enhances without distracting from the delicate and hopeful vibe that has come to define Emily Hurds music.  Lush vocals, vibrant acoustic production, and tones of defiant optimism run through all the songs on Long Lost Ghosts, echoing the uptempo balladry and intelligent anthems, often linked to kindred troubadours Lyle Lovett and Steve Earle.  Emily wrote the songs on her ukulele and recorded them on the vintage grand piano at Chicagos King Size Sound Labs.  The record features an all-star line-up of Chicago musicians: John Abbey (Robbie Fulks, Amy Speace), Darren Garvey (Cameron McGill and What Army, Miles Nielsen), Sue Demel (Sons of the Never Wrong, Come Sunday), and Maria McCullough (Sleepy Lou, Jonas Friddle).    Emily Hurd is an inspirational national indie act, performing for growing pockets of loyal followers who revel in her ample cache of new and old original songs.  She's shared the stage and/or opened for Irma Thomas, Bettye Lavette, Roger McGuinn, and Ozomatli. Her music is featured on the popular CBS crime drama NCIS.  She plays live on WGN TV and radio, WXRT radio, amongst other acclaimed Chicago music institutions.  She appears on the prestigious Old Town School of Folk Music ""Songbook"" collection (released by Bloodshot Records).  She is a winner/finalist in the John Lennon Songwriting Contest, NPR's NewSong Contest, and The International Songwriting Competition.   Her supporters in the Southeast run the annual Emilyfest in an open barn down in a holler of rural North Carolina.  The big skies and high country grass at Emilyfest serve as the perfect backdrop for her fans to listen and lose themselves for a while in her inimitable lyrics. Just listen... "
contentment,http://farm8.staticflickr.com/7385/11352792993_8bba6f4e63_z.jpg,2,3,An Inner Calm Descends I know I have said this before but I do become a much happier and relaxed person when I connect with my female feelings. The clothes are lovely to wear and they become my statement to anyone who notices me that I wear skirts and dresses because I am supposed to be a woman and these clothes also validate the same point to me. It is as that realisation kicks in that the emotions within are released and this fuels the true contentment that comes from expressing my true self. I do so wish that I could look like this every day. 
contentment,http://farm8.staticflickr.com/7061/6833022370_e8607bf1f5_z.jpg,1,4,"""Could a greater miracle take place than for us to look through each other's eyes for an instant?""  ~ Henry David Thoreau    . . My Avon Breast Cancer Walk Donation Page . . "
contentment,http://farm9.staticflickr.com/8351/8394981336_f1828767d0_z.jpg,1,4,"Lower Peirce Reservoir , Singapore Whoever loves and appreciate the beauty of nature will find contentment within"
contentment,http://farm8.staticflickr.com/7267/7450337172_aac6b3a9b8_z.jpg,0,5,Love. Explore quirky1978's photos on Flickr. quirky1978 has uploaded 1713 photos to Flickr.
contentment,http://farm4.staticflickr.com/3449/3401697006_3ea1487f5d_z.jpg,1,4,contentment and love Explore anandajoy's photos on Flickr. anandajoy has uploaded 4097 photos to Flickr.
contentment,http://farm6.staticflickr.com/5574/14590859673_dff3059123_z.jpg,2,3,"Where your hope lies. 229/365 (Self portrait)   After quite a bit of driving, we finally arrived in San Francisco. We traveled around the city and did a number of touristy things there, including shopping and browsing many, many stores. Often, I get so caught up in trying to find the perfect outfit for myself or the perfect gift for someone else and am reminded of how much we fret over material things in life. I believe that we live in an increasingly difficult age where things have become too immediate and readily accessible that we grow numb to the future and what lies ahead, even beyond our own timeline.   ""But godliness with contentment is great gain. For we brought nothing into the world, and we can take nothing out of it. But if we have food and clothing, we will be content with that. Those who want to get rich fall into temptation and a trap and into many foolish and harmful desires that plunge people into ruin and destruction."" -1 Timothy 6:6-9   (Press L!)   Website || Facebook || Instagram || Tumblr || Photo Diary "
contentment,http://farm7.staticflickr.com/6056/6281576491_60554d3559_z.jpg,1,4,Pearl Wedding Anniversary Also available in colour
contentment,http://farm8.staticflickr.com/7132/7704175402_6fbf9ec88b_z.jpg,1,4, 
contentment,http://farm9.staticflickr.com/8083/8309339948_e6801a9951_z.jpg,1,4,Devin Explore sewonandon's photos on Flickr. sewonandon has uploaded 1744 photos to Flickr.
contentment,http://farm9.staticflickr.com/8063/8172189585_cbedcf1b67_z.jpg,1,4,Contentment Explore nw_birder's photos on Flickr. nw_birder has uploaded 4558 photos to Flickr.
contentment,http://farm8.staticflickr.com/7006/6807223937_33fbbd1dd2_z.jpg,0,5,"Squirrel grey eating acorn   Siblands 1.2.2012 (1)   Just caught this fellow right as he sat in the freezing conditions at the foot of a mighty oak eating an acorn,  Picture of contentment."
contentment,http://farm8.staticflickr.com/7280/6962195698_e4f4797838_z.jpg,2,3,So delicious... #corgi #dog #toy #contentment Explore bencapozzi's photos on Flickr. bencapozzi has uploaded 8273 photos to Flickr.
contentment,http://farm4.staticflickr.com/3933/15326049369_18bc93b732_z.jpg,0,5,Contentment 107 Explore Boyle Camera Club's photos on Flickr. Boyle Camera Club has uploaded 7133 photos to Flickr.
contentment,http://farm3.staticflickr.com/2924/14298465602_4f1047789e_z.jpg,0,5,SLIDE 2 Explore Parkviewcc's photos on Flickr. Parkviewcc has uploaded 434 photos to Flickr.
contentment,http://farm3.staticflickr.com/2523/3804836547_acac2bf8fd_z.jpg,1,4,"Spreading Happiness Once again I came back to the upper terrace which is at a few meters from Bivi Razaia Masjid, a small mosque, located in the chawk of Varanasi (Benaras). Up there I know a Muslim family who works on the dyeing process of the famous silk Banarsi sarees. In this timeless and magical place, there is an amazing and contagious happiness among everyone and I always leave this opened workshop with a real feeling of contentment. Maybe this happens because of the colours, colours are everything to me and working all day with colours seems to be the most beautiful job. People there became my friends, they are in a different world, away from a kind of modernity and they show an absence of artificiality. They bear a real kindness in everything they do and say which is naturaly the true nature of innocence. I come there and take pictures at regular times almost every season and I always give them some prints that they enjoy. The night before I took this picture we met by chance along the Ganges and they invited me for dinner at their place. They dont speak English so I have to attempt to speak Urdu and each time it allows me to nelieve that I have been progressing a little. That day was one of the hotest of the year and after his work this young man wanted to take a shower in order to look clean with a fresh shirt and a nice hair style for a kind of official portrait that he asked me to make. I started a few shots before, trying to catch that happiness and innocence. He gave me more as usual with this generous smile like he did last December with another portrait. www.flickr.com/photos/designldg/3081144494/in/set-7215761...  Join the photographer at www.facebook.com/laurent.goldstein.photography   All photographs are copyrighted and all rights reserved.  Please do not use any photographs without permission (even for private use). The use of any work without consent of the artist is PROHIBITED and will lead automatically to consequences."
contentment,http://farm8.staticflickr.com/7036/6879748940_862b4e3f82_z.jpg,2,3,"Sharing The Beauty Copyright Firdaus Mahadi 2012 | View Large!  ""When we die and leave this earth we can take nothing of what we have received, on the contrary what we have given or shared with others.  Lets give and share with others what we have, even if its just a beautiful word or a smile""  Location : Pasir Panjang, Port Dickson, Negeri Sembilan, Malaysia  Related images: Unbearable Conversation Contentment Of Faith Subtle Serenity In Between Soulful Heart  Please don't post here any awards, glitter text, images, and group invite"
contentment,http://farm6.staticflickr.com/5202/5363612448_e84c95c8e8_z.jpg,0,5,"Contented Mittens 2 Mittens sits in contentment, thinking about what a good life she has.  She gets 3 adoring humans to love her, a choice of 3 human beds each night, lots of nice things to eat everyday, and a big gentle cat brother to chase, fight or lick.  Taken with iPhone 3GS."
contentment,http://farm5.staticflickr.com/4026/4521196503_56290da669_z.jpg,0,5,warmth today the sun's warmth is filling me with contentment.
contentment,http://farm7.staticflickr.com/6197/6116344848_60972e1eb7_z.jpg,2,3, 
contentment,http://farm7.staticflickr.com/6179/6187963444_df5a740896_z.jpg,2,3,"269|365 Happy Hour's in Reach This photo is about process.   No. A cheese grater does not make lemonade, but often the processes that I suspect that will lead to my intended result end up creating something completely different: and something exactly as it's meant to be.   Lately I have been finding that life will throw me a bundle of resources, a lemon for the sake of this metaphor. I often have elaborate ideas for exactly how things are meant to go and just the right way to conduct things, or how I want to make nachos supreme from the lemon I was given. Ultimately, I go through the trials and errors, trying to grate the lemon into cheddar cheese, only to find that I get to the result that fate intended all along and I've made perfectly good lemonade from my lemon. The humility then comes from realizing that the learning was in the process, and contentment with the final product is what's important. So spike that lemonade and enjoy Happy Hour, because ""It's 5 o'clock somewhere"".   (And yes, although it wasn't how I intended it to happen, the BA 411 paper is done and my exam will be fine in the morning.)"
contentment,http://farm9.staticflickr.com/8620/16154865595_9000fede72_z.jpg,1,4,"Happy New Year from sunny Hurghada, Egypt. May the new year bring happiness and contentment to all.   #BelovedEgypt #Hurghada #sun #newyear Explore iTripleM's photos on Flickr. iTripleM has uploaded 580 photos to Flickr."
contentment,http://farm8.staticflickr.com/7278/7454356690_7e09bcf483_z.jpg,1,4, 
contentment,http://farm4.staticflickr.com/3134/2665686343_bcff009588_z.jpg,0,5,Tummy Rub Prrrrrrrrrr.......
contentment,http://farm4.staticflickr.com/3074/3073929453_c773d6bef6_z.jpg,1,4,Contentment Explore allen6566's photos on Flickr. allen6566 has uploaded 320 photos to Flickr.
contentment,http://farm4.staticflickr.com/3788/13594512764_e46654f084_z.jpg,1,4,Contentment Leo loves laying on the warm concrete in the sun.
contentment,http://farm8.staticflickr.com/7147/6642104523_2011486950_z.jpg,2,3,"Everything has its wonders, even darkness and silence, and I learn, whatever state I may be in, therein to be content.  2012 Patricia L Walker   All Rights Reserved. My images are not to be used, copied, edited, or blogged without my written permission.   Title quote by Helen Keller  Apps Used: Camera+ Romantic Photo Impression  Have been pouring through so many images I love but that I didn't get a chance to post yet. Here's another image from our Mexico adventures of last November.    Ahhhh...sunsets and the lone fisherman made for a ""not to be missed"" moment.  "
contentment,http://farm4.staticflickr.com/3845/14595136073_6262104bab_z.jpg,1,4,Not moving from this spot for the rest of the day. #bliss #contentment #happiness #vacation #donotdisturb #gluedtoloungechair Explore tmtricia's photos on Flickr. tmtricia has uploaded 2373 photos to Flickr.
contentment,http://farm8.staticflickr.com/7183/6975156869_a58be73a0e_z.jpg,1,4,"Mar9,2012f 001 Contentment Photo taken at the University of Idaho Sheep Farm, Moscow, Idaho."
contentment,http://farm5.staticflickr.com/4031/4367950062_c3666fecd8_z.jpg,2,3,Contentment Explore johanna_W's photos on Flickr. johanna_W has uploaded 95 photos to Flickr.
contentment,http://farm4.staticflickr.com/3683/9677747215_acff8679f3_z.jpg,2,3,"BOL-El Alto-0807-046-v1 Bolivia, El Alto, two smiling girls enjoying ice cream  (c) Art in All of Us /Anthony Asael (a Corbis photographer) Support our children programs through Art in All of Us www.anthonyasael.com Photos of ALL 192 countries Follow me on Facebook Buy Photo   Contact Me    Images may not be copied, downloaded, reproduced, transmitted, manipulated or used in any way without expressed, written permission of the photographer."
contentment,http://farm6.staticflickr.com/5307/5861697471_3870b00274_z.jpg,2,3,"Dear Me Day 180 Day 180/365 ... June 16th, 2011  After a few really crazy days-- well, today was no different.  But instead of bringing my stress home with me, or looking somewhere outside myself for inspiration, I went backwards.  I thought of all the things I wanted, the ""dreams"" that had never been fulfilled, the goals I'd set for myself but not completed.  I thought about all the ""wishes"" ""wants"" the ""would haves.""    And I realized that that list is pretty short these days.  It's not necessarily that what I have is so different, but that I've started to be more content with where I am in the world now.    And this quote really hit home for me, realizing that I'm shifting from a place of constant wanting, constant wishing... into a place of relative contentment and satisfaction.  I have a roof over my  head, a housemate who is lovely and loving and supportive.  I have family near and far who I am so close to.  I have a good, stable, steady job.  I make enough to pay my bills and still do a lot of the things I love to do.  I am talented and passionate, I have friends and coworkers that I enjoy and appreciate.   And I have goals and wishes and dreams that sustain me, instead of draining me.    So yes, contentment.  I'm at a contented point in my life-- even amidst the stress and strain of our busy busy summer season.  Because there is so much more in my life and in my heart than just this momentary stress.  So much more."
contentment,http://farm4.staticflickr.com/3921/14288181809_4f2b51135c_z.jpg,1,4, 
contentment,http://farm6.staticflickr.com/5562/14755965606_3d971c3fef_z.jpg,2,3,"Image from page 407 of ""Hindu mythology, Vedic and Purnic"" (1913) Identifier: hindumythologyve00inwilk Title: Hindu mythology, Vedic and Purnic Year: 1913 (1910s) Authors:  Wilkins, William Joseph, 1843-1902 Subjects:  Hindu gods Publisher:  Calcutta, Thacker, Spink Contributing Library:  Indiana University Digitizing Sponsor:  Indiana University   View Book Page: Book Viewer About This Book: Catalog Entry View All Images: All Images From Book  Click here to view book online to see this illustration in context in a browseable online version of this book.   Text Appearing Before Image: ites impede.She wrought in heavens behalf, and madeTen nights of one. the gods to aid.f Anasuya, then joins with her husband in welcomingthe exiles to their hermitage, and, delighted with theprincess, tells her to ask a boon. As, however, Sitaappeared to want nothing particular, the aged saintsaid My gift to-dayThy sweet contentment shall repay :Accept this precious robe to wear,Of heavenly fabric, rich and rare ;These gems thy limbs to ornament.This precious balsam sweet of scent. * Griffithss Ramayana, ii, 468. f Ibid, ii, 473. DAKSHA. 385 O Maithil dame ! this gift of mineShall make thy limbs with beauty shine.And, breathing oer thy frame, dispenseIts pure and lasting influence.This balsam, on thy fair limbs spread,New radiance on thy lord shall shed,As Lakshmis beauty lends a graceTo Vishnus own celestial face. * 8. DAKSHA. Daksha, the father of Uma, the consort of Siva, hasattained pre-eminence amongst his brethren largelythrough the greatness of liis son-in-law. He, too, is a  Text Appearing After Image: mind-born son of Brahma; or, according to otheraccounts, sprang from the thumb of his father. He is * Griffiths Ramayana, ii, 474.W, HM 25 3$<5 THE INFERIOR DEITIES. one of the chief Prajapatis. Before speaking of Dak-sha, as the term Prajapati is of frequent occurrence,it will not be out of place here to describe the positionof-these beings. The term Prajapati means a lord of creatures ; thePrajapatis, therefore, are regarded as the progenitorsofimankind. The word is used in much the same man-ner as Patriarch in the Christian Scriptures. Some-times Brahma alone is intended by the term Praja-pati .; he is the lord of creatures ; sometimes it isemployed for the first-formed men from whom thehuman race sprang. The word was originally em-ployed as an epithet of Savitri and Soma, as well as ofHiranyagarbha, or Brahma. It afterwards, however,came to denote a separate deity, who appears in threeplaces in the Rig-Veda. Prajapati is sometimes iden-tified with the universe, and described (i   Note About Images Please note that these images are extracted from scanned page images that may have been digitally enhanced for readability - coloration and appearance of these illustrations may not perfectly resemble the original work."
contentment,http://farm8.staticflickr.com/7002/6652828083_febc0cac13_z.jpg,1,4,Contentment Explore bar1959's photos on Flickr. bar1959 has uploaded 807 photos to Flickr.
contentment,http://farm9.staticflickr.com/8233/8410410955_ca3f89f400_z.jpg,2,3,Contentment Monoprint on A1 Cartridge Paper. October 2012
contentment,http://farm8.staticflickr.com/7350/9741625457_e51fe42aa2_z.jpg,2,3,"New The head learns new things, but the heart forever practices old experiences. - Henry Ward Beecher   I wanted to do new things with dance, adapt it to the motion picture medium. - Gene Kelly   You are never too old to set another goal or to dream a new dream. - C. S. Lewis   An old day passes, a new day arrives. The important thing is to make it meaningful. - Dalai Lama   The voyage of discovery is not in seeking new landscapes but in having new eyes. - Marcel Proust    The old Pentacon 50mm f/1.8 lens wore out after 4 years in my camera bag. The new Pentacon 50mm f/1.8 lens came with a lenscap."
contentment,http://farm9.staticflickr.com/8074/8326704064_e37c15571e_z.jpg,2,3,"What Ewe Doing Here? Sometimes, it pays to get off the beaten track.... Half way down the side of a ravine..."
contentment,http://farm7.staticflickr.com/6067/6153864041_edf7bc610b_z.jpg,0,5,Now this is contentment! Explore edmondzoltan's photos on Flickr. edmondzoltan has uploaded 1218 photos to Flickr.
