contentment,http://farm7.staticflickr.com/6060/6320214904_115c492f82_z.jpg,2,3,"Anthropy x Entropy (3) We have an amazing capacity to transform the world around us. Anthropy is thus every action of Man while on Earth  between fellow men and between men and the Planet. It is the relationship of all these actions with the vision of the Universe in which Man and Planet are found.  Entropy is the variation of energy in a system during any transformation  it is the same as the quantity of energy that the system exchanges with the environment. The first law of Entropy does not limit the possibilities of transforming one energy into another. This first principle establishes that energy cannot be created nor destroyed.  Garden is a word derived from Hebrew, comprising the prefix gan, which means protect or defend, implying a notion of enclosure or privacy, and the expression oden or eden, which transmits a sensation of pleasure or contentment.  The etymological interpretation of this word is reflected in the concept of privacy of land for leisure or contentment.  Gardens are an aesthetic expression of human ideas and a concrete expression of mans relationship with nature.  The forest represent the total phenomenon, it is nature in its greatest manifestation. The forest lays a role rich in meanings, which makes it a place of beginnings."
contentment,http://farm6.staticflickr.com/5477/11648371723_803cf9d8da_z.jpg,2,3,"Let go Whatever we are waiting for - peace of mind, contentment, grace, the inner awareness of simple abundance - it will surely come to us, but only when we are ready to receive it with an open and grateful heart.  Sarah Ban Breathnach"
contentment,http://farm4.staticflickr.com/3908/14540873623_bdfb3316e0_z.jpg,0,5,Motherly Love I really love the look of contentment on my friend's face. It's a moment of peace and all that is right in the world.
contentment,http://farm5.staticflickr.com/4131/4996319081_c9260c59f6_z.jpg,2,3,Day 7 - 14 Contentment Explore Peter8340's photos on Flickr. Peter8340 has uploaded 105 photos to Flickr.
contentment,http://farm8.staticflickr.com/7461/15587680949_9fb8caff19_z.jpg,1,4,"France-002049 - At Peace..... PLEASE, NO invitations or self promotions, THEY WILL BE DELETED. My photos are FREE to use, just give me credit and it would be nice if you let me know, thanks.  A nun kneeling in prayer at the site, she had a great look of contentment and at peace. You had to be there, she was radiant, the picture is not great but I tried."
contentment,http://farm7.staticflickr.com/6220/6345766691_5bdfb863cd_z.jpg,1,4,Contentment. Portland Japanese Garden.
contentment,http://farm4.staticflickr.com/3147/2314354394_e2fbf4134b_z.jpg,2,3,"Contentment Contentment is a pearl of great price, and whoever procures it at the expense of ten thousand desires makes a wise and a happy purchase John Balguy  This is the park about 2 minutes from my house, pretty don't ya think.  Listening to: Some kind of wonderful by Joss Stone"
contentment,http://farm9.staticflickr.com/8259/8890606196_09ffc7259c_z.jpg,0,5,"5/12 Zephyr - Spring Contentment Assignment52 - This is one of my favorite images of the year for two reasons.  First, I am very pleased with the way the image turned out.  I tried hard to have the branch arching over her and to get the depth of focus appropriate.  The second reason is because we lost Zephyr in October, so I am obviously treasuring every photo I took of her this year, as well as previously.  Her Favorite Things - May version is spring.  Zephyr loves spring, probably more than she ever did before.  Although she loves snow and cold, it has become difficult for her to get around in the snow, especially when it is deep.  By March, her world had become fairly restricted to the plowed areas close to the house.  Now that spring is finally here, she is enjoying the entire yard again, and she is happy.  It has been really good to see a bounce back in her step, even if those steps are slow, and it is heartwarming to see her looking so contented and happy.  The things Zephyr loves about spring - she loves having us outside with her more, and she loves that we are more relaxed in summer and spend more time playing with her.  She loves to help me garden - if I am kneeling on the ground working on the flower beds, she will sneak up behind me, stick her nose in my ear and plant a kiss on my cheek.  She will then plop down beside me and watch carefully for an opportunity to steal my gloves. She loves to be outdoors, and she loves the sights and sounds of spring, she spends hours in this pose, just watching and listening and enjoying the world.  She luxuriates in the grass - she lays in it, rolls in it, stretches out on her side and presses as much of herself against it as possible.  She lays under the spruce trees that drop their sticky bud sacks on her (as you can see in the photo, she is messy with them).  She loves the cool evenings and mornings, in fact she is spending all night outdoors right now, asking to come inside only when she thinks it is time for breakfast (usually about an hour before it really is time).  This is also a good time of year to steal our shoes from the garage and strew them around the yard.  Spring is good, and Zephyr is contented. "
contentment,http://farm9.staticflickr.com/8522/8691348448_67c734dbc2_z.jpg,0,5,"MOMMABIGPILL .Folks say cats can't smile tho I have always disagreed. The 'Cat From Hell' guy on AP goes a bit further than me on the expression I point to (he says it means 'I Love You') but still on the basic mark. When a cat gives you that direct, dee.p eye blink I believe they are showing complete contentment which is all I have ever asked for. Momma always had the classic 1 for me. She was 1 of the 1s that came in from outdoors like many of the ferals he works with. We never had the challenges the folks he helps do as our invitees said "" So I get as much food as I want (&more); unlimited attention (& photos); all the care & love possible - I'm in!"". :) "
contentment,http://farm5.staticflickr.com/4145/5049330602_7a205260b2_z.jpg,2,3,contentment Explore luvley lucy's photos on Flickr. luvley lucy has uploaded 837 photos to Flickr.
contentment,http://farm4.staticflickr.com/3383/3223285041_aacbc8356d_z.jpg,1,4,"Contentment Also in Davis, in the summer. I miss summer."
contentment,http://farm8.staticflickr.com/7026/6749238609_c50da1fa4b_z.jpg,2,3,contentment she was fascinated by the window and what lies beyond...
contentment,http://farm4.staticflickr.com/3206/2378400018_fe633d37b0_z.jpg,2,3,Tropical Dreams Palms trees and historic railroad bridge in the sunset.
contentment,http://farm4.staticflickr.com/3503/3942206989_0a16d805c6_z.jpg,2,3,Contentment www.wordpaint.com/prem/en/ocean_drop.htm
contentment,http://farm3.staticflickr.com/2616/4168467619_bc75235ebc_z.jpg,1,4,contentment Explore Digital Transient's photos on Flickr. Digital Transient has uploaded 1383 photos to Flickr.
contentment,http://farm8.staticflickr.com/7559/15740546481_f049b8af8b_z.jpg,2,3,"Contentment. Nikon V1 What is this life if full of care,We have no time to stand and stare, No time to stand beneath the boughs and stare as long as sheep or cows.  W.H.Davies. A Welsh Poet."
contentment,http://farm7.staticflickr.com/6127/6006271386_68916e86a9_z.jpg,0,4,A good evening sail ends with contentment Explore Michelle MM2's photos on Flickr. Michelle MM2 has uploaded 6852 photos to Flickr.
contentment,http://farm4.staticflickr.com/3345/4635024869_417654c70d_z.jpg,1,4,Contentment is pure bliss Kelvin-Kelly pics never fail to give me that warm fuzzy feeling. Here we were en-route to Resort World Sentosa via the sky train. 
contentment,http://farm8.staticflickr.com/7484/15525112933_25ec6d0c38_z.jpg,0,5,Contentment Explore definingAvi's photos on Flickr. definingAvi has uploaded 5651 photos to Flickr.
contentment,http://farm7.staticflickr.com/6015/5958088809_e3fd9205b8_z.jpg,2,3,7-17-11 Xander ii Xander's look of smug contentment
contentment,http://farm8.staticflickr.com/7200/7027621813_e05a2aa787_z.jpg,2,3,contentment Explore Janet Leahy's photos on Flickr. Janet Leahy has uploaded 92 photos to Flickr.
contentment,http://farm4.staticflickr.com/3766/14301008894_323d47d3e8_z.jpg,2,3,Drifting off in contentment Explore morgan.joan40's photos on Flickr. morgan.joan40 has uploaded 50 photos to Flickr.
contentment,http://farm5.staticflickr.com/4054/4274422790_f1e558b4fd_z.jpg,2,3,Kissing the clouds goodbye Explore juliejordanscott's photos on Flickr. juliejordanscott has uploaded 40415 photos to Flickr.
contentment,http://farm8.staticflickr.com/7342/10879145196_ce168868cb_z.jpg,1,4,"Nappy Time Daily Dog Challenge 746. Contentment  Our Daily Challenge Nov 15 2013 - Portrait from Behind  Zachary on the left and Henry on the right.   Really proud of the boys as shots facing away from the camera can be difficult/confusing for them.   Taken with, processed, and uploaded from iPhone while Computer ""in the shop"".   Good News!   After 15 days in the shop, the Geniuses finally decided to disassemble the computer, clean it, tighten a loose connection and...  It worked!  They wanted to run tests today just to make sure, but if all went well we should be able to pick it up tomorrow!!!!!!  And they aren't going to charge us a thing.   Fingers and paws crossed that we'll be back to normal tomorrow. :)"
contentment,http://farm4.staticflickr.com/3039/2928354892_b37ebf6fd0_z.jpg,1,4,Contentment A cool breeze blowing across the lake...  Live music drifting down from the festival...  Good Friends...  Cold Beer...  Aaahhh...
contentment,http://farm8.staticflickr.com/7538/15931458688_d491e04671_z.jpg,1,4,"2 years ago, this little man came to our lives. His arrival brought so many changes and challenges but above all, he brought happiness, contentment and gratefulness. We will never change a thing in you and we will keep on loving you with all of our hearts Explore myedeleon's photos on Flickr. myedeleon has uploaded 1737 photos to Flickr."
contentment,http://farm5.staticflickr.com/4058/4565538507_ff44e5937f_z.jpg,1,4,Contentment on Holy isle (Scotland) Explore Carl Betts' photos on Flickr. Carl Betts has uploaded 53 photos to Flickr.
contentment,http://farm7.staticflickr.com/6065/6119441889_161ddd716f_z.jpg,1,4,"...We followed the dreamer through the purple hazy clouds, He could control our sense of time... DREAMER DECEIVER  Standing by my window, breathing summer breeze Saw a figure floating, 'neath the willow tree Asked us if we were happy, we said we didn't know Took us by the hands and up we go  We followed the dreamer through the purple hazy clouds He could control our sense of time We thought we were lost but no matter how we tried Everyone was in peace of mind  We felt the sensations drift inside our frames Finding complete contentment there And all the tensions that hurt us in the past Just seemed to vanish in thin air  He said in the cosmos is a single sonic sound That is vibrating constantly And if we could grip and hold on to the note We would see our minds were free...oh they're free  We are lost above Floating way up high If you think you can find a way You can surely try."
contentment,http://farm9.staticflickr.com/8032/8069406043_38c0a2a2d9_z.jpg,1,4,contentment Explore TheEnigmaticDrew's photos on Flickr. TheEnigmaticDrew has uploaded 56 photos to Flickr.
contentment,http://farm4.staticflickr.com/3921/14595740889_c2f5850543_z.jpg,2,3,"Image from page 320 of ""Examples of household taste"" (1875) Identifier: examplesofhouseh00smit Title: Examples of household taste Year: 1875 (1870s) Authors:  Smith, Walter, 1836-1886 Smith, Walter, 1836-1886. Industrial art of the International Exhibition Subjects:  Centennial Exhibition (1876 : Philadelphia, Pa.) Decorative arts Publisher:  New York, R. Worthington Contributing Library:  Sterling and Francine Clark Art Institute Library Digitizing Sponsor:  Sterling and Francine Clark Art Institute Library   View Book Page: Book Viewer About This Book: Catalog Entry View All Images: All Images From Book  Click here to view book online to see this illustration in context in a browseable online version of this book.   Text Appearing Before Image: Contentment, which INDUSTRIAL ART 305 is illustrated on page 301. Above all things be merry; that indeed he is, andwith rollicking joyousness that knows no solicitation for anything, and whichcounts all that is in the world vanity and toys. He is a good liver, too, andevidently has all a bon vivanVs keen sense of humor. Would that we knewwhat the joke is now, which is making his jolly, fat sides shake with laughter,and has given an expression to his face that makes us laugh to look at him.Who will say that there is not deep philosophical reason underlying thishumorous conception of Contentment, and that the Chinese, in typifying thegod under the guise of a jolly fellow, are not giving expression to a great fundamental truth? Why the little manis represented as a mis-shapen dwarf, and witha razor in his hand, asif he was a barber byprofession, could doubt-less be explained satis-factorily by one learnedin oriental mythology.Perhaps his good na-ture, notwithstandinghis deformity, is the  Text Appearing After Image: Tapestry Chair : Department of Aubusson. more emphasized inthis, but the signifi-cance of the tonsorialinstrument passes ourpowers of conjecture. This little figure ismade of a fine qualityof porcelain and mod-eled with great nicety.The block on which itstands has a texture inimitation of ivory. The pair of Tapestry Panels, illustrated on pages 302 and 303, are chosen from the fine exhibit madeby France which was displayed both in Memorial Hall and in the Main Buildingat the Centennial. In the galleries of the former building were examples of themarvelous work anciently executed at Gobelins and at Beauvais, serving as astandard by which the achievements of the tapestry-makers of the present day,whose contributions were displayed in the Main Building, might be estimated.The examples before us are of this modern workmanship, and our readers willagree that they need not fear comparison with the ancient products of the loom.The designs, in which a group of the instruments of war and anoth   Note About Images Please note that these images are extracted from scanned page images that may have been digitally enhanced for readability - coloration and appearance of these illustrations may not perfectly resemble the original work."
contentment,http://farm9.staticflickr.com/8337/8278014579_e97598009b_z.jpg,2,3,"Memories are a special house May your Christmas sparkle with moments of love, laughter and goodwill, and may the year ahead be full of contentment and joy. Have a very Merry Christmas my Flickr friends and may I take this opportunity to thank you all for your many lovely comments and continued friendship over the last year.  Memories are a special house We build inside ourselves Where love and laughter linger, Where all our past life dwells. On holidays like Christmas We can draw upon the store, Reliving happy times And feeling all that warmth once more. Wherever we may travel, This house is always there To help to blend the old and new, To build on . . . grow . . . and share. This house can never get too full, Just grow from floor to floor, Because the joy of memories Is always making more.        "
contentment,http://farm9.staticflickr.com/8062/8231952496_d2be434441_z.jpg,1,4,SWEET CONTENTMENT Explore paintgirl2009's photos on Flickr. paintgirl2009 has uploaded 10982 photos to Flickr.
contentment,http://farm5.staticflickr.com/4142/4816881210_730de34ff7_z.jpg,0,5,"Slowing it down Day 51 of 365  After a long day at work, it sure is nice to go home, sit on the front porch, kick your feet up, and have the world slow down a bit."
contentment,http://farm4.staticflickr.com/3660/3486712120_a9c5ea908e_z.jpg,0,5,"004_Angie Wittkowski ""Contentment"" My Dad's face makes me realize that when I became a mother I gave the gift of a grandchild to my father.   "
contentment,http://farm8.staticflickr.com/7167/6739509829_fb9bc1c3c6_z.jpg,2,3,06.ravens.content.c.crawford Contentment Norwich Vt. 3/21/2007
contentment,http://farm8.staticflickr.com/7067/6945549583_a2ca2654fb_z.jpg,2,3,Contentment My friend George's cows in Lesmahagow Scotland
contentment,http://farm4.staticflickr.com/3864/15045131489_89c61cb663_z.jpg,0,5,This is peacefulness. This is absolute contentment. Joy. Living in the moment. Purrrrr...#mycat #mylife #myloves #myfamily #myadventures #artvandaldesigns #katfluharty Explore steelskye's photos on Flickr. steelskye has uploaded 2911 photos to Flickr.
contentment,http://farm5.staticflickr.com/4117/4917678992_3fa73436c7_z.jpg,2,3,"Enjoying the Sunshine, San Gimignano Explore Colin Bainbridge's photos on Flickr. Colin Bainbridge has uploaded 876 photos to Flickr."
contentment,http://farm4.staticflickr.com/3763/9505818710_0e3e7a9193_z.jpg,0,5,contentment...like I've never known... Explore lisahill88's photos on Flickr. lisahill88 has uploaded 756 photos to Flickr.
contentment,http://farm8.staticflickr.com/7160/6609110105_f448233c93_z.jpg,1,4,"My New Year's Wish For YOU! May your days be filled with sunshine and your heart be filled with joy. May you have peace where there once was turmoil. May contentment fill your heart.  Dont look for happiness in material things; find joy in a  Mothers smile, a childs laughter, a warm embrace. We may not always understand why things happen in life, but know that God is there to give you comfort if you seek HIM."
contentment,http://farm4.staticflickr.com/3092/2881855113_2719658c28_z.jpg,2,3,"I love your smile Maggie, a woman who always smiles and makes me feel alive. I love her for that! Thank You."
contentment,http://farm5.staticflickr.com/4111/4978638378_717bd8239e_z.jpg,1,4,"contentment ""... contentment is absolute - if you're not afraid to lose everything you have & enjoying the full life in a peaceful way... """
contentment,http://farm4.staticflickr.com/3920/14586890597_15a3cbfd34_z.jpg,2,3,"Image from page 32 of ""Echoes from the prairie and the hills .."" (1908) Identifier: echoesfromprairi00knap Title: Echoes from the prairie and the hills .. Year: 1908 (1900s) Authors:  Knapp, Harriet L. [from old catalog] Subjects:  Publisher:  [Wichita, Kan. Contributing Library:  The Library of Congress Digitizing Sponsor:  Sloan Foundation   View Book Page: Book Viewer About This Book: Catalog Entry View All Images: All Images From Book  Click here to view book online to see this illustration in context in a browseable online version of this book.   Text Appearing Before Image: anding alone, in stately pride, Tower the grand Cathedral spires.The ruins of some ancient pile Where the gods built their altar firesThat left the red glow on rocks and sands.On shapes that were fashioned by giant handsIn that far away, mystical age.Only remembered by poet and sage. JUST OVER THERE Everything seems changed since she has gone, Oh, how we miss her as the days slip by,Forgetting she is dead, we often long. To see the face we love, and wonder why.We do not hear her voice, in accents sweet. Alas! alas! no more will we rejoice.To clasp her hand. Still are her willing feet: And hushed, forever, is her pleasant voice. In my dreams I saw her face, last night; With tender eyes, she gazed through portals fairHer slender form, was clad in shining white. A halo rested on her soft, white hair.She smiled on me; and oh! the heavenly grace The sweet contentment and the perfect peace.That dwelt serene, in her enraptured face. Oh, blessed state! whose joys will never cease. TWENTT-FOUB  Text Appearing After Image: DRIFTING Echoes from We meet and look into each others eyes And heart speaks to heart,Eer we recover from the sweet surprise It is time to part.Ships meet and pass in the soft twilight,We catch a glimpse of sails and shining spars.Dim forms and lights that glimmer like the stareAs in the purple mists they fade from sight. Though drifting apart,The picture leaves its impress on the heart Though drifting afar.Together we will cross the harbor bar. FLOWERS AND MOSSES We will smile and not repine.Though the sun refuse to shine Across our way. Day after day;The years that bring us trials and crosses,Sweetly give us flowers and mossesFragrant flowers and velvet mosses. Though some days are cold and dreary,And our feet are oft times weary, Though lifes sea Tempestuous be,And cruel waves our frail bark tosses.Along the shore are flowers and mossesFragrant flowers and velvet mosses. Oh, how we long to have our measureOf lifes fleeting joy and pleasure, To cast our lot, In some fair spot,   Note About Images Please note that these images are extracted from scanned page images that may have been digitally enhanced for readability - coloration and appearance of these illustrations may not perfectly resemble the original work."
contentment,http://farm5.staticflickr.com/4139/4864746725_75061f29c2_z.jpg,2,3,Post lesson contentment p201006057574
contentment,http://farm6.staticflickr.com/5605/15612924755_a2ce4221ea_z.jpg,1,4,"- ""However mean your life is, meet it and live it; do not shun it and call it hard names. It is not so bad as you are. It looks poorest when you are richest. The fault-finder will find faults even in paradise. Love your life, poor as it is. You may perhaps have some pleasant, thrilling, glorious hours, even in a poorhouse. The setting sun is reflected from the windows of the almshouse as brightly as from the rich man's abode; the snow melts before its door as early in the spring. I do not see but a quiet mind may live as contentedly there, and have as cheering thoughts, as in a palace."" -- Thoreau (from Walden)"
contentment,http://farm4.staticflickr.com/3642/3621055613_8ab5af88a9_z.jpg,2,3, Contentment Ballochgair bull
contentment,http://farm8.staticflickr.com/7448/13976404067_ebd03d7a62_z.jpg,0,5,contentment Explore elnowakowicz's photos on Flickr. elnowakowicz has uploaded 34 photos to Flickr.
contentment,http://farm5.staticflickr.com/4143/4899055079_0b42d1ee4d_z.jpg,2,3,"The laughing Buddha.. Budai(in Chinese) is often depicted as having the appearance of an amply proportioned bald man wearing a robe and wearing or otherwise carrying prayer beads. He carries his few possessions in a cloth sack, being poor but content.  His figure appears throughout Chinese culture as a representation of contentment. His image graces many temples, restaurants, amulets, and businesses. I remember having one at our home long back for the same reason :)  Amongst Westerners new to Buddhism, Budai is often confused with the historical Buddha, Siddhartha Gautama. However, the two are visually very distinct. Gautama is commonly depicted as being tall and slender in appearance (although since no images of him from his lifetime exist, this depiction of him is unverifiable and possibly idealized); Budai is short and overweight. (Buddha means one who has achieved a state of perfect enlightenment and there are several people who have been given the title.)   Source: # Wiki  BIGGER LUCK HERE!"
contentment,http://farm4.staticflickr.com/3699/9444043537_4f76daf357_z.jpg,1,4,2013-06-29 Contentment Explore Koderchrome's photos on Flickr. Koderchrome has uploaded 2913 photos to Flickr.
contentment,http://farm8.staticflickr.com/7172/6796058609_330239e0a9_z.jpg,2,3,"Dalton 14349607 I'm Dalton, lap cat extraordinaire. My idea of contentment is having a lazy human couch potato who lets me stretch out, wiggle my toes, and nap a little in peace and quiet. The bonus perks of a good ear scratch or tummy rub can't be discounted either. Face it, I like my creature comforts, and I take advantage of knowing people get a kick out of loving me. I do have my perky moments, as all kittens do, but at the end of a hard day playing, it's nice to know there's a warm spot and lots of luvvin' nearby. "
contentment,http://farm6.staticflickr.com/5172/5519612327_504509e42f_z.jpg,1,4,"True contentment National Zoo, DC  For more of my photos, visit: beastsinapopulouscity.blogspot.com "
contentment,http://farm3.staticflickr.com/2427/3972209750_b7bc6b9cb3_z.jpg,2,3,contentment Explore goldberrybombadil's photos on Flickr. goldberrybombadil has uploaded 681 photos to Flickr.
contentment,http://farm6.staticflickr.com/5307/5638511220_f5f0eec0ae_z.jpg,1,4,"hampi - hemakuta hill 15 Even without its magnificent architectural heritage, Hampi would be a marvelous tourist destination just for its landscape: the wild, mighty piles of granite, scoured by the elements into a giant's rounded pebbles, glow red at sunset and reflect dramatically into the natural reflecting pools, and of course the river.  Of course, these features are not unique to this exact spot, so it's hard to say that the temples found themselves here just because the landscape had some inherently attractive or spiritual properties.  Anyway, I don't know enough about Hinduism to have any idea what kind of places ""have sacred written all over them"" (in Doug's phrase), or even how these places look and feel to Hindu eyes.  I can only bring my own, Western-shaped picturesque sensibility, which tells me this whole place is drop-dead gorgeous.  That runs the risk, though, of reducing the temples to charming follies scattered in the landscape for solely aesthetic effects, which, of course, is to take them totally out of their actual context.  I don't know.  I felt tremendous peace and contentment wandering around these places; I can't say that it was a spiritual experience, but I'm very glad I went and I recommend it to anybody else who's even within striking distance of Hampi."
contentment,http://farm6.staticflickr.com/5287/5252208890_d441af1d2f_z.jpg,2,3,Love Baby 1990s
contentment,http://farm4.staticflickr.com/3209/2592753291_87ff97045a_z.jpg,1,4,Contentment on Father's Day Explore bethy_truebluecubsfan's photos on Flickr. bethy_truebluecubsfan has uploaded 954 photos to Flickr.
