excitement,http://farm8.staticflickr.com/7171/13270282943_26b6833139_z.jpg,2,3,"Bellamy Young - DSC_0039 3 www.redcarpetreporttv.com  Mingle Media TV's Red Carpet Report team were invited to cover the Divergent Premiere Red Carpet at the Regency Bruin Theatre in Westwood, CA. Fans were lined up along the red carpet with signs filled with excitement for this movie which will be in theaters and IMAX March 21.   Get the Story from the Red Carpet Report Team, follow us on Twitter and Facebook at: twitter.com/TheRedCarpetTV www.facebook.com/RedCarpetReportTV www.redcarpetreporttv.com www.youtube.com/MingleMediaTVNetwork DIVERGENT is a thrilling action-adventure film set in a world where people are divided into distinct factions based on human virtues. Tris Prior (Shailene Woodley) is warned she is Divergent and will never fit into any one group. When she discovers a conspiracy by a faction leader (Kate Winslet) to destroy all Divergents, Tris must learn to trust in the mysterious Four (Theo James) and together they must find out what makes being Divergent so dangerous before it's too late. Based on the best-selling book series by Veronica Roth. divergentthemovie.com/#tickets  Get the soundtrack here!  smarturl.it/DivergentSoundtrack smarturl.it/DivergentTgt   For more of Mingle Media TVs Red Carpet Report coverage, please visit our website and follow us on Twitter and Facebook here: www.minglemediatv.com www.facebook.com/minglemediatvnetwork www.flickr.com/MingleMediaTVNetwork www.twitter.com/minglemediatv www.twitter.com/TheRedCarpetTV"
excitement,http://farm3.staticflickr.com/2950/15272962789_5655bb4ef3_z.jpg,1,4,Snowbirds-6 I wasn't going to post this shot because i made a critical mistake in shooting it. I had my camera set to a low shutter speed to capture some prop blur earlier in the Airshow and in my excitement forget to adjust it to the speed of the Jets. So this is not a great shot. But this image does show how close the Snowbirds proxiemty is to each other at speeds in excess of 400mph. For that reason i like the image and decided to post it.
excitement,http://farm4.staticflickr.com/3917/14478250041_a1dd489d68_z.jpg,2,3,"Mermaid Parade 2014 The Mermaid Parade was a wonderful event full of color, excitement and creativity. geeketteonbicycle.tumblr.com/"
excitement,http://farm4.staticflickr.com/3885/14767432734_5f7e937a55_z.jpg,0,5,"SYHA Torridon Munros course Today we had to go for Liathach, the forecast for the rest of the week looked challenging and I wanted to give the group the best possible conditions for this classic ridge traverse. Some tired legs from our big day yesterday meant that we were not as fast up to the ridge as hoped however once established on the route we made good progress. The clouds cleared as we traversed the pinnacled section of the ridge which added to the enjoyment of scrambling on this Scottish coffee table book route. Today the ridge was quite busy with friends and colleagues also guiding on this magnificent mountain. Excitement builds now with some of the group now within tantalising grasp of Compleation"
excitement,http://farm9.staticflickr.com/8010/7172691942_f2b9d5a0e9_z.jpg,0,5,120505 FACup Final Chelsea v Liverpool (34) pre match excitement
excitement,http://farm3.staticflickr.com/2840/8773619864_fc3c05fb76_z.jpg,1,4,"DINOSAUR TRAIN DISCOVERY TOUR DINOSAUR TRAIN DISCOVERY TOUR  Sunday, May 19, Noon - 5pm, Brookings  Dinosaurs may be extinct, but there are plenty of examples of dino-like strategies to be found in today's world.  A large crowd found out all sorts of facts about dinosaurs, enjoyed an incredible free day of play, and met Buddy the T.rex from Dinosaur Train at the Children's Museum of South Dakota in Brookings on Sunday, May 19, from Noon to 5pm.  Excitement topped the menu for the event, which was fun for kids and grown-ups.  Buddy the T.rex.  Dug for dino bones outdoors.  Explored the Dinosaur Train Discovery Tour scavenger hunt  Nature Adventures hosts Terri and Todd presented live animals  Amazing science demos with Science Steve.  Played in the incredible museum.  Saw the life-size Mama T.rex and her baby, Max.  Hugs from Buddy the SDPB Kid and Kidoodle, the museum mascot."
excitement,http://farm9.staticflickr.com/8502/8445473938_6892361627_z.jpg,2,3,"Area I turns out for Super Bowl XLVII By Franklin Fisher franklin.s.fisher2.civ@mail.mil  CAMP RED CLOUD, South Korea  Warrior Country residents undaunted by winter snows kept their early morning appointment with this years Super Bowl, coming out in their hundreds to Area I installations for a live telecast of Americas premier football event, cheering   sometimes groaning   as the Baltimore Ravens prevailed over the San Francisco 49ers 34-31. The Army gave the Soldiers the day off so they could be part of the Super Bowl XLVII excitement and see it all live, even though theyre stationed half a world away. There was also plenty of food  free breakfasts at Area I clubs, an all-you-can-eat deal at the Camp Casey food court, as well as prize drawings for TV sets, i-Pads and other giveaways. For Soldiers and families stationed in Korea, catching the telecast live from the Mercedes-Benz Superdome in New Orleans meant showing up early, with on-post facilities opening their doors at six. Free breakfast  eggs, grits, creamed beef, biscuits, bacon, sausage, hash browns, coffee, juice   awaited them at a variety of on-post facilities: at the Gateway Club and Warriors Club on Camp Casey, the Iron Triangle on Camp Hovey, Reggies on Camp Stanley, and Mitchells Community Club and Conference Center on Camp Red Cloud.  That was followed later in the morning by still more food  at Mitchells, for example, hot wings, fried wings and hot dogs; at the Gateway, three kinds of pizza   pepperoni, sausage, cheese  the spread varied somewhat from club to club. And the Camp Casey Food Court drew a Super Bowl crowd of its own  about 230 people, offering all-you-can-eat for $11.99, for which patrons could order continually from the eateries of their choice. Soldiers said they were glad for the live game, the food and the chance to socialize with their battle buddies. I think its generous cause its not a given, its a privilege, Pvt. Luis Campos, a Ravens fan with the 552nd Signal Company, said of being given the day off to watch the game. For them doing that, it takes the stress off the Soldiers, especially us being overseas and stuff. Everybody back home, they get a chance to watch the game. So now we get the privilege and stuff, so it makes it better. I really appreciate it, especially being here in Korea, said Spc. Austin Ross of Company B, Headquarters and Headquarters Battalion, 2nd Infantry Division. Ross had been pulling for the 49ers. Had there not been the Super Bowl holiday, Ross would have been at work. Its in the morning, itd be during work, and its something American that I get to do here in Korea. I appreciate it, he said. This is great, said Sgt. 1st Class Randy Waits, a motor sergeant and 49ers fan with Headquarters Support Company, Headquarters and Headquarters Battalion, 2nd Infantry Division. Its great the way they provide the opportunity for the Soldiers to see this and be able to come together, be overseas, away from our families. Just like a holiday. Being able to come together and socialize."
excitement,http://farm4.staticflickr.com/3792/14264728236_06012625bb_z.jpg,1,4,"CAPTURE THE FLEETING MOMENTS- Who Says Shooting The River Rapids Is Life Itself ! 3 Family Life, places and memories of childhood are golden nuggets that nestle deep in a person's mind in his lifetime; a lasting selfless dedication to fulfill his aspirations for the family and grandchildren in the coming years.  Man may travel far and wide or establishes a second Home beyond the borders of his native land; Yet at the twilight years of life, he will  travel back on the long road to the old Home  where he spent the first 7  years of his childhood from the time he was born.  - wilfredosrb   Photo-Travel: kylesijo/nikkiKaamiolenseyes/CdeO/Butuan  Updated and edited June 30, 2015 - wilfredosrb."
excitement,http://farm8.staticflickr.com/7297/8728103288_b80ae886d5_z.jpg,0,5,Little George's Big Reaction ... to the sound of a hiccup (mine).
excitement,http://farm8.staticflickr.com/7320/11721875763_fb02f1aeda_z.jpg,2,3,"2014 NHL Winter Classic (from the stands) MiHockey cameras weren't just on the field, but also throughout the Big House's concourse and stands for the 2014 NHL Winter Classic between the Red Wings and Maple Leafs. Check out these photos that capture that atmosphere, excitement and bitter-cold temperatures from the big game at the Big House. (Photos by Erik Roush/MiHockey)"
excitement,http://farm3.staticflickr.com/2901/14570535523_199a38ce2f_z.jpg,2,3, 
excitement,http://farm4.staticflickr.com/3740/12215293144_435b897846_z.jpg,1,3,"Excitement (B&W) Fred Fletcher Park, Raleigh, NC"
excitement,http://farm6.staticflickr.com/5491/11922399876_0ea7775fc7_z.jpg,1,4,Running at Snell's Explore Occasionally Focused's photos on Flickr. Occasionally Focused has uploaded 5354 photos to Flickr.
excitement,http://farm4.staticflickr.com/3697/9464017875_161ca4a469_z.jpg,0,5,TaeKwonDO - Afternoon August 7th Pictures showing all of the excitement and action of the competitors from the afternoon session of the TaeKwonDo competition.
excitement,http://farm4.staticflickr.com/3731/10844287024_73a5c70a32_z.jpg,1,4,"Honoring of Native Veterans Powwow 2013 Pequot Museum visitors experienced the excitement of a Native celebration with dancers, music, regalia, and traditional arts at the Honoring of Native Veterans Powwow on Saturday, Nov. 9, 2013. "
excitement,http://farm6.staticflickr.com/5555/14534731097_73a71f141d_z.jpg,2,3,Happiness Explore MakeMeReminisce's photos on Flickr. MakeMeReminisce has uploaded 235 photos to Flickr.
excitement,http://farm6.staticflickr.com/5192/14301945524_b608b621c1_z.jpg,1,4,"WHY IS THERE NO RAINBOW DURING STORMY WEATHER? 10 Family Life, places and memories of childhood are golden nuggets that nestle deep in a person's mind in his lifetime; a lasting selfless dedication to fulfill his aspirations for the family and grandchildren in the coming years.  Man may travel far and wide or establishes a second Home beyond the borders of his native land; Yet at the twilight years of life, he will  travel back on the long road to the old Home  where he spent the first 7  years of his childhood from the time he was born.  - wilfredosrb   Photo-Travel: kylesijo/nikkiKaamiolenseyes/CdeO/Butuan  Updated and edited June 30, 2015 - wilfredosrb. "
excitement,http://farm9.staticflickr.com/8183/8121161086_a8f1502335_z.jpg,1,4,"exited girl with her christmas present exited girl with her christmas present - Exited girl with her christmas present sitting over white background, Model: Alyssa Power. To Download this image without watermarks for Free, visit: www.sourcepics.com/free-stock-photography/24728925-exited..."
excitement,http://farm9.staticflickr.com/8110/8580059433_4244432969_z.jpg,2,3,Women Celebrating Birthday --- Image by  Royalty-Free/Corbis Women Celebrating Birthday --- Image by  Royalty-Free/Corbis
excitement,http://farm8.staticflickr.com/7301/12586044254_f3de10ba10_z.jpg,2,3,DSC_8995 Kerry and Shirin
excitement,http://farm3.staticflickr.com/2937/14515209107_f6e510806c_z.jpg,0,5, 
excitement,http://farm8.staticflickr.com/7301/12985499435_38ae183c6d_z.jpg,1,4,Excitement!!! Explore Tasayu Tasnaphun's photos on Flickr. Tasayu Tasnaphun has uploaded 6276 photos to Flickr.
excitement,http://farm9.staticflickr.com/8596/15748481330_6d4b50b2b5_z.jpg,2,3,"Macy's 2014 Thanksgiving Day Parade Macy's Thanksgiving Day Parade in 2014 had the same route as the previous year, from Central Park West then to Sixth Avenue. I was at Rockefeller Center and enjoyed the parade and balloons, especially the new ones. It was cold, with a little bit of snow flurries, but the excitement and smiles of the people around warmed me."
excitement,http://farm4.staticflickr.com/3777/10334937025_2e4d3b1c79_z.jpg,0,5,The excitement. Explore tessabrediger's photos on Flickr. tessabrediger has uploaded 439 photos to Flickr.
excitement,http://farm8.staticflickr.com/7101/7335631542_c96f7f65c9_z.jpg,1,4,Teens At Beach 9 Explore Every Day Adventures' photos on Flickr. Every Day Adventures has uploaded 16052 photos to Flickr.
excitement,http://farm6.staticflickr.com/5446/10195688946_505fa0efff_z.jpg,2,3,"Bike Auction Bologna Each bike is ridden in front of the screaming audience. I thought I liked bikes as much as the next person, but I really couldn't work out the cause of the excitement"
excitement,http://farm8.staticflickr.com/7048/6795462504_3d8fb08961_z.jpg,1,4,IMG_6313 Dave & Buster's Grand Re-Opening Party
excitement,http://farm4.staticflickr.com/3875/14295049038_83c3c615a2_z.jpg,2,3,"Mermaid Parade 2014 The Mermaid Parade was a wonderful event full of color, excitement and creativity. geeketteonbicycle.tumblr.com/"
excitement,http://farm4.staticflickr.com/3823/9031220802_ebe3c5f4bc_z.jpg,2,3,"Flyte attends 2013 Wisconsin FFA Convention Flyte makes new friends and generates excitement by appearing at the 2013 Wisconsin FFA Convention in Madison, Wis., on Tuesday and Wednesday, June 11-12, 2013."
excitement,http://farm3.staticflickr.com/2838/9717513788_d455c42c35_z.jpg,0,5,Excitement! Explore Cavalier92's photos on Flickr. Cavalier92 has uploaded 23321 photos to Flickr.
excitement,http://farm4.staticflickr.com/3698/9466806220_feaf46aba4_z.jpg,0,5,TaeKwonDO - Afternoon August 7th Pictures showing all of the excitement and action of the competitors from the afternoon session of the TaeKwonDo competition.
excitement,http://farm3.staticflickr.com/2919/14300797802_01b7c60a78_z.jpg,0,5,"WHY IS THERE NO RAINBOW DURING STORMY WEATHER? 13 Family Life, places and memories of childhood are golden nuggets that nestle deep in a person's mind in his lifetime; a lasting selfless dedication to fulfill his aspirations for the family and grandchildren in the coming years.  Man may travel far and wide or establishes a second Home beyond the borders of his native land; Yet at the twilight years of life, he will  travel back on the long road to the old Home  where he spent the first 7  years of his childhood from the time he was born.  - wilfredosrb   Photo-Travel: kylesijo/nikkiKaamiolenseyes/CdeO/Butuan  Updated and edited June 30, 2015 - wilfredosrb. "
excitement,http://farm6.staticflickr.com/5588/14650748428_c6884135b4_z.jpg,2,3,DSC_4411 Marlo & Mia 6th Birthday
excitement,http://farm9.staticflickr.com/8296/8005239224_ea6759d1b1_z.jpg,2,3,AYSO First game excitement! AYSO First game excitement!
excitement,http://farm8.staticflickr.com/7060/6980554095_1088c63fb7_z.jpg,2,3,Markus' can hardly contain his excitement! Apple March 2012 announcement of the new iPad
excitement,http://farm8.staticflickr.com/7425/9807722416_e1e701e787_z.jpg,2,3,"Frosh '13 Frosh '13 was 3 days of organized chaos and excitement that gave new students the opportunity to meet new friends at Douglas College.  --------------  Douglife is your one-stop shop for recreation, leadership, volunteering, clubs, wellness and everything Campus Life at Douglas College.  www.Douglife.ca"
excitement,http://farm8.staticflickr.com/7384/13274231403_b8efc146d3_z.jpg,2,3,"Kate Winslett - DSC_0071 2 www.redcarpetreporttv.com  Mingle Media TV's Red Carpet Report team were invited to cover the Divergent Premiere Red Carpet at the Regency Bruin Theatre in Westwood, CA. Fans were lined up along the red carpet with signs filled with excitement for this movie which will be in theaters and IMAX March 21.   Get the Story from the Red Carpet Report Team, follow us on Twitter and Facebook at: twitter.com/TheRedCarpetTV www.facebook.com/RedCarpetReportTV www.redcarpetreporttv.com www.youtube.com/MingleMediaTVNetwork DIVERGENT is a thrilling action-adventure film set in a world where people are divided into distinct factions based on human virtues. Tris Prior (Shailene Woodley) is warned she is Divergent and will never fit into any one group. When she discovers a conspiracy by a faction leader (Kate Winslet) to destroy all Divergents, Tris must learn to trust in the mysterious Four (Theo James) and together they must find out what makes being Divergent so dangerous before it's too late. Based on the best-selling book series by Veronica Roth. divergentthemovie.com/#tickets  Get the soundtrack here!  smarturl.it/DivergentSoundtrack smarturl.it/DivergentTgt   For more of Mingle Media TVs Red Carpet Report coverage, please visit our website and follow us on Twitter and Facebook here: www.minglemediatv.com www.facebook.com/minglemediatvnetwork www.flickr.com/MingleMediaTVNetwork www.twitter.com/minglemediatv www.twitter.com/TheRedCarpetTV"
excitement,http://farm8.staticflickr.com/7255/8165854239_a70d8bc7a9_z.jpg,1,4,"Stay Focused This image of Mark Webber was taken at the 2012 Canadian Grand Prix in Montreal. We opted for grandstand tickets as opposed to a general pass for the weekend. General admission offers some decent spots to take pictures, but after taking in the all the weekend's excitement in Grandstand 33, I now realize that there is no other way to truly experience F1.   Best viewed full-screen! Press L  www.shutter-fotos.com"
excitement,http://farm6.staticflickr.com/5333/7043417123_eab9553072_z.jpg,1,4,Green Fireworks Explore PhojoKash's photos on Flickr. PhojoKash has uploaded 5574 photos to Flickr.
excitement,http://farm6.staticflickr.com/5523/10527405696_3055505ce8_z.jpg,2,3,_67A8894 Explore matt freire's photos on Flickr. matt freire has uploaded 2895 photos to Flickr.
excitement,http://farm8.staticflickr.com/7373/8720844413_530275be66_z.jpg,2,3,Climbing Excitement A climber displays his excitement for climbing.
excitement,http://farm6.staticflickr.com/5603/15603024677_133332db1c_z.jpg,1,4, 
excitement,http://farm8.staticflickr.com/7504/15513936369_7e2384bcda_z.jpg,1,4,"The Excitements, Barts, Curtcircuit, 01-11-2014_4 Explore Ray Molinari's photos on Flickr. Ray Molinari has uploaded 129109 photos to Flickr."
excitement,http://farm9.staticflickr.com/8348/8152195536_5fe31fcedf_z.jpg,2,3,"13th Annual Victorian Erotica Ball 2012 www.KevinLarsonPresents.com  13th Annual Victorian Erotica Ball 13 Shades of Grey Colorados Erotic Costume Mandatory Block Party  The Victorian Erotica Ball is an exploration of eroticism allowing people from all walks of life to explore healthy sensuality  a tasteful fetish party with a maze of unique environments, various proclivities and phenomenal performances. The event is designed to tantalize the mind and senses creating euphoric abandonment.   Celebrate the 13th Annual Ball, 13 Shades of Grey style. Fantasies of the book become reality for one evening.    ""Best place to see a politician in bondage.""  - Westword ""....the party is all about the people."" - Denver Post MANDATORY COSTUMING keeps the energy high causing reality to fade. A person can lose themselves to an alter ego and escape reality for one night. The only costume mandatory event in the state!   Entertainment: Expect 60 entertainers on multiple stages running throughout the night and many other surprises of interaction...  Featuring: Playboy model and MMA fighter-DJ Miss Vicious & DJ Devo  Erotic ballet, living balloon statues, queens of sensuality, Japanese rope bondage, submission shows, multiple DJs, Shibari, fire eaters, professional dominatrix, jugglers, burlesque, exotic belly dancers, contortionists, human marionette, body painters, den of inequity, garden of Eden, topless dancers, live vocalists, angels and demons, live snakes and much, much more!  "
excitement,http://farm3.staticflickr.com/2813/11112717806_a30e57eee2_z.jpg,2,3,"Macy's 2013 Thanksgiving Parade-Duck Dynasty The excitement starts the night before during the balloon inflation near Central Park West. Most of the balloons were already inflated and tied down when I arrived. On Thanksgiving Day, I was along 6th Avenue to take pics and enjoy the parade. "
excitement,http://farm4.staticflickr.com/3823/12097507016_823a48a820_z.jpg,2,3,Haute couture fashion week - more backstage footages. The girls were lined up for the show and excitement was in the air. Explore Shosei_xj's photos on Flickr. Shosei_xj has uploaded 1230 photos to Flickr.
excitement,http://farm4.staticflickr.com/3909/14746751966_7f4c9a6a84_z.jpg,1,4,"SYHA Torridon Munros course Today we had to go for Liathach, the forecast for the rest of the week looked challenging and I wanted to give the group the best possible conditions for this classic ridge traverse. Some tired legs from our big day yesterday meant that we were not as fast up to the ridge as hoped however once established on the route we made good progress. The clouds cleared as we traversed the pinnacled section of the ridge which added to the enjoyment of scrambling on this Scottish coffee table book route. Today the ridge was quite busy with friends and colleagues also guiding on this magnificent mountain. Excitement builds now with some of the group now within tantalising grasp of Compleation"
excitement,http://farm6.staticflickr.com/5562/15278614452_ffc645f6cb_z.jpg,2,3,DSC_4765 The excitement live concert
excitement,http://farm9.staticflickr.com/8229/8590711615_a6a7e6ed4b_z.jpg,1,4,IMG_3196 Explore Vicr of Flickr's photos on Flickr. Vicr of Flickr has uploaded 3984 photos to Flickr.
excitement,http://farm9.staticflickr.com/8463/8427155086_e58de6e6a5_z.jpg,1,4,"Grammy nominated Legendary New Swing Sextet VIDEO PLAYLIST www.youtube.com/watch?v=XyNsyrqQLo4&list=PLC87jK6_9w7...  BUY CD YESTERDAY TODAY & TOMORROW itunes.apple.com/album/yesterday-today-tomorrow/id5890407... OFFICIAL WEBSITE www.thenewswingsextet.com/ FACEBOOK www.facebook.com/pages/Grammy-nominated-Legendary-New-Swi... MY SPACE www.myspace.com/newswingsextet Contact Info Website myspace.com/newswingsextet facebook.com/grammynominatedlegen... Press Contact George Rodriguez/ @ above emails Booking Agent Henry Knowles/ henry@worldsalsadj.com, Angel Justiniano/ angeljustiniano08@gmail.com  Members George Rodriguez/ Vibes- leader, Angel Justiniano/ congas- vocal, coro- co-leader, Harry Justiniano/ Bass, Coro, Hector Ortiz/ Bongo, Percussion, Jimmy Figueroa/ Timbales- coro, Conal Fowkes/ Piano, Gilberto Velasquez,don sonero- Lead vocal............  About New swing sextet, New York oldest Vibe driven sextet, and still performing ""salsa that keeps the dancers moving and the Dj's pumping"" Biography ABOUT THE NEW SWING SEXTET A product of New York City and the excitement and turbulence of the sixties, the New Swing Sextet made its professional debut performing in the Singer Bowl at the last New York Worlds Fair in 1965... The band has been a popular and innovative exponent of Latin jazz, salsa and pop music for nearly four decades. Composed of vocals, piano, vibes, bass and Latin percussion, the original New Swing broke up in the late seventies after successfully recording, touring and doing all the hot club dates that the New York metropolitan area had to offer. In recent years most of the groups core members have reunited and have been performing with Mambo Negro the highly popular Latin jazz ensemble, which performs regularly in and around the tri-state area. However, you can't buy or replace 40 years of history, and on special occasions the band performs as the New Swing. The New Swing offers an established and respected name with a sound from another era, which has been perfectly preserved and bottled for another generation to enjoy. The band was part of a young crop (and new breed of aspiring Latin musicians) who grew up in the greater New York Metropolitan tri-state area with its rich ethnic mix and diverse inner-city culture, while at the same time growing up surrounded by the Latin music explosion happening in the region. The Palladium and other clubs were dancing to the music of Machito and his Afro-Cubans, and the Jose Curbelo Orchestra while Tito Puente, Tito Rodriguez, Eddie Palmieri, Joe Cuba, and Cal Tjader, among many others, had already established their unmistakable sounds. In the early sixties, every other city block in New York had a Latin band and a doo-wop group. Blend these many elements together and you get the influences that shaped the New Swing Sextet and their contemporaries, including Johnny Colon; the Lebron Brothers; Willie Colon, Joe Bataan and Pete Rodriguez groups that helped pioneer a new street sound (which would eventually become Latin Boogaloo and Salsa). The New Swing Sextet would join the Alpha Artists of America (under the Management of Jose Curbelo) and ultimately record 4 long albums (and have a separate Best of the New Swing Sextet) all under the Cotique label. The band regularly performed on popular TV shows such as El Club de la Juventud con Polito Vega; The Tito Puente Show with host Sofi; and El Show de Myrta Silva among others. It was a magical time to be a performing Latin artist in New York City. A fraternity of great musicians and legends in the making, routinely performing together at the great dance clubs of the day, including: The Corso; LaMaganette; The Chez Jose; La Mancha; The Colgate Gardens; The Psycho Room; The Tropicoro; The Cheetah and at all the great battle of the band venues such as The Hunts Point Palace; The Manhattan Center; The Riverside Plaza Hotel and The St. Georges Hotel. Over a ten-year period the New Swing performed all summer-long at popular resorts and at the summer home of Latin music: las Villas. The band has also toured extensively and performed at world famous venues such as the legendary Apollo Theatre; the South Street Seaport and Webster Hall in New York City. Recent performances to large audiences in Montreal, San Francisco, & Los Angeles, proved that the band still has plenty of sabrosura to keep the dancers on the floor. (read less)"
