excitement,http://farm4.staticflickr.com/3910/14690668754_7f7323b3f8_z.jpg,0,5,"Week 4: Willows at Willow Grove Day Camp  willowgrovedaycamp.com/willows/  We cant believe that four wonderful weeks have flown by. It was very exciting to have all of our Willows family members join us for our visiting day. We hope you had as much fun as we did.  While the temperature outside continued to rise, so did the fun and excitement. All the children had plenty of water breaks and extra time swimming to keep cool. Even the threat of rain didnt dampen our spirits. We had the opportunity to have an extra special snack of sandwich cookies decorated with icing and jimmies.  This weeks theme was Finding Nemo, and the Tadpoles and Minnows created CD fish door hangers in Camper Creations. At Ceramics, the campers enjoyed painting their clay hands and feet. All your childrens projects will be sent home shortly. On Wednesday, in preparation for Waterworld and to honor our weekly theme of Finding Nemo, many of our Tadpoles and Minnows attempted the giant water slide and loved it.  To end our wonderful week, The Willows campers joined the rest of camp at Waterworld. The children drove water boats and joined in other great water activities. A terrific time was had by all!  We are looking forward to the next four weeks with your children. As a reminder, please remember to label all items brought to camp and wear yellow as much as possible.  About Willow Grove Day Camp Willow Grove Day Camp provides summer fun for kids who live in Willow Grove, Abington, Blue Bell, Hatboro, Horsham, Huntingdon Valley, Lafayette Hill, Philadelphia, Plymouth Meeting, Southampton and the surrounding areas. For more information on the Willows at Willow Grove Day Camp please visit: willowgrovedaycamp.com/willows/"
excitement,http://farm4.staticflickr.com/3792/9167562790_a12f3cab08_z.jpg,2,3,"VBS 2013 (92) Students eagerly invaded the White's Chapel Campus for the 2013 Vacation Bible School.  What a blessing to have such energy and excitement.  A special word of ""Thanks"" to all of our volunteers!  "
excitement,http://farm9.staticflickr.com/8148/7169024613_3dc6bd74e1_z.jpg,2,3, 
excitement,http://farm6.staticflickr.com/5509/11006444275_323939e4a0_z.jpg,0,5, 
excitement,http://farm9.staticflickr.com/8227/8467989517_81d3a4a014_z.jpg,2,3,"International Days Showcase 2013 This is a glimpse of the International Days Showcase, held Feb. 8, 2013 in the TRU Gym. The event was also streamed live around the world over the web at www.livestream.com/ivetru.  The Showcase is the signature event for International Days and serves as a celebration of the diversity of world cultures and perspectives through the use of music, dance, and performances.   International Days ran Feb. 4-8 and celebrated its 20th anniversary this year and proved to be among the best yet. Guest speakers, presentations, demonstrations, food tasting, movies, contests, and more were on the schedule.   Learn more about Thompson Rivers University."
excitement,http://farm9.staticflickr.com/8037/8042969743_ed7dee9dd8_z.jpg,1,4,"f2-2012_09_29-athens_flying_week-417 Athens Flying Week took place in the last week of September 2012 - from Monday the 24th until Sunday the 30th - and all activities was leading to the peak of the event, which is the Air Show  at Tatoi Airfield, located in the Municipality of Acharnes, on the 29th and 30th of September 2012. Athens Flying Week is designed to become the major flying event for the city of Athens. By special permission from the Ministry of Defense and the Air Force, for two days Tatoi military airport, located in the Municipality of Acharnes opened its gates to the public, who was able to experience a magnificent air show and a series of individual events. Athens Flying Week implemented through promotional events (weekdays) and during the weekend the Tatoi airfield hosted the Air Show plus a series of ground events, activities & happenings.  The planned events took place on two central points of Athens and the Tatoi military airport. Further, except from the air display, the following occurred: fly in, congress of general aviation, trade show, kids park, fly simulators, aeromodelling events, addicting flights and hospitality area, dj line ups & happenings. Every step of the project was planned in order to provide a unique experience to those who wanted to live the thrill and excitement of flights. They aimed to bring those feelings to children, youngsters and families as well as to flying enthusiasts and amateur pilots, in a first seen manner for national standards. "
excitement,http://farm8.staticflickr.com/7053/6836747150_04303f380e_z.jpg,2,3,20120215-359-MonteVerde-zip Excitement?
excitement,http://farm8.staticflickr.com/7300/10844191836_629975c334_z.jpg,2,3,"Honoring of Native Veterans Powwow 2013 Pequot Museum visitors experienced the excitement of a Native celebration with dancers, music, regalia, and traditional arts at the Honoring of Native Veterans Powwow on Saturday, Nov. 9, 2013. "
excitement,http://farm8.staticflickr.com/7166/6706965359_ddf80de651_z.jpg,2,3,"Coptic Christians from Eritrea and Ethiopia, Orthodox Christmas Celebration at the Church of the Nativity, West Bank town of Bethlehem January 6, 2012 Hundreds of African Refugees from Eritrea and Ethiopia make a pilgrimage to Bethlehem to visit Manger Square and the Church of the Nativity for a Coptic Christmas. Bethlehem, Palestine, 6th January 2012.  Shortly about me:  Its my passion to create stories and bring back pictures of events, people and places that are rarely seen. Its a combination of exploration, exposition and artistry that together create a life of adventure and excitement.  In my work it is imperative for me that information be accurate and the images must be respectful of the subject and viewer. My goal is to combine creativity with practicality to capture the best possible images to document events, tell a story, meet the picture editor's deadlines.  If you would like to know more, or even just pick my brains to discuss your project with me, please visit my homepage  documentary photography or send me an Email. "
excitement,http://farm6.staticflickr.com/5563/14315412423_c55fb18d05_z.jpg,2,3,"WHY IS THERE NO RAINBOW DURING STORMY WEATHER? 3 wilfredosrb@73 Featured in this album were groups who enjoyed their weekend adventures and bonding trip participated in by my Children and Grandchildren. They joined the Group of Guests and local Tourists who were there that day. They started as strangers and ended up as friends in the process of sharing moments, thrills and excitement by days end.   History tells us that ancient people started living along rivers which serves as the first passage for travel connecting them with other colonies and settlements found along the same river.   Today the river do not only serves as a conduit for travel but also serves as connecting link for other forms of activities such as sports, etc. On this occasion photos were shared as part of the paid tour package by the unnamed managing agency. Viewing is intended for its entertainment, educational and informative value. Rafting is considered among the least risky Adventure Sports. - wilfredosrb   Updated and edited as of July 10, 2014"
excitement,http://farm6.staticflickr.com/5275/14108797857_634750aee4_z.jpg,0,5,"WHY IS THERE NO RAINBOW DURING STORMY WEATHER? 1 Family Life, places and memories of childhood are golden nuggets that nestle deep in a person's mind in his lifetime; a lasting selfless dedication to fulfill his aspirations for the family and grandchildren in the coming years.  Man may travel far and wide or establishes a second Home beyond the borders of his native land; Yet at the twilight years of life, he will  travel back on the long road to the old Home  where he spent the first 7  years of his childhood from the time he was born.  - wilfredosrb   Photo-Travel: kylesijo/nikkiKaamiolenseyes/CdeO/Butuan  Updated and edited June 30, 2015 - wilfredosrb. "
excitement,http://farm6.staticflickr.com/5584/14857148032_ebddbacbd1_z.jpg,2,3,"The excitement begins Streets of Bangalore, during Chitra Santhe"
excitement,http://farm8.staticflickr.com/7566/15299345363_8a8a4fbf21_z.jpg,2,3, 
excitement,http://farm4.staticflickr.com/3870/14514603188_d775125a60_z.jpg,0,5, 
excitement,http://farm8.staticflickr.com/7439/11765071273_955b0187ea_z.jpg,0,5,Fox Hunters Riders are chasing down the 'Fox'.   No real foxes were hunted today.  
excitement,http://farm3.staticflickr.com/2917/14589694041_f017e3b662_z.jpg,0,5,"Red_White_Blue_02 4th of July Evening at City Park in Ft. Collins, Colorado.  I realized after the show my aperature was much too wide...  I got caught up in the excitement, and ended up with some excellent water smears of color in the waters reflection.  I just wish I hadn't over exposed the display in the sky...  A fantastic display."
excitement,http://farm4.staticflickr.com/3752/13284053634_335ddd686e_z.jpg,0,5,"Shailene Woodley & Maggie Q - DSC_0396 2 www.redcarpetreporttv.com  Mingle Media TV's Red Carpet Report team were invited to cover the Divergent Premiere Red Carpet at the Regency Bruin Theatre in Westwood, CA. Fans were lined up along the red carpet with signs filled with excitement for this movie which will be in theaters and IMAX March 21.   Get the Story from the Red Carpet Report Team, follow us on Twitter and Facebook at: twitter.com/TheRedCarpetTV www.facebook.com/RedCarpetReportTV www.redcarpetreporttv.com www.youtube.com/MingleMediaTVNetwork DIVERGENT is a thrilling action-adventure film set in a world where people are divided into distinct factions based on human virtues. Tris Prior (Shailene Woodley) is warned she is Divergent and will never fit into any one group. When she discovers a conspiracy by a faction leader (Kate Winslet) to destroy all Divergents, Tris must learn to trust in the mysterious Four (Theo James) and together they must find out what makes being Divergent so dangerous before it's too late. Based on the best-selling book series by Veronica Roth. divergentthemovie.com/#tickets  Get the soundtrack here!  smarturl.it/DivergentSoundtrack smarturl.it/DivergentTgt   For more of Mingle Media TVs Red Carpet Report coverage, please visit our website and follow us on Twitter and Facebook here: www.minglemediatv.com www.facebook.com/minglemediatvnetwork www.flickr.com/MingleMediaTVNetwork www.twitter.com/minglemediatv www.twitter.com/TheRedCarpetTV"
excitement,http://farm8.staticflickr.com/7322/12841637543_33216eb951_z.jpg,2,3,"Muriel Bowser - Women for Muriel On Saturday, Jan 26, hundreds of female voters from Washington, DC joined Muriel Bowser and her loyal campaign volunteers for a lovely meet and greet event at the Woman's National Democratic Club in Dupont Circle.   These photos capture the high level of support and excitement from the event attendees and foretold the recent endorsement Bowser received from Emily's List - emilyslist.org/news/releases/emilys-list-endorses-muriel-... - the nations largest resource for women in politics.  You can read more about Bower's campaign to become the next Mayor of Washington, DC at murielformayor.com/  You can also read the great endorsement she received from the Washington Post over incumbent Vincent Gray at www.washingtonpost.com/opinions/muriel-bowser-for-distric..."
excitement,http://farm8.staticflickr.com/7314/11770480135_58b6724bb8_z.jpg,2,3,"_DSC9478 Happy New Year 2014!!  I spent NYE on Granville St in Vancouver BC with two other fantastic photographers capturing the fun of the evening. We lined up side-by-side, many people thought we were with a newspaper or that we knew something really amazing was just about to take place and they asked what it was and wanted to watch too. I chose for us to stand behind street barricades on Granville St as a means to help control foot traffic from knocking us or our cameras over. I had one really close call....when the group of guys decided to pick one of the barricades up and toss it around. I moved pretty darn quick out of the way! That was a good decision!    Later on in the evening, after the NYE countdown, we placed ourselves, still on Granville St, between The Roxy & The Caprice bars so lots of people hanging about there.  It amazes me how fast you move around! I had my camera on super high ISO and on a tripod so a lot of the photos have some blur....or a lot lol. I left the majority of the photos, clear or not as some people will be able to see themselves through the blur.   Some of the photos might seem a bit strange with the movement/blur but I find them artistic and you can find some interesting pictures within a photo when you let yourself just look without expectations. You may also notice the odd clear face/s that paused in all the movement & excitement. All in all, everyone was having a fantastic time!!  If you see yourself in any of the pictures on my Facebook page, please tag yourself and then share the photos to your friends & family. If you like my page then you will get notified for when I post the rest of the pictures which are coming soon! www.facebook.com/AnnaHallPhotographer  Thank YOU for posing for me and bringing such great energy to NYE!!"
excitement,http://farm4.staticflickr.com/3870/15001096692_b01049025b_z.jpg,2,3,"13 Aug 2014 Hippodrome Circus 111th Year Great Yarmouth (627) 2014 is the 111th anniversary of the opening of the historic Hippodrome Circus in Great Yarmouth which marks the special celebration summer season with a classic show set in East Anglias mini Albert Hall, full of fun, thrills and excitement including the unique 1903 amazing water spectacular finale with swimmers, aerialists, special effects and much more (including 75,000 ping pong balls).  The all new spectacular circus, a non-animal, family friendly show, will have the worlds best international circus artists, dynamic dancers and hilarious comedy from host Jack Jay with the much loved young comedian Jonny Mac.  A classic show for a classic year in the Hippodrome's history, in the evocative Edwardian atmosphere of Britains only surviving circus auditorium.   The 2014 spectacular show, presented in the Hippodrome's brand new Opera House setting, inspired by the Phantom of the Opera at the Venetian Hotel in Las Vegas.  Extreme circus stunts continue, including the wheel of death, the gravity defying human hamster wheel, Gengis Van Gool - madcap comedy genius from Las Vegas, Vladimir Georgievsky, comedy stars Jack Jay & Johnny Mac, Polish strongmen Duo Creative and springboard troupe Aliante.  An unforgettable family experience with sensibly priced seats and family deals.  The 2014 show produced by Jack and Peter Jay will evoke memories of the last 111 years of its spectacular shows. Dont miss it! For further details see www.hippodromecircus.co.uk"
excitement,http://farm4.staticflickr.com/3871/14375668451_d73a2ba71f_z.jpg,2,3,"Tech Cocktail's Miami Mixer & Startup Showcase We headed back to Miami where we debuted our ""Mixer and Startup Showcase."" It was a great night filled with excitement and curiosity as people got to meet the startups that showcased. Those showcasing were Bloggin' Mamas, Flat Out of Heels, Kloset Karma App, Munchkin Fun, PRO simity, Waleteros and Wave Interactions.   Readers Choice Award: Kloset Karma App Best Pitch: Flat Out of Heels  Congrats you two! We hope to see you at Tech Cocktail's Celebrate in the fall. Miami, we'll see you again in September. Get your tickets here: bit.ly/1lSegWS  Photographer Credit: Jaymes Gardzinski"
excitement,http://farm8.staticflickr.com/7431/15868275644_522833153c_z.jpg,0,5,"Bill Gribble Memorial Cornwall SSC Bill Gribble Memorial At Landrake Moto Parc, Cornwall SSC Bill Gribble Memorial. Landrake Moto Parc was founded in 1995 and is set in 25 acres of beautiful Cornish countryside, with the track taking approximately half of the site - the rest for paddock area and spectator parking. We also have another 10 acres for additional parking for the very large events. The track is 1900km long and is a minimum of 10 metres wide with some sections 15 metres wide and sits in a valley with trees on one side. With features such as a whoop section, raised berms, ski-ramps, step-downs and step-ups, and a laptime of over two minutes, exhilarating racing is ensured. 40 GP-standard start gates lead you to a 110 metre start straight, turning out into a wide downhill and then a chicane - followed by a very popular feature with spectators immediately in front of the pits - a table-top suitable for laying down some whips and scrubs, with a 100 foot tabletop right after! All this with superb viewing for specatators.   Whilst the track is fast and flowing, its a very technical track, with some old-school features such as adverse cambers and natural terrain, combined with some man-made jumps, along with a rythm section to add to the excitement for riders and spectators alike. So, riders need sublime skills to get a winning lap here. LMP has been used for MAXXIS British Championship rounds with top riders such as 3-times World Champion Dave Thorpe and World Grand Prix riders including  Brad Anderson, Elliott Banks Browne, Steven Clarke, Tommy Searle, Billy Mackenzie, Ken De-Dycker (Holland), Zac Osborne (USA), Josh Coppins from New Zealand, Ryan Rhino Hughes from California, USA., Carl Nunn, James Noble,  Stephen Sword, Tom Church, Mark Eastwood, Mattis Karro from Latvia- the list goes on and on. Not forgetting the many local up-and-coming riders in the South West of England who come to Landrake to make their mark - keep an eye out for Josh Gilbert and Louie Kessell to name j"
excitement,http://farm8.staticflickr.com/7580/15619786578_57ea341e2c_z.jpg,1,4,The Championship Match Explore photocat001's photos on Flickr. photocat001 has uploaded 11904 photos to Flickr.
excitement,http://farm3.staticflickr.com/2907/14659464832_a2b97116d0_z.jpg,1,4,Metallica on Stage Metallica playing @ Sonisphere in Helsinki 2014
