excitement,http://farm9.staticflickr.com/8487/8156862584_cc7835bde3_z.jpg,1,4,"Frame the Game kids learn to play hockey at the Iceplex in Pleasant Prairie, WI Shutter- 1/60 ISO- 400 Aperture- 4.8 This photo has an interesting composition.  The hole used in the scorekeepers box makes for a great frame. Coaching is one of my passions.  I am glad I was able to catch the excitement of these kids playing the greatest game on earth.  I had plenty of time to take the shot because they usually take a while to set up for the face-off (mostly because they forget where to go)."
excitement,http://farm6.staticflickr.com/5571/15104600500_1ca375dde5_z.jpg,2,3,#Reno #Nevada at the #PepperMill ... pure #excitement Explore ymturner's photos on Flickr. ymturner has uploaded 1916 photos to Flickr.
excitement,http://farm9.staticflickr.com/8325/8076086527_f744f5a264_z.jpg,2,3,Untitled excitement ensues. well done fellas.  ANIMATED!!!
excitement,http://farm9.staticflickr.com/8251/8661664560_d7485ba78a_z.jpg,1,4,"Bienvenue  ""Skydive St. Kitts""! / Welcome to ""Skydive St. Kitts""! Bienvenue  ""Skydive St. Kitts""! Imaginez voler au-dessus des rives de cristal bleu et de belles plages de sable blanc de l'le de Saint-Christophe, ajoutez  cette excitation, une chute libre 200 kilomtres par heure en moins de 45 secondes et un atterrissage sur le plancher des vaches accompagn par un parachutiste professionnel en tandem.Nous vous accueillons en haute saison estivale du mois de dcembre au mois de mars. Plus : skydivestkitts.com/ www.facebook.com/SkydiveStKitts  Welcome to Skydive St. Kitts! Imagine flying above crystal blue shorelines and beautiful white sand beaches. Then add to that excitement, freefalling 200 kilometers per hour for up to 45 seconds and then gliding back to earth beneath a parachute built for two. We are a  seasonal skydiving destination and  welcome you from December until March More at: skydivestkitts.com/ www.facebook.com/SkydiveStKitts "
excitement,http://farm9.staticflickr.com/8508/8524790470_aab9603c5b_z.jpg,2,3,The excitement and anticipation before rubbing glass in your face...   #sideshow #sideshowfreaks #hamptonroadstattooandarts #tattoo Explore buickgirl's photos on Flickr. buickgirl has uploaded 477 photos to Flickr.
excitement,http://farm9.staticflickr.com/8179/8047575165_6ea1eaef3d_z.jpg,2,3,Liquid Fashion Pool Party www.LiquidFashionColorado.com
excitement,http://farm4.staticflickr.com/3795/13547838684_17499a2145_z.jpg,1,4,"DSC_9382 The Darby Invitational Volleyball Tournament was March 28-30 at the Darby Fitness Center. Teams from Germany and Italy competed in this first ever volleyball tournament held at Darby. All of the teams played hard, but the winners in the end were the Wiesbaden Eagles for the Womens bracket and NQAS (Not Quite All Stars) in the Coed bracket. Italian teams also participated in the tournament, adding to the excitement and camaraderie of the games. The tournament was a success and I am thankful to be a part of the ongoing European Sports Community.  It's the players and the support they receive that keep the spirit alive, said Megan Tierra, Darby Military Community Sports Programmer. Photo by Amy Drummond "
excitement,http://farm4.staticflickr.com/3684/13728526465_d85f98ddd9_z.jpg,2,3,"Osprey with fish I cannot tell you the excitement I felt yesterday as I watched not one, but TWO Osprey dive right in front of me.  We were at eye level to the water and watching two dive within less than five minutes of each other was so THRILLING. My position for the lighting may not have been the best and the focus was off on some of the shots, but it was something I never thought I would see.    It has always been at a distance and watching from above that we saw dives happen in the past.  What a great day!  I don't need full frame shots, even though they are nice.What a fabulous experience!!! "
excitement,http://farm6.staticflickr.com/5587/15211491342_53eba5d38c_z.jpg,1,4,"IMG_0870 Frosh '14 was 3 days of organized chaos and excitement that gave new students the opportunity to meet new friends at Douglas College.  --------------  Douglife is your one-stop shop for recreation, leadership, volunteering, clubs, wellness and everything Campus Life at Douglas College.  www.Douglife.ca "
excitement,http://farm6.staticflickr.com/5454/9807698865_977ecc4b75_z.jpg,2,3,"Frosh '13 Frosh '13 was 3 days of organized chaos and excitement that gave new students the opportunity to meet new friends at Douglas College.  --------------  Douglife is your one-stop shop for recreation, leadership, volunteering, clubs, wellness and everything Campus Life at Douglas College.  www.Douglife.ca"
excitement,http://farm9.staticflickr.com/8519/8531854231_9a9fd7e875_z.jpg,1,4,Bull Riding best viewed in quick sequence.
excitement,http://farm6.staticflickr.com/5572/14698230261_501927f156_z.jpg,1,4, 
excitement,http://farm6.staticflickr.com/5510/11722363256_4687a8f597_z.jpg,1,4,"2014 NHL Winter Classic (from the stands) MiHockey cameras weren't just on the field, but also throughout the Big House's concourse and stands for the 2014 NHL Winter Classic between the Red Wings and Maple Leafs. Check out these photos that capture that atmosphere, excitement and bitter-cold temperatures from the big game at the Big House. (Photos by Erik Roush/MiHockey)"
excitement,http://farm9.staticflickr.com/8573/15406944583_95184b2684_z.jpg,1,4, 
excitement,http://farm9.staticflickr.com/8032/8053239133_e82966134f_z.jpg,0,5,"Conor Oberst, Jason Boesel, Macey Taylor _COO6089xr Conor Oberst, Jason Boesel, Macey Taylor @ the Fox Theater, Pomona, CA. October 3rd, 2012. Jenny Lewis opened.    Conor reunited the Mystic Valley Band for this show... Completely different set up / set list than his other recent ""solo"" shows that I shot. Haven't had a chance to go through hardly any of my photos yet but in all the excitement I figured I'd still throw a few up here now. Lots more soon...  Setlist: 1) Sausalito 2) Get Well Cards 3) Soul Singer in a Session Band 4) We Are Nowhere and Its Now 5) Method Acting 6) I Wont Ever Be Happy Again 7) Danny Callahan 8) Ahead of the Curve 9) Ten Women 10) Lua 11) Make a Plan to Love Me 12) Moab 13) Eagle on A Pole 14) I Dont Want to Die (in the Hospital) 15) Easy/Lucky/Free 16) Roosevelt Room Encore: 17) Make War 18) Milk Thistle  _____ All Images Copyright  Lindsey Best. Please do not steal or repost my images without prior consent & proper credit.  If you're interested in licensing an image or acquiring a print, please email me.     www.LindseyBest.com"
excitement,http://farm4.staticflickr.com/3821/13698623333_2b7c4222f0_z.jpg,2,3,The excitements Explore Darkroom Project's photos on Flickr. Darkroom Project has uploaded 18686 photos to Flickr.
excitement,http://farm9.staticflickr.com/8278/8698356887_e2f5c6d838_z.jpg,1,4,"University Graduation - Salta, Argentina While biking the city of Salta, I saw three cars hocking their horns and two girls cheering from the back of a car trunk. I though, ""this is random!"" and continue cycling curious of the reason for the cheering. Well, a few minutes later I spotted the girls and their family members taking photos at the Momento General Martn Miguel de Gemes. I rolled up and asked for the reason for the celebration. The reason for the excitement was an Argentinian tradition to celebrate a university graduation. I was lucky to capture the wonderful smiles and excitement!"
excitement,http://farm9.staticflickr.com/8179/7979653886_1bec846c4c_z.jpg,0,5,Vortex Vortex
excitement,http://farm8.staticflickr.com/7131/13816386635_4d0f52cec8_z.jpg,2,3, 
excitement,http://farm8.staticflickr.com/7268/7751680296_0007401e65_z.jpg,1,4,"London 2012 day 13 - Ladies football Gold medal match Wembley -  USA 2-1 Japan Ladies football Gold medal match Wembley London 2012: USA avenge World Cup defeat by Japan to win Olympic gold  USA 2-1 Japan  Lloyd 8 54; Ogimi 63 USA gained the desired revenge for losing to Japan in last year's World Cup final on penalties. There was personal redemption, too, for Carli Lloyd, who answered her missed kick in that 3-1 shootout loss by scoring a goal in each half to seal the Olympic crown for her nation.  Japan were dubbed the Barcelona of the women's game for their flurry of neat passing and slick movement and their average height of 5ft 4in compared to the US's 5ft 7in. The Americans were the big tournament specialists. This was the fifth women's Olympic final and USA were continuing their record of being in all of them, losing only to Norway at Sydney 2000, 3-2.  For Japan, their coach Norio Sasaki framed the attempted conquest of gold as part of the country's healing process, following the trauma of last year's earthquake which killed nearly 20,000 people.  Ahead of this final he said: ""All the Japanese people are still trying to come back from the earthquake disaster.  ""Winning the World Cup was very emotional last year and gave energy to the nation after what had happened and the same can happen again.""  After eight minutes a noisy, though not completely filled Wembley, witnessed the opening strike. Tobin Heath galloped into space down the left before Alex Morgan's twist and cross was met by Carli Lloyd, just ahead of the 143-goal Abby Wambach.  Far from being unsettled, Japan went in search of an instant reply. A shot from Nahomi Kawasumi was blocked by the USA captain, Christie Rampone, with Hope Solo, the keeper, stranded. Yuki Ogimi followed up but could not convert.  Ogimi went closer moments later. A hanging jump was followed by the forward's header being superbly palmed onto the bar b y Solo.  The goal-frame proved an extra defender for both sides. Amy LePeilbet's cross was met with a glancing header by Rampone that hit Yuki Fukomoto's right post. At the opposite end, Aya Miyama's pile-driver smashed back off the bar.  Ogimi was instrumental in every Japan attack. Her lay-off nine minutes from half-time was hit with a menacing curl by Shinobu Ohno but the ball was marginally wide of the post.  The open, entertaining nature of this contest continued after the break. Japan spread the ball across midfield only for their attacks to founder due to a belief deficit. When given sight of goal  as Miyama, the captain, on 52 minutes  the opportunity was snatched at.  When America flooded forward there was menace. After Megan Rapinoe laid the ball into Lloyd, she surged from near half-way then unloaded a 20-yard humdinger that gave the 5ft 4in keeper Fukumoto no chance, and that was 2-0 to Pia Sunhage's team.  In the 63nd minute Japan's Ogimi raised the excitement scale to fevered after her strike, though this proved a consolation as the neat triangles that were ending in cul-de-sacs continued to frustrate the Japanese.  The world champions still had their chances but when Miyama had two free-kicks to deliver in quick succession, her side failed to profit."
excitement,http://farm4.staticflickr.com/3727/14116048157_f6b938a024_z.jpg,1,4,"WHY IS THERE NO RAINBOW DURING STORMY WEATHER? 9 Family Life, places and memories of childhood are golden nuggets that nestle deep in a person's mind in his lifetime; a lasting selfless dedication to fulfill his aspirations for the family and grandchildren in the coming years.  Man may travel far and wide or establishes a second Home beyond the borders of his native land; Yet at the twilight years of life, he will  travel back on the long road to the old Home  where he spent the first 7  years of his childhood from the time he was born.  - wilfredosrb   Photo-Travel: kylesijo/nikkiKaamiolenseyes/CdeO/Butuan  Updated and edited June 30, 2015 - wilfredosrb. "
excitement,http://farm8.staticflickr.com/7233/7308852882_7f4384de1d_z.jpg,1,4,"Torch Upper Studley 002 May 22, 2012: excitement grows: locals strain for a first glimpse"
excitement,http://farm4.staticflickr.com/3681/9807744213_0e1d287583_z.jpg,0,5,"Frosh '13 Frosh '13 was 3 days of organized chaos and excitement that gave new students the opportunity to meet new friends at Douglas College.  --------------  Douglife is your one-stop shop for recreation, leadership, volunteering, clubs, wellness and everything Campus Life at Douglas College.  www.Douglife.ca"
excitement,http://farm8.staticflickr.com/7144/6830046343_32edff5a62_z.jpg,0,5,"For Macca and SJ, the excitement of the Cambridge #gyroadshow is almost too much... #ttot #gapyear Explore andrewtipp's photos on Flickr. andrewtipp has uploaded 442 photos to Flickr."
excitement,http://farm8.staticflickr.com/7065/13698608875_16b89a8b11_z.jpg,2,3,The excitements Explore Darkroom Project's photos on Flickr. Darkroom Project has uploaded 18686 photos to Flickr.
excitement,http://farm8.staticflickr.com/7124/7024893781_44fa8ec2ea_z.jpg,0,5,021 20050828510 Cowes P1 a Explore Clive_Richardson's photos on Flickr. Clive_Richardson has uploaded 8356 photos to Flickr.
excitement,http://farm3.staticflickr.com/2833/12417960053_45643b2195_z.jpg,0,5,Fireworks Over Albuquerque This fireworks display was part of the Albuquerque Balloon Fiesta.
excitement,http://farm9.staticflickr.com/8029/7979656388_c9b16613e4_z.jpg,0,5,Vortex Vortex
excitement,http://farm4.staticflickr.com/3770/9235830166_951a38e0eb_z.jpg,2,3,Excitement Explore KaraleeScouten's photos on Flickr. KaraleeScouten has uploaded 1238 photos to Flickr.
excitement,http://farm9.staticflickr.com/8215/8321335507_5f41420968_z.jpg,1,4,"Icing on the Cake: Quijos Run - 035 The final day of paddling is always bittersweet: it is another great section of river, but it is the final day of paddling.  We added some excitement with high water and our first-ever raft trip on the Quijos! "
excitement,http://farm9.staticflickr.com/8209/8230186638_f9c3b739d4_z.jpg,2,3,"2nd Annual Mardi Gras 2012 Now we are very excited to bring you the 2nd installment of Denver Mardi Gras in a new location with more entertainment, interaction and excitement! As they say it will be Bigger and Better this year!  $20,000 in Free video games $4,000 in Free Beads $5 Drinks 2,000 people celebrating  Only $25 - GET TICKETS NOW VIP $59 -  This event will sell out! Buy Online!  www.DenverMardiGras.com  Denver, Colorado Mardi Gras 2012  Date: February 18, 2012 Location: Dave and Busters (Colorado & I25) Time: 9:00 - 2:00 am  You Receive:  VIP Offerings Includes Cajun food buffet, VIP exclusive cash bar, beads, free game card and entertainment  Complete venue take over 2,500 people $5 Well drinks Free Video Games Free Mardi Gras Beads, beads and more beads. Multiple DJs and Bands, Multiple rooms and environments including 2 dance floors   Pool, Ping Pong, Air Hockey VIP includes Cajun buffet (includes blackened chicken Cajun pasta, cornbread, and much more!) Stilt walkers, jugglers, tarot card readers, face painters, mask makers, dancers Music : Hip Hop, Top 40, Dance, Techno, and Dubstep P-Nuckle live band DJ Skeet Dub Twins debut Sammy T Hypnautic and King Tef - creators of the original Mardi Gras song Megan Page - live vocals National Performers Alliance - performers and dancers and more"
excitement,http://farm4.staticflickr.com/3915/14805828399_e5cd83444f_z.jpg,0,5,"13 Aug 2014 Hippodrome Circus 111th Year Great Yarmouth (134) 2014 is the 111th anniversary of the opening of the historic Hippodrome Circus in Great Yarmouth which marks the special celebration summer season with a classic show set in East Anglias mini Albert Hall, full of fun, thrills and excitement including the unique 1903 amazing water spectacular finale with swimmers, aerialists, special effects and much more (including 75,000 ping pong balls).  The all new spectacular circus, a non-animal, family friendly show, will have the worlds best international circus artists, dynamic dancers and hilarious comedy from host Jack Jay with the much loved young comedian Jonny Mac.  A classic show for a classic year in the Hippodrome's history, in the evocative Edwardian atmosphere of Britains only surviving circus auditorium.   The 2014 spectacular show, presented in the Hippodrome's brand new Opera House setting, inspired by the Phantom of the Opera at the Venetian Hotel in Las Vegas.  Extreme circus stunts continue, including the wheel of death, the gravity defying human hamster wheel, Gengis Van Gool - madcap comedy genius from Las Vegas, Vladimir Georgievsky, comedy stars Jack Jay & Johnny Mac, Polish strongmen Duo Creative and springboard troupe Aliante.  An unforgettable family experience with sensibly priced seats and family deals.  The 2014 show produced by Jack and Peter Jay will evoke memories of the last 111 years of its spectacular shows. Dont miss it! For further details see www.hippodromecircus.co.uk"
excitement,http://farm8.staticflickr.com/7122/7533266320_f3909d28c8_z.jpg,2,3,EXPERIENCE A ONE OF A KIND BADMINTON FACILITY EXPERIENCE A ONE OF A KIND BADMINTON FACILITY  www.Badminton-Vancouver.com
excitement,http://farm4.staticflickr.com/3268/13055791144_8fc127d474_z.jpg,0,5, 
excitement,http://farm4.staticflickr.com/3819/10905872016_7c9bd48260_z.jpg,1,4, 
excitement,http://farm4.staticflickr.com/3853/14668443479_92586a817c_z.jpg,2,3,"Today is a new day a day of excitement and adventure to accomplish things I have dared to try. Today is a day that I can wipe the slate clean and start all over forgot about the troubles of yesterday, and welcome the happiness of today. The sun is shini by classofluxury ift.tt/1sC7abu"
excitement,http://farm8.staticflickr.com/7367/11722389016_ebf3856e46_z.jpg,1,4,"2014 NHL Winter Classic (from the stands) MiHockey cameras weren't just on the field, but also throughout the Big House's concourse and stands for the 2014 NHL Winter Classic between the Red Wings and Maple Leafs. Check out these photos that capture that atmosphere, excitement and bitter-cold temperatures from the big game at the Big House. (Photos by Erik Roush/MiHockey)"
excitement,http://farm8.staticflickr.com/7395/10922726393_308eefffdf_z.jpg,2,3,Regional Minister Nii Afotey Agbo joins the community in an agbadza dance to showcase their excitement Explore John Dramani Mahama's photos on Flickr. John Dramani Mahama has uploaded 37012 photos to Flickr.
excitement,http://farm6.staticflickr.com/5471/9398859094_19c2b6f06c_z.jpg,2,3,Capture The Flag!! YMCA Camp Pinewood's Summer Session 4A held our regular Monday night Capture The Flag game!!!  The excitement was great!!!  
excitement,http://farm3.staticflickr.com/2864/9464015883_15d70f1f2c_z.jpg,2,3,TaeKwonDO - Afternoon August 7th Pictures showing all of the excitement and action of the competitors from the afternoon session of the TaeKwonDo competition.
excitement,http://farm3.staticflickr.com/2932/14569952576_9f008f34c4_z.jpg,0,5,"Unique_Portal 4th of July Evening at City Park in Ft. Collins, Colorado.  I realized after the show my aperature was much too wide...  I got caught up in the excitement, and ended up with some excellent water smears of color in the waters reflection.  I just wish I hadn't over exposed the display in the sky...  A fantastic display."
excitement,http://farm9.staticflickr.com/8326/8121524528_49dec9dbc1_z.jpg,2,3,"portrait of a smiling girl showing her christmas present portrait of a smiling girl showing her christmas present - Portrait of a smiling girl showing her christmas present against white background, Model: Shania Chapman - Agent is Breann at MMG. breann@nymmg.com. To Download this image without watermarks for Free, visit: www.sourcepics.com/free-stock-photography/24728753-portra..."
excitement,http://farm9.staticflickr.com/8347/8201241282_064a6c9e11_z.jpg,2,3,"Lafayette Lehigh Game Day - 2012 Thousands of Lafayette students, alumni, and friends came out to support Leopard football during the 148th game in college football's most-played rivalry Nov. 17 at Fisher Stadium. Although Lehigh beat Lafayette 38-21, the day and preceding week were full of excitement on campus. The rivalry dates back to 1884, when Lafayette shut out Lehigh 50-0 in Easton. The Leopards lead the series 76-67-5.  November 17, 2012 Chuck Zovko / Zovko Photographic llc "
excitement,http://farm4.staticflickr.com/3906/14549506112_9f5c0cc14f_z.jpg,1,4, 
excitement,http://farm8.staticflickr.com/7257/7445952284_a99b344e08_z.jpg,1,4,"The Competition The competition showcases the worlds best free ride mountain bike riders competing before a crowd of over sixty thousand spectators. Jumpship brings unparalleled action, excitement and entertainment to a new level. Riders will battle for cash and personal pride on the surface of a floating barge in Canadas most beautiful city.  "
excitement,http://farm8.staticflickr.com/7115/7551099720_29c9a0db41_z.jpg,2,3,Liquid Fashion Pool Events
excitement,http://farm3.staticflickr.com/2898/14489136779_08fe0531db_z.jpg,2,3,"Detroit Speed Goodguys Nationals Columbus Recap and Photos 2014 goo.gl/IywoDy. 2014. Every year the anticipation of the Goodguys Columbus Nationals seems to grow a little bit. This year was no different. The crew at Detroit Speed was overly excited to get to Columbus and when they did, as always, it didn't disappoint. With the autocross sponsor shootout, Detroit Speed's latest creation, Angelo Vespi's 1969 Camaro unveiling, as well as a full weekend of autocross action, there was no shortage of excitement at the Columbus expo center during the long weekend. "
excitement,http://farm4.staticflickr.com/3826/9410499873_0ab7359c56_z.jpg,2,3,Wildfire vs. AMAX CEO Players from Wildfire and AMAX CEO putting up a great game and excitement for the crowd. Feel free to share and tag the photos!  Visit www.amaxballapalooza.com to learn more about our event
excitement,http://farm9.staticflickr.com/8317/7964003436_2d7034af60_z.jpg,0,5,Underwater Jet Ski Champion Explore Grand-Poobar's photos on Flickr. Grand-Poobar has uploaded 2316 photos to Flickr.
excitement,http://farm9.staticflickr.com/8259/8663581030_e957ec17c4_z.jpg,2,3,Flamingo Land Resort Flamingo Land Resort
excitement,http://farm3.staticflickr.com/2907/14101826657_77e880b6ed_z.jpg,1,4,"CAPTURE THE FLEETING MOMENTS- Who Says Shooting The River Rapids Is Life Itself ! 8 Family Life, places and memories of childhood are golden nuggets that nestle deep in a person's mind in his lifetime; a lasting selfless dedication to fulfill his aspirations for the family and grandchildren in the coming years.  Man may travel far and wide or establishes a second Home beyond the borders of his native land; Yet at the twilight years of life, he will  travel back on the long road to the old Home  where he spent the first 7  years of his childhood from the time he was born.  - wilfredosrb   Photo-Travel: kylesijo/nikkiKaamiolenseyes/CdeO/Butuan  Updated and edited June 30, 2015 - wilfredosrb. "
excitement,http://farm8.staticflickr.com/7349/13454984415_a9a52dd75d_z.jpg,2,3,"Detroit Speed #DriveUSCA Ft. Worth Ryan Mathews and the Goodguys Sponsored DSE ""White Monster"" Camaro Named Fastest Fifth Gen at the USCA Fort Worth Event The second event of the 10 event Ultimate Street Car Association schedule was held March 21st - March 23rd at Texas Motor Speedway in Fort Worth and did not disappoint. From the huge 80 mile Detroit Speed Road Rally to the autocross and road racing it was a full weekend of excitement.  The Detroit Speed Road Rally actually kicked off inside Texas Motor Speedway with 3 laps around the track followed by an 80 mile cruise out and around the Fort Worth area before returning to the track to prepare for the Saturday and Sunday events. goo.gl/sPPSVA "
excitement,http://farm3.staticflickr.com/2805/9464018973_1909da4cbe_z.jpg,0,5,TaeKwonDO - Afternoon August 7th Pictures showing all of the excitement and action of the competitors from the afternoon session of the TaeKwonDo competition.
excitement,http://farm9.staticflickr.com/8187/8119484269_b736d6bcde_z.jpg,1,4,"13th Annual Victorian Erotica Ball 2012 13th Annual Victorian Erotica Ball 13 Shades of Grey Colorados Erotic Costume Mandatory Block Party  The Victorian Erotica Ball is an exploration of eroticism allowing people from all walks of life to explore healthy sensuality  a tasteful fetish party with a maze of unique environments, various proclivities and phenomenal performances. The event is designed to tantalize the mind and senses creating euphoric abandonment.   Celebrate the 13th Annual Ball, 13 Shades of Grey style. Fantasies of the book become reality for one evening.   www.KevinLarsonPresents.com  www.Kevin L"
excitement,http://farm6.staticflickr.com/5588/14962780217_3edfcd8e9b_z.jpg,2,3,Welcome Week & Semester Kickoff 2014 The campus was filled with energy and excitement for Welcome Week and Semester Kickoff. The first three days of school were a blast. Follow #WelcomeToLangara on social media for more snippets of the action on campus.
excitement,http://farm8.staticflickr.com/7353/11721983073_b1aa499c8b_z.jpg,1,4,"2014 NHL Winter Classic (from the stands) MiHockey cameras weren't just on the field, but also throughout the Big House's concourse and stands for the 2014 NHL Winter Classic between the Red Wings and Maple Leafs. Check out these photos that capture that atmosphere, excitement and bitter-cold temperatures from the big game at the Big House. (Photos by Erik Roush/MiHockey)"
excitement,http://farm4.staticflickr.com/3885/14491530864_74c868dd71_z.jpg,0,5,"Watching the World Cup at Civic Center, San Francisco: USA vs. Portugal (June 22, 2014) IMG_7733b"
