excitement,http://farm8.staticflickr.com/7352/12717535023_acbb97b9e3_z.jpg,1,4,"Vegetarian Festival - Phuket The Vegetarian Festival is celebrated in the month of October all over Thailand, but mostly in Phuket.  The festival is also known as the Tesagan Gin Je or the Nine Emperor Gods Festival.  This festival is filled with tradition and excitement.  Most of the people taking part in the festival are of Chinese heritage, 30% of the population in Thailand.  The festival started in 1825 when a Chinese circus act came to town and a sickness broke out amongst the artists.  They healed themselves by following a strict vegetarian diet.  These days the festival is a VERY exciting event full of surprises and amazing photo opportunities.  If you havent experienced something like this before, brace yourself. "
excitement,http://farm3.staticflickr.com/2809/11132748824_aa596099f6_z.jpg,1,4,20131123---BIME--THESE-NEW-PURITANS---02 THESE NEW PURITANS BIME - Bilbao 23/11/2013  www.rockinfocus.com  Queda prohibida la utilizacin de todas las imgenes sin el consentimiento expreso del autor.
excitement,http://farm6.staticflickr.com/5576/15154790576_668d75b91b_z.jpg,0,5,"Bill Gribble Memorial Cornwall SSC Bill Gribble Memorial At Landrake Moto Parc, Cornwall SSC Bill Gribble Memorial. Landrake Moto Parc was founded in 1995 and is set in 25 acres of beautiful Cornish countryside, with the track taking approximately half of the site - the rest for paddock area and spectator parking. We also have another 10 acres for additional parking for the very large events. The track is 1900km long and is a minimum of 10 metres wide with some sections 15 metres wide and sits in a valley with trees on one side. With features such as a whoop section, raised berms, ski-ramps, step-downs and step-ups, and a laptime of over two minutes, exhilarating racing is ensured. 40 GP-standard start gates lead you to a 110 metre start straight, turning out into a wide downhill and then a chicane - followed by a very popular feature with spectators immediately in front of the pits - a table-top suitable for laying down some whips and scrubs, with a 100 foot tabletop right after! All this with superb viewing for specatators.   Whilst the track is fast and flowing, its a very technical track, with some old-school features such as adverse cambers and natural terrain, combined with some man-made jumps, along with a rythm section to add to the excitement for riders and spectators alike. So, riders need sublime skills to get a winning lap here. LMP has been used for MAXXIS British Championship rounds with top riders such as 3-times World Champion Dave Thorpe and World Grand Prix riders including  Brad Anderson, Elliott Banks Browne, Steven Clarke, Tommy Searle, Billy Mackenzie, Ken De-Dycker (Holland), Zac Osborne (USA), Josh Coppins from New Zealand, Ryan Rhino Hughes from California, USA., Carl Nunn, James Noble,  Stephen Sword, Tom Church, Mark Eastwood, Mattis Karro from Latvia- the list goes on and on. Not forgetting the many local up-and-coming riders in the South West of England who come to Landrake to make their mark - keep an eye out for Josh Gilbert and Louie Kessell to name j"
excitement,http://farm4.staticflickr.com/3734/10463761713_01bb279282_z.jpg,0,5,20130914_TCFFopenHouse __A9V8025 Explore aaronbelford's photos on Flickr. aaronbelford has uploaded 255 photos to Flickr.
excitement,http://farm3.staticflickr.com/2903/14489340387_2a53e4fcc7_z.jpg,1,4,"Detroit Speed Goodguys Nationals Columbus Recap and Photos 2014 goo.gl/IywoDy. 2014. Every year the anticipation of the Goodguys Columbus Nationals seems to grow a little bit. This year was no different. The crew at Detroit Speed was overly excited to get to Columbus and when they did, as always, it didn't disappoint. With the autocross sponsor shootout, Detroit Speed's latest creation, Angelo Vespi's 1969 Camaro unveiling, as well as a full weekend of autocross action, there was no shortage of excitement at the Columbus expo center during the long weekend. "
excitement,http://farm4.staticflickr.com/3914/14673499627_a9a1215351_z.jpg,1,4,Camera Roll-1214 Explore #KPbIM's photos on Flickr. #KPbIM has uploaded 7734 photos to Flickr.
excitement,http://farm8.staticflickr.com/7076/7013294479_d8def68130_z.jpg,0,5,18 200505081042 a Explore Clive_Richardson's photos on Flickr. Clive_Richardson has uploaded 8356 photos to Flickr.
excitement,http://farm9.staticflickr.com/8525/8679823213_50e00c684b_z.jpg,2,3,Blackpool Pleasure Beach Blackpool Pleasure Beach
excitement,http://farm8.staticflickr.com/7052/6979755111_3fe3eb99cf_z.jpg,0,5, 
excitement,http://farm4.staticflickr.com/3678/13055602253_b5026f7012_z.jpg,1,4,2014 QRA MARGATE BEACHCROSS WEEKEND Explore wayne's pix1's photos on Flickr. wayne's pix1 has uploaded 700 photos to Flickr.
excitement,http://farm4.staticflickr.com/3865/15152600946_e84c8875d5_z.jpg,2,3,MaSA Kick-Off Meeting and Merdeka 2014 Our first meeting for Fall 2014. We met new friends and had so much fun! Hoping for the same excitement for the upcoming events!
excitement,http://farm4.staticflickr.com/3680/10785984913_e95b00985a_z.jpg,1,4,THE EXCITEMENTS @ Caf de la Danse - Paris 5 novembre 2013
excitement,http://farm8.staticflickr.com/7343/8716615290_8879c2d6f8_z.jpg,2,3,#been #mad #happy all #day for some #strange #reason #ohwell #well #needed #happiness #fun #excitement #live #love #life Explore lilbubs2004's photos on Flickr. lilbubs2004 has uploaded 346 photos to Flickr.
excitement,http://farm6.staticflickr.com/5601/15337189077_636409d409_z.jpg,0,5,excitement Explore simonpjohnson's photos on Flickr. simonpjohnson has uploaded 217 photos to Flickr.
excitement,http://farm9.staticflickr.com/8193/8384787433_4eb6695f26_z.jpg,2,3,NYE 2012! All the fun and excitement at Ri Ra Irish Pub in Evansville Indiana!
excitement,http://farm9.staticflickr.com/8032/7971524288_2bdd3cf593_z.jpg,1,4, 
excitement,http://farm9.staticflickr.com/8457/7929804914_994f8222ef_z.jpg,1,4,Dragons Fury Dragons Fury
excitement,http://farm8.staticflickr.com/7466/15974403577_e33e1379c2_z.jpg,1,4,Barbie Excitement Explore Read!2012's photos on Flickr. Read!2012 has uploaded 3816 photos to Flickr.
excitement,http://farm8.staticflickr.com/7127/7024871835_58f9e0d22b_z.jpg,1,4,00 20050828103 Cowes P1 a Explore Clive_Richardson's photos on Flickr. Clive_Richardson has uploaded 8356 photos to Flickr.
excitement,http://farm8.staticflickr.com/7545/15886085845_ea217c021e_z.jpg,2,3,It's going down tonight! Come have some fun with us at the LA Coliseum. The excitement begins at 6:30 PM. Explore diazadj's photos on Flickr. diazadj has uploaded 346 photos to Flickr.
excitement,http://farm9.staticflickr.com/8376/8581154426_3605c821b8_z.jpg,1,4,"IMG_8970 Acoustica is a musical collective consisting of 5 talented and experienced musicians, drawn together to reinterpret some of the most popular songs into a delicious musical dish to appeal to all age groups alike. Individually coming from different musical backgrounds, Acoustica is a mixing pot of a wide range of influences drawing from ideas of all music to create the perfect balance of atmosphere and excitement. Acousticas repertoire includes popular songs that have been stripped down to their basic form delivering a sweet nostalgic experience in an easily listenable form."
excitement,http://farm4.staticflickr.com/3765/9807697435_8c9d9ea64c_z.jpg,2,3,"Frosh '13 Frosh '13 was 3 days of organized chaos and excitement that gave new students the opportunity to meet new friends at Douglas College.  --------------  Douglife is your one-stop shop for recreation, leadership, volunteering, clubs, wellness and everything Campus Life at Douglas College.  www.Douglife.ca"
excitement,http://farm4.staticflickr.com/3764/12865388463_ec58e9f7be_z.jpg,2,3,"Kate Mara - Netflix's ""House of Cards"" - @_KateMara DSC_0969 www.redcarpetreporttv.com  Mingle Media TV and Red Carpet Report host Brogyn Gage were invited to cover QVCs Red Carpet Style party at the Four Seasons Hotel in Beverly Hills. This event was hosted by Lisa Robertson and celebrated red carpet fashion and celebrity styles and stylists.   During the LIVE streamed QVC Red Carpet Style party guests were Tweeting, Instagraming and Facebooking their pics as well as online fans watching and interacting via the social wall on QVCRedCarpet.com. This party was truly a one-of-a-kind, interactive event bringing Oscar excitement and fashion to all the QVC fashionistas out there. Check out the posts here qvcredcarpet.com.  Get the Story from the Red Carpet Report Team, follow us on Twitter and Facebook at: http://twitter.com/TheRedCarpetTV https://www.facebook.com/RedCarpetReportTV http://www.redcarpetreporttv.com http://www.youtube.com/MingleMediaTVNetwork  About QVC Red Carpet Style and LA Party QVC celebrated Hollywoods biggest week of the year with the hottest party live from the Four Seasons Hotel Los Angeles at Beverly Hills hosted Lisa Robertson and celebrating red carpet fashions and celebrity styles with icons including Joan Rivers, Bob Mackie, Isaac Mizrahi, and Nicole Richie, plus up-and-comers including the winning designer of this years Project Runway All Stars, SethAaron, and celebrated stylists like Lori Goldstein, Jen Rade, and Joe Zee. Online, fans could get the scoop on the latest fashion trends and celebrity styles from the biggest names in fashion, beauty, accessories, jewelry, and more while checking out the fashions and accessories to make a stunning ensemble for their own red carpet moment with styles inspired by this year's Red Carpet Style event on QVC. For more info please visit QVCs Red Carpet Style page found here: www.qvc.com/RedCarpetStyle.content.html  For more of Mingle Media TVs Red Carpet Report coverage, please visit our website and follow us on Twitter and Facebook here: https://www.minglemediatv.com https://www.facebook.com/minglemediatvnetwork http://www.flickr.com/MingleMediaTVNetwork https://www.twitter.com/minglemediatv  Follow our host Brogyn Gage on Twitter at twitter.com/BrogynMarie"
excitement,http://farm8.staticflickr.com/7391/9162754958_98cd6af495_z.jpg,2,3,Building excitement... Filming of CharacterSelectShow first official video
excitement,http://farm4.staticflickr.com/3805/11770361344_241334390f_z.jpg,1,4,"_DSC9393 Happy New Year 2014!!  I spent NYE on Granville St in Vancouver BC with two other fantastic photographers capturing the fun of the evening. We lined up side-by-side, many people thought we were with a newspaper or that we knew something really amazing was just about to take place and they asked what it was and wanted to watch too. I chose for us to stand behind street barricades on Granville St as a means to help control foot traffic from knocking us or our cameras over. I had one really close call....when the group of guys decided to pick one of the barricades up and toss it around. I moved pretty darn quick out of the way! That was a good decision!    Later on in the evening, after the NYE countdown, we placed ourselves, still on Granville St, between The Roxy & The Caprice bars so lots of people hanging about there.  It amazes me how fast you move around! I had my camera on super high ISO and on a tripod so a lot of the photos have some blur....or a lot lol. I left the majority of the photos, clear or not as some people will be able to see themselves through the blur.   Some of the photos might seem a bit strange with the movement/blur but I find them artistic and you can find some interesting pictures within a photo when you let yourself just look without expectations. You may also notice the odd clear face/s that paused in all the movement & excitement. All in all, everyone was having a fantastic time!!  If you see yourself in any of the pictures on my Facebook page, please tag yourself and then share the photos to your friends & family. If you like my page then you will get notified for when I post the rest of the pictures which are coming soon! www.facebook.com/AnnaHallPhotographer  Thank YOU for posing for me and bringing such great energy to NYE!!"
excitement,http://farm8.staticflickr.com/7440/10024663514_74b4e5ce6a_z.jpg,2,3,"Darcy Rose Byrnes - DSC_0048 www.redcarpetreporttv.com  Mingle Media TV's Red Carpet Report and host, Brandi Chang, were invited to come out to the Disney Junior Live On Tour Pirate & Princess Adventure Red Carpet at the Paley Center at the DOLBY THEATRE at Holllywood & Highland. This never-before-seen live show features our favorite characters from Disney Junior series Sofia the First and Jake and the Never Land Pirates.  Get the Story from the Red Carpet Report Team - follow us on Twitter and Facebook at: twitter.com/TheRedCarpetTV www.facebook.com/RedCarpetReportTV www.redcarpetreporttv.com www.youtube.com/MingleMediaTVNetwork About Disney Junior Live The Disney Junior Live On Tour! Pirate & Princess Adventure is a never-before-seen live show featuring your favorite characters from Disney Junior's hit series, Sofia the First and Jake and the Never Land Pirates. Get swept up in the excitement as Sofia and her family prepare for a royal celebration that helps us all learn the true meaning of being a princess with a special appearance from Cinderella. Then it's off to Never Land where Jake and his swashbuckling friends Izzy and Cubby, with a little help from Peter Pan, battle Captain Hook to unlock treasure hidden inside a mysterious volcano. It's danger and dueling on the high seas as Jake discovers what it takes to be a true hero. Filled with new music, amazing effects, thrilling action and endless surprises, your whole family will sing, shout, and soar into the action when Disney Junior Live On Tour! Pirate & Princess Adventure sails into your hometown.   Special bonus! Starting ten minutes before every performance join loveable Doc McStuffins for a special pre-show! You can help Doc take care of one of her beloved toys with her own special brand of love and magic. Free to all ticket holders. For more info please visit www.disneyjuniorlive.com  For more of Mingle Media TVs Red Carpet Report coverage, please visit our website and follow us on Twitter and Facebook here: www.minglemediatv.com www.facebook.com/minglemediatvnetwork www.flickr.com/MingleMediaTVNetwork www.twitter.com/minglemediatv Follow our host, Brandi Chang at twitter.com/BrandiChang    "
excitement,http://farm9.staticflickr.com/8425/7834769152_24edd4b2d0_z.jpg,0,5,"Falling Texas Roller Derby Lonestar Rollergirls bout between the Holy Rollers (white) and Rhinestone Cowgirls(red) on Aug 4, 2012, in Austin, Texas.  The Rhinestone Cowgirls won this one.  This is the group that started the modern resurgence in Roller Derby in 2002. They skate on a banked track for a faster game and more excitement. More info at their web site: www.txrd.com"
excitement,http://farm4.staticflickr.com/3932/15257210267_e73c5b8a7e_z.jpg,2,3,DSC_7331 Kaiser - SCPMG
excitement,http://farm9.staticflickr.com/8459/7930951022_43ac6d5445_z.jpg,0,5,Tiger Rock Tiger Rock
excitement,http://farm6.staticflickr.com/5595/15010500362_8a8266917c_z.jpg,1,4,"Bristol-Bath HOLI ONE Colour Festival The festival will be pitched as a celebration of life with rich vibrant energy and color. Whilst cues will be taken from its Hindi name sake, the festival has many purposes so HOLI ONE Germany can proudly introduce and broadcast the great tradition of Holi India based on a non-religious aspects.   The key concept for participates is to take part in powerful countdowns and throw coloured powder in the air or at each other in a vibrant atmosphere filled with love, excitement, fun and joy. Accompanied by a huge line-up of the best DJs, everyone is looking forward to celebrate an unforgettable Festival! WE ARE ALL ONE"
excitement,http://farm9.staticflickr.com/8544/8686450384_31b23ed8c5_z.jpg,2,3, 
excitement,http://farm9.staticflickr.com/8217/8274019308_025c3ca7af_z.jpg,2,3,Tonight Grateful for Kelly. Grateful for the power of thought. Grateful to not care. Grateful to breathe in and feel light. Grateful to breathe out and shine.  Wouldn't it be nice to have the best night ever? Wouldn't it be nice to laugh and play and have everything work out? Wouldn't it be nice to be wild and silly and fun and full of inspiration?  Wouldn't it be nice to let go and stop caring?  I pray for a wonderful night. I pray for ease and flow. I pray for the ability to express love. I pray to be kind and compassionate. I pray for joy and excitement.  I love it when everything works out. I love it when life is easy. I love being in control of my vibration. I love not caring. I love being practiced. I love celebrating. I love when I pay attention. I love when I let it come to me. I love when I feel energized and invigorated. I love it when I get to spend time with my kitties. I love it when I go with the flow. I love it when I attract solutions. I love it when I remember my mood is my work!
excitement,http://farm9.staticflickr.com/8681/15799196307_f4f6bcc938_z.jpg,2,3,"(December 6, 2014) Bikes for Kids It took hours of prep work from dozens of volunteers, unloading and assembling bikes.  But when 200+ kids streamed through the doors at the Webster University gymnasium Saturday morning and saw their new bikes waiting for them, it made all the effort worthwhile!   Bikes for Kids is always a magical extravaganza of excitement for all the kids that get to take home new bikes. This is what the magic looked like.  Thank you to all our volunteer crews, partner agencies, sponsors, St. Louis Rams cheerleaders, Rampage and our terrific hosts at Webster!"
excitement,http://farm8.staticflickr.com/7125/7876125676_d8bc10e8a8_z.jpg,1,4,Inaugural_Soccer_MensAction_JB_211 Explore GeorgiaGwinnettCollege's photos on Flickr. GeorgiaGwinnettCollege has uploaded 27238 photos to Flickr.
excitement,http://farm9.staticflickr.com/8441/7972344770_8a9b8e0156_z.jpg,0,5,Nemesis Inferno Nemesis Inferno
excitement,http://farm4.staticflickr.com/3775/12269758883_8688aecc92_z.jpg,2,3,The Excitements Explore Confort Moderne's photos on Flickr. Confort Moderne has uploaded 1610 photos to Flickr.
excitement,http://farm6.staticflickr.com/5560/14806156729_0a22ea9bce_z.jpg,0,5,"13 Aug 2014 Hippodrome Circus 111th Year Great Yarmouth (248) 2014 is the 111th anniversary of the opening of the historic Hippodrome Circus in Great Yarmouth which marks the special celebration summer season with a classic show set in East Anglias mini Albert Hall, full of fun, thrills and excitement including the unique 1903 amazing water spectacular finale with swimmers, aerialists, special effects and much more (including 75,000 ping pong balls).  The all new spectacular circus, a non-animal, family friendly show, will have the worlds best international circus artists, dynamic dancers and hilarious comedy from host Jack Jay with the much loved young comedian Jonny Mac.  A classic show for a classic year in the Hippodrome's history, in the evocative Edwardian atmosphere of Britains only surviving circus auditorium.   The 2014 spectacular show, presented in the Hippodrome's brand new Opera House setting, inspired by the Phantom of the Opera at the Venetian Hotel in Las Vegas.  Extreme circus stunts continue, including the wheel of death, the gravity defying human hamster wheel, Gengis Van Gool - madcap comedy genius from Las Vegas, Vladimir Georgievsky, comedy stars Jack Jay & Johnny Mac, Polish strongmen Duo Creative and springboard troupe Aliante.  An unforgettable family experience with sensibly priced seats and family deals.  The 2014 show produced by Jack and Peter Jay will evoke memories of the last 111 years of its spectacular shows. Dont miss it! For further details see www.hippodromecircus.co.uk"
excitement,http://farm4.staticflickr.com/3800/11608162153_aa7d102d06_z.jpg,2,3,"Euphoria . This photograph is more about a story than merely a concept . This here is a photograph of my little cousin Naba , who came to Bangladesh with my aunt few weeks back to pay us a visit . They are currently residing in Italy . So they stayed at our place for two weeks , and these two weeks were amazing and her presence made it even better . During these two weeks of their stay , there was not a single day when I saw her sad . She had been ecstatic all the time , played madly with the other cousins who came over . So one morning , she came to my room and was staring at my walls very keenly . That night she asked me , where do I keep the wings and asked me if I could fly . I replied with a smile "" Everyone has their wings , and every one can fly in their dreams "" . The walls she was staring at consisted of some of my artworks and one of them was of my twin sister with the angelic wings . The day before they left , she came to me and asked "" Can I ask for something ? ""  . I said ""yes dear anything you want"" , then she said with great excitement "" I also want those wings , I also want to fly "" . I said ""Sure you can have them , but remember you can only see yourself flying while you're asleep"" and then she said "" Nessun problema, sto bene con quello! "" , I asked her what that means and she said "" It means , no problem I'm fine with that "" . That very night , I also took some photographs of her .  She seemed euphoric like she always does and last night I showed her the picture , she was extremely happy .   If there is one thing that I learned from her , it would be how to be in Euphoria with the little things you have . Her departure saddens me at times , but whenever I look at this photograph I feel Euphoric and this is something that I would want to cherish !     Press L  Please don't use this image anywhere without my explicit permission.  All rights reserved by Meer Sadi   LIKE MY PAGE ON FACEBOOK  "
excitement,http://farm9.staticflickr.com/8107/8508691940_da5c2c536c_z.jpg,2,3,"3rd Annual Denver Mardi Gras 2013 3rd Annual Denver Mardi Gras 2013 By Kevin Larson Presents   Everyone loves the celebration of Mardi Gras, so why not go to the extreme this year and join our carnival of music, theatrics and beads. Make this a fantastically fun February by celebrating Mardi Gras at the Kevin Larson Presents hotel event. Born in France, the holiday has since been growing all over the world. This year we give you the 3rd annual Mardi Gras event in the most perfect setting. Guest balconies overlooking the main event room, an indoor swimming pool, retro-style decor and, of course, a giant ballroom creates an elegant and playful atmosphere. Stilt walkers and jugglers, as part of the fascinating entertainment, bring amazement to your face as you dance the night away.   In a burst of color and excitement we bring you: Denver Mardi Gras - the most extraordinary Mardi Gras event yet!  Hilton Doubletree DTC 7801 East Orchard Road, Greenwood Village, CO February 9, 2013 9pm - 2am  Tickets: www.DenverMardiGras.com 21+  Entertainment: A complete hotel takeover will bring you:   10,000 Beads 50 Room balconies overlooking the party. Balcony decor contest!  $5 drinks 1,000 balloons in Gold, Green and Purple Multiple rooms and environments including 2 dance floors  Music : Hip Hop, Top 40, Dance, Techno, and Dub Step P-Nuckle live band DJ Sirc Tha Illest Hypnautic and Top Flite  Decor: Green, Purple, Gold festival decor  Attire: Get in the spirit, come in costume. Purple Gold and Green are the traditional colors. Masks are always a plus, costumes are not mandatory but encouraged.  Tickets: GA - $29 - Includes beads VIP - $59 - Includes VIP exclusive cash bar, beads  This event will sellout! Buy Online! www.KevinLarsonPresents.com  Ticket Outlets: Max Muscle Highlands Ranch  9226 Park Meadows Drive, Lone Tree, CO  Live Love Lash Denver 275 Clayton St, Denver, CO 80206  Wizards Chest  230 Fillmore Street, Denver, CO 80206  Proudly sponsored by: 107.1 Jack FM Radio, Colorado Photo Medicine, The Wizards Chest, Live Love Lash, Max Muscle Highlands Ranch, Zaca, VIP Real Estate Company  www.KevinLarsonPresents.com Facebook.com/KevinLarsonPresents Twitter.com/KevinJLarson  For more information please contact Kevin Larson at 720-936-2999, Kevin@KevinLarsonPresents.com  www.DenverMardiGras.com"
excitement,http://farm4.staticflickr.com/3739/9578509642_cfa4122e1e_z.jpg,2,3,"Monsters Hockey Girls Finalists Ten women were surprised on August 21st at Quicken Loans Arena, as they were selected to the 2013-14 MHG Team! The ladies were bombarded with confetti, flowers, a MHG T-Shirt and excitement with the announcement. Cavalier Girls and Sully were there to help celebrate!"
