sadness,http://farm8.staticflickr.com/7110/7139725341_11e54ced6c_z.jpg,2,3,"day one hundred twenty-four. 124 / 366 may 03, 2012  grandma moved away this morning. now i'm left with a messy house to clean...  the past few weeks i was super excited about moving home. excited about my birthday. excited to spend time with my girlfriend. today... not so much. sadness and disappointment plagues me. i'm trying really hard to be happy. maybe happiness just isn't in the cards for me.   stephanie"
sadness,http://farm7.staticflickr.com/6073/6072878549_c6888b437e_z.jpg,2,3,Godspeed You! Black Emperor Not for you if you are faint of heart.  Not for you if you don't feel deeply.  Not for you if you don't want to chance feeling deeply.  youtu.be/4vRrGCVlMHk  **All photos are copyrighed. Please don't use without permission**
sadness,http://farm9.staticflickr.com/8443/8011556082_5f00600492_z.jpg,2,3,. Berlin. 2012.  Gedenken an Tamer Al-Awwam  Thorsten Strasas. - Demotix.  - Seconds2Real.
sadness,http://farm8.staticflickr.com/7024/6458920355_2950e49ebb_z.jpg,2,3, 
sadness,http://farm3.staticflickr.com/2083/5787556841_f68460e684_z.jpg,1,4,"Sadness Lgrimas que brotan en vano, lgrimas que no quieren llorar. Y cuando todo pasa, la vida te sonre y Dios te bendice ms y ms :)"
sadness,http://farm3.staticflickr.com/2619/4008256632_59042d7a1c_z.jpg,2,3,Sadness... Explore Mathilde V.'s photos on Flickr. Mathilde V. has uploaded 53 photos to Flickr.
sadness,http://farm7.staticflickr.com/6208/6044509614_41cff3c2e2_z.jpg,2,3,"bringing down a landmark Super expired Kodak TMax100 that was part of a bag full of old film I bought from someone through Craigslist.  Got exactly what I'd hoped for: grainy, gritty, unpredictable film.  Happened to have the camera loaded with it the day after Pizza Man and its surroundings burned."
sadness,http://farm8.staticflickr.com/7342/14157810342_73211d0109_z.jpg,2,3,A1 FB page: www.facebook.com/lumieresdumatin1 Tumblr: lumieresdumatin.tumblr.com Instagram: instagram.com/lumieresdumatin
sadness,http://farm4.staticflickr.com/3311/3425686628_60bf4c44ba_z.jpg,0,5,"where do you belong to? when you have nothing nice to say, you better don't say anything at all. my head is a mess"
sadness,http://farm8.staticflickr.com/7486/15940001842_ecc53f1b77_z.jpg,1,4,Lychakiv Cemetery Satue on grave in the old cemetery
sadness,http://farm5.staticflickr.com/4117/4937174280_2a06768610_z.jpg,2,3, 
sadness,http://farm4.staticflickr.com/3424/3714392841_162031d59c_z.jpg,0,5,"117/365 - I am thinking about giving up on this whole thing april 27, monday  this was taken on a day when i was really upset about having broken up with my boyfriend of a year and a half..."
sadness,http://farm9.staticflickr.com/8625/15794236980_b25ffa23f7_z.jpg,1,4,IMG_4257 Explore saru.gallery's photos on Flickr. saru.gallery has uploaded 1869 photos to Flickr.
sadness,http://farm3.staticflickr.com/2803/4435737960_3f1d6951e7_z.jpg,1,4,.. Story of a suicide 8 .. www.facebook.com/robertafacchinifotografia  for the whole story click here: www.youtube.com/watch?v=sebjQj9VJFY
sadness,http://farm8.staticflickr.com/7313/10102711023_f782c85666_z.jpg,2,3,"Submitted for Week #40 of ""52 in 2013"" flickr group. Theme ""Sadness/what make you sad"" This monument was put in place last week in honor of two local firemen who lost their lives in the line of duty six years ago.  It is a striking monument and definitely saddened me this week. :-( "
sadness,http://farm3.staticflickr.com/2589/4143289085_13fdeeacf4_z.jpg,1,4,IMG_4986 Explore rose_imogen's photos on Flickr. rose_imogen has uploaded 1021 photos to Flickr.
sadness,http://farm9.staticflickr.com/8509/8551702156_582dabe7f5_z.jpg,2,3,"DSC09682w Abandoned buildings located in outskirts of Pirna, Germany.      From a Friend, I learned this placed is called Sonnenstein (part of Aktion T4).  The place was isolated and you can feel the sadness."
sadness,http://farm8.staticflickr.com/7015/6430933263_4bdedcbeb9_z.jpg,1,4,Sadness Explore Claudio Cantonetti's photos on Flickr. Claudio Cantonetti has uploaded 957 photos to Flickr.
sadness,http://farm6.staticflickr.com/5251/5395109352_e0ca901f67_z.jpg,1,4,Hold On Explore Mylar Bono's photos on Flickr. Mylar Bono has uploaded 418 photos to Flickr.
sadness,http://farm9.staticflickr.com/8327/8149543669_8b728df9ba_z.jpg,0,5,Sadness Explore BlueCaru's photos on Flickr. BlueCaru has uploaded 58 photos to Flickr.
sadness,http://farm9.staticflickr.com/8244/8454637010_37d0233ba3_z.jpg,0,5,Sadness Photography by Martijn van Haaster
sadness,http://farm4.staticflickr.com/3858/14332446992_41a00ce6b4_z.jpg,2,3,"Worst Morning When one mangles ones own zipper, ultimate sadness results."
sadness,http://farm3.staticflickr.com/2679/4363584321_66d26e4155_z.jpg,0,5,"Silhuette in the room. Eu resolvi mostrar uma foto oposta tambm. A tristeza e a felicidade em um mesmo quarto.  Existe uma terceira foto, mas eu no vou mostrar para vocs, hehe.   ---------------------------------------------------   I decided to show an image opposite. The sadness and happiness in the same bedroom.  There's a third pic, but I don't go show you, hehe."
sadness,http://farm4.staticflickr.com/3797/13235839754_4fbf7df149_z.jpg,2,3, 
sadness,http://farm9.staticflickr.com/8140/15637392209_928a517dd8_z.jpg,2,3,Tristeza de vero Explore Bea Zabotto's photos on Flickr. Bea Zabotto has uploaded 58 photos to Flickr.
sadness,http://farm4.staticflickr.com/3631/3512011719_513ac1bb69_z.jpg,0,5,This feeling is not sadness; this feeling is not joy. [115/365] For me this video has got nothing to do with the song meaning. Just listen! :D VNV Nation: www.youtube.com/watch?v=pu-8wGbWMro
sadness,http://farm9.staticflickr.com/8056/8143211233_be9f40f62e_z.jpg,2,3,Shape of Sadness The shape of this broken tree makes me feel like an elephant is crying
sadness,http://farm5.staticflickr.com/4088/4968299054_922524855b_z.jpg,2,3,"Time to stop and stare.. Wales Ape and Monkey Sanctuary, Brecon Beacons, Wales. The sanctuary rescues and provides a home for many types of unwanted animals - especially primates, such as chimpanzees, baboons, spider monkeys, capuchins and marmosets.   I personally can't make my mind about whether we should support these places or not - on the one hand, their looking after and caring for these animals, but on the other, you look into their eyes and see such sadness, I wonder whether we're just better off releasing them back into the wild to let nature run its course.."
sadness,http://farm8.staticflickr.com/7480/15574385493_a8658c3181_z.jpg,2,3, 
sadness,http://farm4.staticflickr.com/3892/14846920117_1bb8961a16_z.jpg,1,4,summertime sadness Explore megeo2's photos on Flickr. megeo2 has uploaded 451 photos to Flickr.
sadness,http://farm4.staticflickr.com/3223/2865871387_7bc49e32dd_z.jpg,1,4,sadness Explore Manuel Luce's photos on Flickr. Manuel Luce has uploaded 1940 photos to Flickr.
sadness,http://farm8.staticflickr.com/7018/6486166371_5162db404e_z.jpg,2,3,. Explore xenia.vass' photos on Flickr. xenia.vass has uploaded 46 photos to Flickr.
sadness,http://farm7.staticflickr.com/6073/6126154139_97ca23f8d0_z.jpg,1,4,Sadness  Explore Mohamed HOla's photos on Flickr. Mohamed HOla has uploaded 79 photos to Flickr.
sadness,http://farm6.staticflickr.com/5208/5210683564_3acbca8bf8_z.jpg,1,4,little sadness Explore LaHija de la lgrimA ~'s photos on Flickr. LaHija de la lgrimA ~ has uploaded 58 photos to Flickr.
sadness,http://farm9.staticflickr.com/8246/8561360396_d0f8394c0f_z.jpg,1,4,Sadness. Right in front of the main library. Explore RahiemtheWriter's photos on Flickr. RahiemtheWriter has uploaded 1613 photos to Flickr.
sadness,http://farm5.staticflickr.com/4027/4308413806_4d5d93d85b_z.jpg,0,5,"January 26, 2010 ~ Day Ocho This picture pretty much describes my day by itself. Stressed out to the max. Sorry that today's photo isn't super great, I've got loads of math homework and a test tomorow that I'm pretty sure I'm going to fail (since I've missed half of the content I have a pretty slim chance of passing). My lack of motivation has contributed to this missing of content A LOT. But, there's always the next test I suppose. One bad grade isn't going to kill my whole semester. Gotta look at the glass as half full, or I'll never get past this last drag of the year.   Oh well, besides the whole stressed out to the max thing, today was alright. Pretty average as far as Green days go. I got a new notebook for psyc =) that was exciting =) (I'm a big fan of notebooks =P ). Otherwise a very uneventful day.   Hopefully tomorow will be better. I promise that I have a great idea for my photo of the day tomo =) it's going to be epic. (If I can pull it off =P )  Sweet dreams everyone."
sadness,http://farm4.staticflickr.com/3698/9817379416_f1033a9413_z.jpg,2,3,emotions Explore momopandajacc's photos on Flickr. momopandajacc has uploaded 21 photos to Flickr.
sadness,http://farm4.staticflickr.com/3696/9936339315_3c53ab41e1_z.jpg,0,5,Untitled Photo and makeup: Serena Adriana Ramunni
sadness,http://farm5.staticflickr.com/4100/4908749583_8f9b8f9981_z.jpg,2,3,August 17 - Sadness Dirty in Bidwell park the night before he left to go back to Oregon. 
sadness,http://farm3.staticflickr.com/2451/3586559647_a762a32256_z.jpg,1,4,"Sad Sleeper  Strobist Info: Spot grid on background 1/16th, softbox camera right 1/4"
sadness,http://farm6.staticflickr.com/5097/5464664277_f7a766ec09_z.jpg,2,3,Veteran One   This is my friend Austin.  Both he and I served in Iraq.  He was a Marine and I was in the Army.  I had this idea of an intense flag image and I knew he would be perfect for it.  
sadness,http://farm9.staticflickr.com/8649/15235235514_043e50f402_z.jpg,2,3,sadness via 500px ift.tt/1vAd2qG
sadness,http://farm4.staticflickr.com/3213/3076817099_e741a0ed35_z.jpg,1,4,A Day Before Tomorrow 2046 ADBT day 3 and 4 stills
sadness,http://farm4.staticflickr.com/3415/3429140704_9f2c9f4549_z.jpg,1,4,"Brittany Gailey- Photo 4 John S. Dodd was named the first permanent pastor of the original Bethsaida Baptist Church in 1843. Here pictured, is a few of his family members. Thomas Edward Dodd and Margaret Bethel Dodd were the two that were buried at this particular spot. The front side of the head stone (as pictured) reads: Jesus can make a dying bed feel soft as downy pillows are, While on his breast I lean my head and breathe my life out sweetly there. Obviously this is the family of the original pastor. This just shows one of the many families who have burial plots located at the cemetery. All the headstones that you see are actually people who had families. This is where the sadness comes in. There are even a few burial plots from children who didnt make it through birth. Regardless of why, where, and when all these men and woman were buried, they all are together in one place. After you have looked around the cemetery, you can really get a feeling of how much history is in this one place."
sadness,http://farm9.staticflickr.com/8207/8287066108_84793cd7e2_z.jpg,2,3,"_DSC0765 feeling/mood of cold, sadness, loneliness, sorrow"
sadness,http://farm6.staticflickr.com/5096/5529502589_57432a4b15_z.jpg,2,3,"Olga ""Le souci de l'autre"" Gargenville, March 2011. FR"
sadness,http://farm9.staticflickr.com/8124/8855544932_911c20ef71_z.jpg,2,3,mombello356 Explore [Blackriver Productions]'s photos on Flickr. [Blackriver Productions] has uploaded 11481 photos to Flickr.
sadness,http://farm9.staticflickr.com/8001/7490732066_1284218107_z.jpg,2,3,Summertime Sadness Explore Terfaelr's photos on Flickr. Terfaelr has uploaded 41 photos to Flickr.
sadness,http://farm9.staticflickr.com/8196/8084235004_c70d4e2d44_z.jpg,2,3,Thoughts Explore EjoMolnar's photos on Flickr. EjoMolnar has uploaded 143 photos to Flickr.
sadness,http://farm8.staticflickr.com/7209/6834416586_d19a665962_z.jpg,2,3,clowning Explore Jim_V's photos on Flickr. Jim_V has uploaded 559 photos to Flickr.
sadness,http://farm4.staticflickr.com/3725/13565071565_2cd7770850_z.jpg,0,5,It was yesterday Explore Soloross' photos on Flickr. Soloross has uploaded 662 photos to Flickr.
sadness,http://farm4.staticflickr.com/3398/3278293640_620c2565b2_z.jpg,2,3,"Tristeza / Sadness (Xela, Guatemala) dleiva.com/"
sadness,http://farm5.staticflickr.com/4023/4454690346_d8bb4ea2a6_z.jpg,0,5,Now you're death. Automatic shutter release.  Model: me
sadness,http://farm5.staticflickr.com/4109/4978494208_5456a577f1_z.jpg,2,3,"L'Esprit de la Marie erre au cimetire  Modle: Audrey Gosselin  L'Esprit de la Marie erre au cimetire est une srie photos qui viennent illustrer un conte dont je suis l'auteure. Une grande partie du conte tait relat ici mais je me suis ravis et l'ai effac.  En effet, ce projet m'est trop cher pour que je ne risque de me le faire piquer ici.  Je peux par contre vous faire part des grandes lignes:  La propritaire d'une auberge, voulant me convaincre de ne pas visiter le cimetire du village durant la nuit en vint  me relater l'histoire de la marie.  La jeune femme avait apprit la mort de son fianc quelques minutes avant la clbration du mariage.  Cela s'tait droul des dizaines d'annes plut tt et depuis la jeune marie, Maria, est prsente toutes les nuits dans le cimetire.  Elle s'en prend aux malheureux qui osent entrer dans le cimetire durant le nuit.   L'aubergiste me relate divers vnements s'tant drouls depuis."
sadness,http://farm4.staticflickr.com/3719/9620758375_79783574c8_z.jpg,1,4,"Odd Flower Not sure what the exact name of this flower is. For me, it's kind of ugly that it's beautiful along with the sadness of the cemetery.  Beauty always happens in ugliness."
sadness,http://farm6.staticflickr.com/5606/15541037945_1f7d8fe3c4_z.jpg,2,3,  . # # # # #Autumn #Sadness #Pain Explore Kotinkiss' photos on Flickr. Kotinkiss has uploaded 64 photos to Flickr.
sadness,http://farm3.staticflickr.com/2926/14206643732_d5b1c1ccef_z.jpg,1,4,"Crash closes Route 30 for almost six hours Thursday April 26, 2012  BRATTLEBORO -- A head-on collision on Route 30 under the Interstate 91 overpass sent three people to the hospital, one with serious injuries.  According to police, Dustin W. North, 32, of Putney, was traveling toward Brattleboro in a 2005 Audi S4 when he struck head on a 2003 Volkswagen Jetta at about 11:45 a.m. on Wednesday.  North was given a roadside sobriety test while the Brattleboro Fire Department used the Jaws of Life to extricate a man from the Jetta. It took about an hour to extricate the man, who was conscious as he was wheeled on a gurney into the back of a Rescue Inc. ambulance.  North left the scene in the back seat of a police cruiser and was later cited for driving under the influence of drugs resulting in serious injury and grossly negligent operation of a vehicle, also resulting in serious injury.  He was ordered to appear in court on May 8.  The names and conditions of the three people taken to the hospital have not yet been released.  A witness who was driving to Brattleboro on his way to work said he pulled to the side of the road to make room for an oncoming emergency vehicle with lights flashing and siren blaring. To the witness' amazement, a car split the gap between him and the ambulance.  The witness told the Reformer he watched as the driver of the Audi weaved back and forth, crossing the white and yellow lines at least 15 times.  ""Before the accident he passed two cars in front of me,"" said the witness, who asked that his name not be released. ""He floored it. It looked like (the cars he was passing) were standing still.""  The witness did not see the actual accident but as he was rounding the corner at the future West River Park he saw the two cars spinning in the middle of Route 30 following the impact.  He said as he arrived on the scene, the passenger in the Audi opened his door and fell out onto the pavement, leading to the initial but erroneous report that one person had been ejected during the crash.  The witness said he would have called police, but his mobile phone didn't have a signal.  He was visibly upset by what he had seen.  ""You don't know what you are going to see in terms of the hurt,"" he said. ""You feel the sadness and frustration of knowing that you saw someone not driving responsibly ... and causing an accident.""  Route 30 was closed from about 11:45 p.m. to 6 p.m. as Brattleboro police, assisted by the Vermont State Police, conducted an investigation. Traffic was diverted onto Upper Dummerston Road during that time period.  The Brattleboro Fire Department was assisted by emergency responders from Rescue Inc.  According to police, no additional arrests are expected. "
sadness,http://farm9.staticflickr.com/8159/7259626556_32dae03a7e_z.jpg,1,4,"sorrow drips into your heart through a pinhole just like a faucet that leaks and there is comfort in the sound, but while you debate half-empty or half-full, it slowly rises your love is gonna drown"
sadness,http://farm6.staticflickr.com/5190/5631501108_1976b1dc94_z.jpg,0,5,Down Sydney
sadness,http://farm4.staticflickr.com/3181/2530668387_528e25fffd_z.jpg,2,3,Old San Juan Cementary Puerto Rico Explore Face-2-Face's photos on Flickr. Face-2-Face has uploaded 5233 photos to Flickr.
sadness,http://farm4.staticflickr.com/3824/9366843095_de9ebcfba4_z.jpg,1,4, 
sadness,http://farm6.staticflickr.com/5011/5432793691_c646bb6e7e_z.jpg,1,4,"www.jennika.co.uk This is my fave shot from the series.  There is a slight sadness and a feeling of being trapped and wanting to escape, but having given up the fight."
sadness,http://farm2.staticflickr.com/1259/5138954921_fe48485760_z.jpg,1,4,Sadness Tropical Disease Research in Ecuador 2010
sadness,http://farm4.staticflickr.com/3218/5866870974_0f05f52aba_z.jpg,1,4,Sacred Sadness Explore gidantribal's photos on Flickr. gidantribal has uploaded 81 photos to Flickr.
sadness,http://farm5.staticflickr.com/4125/4834533914_cc8efac4cc_z.jpg,0,5,Alone. Explore Sunsets Forgotton's photos on Flickr. Sunsets Forgotton has uploaded 78 photos to Flickr.
sadness,http://farm4.staticflickr.com/3301/3598192014_0ba5998d57_z.jpg,2,3,"This is my wish for you Comfort on difficult days, smiles when sadness intrudes, rainbows to follow the clouds, laughter to kiss your lips, sunsets to warm your heart, hugs when spirits sag, beauty for your eyes to see, friendships to brighten your being, faith so that you can believe, confidence for when you doubt, courage to know yourself, patience to accept the truth   for Karolinas 365 project 120/365"
sadness,http://farm2.staticflickr.com/1196/5108791620_f4431ceffa_z.jpg,0,5,Sadness Explore Gret B.'s photos on Flickr. Gret B. has uploaded 1541 photos to Flickr.
sadness,http://farm8.staticflickr.com/7291/15946773293_bc298b2136_z.jpg,2,3, 
sadness,http://farm9.staticflickr.com/8505/8354551076_88bd1ca225_z.jpg,2,3,Untitled Fragments
sadness,http://farm7.staticflickr.com/6096/6309911856_8346c93742_z.jpg,0,5,WH 438 Bonjour tristesse !
sadness,http://farm6.staticflickr.com/5110/5771707574_0b2278baae_z.jpg,2,3,Sadness. Nikon D700
sadness,http://farm6.staticflickr.com/5163/5302622967_55f1bcba8f_z.jpg,2,3,Hollywood Portrait A real Hollywood Portrait
sadness,http://farm6.staticflickr.com/5020/5486571246_5508a80379_z.jpg,2,3,"Untitled My photography routine always seems to begin the same way - I start out going to the most populated places, become entirely overwhelmed/disenchanted within minutes and end up doing my best work of a lone individual on a barren side street.    This image was taken on East 23rd Street across from the FDR."
sadness,http://farm3.staticflickr.com/2183/5735430054_9ac128c97b_z.jpg,1,4,Sadness Explore Gabriel A. Monteiro's photos on Flickr. Gabriel A. Monteiro has uploaded 46 photos to Flickr.
sadness,http://farm5.staticflickr.com/4150/5020886243_c3377785ba_z.jpg,0,5, 
sadness,http://farm4.staticflickr.com/3848/14687810978_53a141d24a_z.jpg,1,4,"The beauty and the waste / Une rose sur un tas de fumier Malabar Hill, Mumbai Sad and troubling look"
sadness,http://farm5.staticflickr.com/4140/4882563080_c1188d1ca0_z.jpg,2,3,"Cimetire du Pre-Lachaise Paris, Pre Lachaise Cemetery"
sadness,http://farm8.staticflickr.com/7211/7241282580_8df8bc9987_z.jpg,0,5,Untitled Explore Henri Railowsky's photos on Flickr. Henri Railowsky has uploaded 2198 photos to Flickr.
sadness,http://farm3.staticflickr.com/2879/9186933608_d4ed269ff2_z.jpg,1,4,Despair PLEASE VIEW LARGER ----------------------------------------
sadness,http://farm6.staticflickr.com/5347/7077229723_4472588a95_z.jpg,2,3, 
sadness,http://farm5.staticflickr.com/4118/4767078199_3c611339e3_z.jpg,2,3,SARKOZY PRESIDENT ! Life is a Bitch
sadness,http://farm3.staticflickr.com/2815/9570215601_8977bc6135_z.jpg,1,4,In his eyes Explore TGe's photos on Flickr. TGe has uploaded 1862 photos to Flickr.
sadness,http://farm6.staticflickr.com/5221/5634475528_78fc20672e_z.jpg,2,3,In all things it is better to hope than to despair Goethe
sadness,http://farm4.staticflickr.com/3631/3553968150_a802d09d18_z.jpg,0,5,"Sadness Part of a large statue that stands in the middle of the St. Louis De Gonzague Cemetery in Nashua, NH. It honors Julian Joseph Richard who died in 1929. "
sadness,http://farm7.staticflickr.com/6240/6275653389_d8c95de298_z.jpg,2,3,Uncinscious sadness Explore r0cks_and_r0lls' photos on Flickr. r0cks_and_r0lls has uploaded 55 photos to Flickr.
sadness,http://farm9.staticflickr.com/8333/8115884120_65548d03a9_z.jpg,2,3,watching                                
sadness,http://farm6.staticflickr.com/5583/14601262919_7d74374c61_z.jpg,2,3,"Lost in a World of Books and Trees Day 34 not been feeling well today, so had plenty of time to play with layers in photoshop, this actually sums up my mood today."
sadness,http://farm3.staticflickr.com/2925/14096405288_4518130c9b_z.jpg,0,5,IsolatedSystem Explore Federica [C]'s photos on Flickr. Federica [C] has uploaded 941 photos to Flickr.
sadness,http://farm3.staticflickr.com/2751/4287434999_74ae27d058_z.jpg,2,3,Break The Rulez OUTing ... a series of SADness ....
sadness,http://farm6.staticflickr.com/5570/14834402468_e6af2e55b8_z.jpg,1,4,Fallen angel. Rome - Protestant cemetery 
sadness,http://farm9.staticflickr.com/8474/8084567011_e4cbac56ed_z.jpg,0,5,2012-10-12 17.47.27_Jean Explore toki.'s photos on Flickr. toki. has uploaded 64 photos to Flickr.
sadness,http://farm6.staticflickr.com/5504/11920452373_7346440698_z.jpg,2,3, 
sadness,http://farm6.staticflickr.com/5319/5806761831_5b156c1854_z.jpg,1,4,"Lonely I am a lonely person I have many people around me But the feeling of loneliness Its deeply seated in me  The birds are chirping I can hear the voices My kids are chatting around But I feel lonely, I am a lonely person.  To subside the feeling I mingle with my kids Playing with them for a while Making them laugh.  Then again I feel lonely Its my inner feeling I am a lonely person like a lonely tree in the desert. I am a lonely person! "
sadness,http://farm9.staticflickr.com/8680/15839236362_0a869be058_z.jpg,2,3, 
sadness,http://farm8.staticflickr.com/7297/9836268326_6eb2a08e23_z.jpg,2,3, 
sadness,http://farm4.staticflickr.com/3295/3079687802_a3f67502b1_z.jpg,2,3,"frustration Im in that point in my life where I feel my emotions have taken over. I feel the need to express myself and the best way is in my photography.   My life has become something I can't control  I feel so helpless, worry over takes me, frustration blinds me and sadness has become me"
sadness,http://farm6.staticflickr.com/5272/5882511791_baa869eb03_z.jpg,1,4,To sadness Explore Matias Carrillo's photos on Flickr. Matias Carrillo has uploaded 13 photos to Flickr.
sadness,http://farm4.staticflickr.com/3720/9571206521_6afbc63d79_z.jpg,1,4,sadness-lonely-memories-collage Explore georgecelmis' photos on Flickr. georgecelmis has uploaded 276 photos to Flickr.
sadness,http://farm4.staticflickr.com/3726/10288360276_8f9f91c305_z.jpg,1,4,Cornelle 2012 Rinoceronte
sadness,http://farm9.staticflickr.com/8003/7341067436_92a02206b3_z.jpg,2,3, 
sadness,http://farm6.staticflickr.com/5161/5379067484_62674ac521_z.jpg,2,3,Douce Marie // 004 Explore tiphaine_robion's photos on Flickr. tiphaine_robion has uploaded 101 photos to Flickr.
sadness,http://farm5.staticflickr.com/4143/4914155465_8a1c60d7a6_z.jpg,1,4,"Cimetire du Pre-Lachaise Paris, Pre Lachaise Cemetery"
sadness,http://farm8.staticflickr.com/7120/7671432768_b00138ebef_z.jpg,2,3,Summertime Sadness Explore she keeps on dreaming's photos on Flickr. she keeps on dreaming has uploaded 818 photos to Flickr.
sadness,http://farm8.staticflickr.com/7068/6946950929_f01a1a9bbc_z.jpg,2,3, 
sadness,http://farm6.staticflickr.com/5059/5540774881_6244cd7855_z.jpg,0,5, / Kampung Asli Bukit Tampoi ! / What an expression of sadness!
sadness,http://farm8.staticflickr.com/7530/15772575157_1b4b585ac4_z.jpg,0,5,#sadness #tear #teardrop Explore beatrise.kede's photos on Flickr. beatrise.kede has uploaded 29 photos to Flickr.
sadness,http://farm5.staticflickr.com/4049/4308694835_6bbc9e44c0_z.jpg,1,4,"Sadness Sadness is an emotion characterized by feelings of disadvantage, loss, and helplessness. When sad, people often become quiet, less energetic, and withdrawn."
sadness,http://farm4.staticflickr.com/3147/3064598115_cda439fae5_z.jpg,2,3,Angie This is a series for my photography class on depression. 
sadness,http://farm6.staticflickr.com/5117/6927092874_4a2fcd9fda_z.jpg,0,5,No future. Calcutta  Rachel Carbonell. www.rachelcarbonell.com
