sadness,http://farm4.staticflickr.com/3179/2881897159_ba039a5bbd_z.jpg,2,3,"Seeing the Light cause there's this switch that gets hit and it all stops making sense and in the middle of drinks maybe the fifth or the sixth I'm completely alone at a table of friends I feel nothing for them I feel nothing, nothing. -Bright Eyes  I go to this school. All girls. All rich. All of us, except those on scholarships. We don't appreciate what we have; we never have. We may be grateful, but we have no idea how hard it is for the rest of the world. I'm tired of being sheltered, tired of being around people that do nothing but talk about each other and whine about our privileged lives. It numbs my emotions, it dulls my mind, and I want to be better than that. I didn't quote the lyrics for their reference to alcohol--I never drink. It's just that sensation of feeling completely alone among this mass of people that have everything in common. I'm a girl, I'm rich, I'm unappreciative, but I want something different. So the switch was hit (not off, but on) somewhere along the line, and I started to realize how much more there was to life. I feel nothing for where I am, and I'll find somewhere better."
sadness,http://farm3.staticflickr.com/2871/10522444044_375f99cb6a_z.jpg,1,4, 
sadness,http://farm4.staticflickr.com/3775/8908651076_52196b0491_z.jpg,2,3,Death Weeping Death
sadness,http://farm4.staticflickr.com/3860/14943444809_efe5d29143_z.jpg,1,4,and her guardian Explore collapsingstars' photos on Flickr. collapsingstars has uploaded 25 photos to Flickr.
sadness,http://farm4.staticflickr.com/3669/9522142455_616275c540_z.jpg,0,5,Cardiff (On a Good Day) Explore expat a's photos on Flickr. expat a has uploaded 9503 photos to Flickr.
sadness,http://farm9.staticflickr.com/8504/8421897591_dc4e88bb57_z.jpg,0,5,heartache record listening sadness 
sadness,http://farm7.staticflickr.com/6110/6221634169_6e6fe7704c_z.jpg,0,5, 
sadness,http://farm8.staticflickr.com/7029/6703712111_8cd0f54647_z.jpg,0,5,Let It Fall blogged
sadness,http://farm6.staticflickr.com/5095/5406343533_4e82caf990_z.jpg,2,3,sadness Explore liz.brinck's photos on Flickr. liz.brinck has uploaded 191 photos to Flickr.
sadness,http://farm8.staticflickr.com/7016/6655159733_0b0cd3c202_z.jpg,2,3,"20120107 CPD Ofc. #4103 End of Watch 29DEC2011 Week 2 Theme - Fashion  Uniforms  Uniforms bring a group of people together to show each other and everyone else, This is our group.  This sentiment is felt most clearly at the funeral service for a Police Officer killed in the line of duty.  If you find yourself at a CPD funeral but you are not part of the law enforcement community (i.e., Officer or family member) you had better be respectful because you are on hallowed ground... in a sacred space.  At these services, outsiders (guests) can sense the grief and the remorse felt by those Officers in attendance but most of all you can sense a feeling that says to everyone, This is our group.  This happened to us.  There is a palpable, underlying tension that can only be interpreted as, We will fix this problem, our problem.  And no one should think for one minute of getting in our way; of stopping us.    We all have our opinions about revenge and justice but trust me when I say there is absolutely no room for debate or discussion of those things at these services.  There is only profound sadness for the Officer's family and solemn respect for what needs to be done next.  If you look into the eyes of all of those in uniform at this service you'll see firsthand the CPD's resolve and determination to take care of one of their own.  It's an amazing, collective natural phenomenon.  Today, nine days after CPD Ofc. Clifton Lewis was gunned down (and thirteen days after he proposed to his long-time girlfriend on Christmas) two men were charged with his murder.    Farewell Clifton.  Your friendship and laughter will be dearly missed and your uniform will always remain empty to us.  Photo gallery of the funeral services and related images... www.chicagotribune.com/news/local/breaking/chi-111229-off...  Notes I wrote from another Officer's funeral in 2009 (coincidentally describing their uniforms also)... atimelived.wordpress.com/2009/06/08/notes-from-a-chicago-... "
sadness,http://farm4.staticflickr.com/3722/11948225583_12be5e2bd4_z.jpg,0,5,"Untitled 10/365  The original concept for this, which I didn't execute as well as I had hoped, was about letting go of your pain. I'm not the type of person who can hold in sadness and ignore it. I have to acknowledge it, experience it, learn from it, and then after finding the deeper problem and resolving it, I can let it go. "
sadness,http://farm8.staticflickr.com/7519/15229787863_00ab517269_z.jpg,2,3,"Bloodstained Glass it's been awhile flickr. I hope things are well.  so much has happened since my last upload. I don't even remember what I uploaded last. I could look, but I just don't have the desire to right now. I'm not in the best place, mentally. so much going on, and so much sadness.   this is inspired by one of my best friends, who passed away November 18th. she was battling pancreatic cancer after being diagnosed last year. she was finally able to go home after several months and close calls, and was doing well, until she had liver failure last month. she bounced back, even though doctors only gave her days to live. just a couple weeks later, she developed a GI bleed, but doctors couldn't pinpoint where. after a long talk with her husband, she decided against treatment, and requested medicine to keep her comfortable until her time passed. this is inspired by the internal bleeding she suffered. :(   words literally do not do her justice. she was such an amazing woman. I've decided to post one memory of her with each photo from here on out. so at the end of this description, that's what i'll do.  love your friends. tell them everyday. support them 100%. I just wish I was able to do more for her, and support her the way she supported me. I guess I just didn't know how to, but that just sounds like a fucking excuse.  I'm sorry I don't have more to say, or anything chipper. her death has hit me harder than I ever thought it could, so I need to process that before I can be truly happy again.  Tamarra Memory:  lemon bars. those were here ABSOLUTE favorite dessert (according to her of course). one time, while she was in the hospital, I made her some, and had to sneak them in to her. :) being the naughty girl she was, she snuck a tiny bite (she was having a procedure the next day, so no food night before. tsk tsk. ;)  ) she was so happy. :)  I made some tonight, because of this specific memory, but I can't bring myself to eat them. they just don't taste the same if I can't share them. I'm hoping she'll stop by and grab a bite though. :'(  she was an incredible artist. please check out her work, and don't let it be forgotten. I should've shared her work more when she was alive. bellamiastudio.smugmug.com/  "
sadness,http://farm8.staticflickr.com/7081/7050946759_95d127da23_z.jpg,0,5,living from the garbage pepena en la central de abastos de la ciudad de Mexico
sadness,http://farm5.staticflickr.com/4097/4907642746_c8652b1700_z.jpg,1,4,AmanuelB&W Refugee...through sea..towards lifeline...
sadness,http://farm7.staticflickr.com/6056/5915180856_972283b52c_z.jpg,2,3,Furniture sadness... 2010. Explore Dave Whatt's photos on Flickr. Dave Whatt has uploaded 996 photos to Flickr.
sadness,http://farm5.staticflickr.com/4050/4238801923_403dcc0ed5_z.jpg,1,4,Green-Wood Cemetery (Brooklyn) 0124 Explore sjnavarro's photos on Flickr. sjnavarro has uploaded 865 photos to Flickr.
sadness,http://farm9.staticflickr.com/8230/8506025211_0a8904e3dc_z.jpg,0,5,Indian Eremit somewhere in the gujarati mountains
sadness,http://farm3.staticflickr.com/2914/14458789336_4dfbeb4cb2_z.jpg,2,3,Ghost something. squirrelvk.blogspot.be/2014/06/ghost-something.html
sadness,http://farm6.staticflickr.com/5228/5565619508_229a1df578_z.jpg,1,4,Untitled Explore piggy2007b's photos on Flickr. piggy2007b has uploaded 849 photos to Flickr.
sadness,http://farm4.staticflickr.com/3056/5816306814_9a116e0266_z.jpg,1,4,Untitled Explore H'pics' photos on Flickr. H'pics has uploaded 242 photos to Flickr.
sadness,http://farm6.staticflickr.com/5018/5456779234_fc39861394_z.jpg,1,4,Dolor VII Explore NachoRoizman's photos on Flickr. NachoRoizman has uploaded 1910 photos to Flickr.
sadness,http://farm8.staticflickr.com/7200/6922523804_bb0d26af05_z.jpg,2,3, 
sadness,http://farm6.staticflickr.com/5002/5319448692_f738af0eca_z.jpg,2,3,A Day Before Tomorrow 1940 (flickr) Production Stills from the short film 'A Day Before Tomorrow'
sadness,http://farm6.staticflickr.com/5576/14626797748_5fcd7f0597_z.jpg,1,4, 
sadness,http://farm5.staticflickr.com/4140/4794711785_618412f8b9_z.jpg,2,3,cold heart bitch some days that's all I think I am. 
sadness,http://farm9.staticflickr.com/8086/8429192594_f383881711_z.jpg,1,4,"Australia Day #2 Sydney Harbour, a few minutes before the fireworks. More to come in these series.  You can see Australia Day #1 here, Australia Day #3 here, Australia Day #4 here, and Australia Day #5 here."
sadness,http://farm3.staticflickr.com/2937/14497195262_824911617e_z.jpg,0,5,"Diary #113 ""Contavo i giorni lontano da te e toglievo ad ogni giorno almeno un'ora.""  Diary#  il mio primo progetto,  un progetto personale dedicato all'autoritratto il cui scopo  indagare dentro me stessa e tirare fuori i fantasmi che si annidano nell'identit di una persona. A me piace definirlo... un'autoterapia. [ qui lo trovate completo. ]   Facebook Page Web Site"
sadness,http://farm6.staticflickr.com/5148/5701186945_9aa7069fe2_z.jpg,1,4, 
sadness,http://farm3.staticflickr.com/2724/4384741783_ce873b87da_z.jpg,1,4,"Molly One This photoshoot was the second I have had, without training etc, in our studio at college."
sadness,http://farm6.staticflickr.com/5286/5371431746_c54711b299_z.jpg,1,4,Sadness Explore ssimicel's photos on Flickr. ssimicel has uploaded 88 photos to Flickr.
sadness,http://farm9.staticflickr.com/8045/8081165770_582affa685_z.jpg,2,3,Sadness built up within. Explore PeaceLoveShae*'s photos on Flickr. PeaceLoveShae* has uploaded 400 photos to Flickr.
sadness,http://farm4.staticflickr.com/3110/2720130677_87398e3cb0_z.jpg,2,3, 
sadness,http://farm5.staticflickr.com/4018/4448985776_c0781c75ba_z.jpg,1,4,portrait #243 Candid Portrait; 2010 DianaLee Photo Designs
sadness,http://farm6.staticflickr.com/5129/5240142418_94db0f7169_z.jpg,1,4,Sadness A Day of Mourning...
sadness,http://farm8.staticflickr.com/7053/6993783219_bd15fa6490_z.jpg,1,4,Waiting for Cuddles An abandoned nursery inside the exclusion zone around the Chernobyl Nuclear Power Plant.
sadness,http://farm3.staticflickr.com/2617/4034177096_5888247c17_z.jpg,0,5,Club Week 5 This is a Ju Go Ju pledge showing her sadness for this weeks events.  She voluntarily posed after I signed her book for her. 
sadness,http://farm6.staticflickr.com/5290/5312339706_276b2e4e11_z.jpg,0,5,A sad portrait Explore Q's photos on Flickr. Q has uploaded 196 photos to Flickr.
sadness,http://farm9.staticflickr.com/8045/8119393705_dc7ebcb736_z.jpg,2,3,Goodbye Dolly Gray Bamforth published a huge series of patriotic and sentimental postcards during the Great War. This is just one of several hundred that I found in my Great-Uncle William's attic.
sadness,http://farm7.staticflickr.com/6076/6126948940_8d6f7e288f_z.jpg,2,3,"b no b  London, United Kingdom    DSC_9674"
sadness,http://farm9.staticflickr.com/8388/8683220715_4bb7dd62e6_z.jpg,1,4,lovers001 SONY DSC
sadness,http://farm4.staticflickr.com/3198/2720997317_cec7a3582e_z.jpg,1,4,sadness Explore cpmanda's photos on Flickr. cpmanda has uploaded 6741 photos to Flickr.
sadness,http://farm9.staticflickr.com/8011/7356295658_c810209e1d_z.jpg,2,3,Tragedy Sometimes life hands you clichs.
sadness,http://farm9.staticflickr.com/8232/8511120946_8755cba2a1_z.jpg,0,5,"day 57 ii ""She looked out the window her whole life, the way so many women sit their sadness on an elbow.""  The House on Mango Street by Sandra Cisneros   This is another one that doesn't look anything like me, but it was fun to create.   Here is the rest of the quote: ...""I wonder if she made the best with what she got or was she sorry because she couldnt be all the things she wanted to be."" I didn't include that it was too sad. I don't want that to be me!! "
sadness,http://farm5.staticflickr.com/4065/4219549701_1c2bc7ca44_z.jpg,2,3,"~ dedicated 2 angelic michael ~ 4 michael's funeral service i made a wreath of the last photo i had taken of him & used  my tripod 2 display it through the  service, my youngest nephew i have lost...dedicated 2 angelic michael 1988 ~ 2009  www.legacy.com/Daily-Times/Obituaries.asp?Page=SearchResu...   "" What does it mean to be Samurai? To devote yourself utterly to a set of moral principles. To seek a stillness of your mind. And to master the way of the sword.""  * Last Samurai * ~ Theme song www.youtube.com/watch?v=HSQpdWMDWSU quote from film : by algren [narrating] Winter, 1877.  ~~~~~~~~~~~~~~~~~~~~~~~~~~~~~~~~~~~~~~~~~~~~~~~~~~~~~  Michael Denetsone Benallie  July 20, 1988 - Dec. 18, 2009  Michael D. Benallie, 21 of Tempe, Ariz., passed away on Friday, Dec. 18, 2009, in Tempe. He was born July 20, 1988, in Shiprock.  Michael graduated from Shiprock High School in 2006. He participated in football and wrestling, and he was proud to have played with his teammates. In 2007, he volunteered his time to assist coaching wrestling at Navajo Preparatory School, which he enjoyed.  Michael embraced the Japanese culture. His favorite pastimes revolved around anime, MySpace, chat lines, working on his laptop and being around his family and friends. He will certainly be missed by everyone who knew him.  He was preceded in death by his aunts, Yolanda Lee and Audrey Begay; uncle, Ross Kee Lee; maternal great-grandparents, Robert and Elsie Martin; and paternal great-grandparents, Hoskie and Mary Lee.  Michael is survived by his parents, Chee ""Sonny"" D. Benallie Jr. and Vernita ""Vee"" Lee-Benallie; brother, Gabriel C. Benallie and niece, Kaylee (Ponyo) D. Benallie of the family home. He is also survived by his maternal grandparents, Wilford and Irene Lee; paternal grandparents, the Rev. Chee D. Benallie Sr., Lois Nez-Begay and Anna Mae Benallie; aunts, Virginia Lee, Linda Lee, Nadia Lonewolf (Dennis), Brenda Lee (Nate Begay) and Desbah D. Allison (Rob); uncles, Albert Lee (Verna), Wilbert Lee, Terrance Billy (Lynette), Lewis W. Ckray and Arthur C. Begay Jr.; and many more nieces, nephews and other family relatives.  Michael had the best five months of his life, living in Tempe with his friends, Jeremy, Julius and Audrey. He had many friends who he enjoyed hanging out with. Those who knew him were touched by his generous, gentle, humorous, kind and caring spirit.  Pallbearers are Jeremy Atcitty, Julius Walter, Shawn Franklin, Brandon Shorthair, Kodie Penn, Aaron Lee, Roberto Lee and Kody Jones.  Alternate pallbearers are Verna Lee, Carmelita Lee, Dennis Lonewolf, Nate Begay, Rob Allison, Doc Mann and Colleen Mann. Honorary pallbearers are the immediate maternal and paternal family.  Funeral services will be at 10 a.m. Saturday, Dec. 26, at Din Christian Center in Shiprock. Pastor Freddie Hall will officiate at the service.  Burial will take place at the Shiprock Community Cemetery.  A celebration of Michael's life will be at the Din Center.  The Benallie family would like to extend their appreciation and thanks to all those who contributed and assisted with words of condolences, encouragement, monetary donations, food, flowers and being with the family during their loss of their son, brother, uncle, nephew, relative and friend - ""Domo Arigato!""  Michael is in the care of Desert View Funeral Home of Shiprock, North U.S. Hwy. 491; (505) 368-4607.   Published in the Farmington Daily Times on 12/24/2009    ~~~~~~~~~~~~~~~~~~~~~~~~~~~~~~~~~~~~~~~~~~~~~~~~~  "
sadness,http://farm8.staticflickr.com/7415/10137081826_a8d20785a3_z.jpg,1,4,Alone with my thoughts - Selsey - March 2013 Explore paulstokes259's photos on Flickr. paulstokes259 has uploaded 67 photos to Flickr.
sadness,http://farm9.staticflickr.com/8474/8365900065_d556bf1185_z.jpg,0,5,Summertime Sadness Explore Christine Leak's photos on Flickr. Christine Leak has uploaded 43 photos to Flickr.
sadness,http://farm7.staticflickr.com/6031/6384896387_73c36ae279_z.jpg,0,5,The walls we build around us to keep sadness out also keeps out the joy.  ~Jim Rohn  All Rights Reserved | Join my Facebook page:   B A Y A N  A L S A D i Q  Photography 
sadness,http://farm5.staticflickr.com/4073/4805976959_0bc79f1081_z.jpg,0,5,Fear Explore atomicpro's photos on Flickr. atomicpro has uploaded 247 photos to Flickr.
sadness,http://farm9.staticflickr.com/8097/8379256368_25503f448c_z.jpg,1,4,"Mary's Pain Not personally belonging to a Christian faith doesn't prevent me from holding close a deep admiration for the beauty of what Jesus Christ stood for. I was particularly taken by this memorial which, if I'm correct, is of the Holly Mother grasping at the cross with the word ""Cling"" written on it staring up, to the heavens above. The look on her face really speaks to me, the creator of this art somehow captures both horror and sadness in Mary's face but not without also leaving in some hope. When I see imagery like this, it serves to remind me why the Christian Faith is as large and meaningful in the lives of as many of my friends as I know it is. This is why no matter what faith I personally subscribe too,  I always consider it a blessing whenever anybody sends me a blessing. "
sadness,http://farm6.staticflickr.com/5586/15029830262_6805a9209e_z.jpg,1,4,Auschwitz1 Explore chrisxx64's photos on Flickr. chrisxx64 has uploaded 4609 photos to Flickr.
sadness,http://farm9.staticflickr.com/8163/6959127270_f1a4ce138f_z.jpg,0,5,lol stereotypical photo Canon G12 Featured in Saint Agnes Reflections video  
sadness,http://farm6.staticflickr.com/5064/5602023452_205274876d_z.jpg,2,3,IMG_0670 Explore fallingwater123's photos on Flickr. fallingwater123 has uploaded 5520 photos to Flickr.
sadness,http://farm4.staticflickr.com/3431/3732627459_60d52f03e6_z.jpg,1,4, 
sadness,http://farm3.staticflickr.com/2133/5780149740_311d7d4023_z.jpg,0,5,The Rain Holds the Tears of my Heart ...sometimes nature can express sadness in ways we cannot... Original and Prints :): www.etsy.com/shop/therubynest
sadness,http://farm9.staticflickr.com/8366/8525434019_0d0f96cc3e_z.jpg,2,3, 
sadness,http://farm8.staticflickr.com/7103/7207745886_55dcb83194_z.jpg,2,3,Tears of Sadness Explore Ileana Bojorquez's photos on Flickr. Ileana Bojorquez has uploaded 31 photos to Flickr.
sadness,http://farm3.staticflickr.com/2830/10013628615_f99485d64d_z.jpg,2,3,Panda sadness Taken by Ashley Nading edit by me
sadness,http://farm6.staticflickr.com/5048/5304447323_ea34c6e575_z.jpg,0,5,"Aberfan Coal Tip Disaster, Friday, 21 October 1966 27th October, 1966 :Attendees at Mass Funeral Site.  Image by  Bettmann/CORBIS"
sadness,http://farm4.staticflickr.com/3817/11454480314_b47a3455a8_z.jpg,1,4,Loki Deep thought or sadness?
sadness,http://farm4.staticflickr.com/3716/8958736134_54f23cc361_z.jpg,2,3,"Every seconds soaked in sadness Explore Nait,'s photos on Flickr. Nait, has uploaded 83 photos to Flickr."
sadness,http://farm3.staticflickr.com/2517/4018956500_b3f2c7b9ac_z.jpg,2,3,Broken Up Tags on Beacon Messages from one lover to the one who got away.  Found on the railing of the Atlantic St. stairs on N. Beacon Hill.  Was the gender of the writer?  What were the circumstances?  And what horrible crime happened on Myspace?
sadness,http://farm8.staticflickr.com/7574/15356482343_c0198eb43e_z.jpg,0,5,IMG_4211 Explore saru.gallery's photos on Flickr. saru.gallery has uploaded 1869 photos to Flickr.
sadness,http://farm9.staticflickr.com/8380/8585017615_908b7d12ed_z.jpg,1,4,* Explore Andrea Clemente's photos on Flickr. Andrea Clemente has uploaded 676 photos to Flickr.
sadness,http://farm5.staticflickr.com/4068/4438301454_ac1b6a43b9_z.jpg,1,4,.. Story of a suicide 6 .. www.facebook.com/robertafacchinifotografia for the whole story click here: www.youtube.com/watch?v=sebjQj9VJFY
sadness,http://farm3.staticflickr.com/2580/3816616816_063ddaa465_z.jpg,1,4,"THE BIG EMPTY. www.youtube.com/watch?v=xKhVH01x478  drivin' faster in my car falling farther from just what we are smoke a cigarette and lie some more these conversations kill falling faster in my car time to take her home her dizzy head is conscience laden time to take a ride it leaves today no conversation time to take her home her dizzy head is conscience laden time to wait too longto wait too long these conversations kill too much walkin', shoes worn thin too much trippin' and my soul's worn thin time to catch a ride it leaves today, her name is what it means too much walkin', shoe's worn thin"
sadness,http://farm8.staticflickr.com/7162/6645916199_4df9a20e5f_z.jpg,2,3,234 of 365 Sad Thursday
sadness,http://farm9.staticflickr.com/8334/8115759139_ac7ab6e44d_z.jpg,0,5,sadness Explore Joe Baker AKA Romeojo's photos on Flickr. Joe Baker AKA Romeojo has uploaded 6539 photos to Flickr.
sadness,http://farm4.staticflickr.com/3130/3146380214_917034d8dc_z.jpg,2,3,Sadness Rose Hill Cemetery photostroll. Blogged.
sadness,http://farm6.staticflickr.com/5564/14843639407_a333212f66_z.jpg,2,3,Auschwitz II-Birkenau Explore chrisxx64's photos on Flickr. chrisxx64 has uploaded 4609 photos to Flickr.
sadness,http://farm6.staticflickr.com/5224/5587849209_9cfca874dd_z.jpg,0,5,Sadness of MAD MAN Sad man Put his legs in the water  in the street  Silent mood with Sad Face ..Strange Man In rain While Very Difficult weather 
sadness,http://farm6.staticflickr.com/5282/5374614525_ac8e58b8d4_z.jpg,1,4,me n sadness hukhukhuk! :-( Hmm...n0b0dy kn0w...
sadness,http://farm5.staticflickr.com/4081/4922547308_df9e9164ce_z.jpg,1,4,She's a whore anyway. Explore Remember.'s photos on Flickr. Remember. has uploaded 253 photos to Flickr.
sadness,http://farm3.staticflickr.com/2066/13047953145_619b76de85_z.jpg,2,3,(SAY 'NO' MORE. YOU'RE DONE.) #goodbye #grateful #godhasaplan #grimdaiz #difficultchoice #faith #faithful #difficult #decision #done #singlesdevo #sadbuttrue #shrewdstories #sadness #surrender #sermon #sermononthemount #shrewd #bored #broken #truejoy #tal Explore grimdaiz74's photos on Flickr. grimdaiz74 has uploaded 3673 photos to Flickr.
sadness,http://farm9.staticflickr.com/8347/8240918415_3103b5c485_z.jpg,0,5,The Sadness of History  Gedenksttte Buchenwald Photo taken in Germany
sadness,http://farm3.staticflickr.com/2695/4370634357_24b8e4277a_z.jpg,0,5,Sadness Explore HoosierSands' photos on Flickr. HoosierSands has uploaded 6626 photos to Flickr.
sadness,http://farm8.staticflickr.com/7225/7402169626_393288efee_z.jpg,1,4,"IMG_2890 Cave Hill Cemetery - Louisville, KY."
sadness,http://farm4.staticflickr.com/3291/2366954358_3f1034ea03_z.jpg,1,4,"Farewell Mickey It is with deep sadness that we report the passing of Mickey, who suffered a heavy fall and lost his head. His memory shall live on..."
sadness,http://farm5.staticflickr.com/4116/4754830942_c303accdd4_z.jpg,1,4,cortina de lluvia y el golpeteo de las gotas contra los cristales
sadness,http://farm4.staticflickr.com/3563/3576413803_c61ff16b2b_z.jpg,1,4,The Biologist Explore Ulmar Chaves Viteri's photos on Flickr. Ulmar Chaves Viteri has uploaded 339 photos to Flickr.
sadness,http://farm4.staticflickr.com/3813/13563717475_0be0fc3f60_z.jpg,2,3, 
sadness,http://farm4.staticflickr.com/3221/3065765064_286d68755e_z.jpg,2,3,Mellon Collie and the infinite sadness Sentiva una gran tenerezza al pensare che la povera paralitica non poteva muoversi n parlare  Giovanni Verga    [ Smashing Pumpkins]
sadness,http://farm3.staticflickr.com/2053/2740345992_d666f7a468_z.jpg,1,4,the mighty warrior has fallen... day 111 it was one of those days were it took everything in me not to cry...  work is just harder then I ever imagined... I wish I could be as good as my co-workers..  and the icing on the cake? my teeth are hurting me once again in fact I can feel my left side of my face swelling... great
sadness,http://farm6.staticflickr.com/5085/5370985335_de9fd97080_z.jpg,2,3,"100930_Afgh_0026_031_e Safdar Tawakoli was recently christened the ""symbol of national unity"" by President Karzai. ""When I was younger,"" Tawakoli said to me, ""I did not want to leave my country for anything."" Throughout decades of war and despotic regimes, he stayed put. He survived the Taliban, a doubly dangerous task as a musician and a Hazara. ""But now, I am ready to leave,"" he says. There is a brittle tone in his voice that reveals his sadness. It is the sound of resign. He is weary of fearing for his own safety and that of his wife and children. For the first time in a long career dedicated to this violent country, Safdar is ready to seek peace elsewhere. The only problem is - he has nowhere to go. "
sadness,http://farm3.staticflickr.com/2525/4142369446_9b702b9b89_z.jpg,1,4,Medea re-invented Photoshoot Explore rose_imogen's photos on Flickr. rose_imogen has uploaded 1021 photos to Flickr.
sadness,http://farm3.staticflickr.com/2322/2194379116_a3a01406cc_z.jpg,2,3,"Heartfelt (Gone but not forgotten) Sometimes after the storm comes the waves, they roll until they gather momentum.  It has been six short weeks since ""my little Bug"" departed......and oh how I just want to touch his lovely little head.  The love remains, my heart is heavy.   I try to feel his spirit and I don't know where it is. Those waves - there must be a song about them somewhere.  I have two of his little whiskers that he lost during his treatments.  They are in my jewelry box.  His whiskers are diamonds.  Priceless diamonds."
sadness,http://farm4.staticflickr.com/3756/10983143663_99dcbe9839_z.jpg,2,3,Esboos Sem ttulo - Black Branches Book - Nanquim sobre papel / 2013
