sadness,http://farm6.staticflickr.com/5298/5587995211_eb28cc8ea0_z.jpg,2,3,"Power Lines in Water Ishinomaki Higashi Matsushima Yamoto Japan Earthquake Tsunami Disaster and Destruction Miyagi 2011 It took me a lot longer than I had expected to get these pictures up from last weekend, but it's been hard to find time between my job and volunteering.  Taking pictures just has not been the most important thing for me at this point, but nevertheless I will continue squeezing the shutter whenever I can.  Hopefully, we will all be able to see dramatic transformation of these areas back into their original beauty, but it is clearly a long road ahead.    If you live in the area and wish to help, please contact me and I will send you a list of volunteer centers throughout Miyagi as well as a list of important equipment to bring with you.  If you do decide to volunteer, please go with an organized group and bring the necessary equipment.  I don't mean to frighten anyone, but I was notified again today that there still are dangerous areas.  Don't go alone, please.    Here is a video that I took of the area the same day I took these pictures:  www.youtube.com/watch?v=CazswZd454o  The area that these pictures were taken, was utterly obliterated by the tsunami.  After a few hours of hauling items back and forth between my friends' destroyed home, I started to get a headache and feel sick from the fumes.  In my last post, I also mentioned that I had heard of people setting off explosions and starting fires from trying to light their cigarettes.    We worked amidst pure devastation for about 5 Hours, however we were only able to salvage a handful of their things. Sometimes it was hard to know what was theirs, since the tsunami had swept a whole city worth of belongings through the first floor of their home.  Surprisingly, the four-year-old house was in pretty good shape despite the fact that it was blown back off of its foundation about 200 feet and sat about 10-15 degrees off of level (in the video I said 60 feet, but I meant to say 60 meters.  The distance and angle is still a total guess, but you can judge for yourself in the pictures/video).  The structure of house was in such good condition, that we were able to walk up to the second floor and salvage most of the dry, smaller items.  Their daughter was just given a brand new bed and desk-set as an elementary graduation present, but we unfortunately could not take it out.     The reason we needed to go and salvage what we could as quickly as possible was because the house, although it did not look like it, was sitting in the middle of a road.  The city and self defense force had given them  only a few more days to clear out before they would have to bulldoze it down.    I asked the family if they had tsunami insurance, but apparently there is no tsunami insurance.  They will receive a small amount of money from the government, but it will not even come close to covering the damage they sustained.    The most dumbfounding part of that day for me was not surreal experience of walking through the total destruction of an entire town, but rather the laughing and smiling that came from a family who just lost everything- everything except each other.  Items and worldly possessions are of little value against the people we hold dear.  I tried to reciprocate the smiles, laughter, and healthy conversation (especially in light of the children), but it wasn't easy fighting off the grim emotions lurking below the surface.    This last weekend, I was able to volunteer for a short time in Downtown Ishinomaki and also take a few more pictures/video  The downtown area seems to be getting a lot more attention, and about half of the roads seem traversable.  Downtown also felt incredibly safe during the day time due to the dozens of police and military (both Japanese and US) walking the streets and distributing food and water at the camps.  I will post those pictures later this week.  I know my website is in shambles right now (I just have not had time), but I'm hoping to have it looking nicer as soon as possible.  I've never really sold anything from my website, but I'm going to donate all of the money I earn from ANY of the pictures I sell (not just the quake photos) to Red Cross Japan for at least the next year.  Please take it into consideration. Here is my site:  www.carstenKnoche.com  In addition, I contributed many of my pictures to QUAKEBOOK.org, and if you have never heard this organization, PLEASE check them out as well.  All of Quakebook's revenue will also go towards the Red Cross Japan.   www.quakebook.org/   Lastly, you can contribute directly to Red Cross Japan here:  www.jrc.or.jp/english/relief/l4/Vcms4_00002070.html  Thank you very much for facing this tragedy with us. With cooperation, strength, and perseverance, we can accomplish anything.  Take care, Carsten Knoche"
sadness,http://farm4.staticflickr.com/3281/2397317561_6d696ebc9b_z.jpg,2,3,Wondering... thinking Part of the photo essay showing our grief on the loss of our son Nicholas Kennedy Leon.
sadness,http://farm4.staticflickr.com/3341/3555333362_a8de39d4f0_z.jpg,2,3,331 - T -34 Sadness flies away on the wings of time. - Jean de La Fontain  does it really?
sadness,http://farm6.staticflickr.com/5249/5377871159_3b6e45544f_z.jpg,1,4,window and nude Explore DarkCla's photos on Flickr. DarkCla has uploaded 863 photos to Flickr.
sadness,http://farm7.staticflickr.com/6158/6190719256_d9da7438fa_z.jpg,0,5,Depression Explore gretchenpow's photos on Flickr. gretchenpow has uploaded 5725 photos to Flickr.
sadness,http://farm3.staticflickr.com/2938/13917185920_e53fdd3845_z.jpg,2,3,"Sad Boy A non landscape picture for a change... Little sad boy, actually he's probably grumpy with me for having a lie in and walking him later than usual.  I haven't posted anything for a while, not sure about this new Flickr format, but i'm going to try and post more frequently to try and get used to it again.   "
sadness,http://farm8.staticflickr.com/7367/11051232635_59ebe18048_z.jpg,1,4,distance II Explore ESPRIT CONFUS' photos on Flickr. ESPRIT CONFUS has uploaded 325 photos to Flickr.
sadness,http://farm6.staticflickr.com/5228/5675891308_32d0cdf0f8_z.jpg,1,4,where is wild where is wild
sadness,http://farm9.staticflickr.com/8287/7745774028_2f8b617297_z.jpg,0,5,Efi Sadness
sadness,http://farm3.staticflickr.com/2789/4071267477_42be2bb237_z.jpg,2,3,Inmenso abandono Only text comments are allowed. Otherwise the comments may be banned.  Se agradecen los comentarios con texto: GRACIAS.  ----------- Mi blog literario es: www.soloelmundoyyo.com.ar
sadness,http://farm9.staticflickr.com/8342/8153959082_f405210836_z.jpg,2,3,The sadness of autumn - rain in the fall Explore Roland Bogush's photos on Flickr. Roland Bogush has uploaded 4251 photos to Flickr.
sadness,http://farm6.staticflickr.com/5098/5477354275_f11e7dc687_z.jpg,1,4,"[ Within Temptation - Forgiven ] Omar Rodriguez V. Forgiven Within Temptation Digital . Fantasy . Art Omar Rodriguez V.   High Quality 666 x 806 px:  www.flickr.com/photos/slave4britney/5477354275/sizes/l/  Audio/Video:  www.youtube.com/watch?v=k6mQXa_0fyQ  Couldn't save you from the start Love you so it hurts my soul Can you forgive me for trying again Your silence makes me hold my breath Oh, time has passed you by  Ooh, for so long I've tried to shield you from the world Ooh, you couldn't face the freedom on your own Here I am left in silence  You gave up the fight You left me behind All that's done's forgiven You'll always be mine I know deep inside All that's done's forgiven  I watched the clouds drifting away Still the sun can't warm my face I know it was destined to go wrong You were looking for the great escape To chase your demons away  Ooh, for so long I've tried to shield you from the world Ooh, you couldn't face the freedom on your own And here I am left in silence  You gave up the fight You left me behind All that's done's forgiven You'll always be mine I know deep inside All that's done's forgiven  I've been so lost since you've gone Why not me before you Why did fate deceive me Everything turned out so wrong Why did you leave me in silence  You gave up the fight You left me behind All that's done's forgiven You'll always be mine I know deep inside All that's done's forgiven "
sadness,http://farm8.staticflickr.com/7220/6876966252_1d3425917c_z.jpg,0,5,Untitled Explore maggie c-'s photos on Flickr. maggie c- has uploaded 250 photos to Flickr.
sadness,http://farm4.staticflickr.com/3207/5739367981_b9e6bd5538_z.jpg,2,3,Sadness Explore GVG Photography's photos on Flickr. GVG Photography has uploaded 327 photos to Flickr.
sadness,http://farm7.staticflickr.com/6155/6163383314_142387ed54_z.jpg,1,4,The Sadness Will Never End Explore _xantto_'s photos on Flickr. _xantto_ has uploaded 3022 photos to Flickr.
sadness,http://farm5.staticflickr.com/4011/4387010121_92953f1117_z.jpg,2,3,Untitled Explore sXer's photos on Flickr. sXer has uploaded 370 photos to Flickr.
sadness,http://farm9.staticflickr.com/8432/7874180656_02c930a7d7_z.jpg,0,5,Old Geezer Explore Craig Kempf's photos on Flickr. Craig Kempf has uploaded 1703 photos to Flickr.
sadness,http://farm3.staticflickr.com/2085/2286167950_d71292470c_z.jpg,2,3,Angel Explore Jazzy Photography's photos on Flickr. Jazzy Photography has uploaded 482 photos to Flickr.
sadness,http://farm5.staticflickr.com/4125/4962064060_6cd3800da9_z.jpg,1,4,"""And what it all boils down to Is that no one's really got it figured out just yet"" 30/365  I totally do not feel sad or down. I was just playing around with my tripod and came up with this. I seriously envy all those creative individuals out there. Self portraits are not the easiest. It's also my first attempt at adding text to a picture.  Thanks everyone for 1100 views!!!"
sadness,http://farm4.staticflickr.com/3720/8981801066_b4e942ebcd_z.jpg,2,3,Untitled Explore elisewin?'s photos on Flickr. elisewin? has uploaded 609 photos to Flickr.
sadness,http://farm8.staticflickr.com/7012/6499902757_69ff29daba_z.jpg,2,3,P1000889 Explore bjarndyr's photos on Flickr. bjarndyr has uploaded 226 photos to Flickr.
sadness,http://farm6.staticflickr.com/5286/5350163551_63b1d029f5_z.jpg,2,3, 
sadness,http://farm8.staticflickr.com/7150/6506224453_41731a6743_z.jpg,2,3,sadness Explore brandongrays' photos on Flickr. brandongrays has uploaded 179 photos to Flickr.
sadness,http://farm8.staticflickr.com/7041/13304069275_2b8e60aaa9_z.jpg,2,3,sadness SONY ALPHA 35 // 50 MM // WORK 2013
sadness,http://farm9.staticflickr.com/8331/8384421701_4c2d635134_z.jpg,2,3,Serious Prislla
sadness,http://farm8.staticflickr.com/7108/8166867455_244004f194_z.jpg,0,5,Untitled Explore danielwillard's photos on Flickr. danielwillard has uploaded 3 photos to Flickr.
sadness,http://farm3.staticflickr.com/2783/4521056423_43c3061c58_z.jpg,1,4, 
sadness,http://farm7.staticflickr.com/6090/6105802608_1431dc0b10_z.jpg,1,4,"Our Lost Dreams... XXIX My Only Dream Is You, My Love. And You Are Not Lost, I'm Not Lost, Because We Found Each Other. And Forever, We Will Live A Dream, Our Dream! :)"
sadness,http://farm9.staticflickr.com/8527/8652150274_64b84ec9ef_z.jpg,2,3, 
sadness,http://farm8.staticflickr.com/7555/15815095390_48aeb90988_z.jpg,2,3,"Hushed I've lately become obsessed with quite, contemplative moments both for the subject and the viewer, and although many of them can invoke a feeling of sadness I believe there is a deep beauty in the quite moments, an emotional catharsis, aided by the ambience of silence. "
sadness,http://farm6.staticflickr.com/5503/9616600297_ab8004ae45_z.jpg,2,3,"90/365 ""Too Much""   I am having too much hit me. I am sleeping, crying, and being sad too much. I hate that I am leaving. I hate that I am so close to leaving. That I am so close to no longer sleeping in this bed with Chris.   I have too much going on. I can't wrap my head around all the responsibilities I have and all the new responsibilities that come with this move. I just want to stay in bed... I just want to sleep.   Did I mention I am sick? I can't even stay awake. Chris's mom made me chicken noodle soup because I couldn't even eat supper without getting sick to my stomach. It's been a bad day."
sadness,http://farm6.staticflickr.com/5246/5370702096_d22f6fa8f0_z.jpg,1,4,THE SADNESS OF HER Explore rmsgentlewind's photos on Flickr. rmsgentlewind has uploaded 78 photos to Flickr.
sadness,http://farm4.staticflickr.com/3018/3044241066_b6da296237_z.jpg,2,3,alienation Explore vetlife2005's photos on Flickr. vetlife2005 has uploaded 3111 photos to Flickr.
sadness,http://farm4.staticflickr.com/3861/14434274051_b6b5a78ba0_z.jpg,1,4,Sadness Explore Mo Mp M's photos on Flickr. Mo Mp M has uploaded 66 photos to Flickr.
sadness,http://farm4.staticflickr.com/3377/3583983570_ffea16bba3_z.jpg,2,3,K White beautiful sadness Explore LowDownOnline's photos on Flickr. LowDownOnline has uploaded 2007 photos to Flickr.
sadness,http://farm6.staticflickr.com/5097/5485785934_803b9dbc56_z.jpg,0,5,"Last Light Mount Olivet Cemetery - Nashville, TN."
sadness,http://farm3.staticflickr.com/2661/4134201464_2bac520b34_z.jpg,1,4,"Black and White Such Sadness.  Don't worry Mr. Bear...someday, you'll be free.   _____ ___  I didn't realize Ikea made depressed panda toys for kids.   ""Silly Swedes!, Pandas are for China!"""
sadness,http://farm4.staticflickr.com/3145/3036209016_870c0e0d4a_z.jpg,2,3, 
sadness,http://farm3.staticflickr.com/2706/4262070284_1187f239bd_z.jpg,1,4, Explore Jackie-answer's photos on Flickr. Jackie-answer has uploaded 123 photos to Flickr.
sadness,http://farm6.staticflickr.com/5252/5588577494_e2614d09fa_z.jpg,0,5,"Debris Piled on White Car Fringe of Tsunami Ishinomaki Higashi Matsushima Yamoto Japan Earthquake Tsunami Miyagi 2011 It took me a lot longer than I had expected to get these pictures up from last weekend, but it's been hard to find time between my job and volunteering.  Taking pictures just has not been the most important thing for me at this point, but nevertheless I will continue squeezing the shutter whenever I can.  Hopefully, we will all be able to see dramatic transformation of these areas back into their original beauty, but it is clearly a long road ahead.    If you live in the area and wish to help, please contact me and I will send you a list of volunteer centers throughout Miyagi as well as a list of important equipment to bring with you.  If you do decide to volunteer, please go with an organized group and bring the necessary equipment.  I don't mean to frighten anyone, but I was notified again today that there still are dangerous areas.  Don't go alone, please.    Here is a video that I took of the area the same day I took these pictures:  www.youtube.com/watch?v=CazswZd454o  The area that these pictures were taken, was utterly obliterated by the tsunami.  After a few hours of hauling items back and forth between my friends' destroyed home, I started to get a headache and feel sick from the fumes.  In my last post, I also mentioned that I had heard of people setting off explosions and starting fires from trying to light their cigarettes.    We worked amidst pure devastation for about 5 Hours, however we were only able to salvage a handful of their things. Sometimes it was hard to know what was theirs, since the tsunami had swept a whole city worth of belongings through the first floor of their home.  Surprisingly, the four-year-old house was in pretty good shape despite the fact that it was blown back off of its foundation about 200 feet and sat about 10-15 degrees off of level (in the video I said 60 feet, but I meant to say 60 meters.  The distance and angle is still a total guess, but you can judge for yourself in the pictures/video).  The structure of house was in such good condition, that we were able to walk up to the second floor and salvage most of the dry, smaller items.  Their daughter was just given a brand new bed and desk-set as an elementary graduation present, but we unfortunately could not take it out.     The reason we needed to go and salvage what we could as quickly as possible was because the house, although it did not look like it, was sitting in the middle of a road.  The city and self defense force had given them  only a few more days to clear out before they would have to bulldoze it down.    I asked the family if they had tsunami insurance, but apparently there is no tsunami insurance.  They will receive a small amount of money from the government, but it will not even come close to covering the damage they sustained.    The most dumbfounding part of that day for me was not surreal experience of walking through the total destruction of an entire town, but rather the laughing and smiling that came from a family who just lost everything- everything except each other.  Items and worldly possessions are of little value against the people we hold dear.  I tried to reciprocate the smiles, laughter, and healthy conversation (especially in light of the children), but it wasn't easy fighting off the grim emotions lurking below the surface.    This last weekend, I was able to volunteer for a short time in Downtown Ishinomaki and also take a few more pictures/video  The downtown area seems to be getting a lot more attention, and about half of the roads seem traversable.  Downtown also felt incredibly safe during the day time due to the dozens of police and military (both Japanese and US) walking the streets and distributing food and water at the camps.  I will post those pictures later this week.  I know my website is in shambles right now (I just have not had time), but I'm hoping to have it looking nicer as soon as possible.  I've never really sold anything from my website, but I'm going to donate all of the money I earn from ANY of the pictures I sell (not just the quake photos) to Red Cross Japan for at least the next year.  Please take it into consideration. Here is my site:  www.carstenKnoche.com  In addition, I contributed many of my pictures to QUAKEBOOK.org, and if you have never heard this organization, PLEASE check them out as well.  All of Quakebook's revenue will also go towards the Red Cross Japan.   www.quakebook.org/   Lastly, you can contribute directly to Red Cross Japan here:  www.jrc.or.jp/english/relief/l4/Vcms4_00002070.html  Thank you very much for facing this tragedy with us. With cooperation, strength, and perseverance, we can accomplish anything.  Take care, Carsten Knoche"
sadness,http://farm9.staticflickr.com/8328/8114846518_1bce2bbdc7_z.jpg,2,3,IE189-091 A ballerina crying
sadness,http://farm5.staticflickr.com/4140/4854216072_020111ff53_z.jpg,2,3,Fear. Explore GiuliaParisi's photos on Flickr. GiuliaParisi has uploaded 62 photos to Flickr.
sadness,http://farm3.staticflickr.com/2689/4316272537_c250c932b1_z.jpg,1,4,Cointreaupolitan 50 ml Cointreau 20 ml fresh lemon juice blackcurrant juice ice  mmm mniam
sadness,http://farm9.staticflickr.com/8003/7445150270_cae9a299d0_z.jpg,0,5, 
sadness,http://farm3.staticflickr.com/2069/2250458980_69a5197a29_z.jpg,2,3,"Let me go A tiger in Darjeeling zoo wishing he was free, and out of this cage..."
sadness,http://farm8.staticflickr.com/7564/15108082533_9616e5f7e5_z.jpg,1,4,My mind is killing me  Nice  06/11/2014
sadness,http://farm4.staticflickr.com/3034/2644155458_9c2d14d66b_z.jpg,1,4,"I committed suicide by tiny tiny increments for so long on n'a pas les os en verre, on peut se cogner  la vie"
sadness,http://farm9.staticflickr.com/8015/7678341560_79373ba308_z.jpg,2,3,but you promised FACEBOOK
sadness,http://farm9.staticflickr.com/8439/7845192818_392fd68d0d_z.jpg,1,4,I stole a key. Explore Ivn Ren's photos on Flickr. Ivn Ren has uploaded 440 photos to Flickr.
sadness,http://farm3.staticflickr.com/2943/15144143608_655b471971_z.jpg,2,3,"March Revolution 1848 Well, this photo arose during a re-staging of the Mrzgefallene in Berlin. That was a revolution in 1848 happening in Berlin and Vienna at that time.  A lot of actors created an atmosphere like you were back in 1848. Everything was so real. That was the reason to give the photos a vintage style. Of course that was my post production work, I used a DSLR. The idea was simple: Lets go back to the roots. I really fell in love with these photos because while I was taking them I felt sad because they played it quite realistic. Sadness is exactly that emotion which I wanted to recreate. "
sadness,http://farm8.staticflickr.com/7164/13579205494_bffc5f03a9_z.jpg,1,4, 
sadness,http://farm4.staticflickr.com/3332/4626438444_0323018310_z.jpg,2,3, You look so defeated lying there in your new twin size bed. With a single pillow underneath your single head. #1 of song lyric of the day..... Death Cab For Cutie: Your New Twin Sized Bed
sadness,http://farm3.staticflickr.com/2179/2300829742_4c547920c4_z.jpg,1,4, 
sadness,http://farm9.staticflickr.com/8081/8297128372_1246f0fff3_z.jpg,1,4,Left alone Little girl in a abandoned house in Croatia
sadness,http://farm5.staticflickr.com/4131/5083513539_51288a4959_z.jpg,0,5,Sadness flies away on the wings of time. TV:1/100 AV:5.6 ISO:100 Focal length:55.0mm Flash: Not fired Metering mode: Average  Quote by Jean de La Fontaine
sadness,http://farm3.staticflickr.com/2887/9593026957_bcd16fe137_z.jpg,2,3,Sun's fall Day 50 of 80 With eyes wide shut we lay stagnant awake Safe for now in this wondrous state Lost at a crossroad thats missing a sign How do we know if they made it alive?
sadness,http://farm6.staticflickr.com/5181/5598390018_42b8b8e8e7_z.jpg,1,4, 
sadness,http://farm8.staticflickr.com/7128/7780971312_deeec255fe_z.jpg,1,4,Look at the Time Felt like such an invasion of privacy taking this photo (even though it was shot @ 200mm and cropped significantly). You could just feel the emotion pouring from this sweet man who is terribly missing someone he loves. He continued to adjust & readjust the butterfly he brought until it was perfect. The natural vignette created by the tree & shadowing drew me in and intensified the sadness I felt for him.
sadness,http://farm6.staticflickr.com/5036/5908444663_fc0518cca8_z.jpg,1,4,"M245/0362 MODEL RELEASED. Depression. Portrait of an elderly man holding his hands to his face in a depressed, forlorn and lonely mood. He appears stressed. Most people experience symptoms of mild depression, such as excessive sadness or despair, at some point in life. It is common in the elderly who might be mourning the death of a spouse, feeling socially isolated, or may be physically ill and in pain. More women suffer depression than men."
sadness,http://farm8.staticflickr.com/7040/6985873099_0b75b912dd_z.jpg,2,3,SCRUB - Piercing Sadness - PREVIEW for GSP Credits
sadness,http://farm4.staticflickr.com/3283/3035989004_c528570912_z.jpg,2,3, 
sadness,http://farm8.staticflickr.com/7209/6792986372_c1e28af321_z.jpg,2,3,"Cause Ive seen your sadness grow. And it swallows these days until it hurts to breath.  she's the one keeping me alive and she doesn't even know. i love her.  she wouldn't like this picture, but it's special to me.   i know it's weird, but i somehow like that my pictures are not getting much feedback lately. i am glad that i like it. it means i do photography for myself, art for myself and i don't need other people to like it to be able to appreciate it myself.  281/365."
sadness,http://farm5.staticflickr.com/4096/4770175461_21eb9d54d1_z.jpg,2,3,Untitled Explore www.sidneymorgan.com's photos on Flickr. www.sidneymorgan.com has uploaded 144 photos to Flickr.
sadness,http://farm4.staticflickr.com/3424/3784372653_9676110f83_z.jpg,0,5,"The Visitors II Mt. Hope Cemetery - Franklin, TN."
sadness,http://farm3.staticflickr.com/2808/9672475181_2f0b739e71_z.jpg,2,3,"The girl who waited What, I've been watching a lot of Doctor Who lately.  It seemed like an appropriate title.  Don't judge me!   500px | Blog | Facebook | Tumblr"
sadness,http://farm6.staticflickr.com/5082/5343510736_292771e1d9_z.jpg,2,3,"Teardrops out-in side, south pier. San Benedetto del Tronto, AP, 25-12-10."
sadness,http://farm3.staticflickr.com/2017/2270794027_f4f936ec83_z.jpg,2,3, 
sadness,http://farm9.staticflickr.com/8150/7116978723_1636c2dd25_z.jpg,2,3,IMG_1405 Explore yuicino's photos on Flickr. yuicino has uploaded 1035 photos to Flickr.
sadness,http://farm8.staticflickr.com/7179/13900971502_f23bef2981_z.jpg,2,3,Sadness Jesus Christ and his mother Mary.
sadness,http://farm2.staticflickr.com/1396/5122013141_34d866a0d0_z.jpg,2,3,"I Miss You For more please visit: -----------------------------  yaruali.blogspot.com  also   please join us on Face book ---------------------------------------  www.facebook.com/pages/Karachi-Pakistan/Artistic-Edge/972...   Thanks & Regards,  Yaru Ali CEO Artistic Edge"
sadness,http://farm4.staticflickr.com/3589/3469436451_3ed74fd9e0_z.jpg,1,4,thefuneral 207 Explore Ciara*'s photos on Flickr. Ciara* has uploaded 3490 photos to Flickr.
sadness,http://farm3.staticflickr.com/2637/4215909763_01a754fa0d_z.jpg,2,3,    *  !!     =( 
sadness,http://farm8.staticflickr.com/7028/6597220373_dd0529e300_z.jpg,2,3,Sadness II Explore Diego Iberri Fotografa's photos on Flickr. Diego Iberri Fotografa has uploaded 364 photos to Flickr.
sadness,http://farm7.staticflickr.com/6028/5921344922_4ec3fac5b5_z.jpg,1,4,a horse sadness Explore snow tear's photos on Flickr. snow tear has uploaded 6 photos to Flickr.
sadness,http://farm9.staticflickr.com/8098/8475415943_f01bd9f9f2_z.jpg,1,4, 
sadness,http://farm8.staticflickr.com/7204/7134295965_6c9d303661_z.jpg,2,3,A man with sadness on a grave He seemed to lose his family or relative. He didn't move for a long time. On 5th November 2011.
sadness,http://farm8.staticflickr.com/7090/6863650514_0950a3da4f_z.jpg,1,4, 
sadness,http://farm5.staticflickr.com/4066/4573834987_c802988fbe_z.jpg,2,3,Painting of Today Explore kinakat's photos on Flickr. kinakat has uploaded 656 photos to Flickr.
