sadness,http://farm3.staticflickr.com/2577/3879072998_dcd0ff4e3e_z.jpg,2,3,Stories behind Glass (see whole set) Explore The Tango of Photography's photos on Flickr. The Tango of Photography has uploaded 3076 photos to Flickr.
sadness,http://farm4.staticflickr.com/3104/2851695450_56399f3174_z.jpg,1,4,"Sad Statue This is one of the most beautiful cemetary statues i have ever seen.  I pass her with her back to me daily but I never see her face.  Notice the detail in the sleaves of her dress and the wreath of flowers in her hand.  New Hartford, Ct."
sadness,http://farm4.staticflickr.com/3639/5692586570_ff9fc47ed6_z.jpg,2,3,Waiting for a Reply I cry out in the night because I cannot wait for the morning.
sadness,http://farm8.staticflickr.com/7072/7162057656_207803b414_z.jpg,2,3,Dark Scene Les compagnies forestires ont tellement fait de coupe  blanc dans la rgion que ce phnomne m'a inspir cette photo que j'ai remplie de noirceur et de tristesse. Cette photo reprsente bien mon tat d'esprit face  cette destruction d'habitat naturel au non de la prosprit conomique.    Forest companies have cut so many tree in the region that it inspired me this photo that I have filled with darkness and sadness. This really captures my state of mind against this destruction of our natural habitat in the name of economic prosperity.  
sadness,http://farm8.staticflickr.com/7110/7851589628_162438d348_z.jpg,1,4,sadness Explore chiara.tad's photos on Flickr. chiara.tad has uploaded 189 photos to Flickr.
sadness,http://farm4.staticflickr.com/3678/9206500799_d57fe6c939_z.jpg,0,5,#art #sadness #blue #yellow #lilac #beautiful Explore alexayzuniga's photos on Flickr. alexayzuniga has uploaded 143 photos to Flickr.
sadness,http://farm4.staticflickr.com/3450/3988371519_0bb87db637_z.jpg,2,3,"Graham Button 3 Theatre Masks Happy And Sad, Laugh And Cry"
sadness,http://farm4.staticflickr.com/3440/3262737715_c8e90dd022_z.jpg,1,4,"Silence View On Black  Vows are spoken To be broken Feelings are intense Words are trivial Pleasures remain So does the pain Words are meaningless And forgettable  All I ever wanted All I ever needed Is here in my arms Words are very unnecessary They can only do harm  by Depeche Mode ""Enjoy the Silence"" www.youtube.com/watch?v=bldZ8gizZgQ&feature=related  PS had one flickr member blasting my pics and advising me to quit photography immediately. You know I was smiling :) It's a shame - he is a good artist, too bad that a total jerk."
sadness,http://farm6.staticflickr.com/5208/5268953909_0a4dc5f609_z.jpg,2,3," ......          ,            They grant to us the world and what in it and they are dead, offer to us themselves as the withered roses that indicate only the sadness and the pain   by my pen"
sadness,http://farm8.staticflickr.com/7062/6994007950_3428cf6df4_z.jpg,1,4,"Anna For Karinella99's BNTM: Song Titles- Just To Get High So, I chose the song Just To Get High by Nickelback. Here is my story for it: So, Anna was walking one day to her friend Carly's house. As she walked in, she found her getting high off Cocaine. Anna screamed at her, calling her every name in the book. She stormed out of the house. That night, she was walking down the street and took a wrong turn. SHe ended up down an allyway, which happened to be a dead end. As she made her way through the small path, she tripped and fell over something. As she turned around, it was Carly. She was a slight shade of blue, her lips and nose very badly beaten. There was no life in her eyes. As it turned out, Carly was beaten to death because she did not pay her dealer in time.  From now on, Anna holds a slight guilt against herself, knowing that she could have done something better to help, than just yell. She visits her grave weekly, and recites the same lines (which are from the song lol)  ""Tell me what you gone and done now!  A gun would do the trick, get it over with,  You're better off...  To take all you've got and burn it on the spot,  To get high-igh, igh, igh (high-igh, igh, igh).""  So, yeah! I hope we get a good placing! :D  "
sadness,http://farm4.staticflickr.com/3497/4001092683_1508aa7222_z.jpg,1,4,"Almohada // Pillow Confidente, blanda amiga de mis emociones. Suave y fiel compaera de mi llanto.  T, que callas cuando grito.  T, que eres muda ante mis lgrimas y guardas el secreto de mis sollozos.   -Natalia Ansua-  ----------------------------------------  Confidant, soft friend of my emotions. Soft and faithful company of my tears. You, that shut up when I shout. You, that become dumb before my tears and keep the secret of my sobs.  -Natalia Ansua-"
sadness,http://farm4.staticflickr.com/3860/14482885798_ab0f4cf691_z.jpg,1,4,sadness Explore VladaJablanov's photos on Flickr. VladaJablanov has uploaded 835 photos to Flickr.
sadness,http://farm4.staticflickr.com/3746/9217343209_9423af7b18_z.jpg,2,3,IMG_0571b Explore sarahkoontz's photos on Flickr. sarahkoontz has uploaded 255 photos to Flickr.
sadness,http://farm4.staticflickr.com/3479/3801751717_29626cb58a_z.jpg,0,5,Sorrow Please View On Black
sadness,http://farm4.staticflickr.com/3112/2621844423_2a88aa81b4_z.jpg,1,4,"even, when is bad.. always together.. Explore kochana1_2007's photos on Flickr. kochana1_2007 has uploaded 179 photos to Flickr."
sadness,http://farm6.staticflickr.com/5087/5382044352_c8a97aa37b_z.jpg,0,5,Time After Time Lying in my bed I hear the clock ticks and think of you  
sadness,http://farm9.staticflickr.com/8638/15715009423_547c2b906a_z.jpg,1,4,"Colonel Nahida Ahmad Rashid With A Picture Of Captain Rangin Yousuf Killed By Daesh, Sulaymaniyah, Kurdistan, Iraq  Eric Lafforgue www.ericlafforgue.com "
sadness,http://farm6.staticflickr.com/5511/14225108803_d004fea938_z.jpg,1,4, 
sadness,http://farm5.staticflickr.com/4108/5090722919_7fa40fea10_z.jpg,0,5,"Beauty from Pain The lyrics are from Beauty from Pain by Superchick. Great band. I enjoy many all of their songs. I try to bring out only pure emotion in this and my inspiration belongs within my life. I love, I hurt, and someday I hop again. Please tell me what you think."
sadness,http://farm4.staticflickr.com/3199/2668622830_710c00cb88_z.jpg,2,3,"Sad fiddler This Romanian Fiddler tried to entertain us, but the sadness in his eyes was obvious..."
sadness,http://farm9.staticflickr.com/8322/8055539180_7dcb99b07f_z.jpg,1,4,"Untitled acrylic on board, 2012"
sadness,http://farm4.staticflickr.com/3653/5783614480_4c4afacd04_z.jpg,0,5,she knows what is sadness Explore shovagabonda's photos on Flickr. shovagabonda has uploaded 165 photos to Flickr.
sadness,http://farm8.staticflickr.com/7140/7153072615_c37194a8c3_z.jpg,2,3,"Heartache 3rd photo in my Forget Me Not Series. This whole series represents the stages of grief and sadness and how I deal with it. I wanted this to look like you were peering through a looking glass. The girl just wants to be alone, to wallow in her heartache and sadness. Everyone needs their time by themselves to heal. See the series  here MORE TO COME"
