sadness,http://farm9.staticflickr.com/8232/8456953689_729ac02bc7_z.jpg,0,5,"Do Not Wait Till I Am Gone If you're ever going to love me, love me now while I can know All the sweet and tender feeling which from real affection flow. Love me now, while I am living; do not wait till I am gone And then chisel it in marble-- warm love words on ice-cold stone.  If you've dear, sweet thought of me, why not whisper them to me? Don't you know 'twould make me happy and as glad as glad could be? If you wait till I am sleeping, ne'er to waken here again, There'll be walls of earth between us and I couldn't here you then.  If you knew someone was thirsting for a drop of water sweet Would you be slow to bring it? Would you step with laggard feet? There are tender hearts all round us who are thirsting for our love; Why withhold from them what nature makes them crave all else above?  I won't need your kind caresses when the grass grows o'er my face; I won't crave your love or kisses in my last low resting place. So, then, if you love me any, if it's but a little bit, Let me know it now while living; I can own and treasure it.  (Author Unknown)"
sadness,http://farm6.staticflickr.com/5575/14679010608_156fb4b3fc_z.jpg,1,4, 
sadness,http://farm6.staticflickr.com/5324/9088578723_d90978f68c_z.jpg,1,4,DSC_1295 me by Nelly
sadness,http://farm9.staticflickr.com/8450/8027512035_d63b57b17f_z.jpg,1,4,"Cry light(ly) These self-portrait images follow a progression of emotions. The first image was created by using several layers, color filters, and adjustments. First I added a normal photo layer, then a brightness layer to bring out the ray of sunlight under my eye. Next I decreased the exposure and readjusted with two more layers to change the brightness. The next layer was a color burn layer to darken the grass and darken and highlight my hair, followed by a hue layer to darken the grass so the eye would not be drawn too much to the left of the image and away from my face. The final layers were color dodge and saturation layers to bring out tones in the color of my eye.  I made these changes to communicate a message about light. I communicated a certain sadness in my expression and the way I took the photograph created a prism effect through my eye. This makes it look like sunlight is falling from my eye as if it were a tear. This represents the first idea of my progression: sometimes crying is necessary to cleanse sadness and to bring light and clarity to a situation. "
sadness,http://farm4.staticflickr.com/3118/2919209765_97913d831d_z.jpg,2,3,"Heart Breaking Taken for October MSH - Heart Breaker  I wasn't sure whether to use this shot or not. I went to the local cemetary today intending to take a shot of my fathers grave to use for this category, as a young child it broke my heart when he died.  As we were walking round we saw this grave of a 15 year old girl who died 8 years ago. The well tended grave, the lanterns, the windchimes and the fresh flowers show how much she must have been loved. The heart shaped border of the inscription and the wording that her no doubt broken hearted parents chose to use moved me incredibly.  The death of a child is something I cannot imagine and my heart goes out to her family.  This sums up heartbreaker for me more than anything else ever could."
sadness,http://farm8.staticflickr.com/7506/15934115229_9f38e8b989_z.jpg,2,3,Sone statue Stone statue at Monserrat
sadness,http://farm5.staticflickr.com/4055/5124641190_d786fa2ca9_z.jpg,2,3,Moment of Despair Explore Alex E. Proimos' photos on Flickr. Alex E. Proimos has uploaded 6509 photos to Flickr.
sadness,http://farm6.staticflickr.com/5070/5675269926_607c4eaf23_z.jpg,2,3,Sadness Behind Sadness little mermaid.   from little Mermaid project ;) Test for wig. X3     (  O_o'') (??)   XP
sadness,http://farm5.staticflickr.com/4141/4865744359_2164607874_z.jpg,0,5,A portrait of loneliness Explore falysiya's photos on Flickr. falysiya has uploaded 131 photos to Flickr.
sadness,http://farm3.staticflickr.com/2461/5855551087_910bac0286_z.jpg,2,3,"no A/C lots of cries At my neurologist today, the A/C was out. While it was awful, the pain was 97% of the tears"
sadness,http://farm8.staticflickr.com/7133/7660797568_d8c7be1ede_z.jpg,1,4,Sabrina Photographer: Daniele Nicolucci Model: Sabrina Di Battista Make-up artist: Stefania Di Gregorio  Follow on FB for sneak peeks and previews!  Check out my other photos of Sabrina here and all my models here!
sadness,http://farm3.staticflickr.com/2905/14149863298_2d38f7b05d_z.jpg,2,3,girl_angel_wings_windows_sky_clouds_purity_sadness_chain_9577_640x1136 Explore vadaka1986's photos on Flickr. vadaka1986 has uploaded 11920 photos to Flickr.
sadness,http://farm8.staticflickr.com/7516/16334055742_1f24c38f3e_z.jpg,2,3,"Yezedi Baby Refugee Displaced From Sinjar, Duhok, Kurdistan, Iraq A few kilometers outside of Dohuk, Iraq, what was supposed to be a five-star hotel has become a nightmarish makeshift refugee camp. After ISIS attacked Sinjar, massacring and enslaving the local Yazidi people, a few of those fortunate enough to escape have sought refuge at the massive Hotel Kayar (literally place where one receives friends). With construction stalled in its early stages, the concrete structure is an inhospitable environment for the 63 Yazidi families who now call it home. Children play with no railing or walls to prevent them from falling. We just want tents like the other refugees, said one man, after a storm recently ravaged the little infrastructure they managed to set up in the two months theyve been here. With a cold winter right around the corner and scarce food and water, the future looks dire.And the kids keep smiling...   Eric Lafforgue www.ericlafforgue.com "
sadness,http://farm5.staticflickr.com/4129/4839503306_238e633321_z.jpg,2,3,"La Prisonnire ""How could I not have noticed long ago that Albertine's eyes belonged to the family of those...  which seem made up of different elements for all the different places where their owner would like to be--and will not admit that she would like to be--on a given day?  Eyes always lyingly motionless and passive, but dynamic, measurable by the metres or kilometres to be covered in order to arrive at the desired--implacably desired--meeting-place, eyes given not so much to smiling at the temptations of pleasure, as to clouding over with sadness and discouragement at the thought of possible difficulties separating them from the goal.  Even held in one's hands, these beings are creatures of flight.  To understand the feelings they inspire and which other beings, even more beautiful ones, cannot, we must consider them not as immobile but in movement, and add to their description a sign corresponding to the sign for speed in physics"" Marcel Proust, In Search of Lost Time  Unidoll Selina as Albertine"
sadness,http://farm3.staticflickr.com/2781/4501273550_a56004f4f1_z.jpg,2,3,Sadness well dressed Explore Captain Kodack***Lost at sea's photos on Flickr. Captain Kodack***Lost at sea has uploaded 1226 photos to Flickr.
sadness,http://farm7.staticflickr.com/6099/6391200039_f392a40274_z.jpg,2,3,Sadness Explore laxfhbb13's photos on Flickr. laxfhbb13 has uploaded 46 photos to Flickr.
sadness,http://farm8.staticflickr.com/7215/7402193668_4eb56ef418_z.jpg,0,5,"IMG_2862 Cave Hill Cemetery - Louisville, KY."
sadness,http://farm6.staticflickr.com/5571/15098041960_774e59f395_z.jpg,2,3, 
sadness,http://farm9.staticflickr.com/8240/8530710338_d58fef1647_z.jpg,1,4, 
sadness,http://farm3.staticflickr.com/2322/2462510355_6984ef6292_z.jpg,0,5,Bathroom Depression Explore The GlassPeople's photos on Flickr. The GlassPeople has uploaded 1750 photos to Flickr.
sadness,http://farm3.staticflickr.com/2177/2464525268_6c80ee8437_z.jpg,2,3,SADNESS Explore shielachua2000's photos on Flickr. shielachua2000 has uploaded 13 photos to Flickr.
sadness,http://farm8.staticflickr.com/7414/12956694313_0dab783dcf_z.jpg,1,4,318 - the number of sadness Cimitero delle Fontanelle - Napoli
sadness,http://farm6.staticflickr.com/5484/10926629446_7531b5baa7_z.jpg,1,4,"Last photo of Mrs. Chan - Melody and her mother 131006-130216 C4Tc This mother daughter image was captured during a Sunday visit to Mrs. Chan's San Francisco home. Yes, that is how Melody's mother was addressed - Mrs. Chan. Of course she was also called mom, grandma, sister, aunt, friend, and confidant by family and friends.  Ninety-three is a ripe old age but it is still difficult to see our loved ones walking toward the bridge that will pass them to the other side. It is with both sadness and relief that Mrs Chan crossed that bridge yesterday, Sunday morning, six weeks to the day after the taking of this photo on October 6, 2013.  Please help Mrs. Chan on her journey with thoughts, good wishes, and especially - if you are inclined - your prayers. "
sadness,http://farm9.staticflickr.com/8302/7851538944_c2f34eb536_z.jpg,2,3,Goodbye #Sadness # Explore Pouyaa's photos on Flickr. Pouyaa has uploaded 1264 photos to Flickr.
sadness,http://farm3.staticflickr.com/2707/4546219179_b2c3dd4eea_z.jpg,0,5,"Woman in Black at Fort Custer Woman in black walking among gravestones at Fort Custer National Cemetery, a national cemetery where military veterans are buried, near Augusta and Battle Creek, Michigan, USA, 2008_MI_3406"
sadness,http://farm8.staticflickr.com/7307/11685358984_c56e99901d_z.jpg,2,3,P1010954 Sadness
sadness,http://farm9.staticflickr.com/8403/8700240908_c729148e34_z.jpg,2,3,Trapped in sadness Explore Albin Thelander's photos on Flickr. Albin Thelander has uploaded 193 photos to Flickr.
sadness,http://farm3.staticflickr.com/2889/10683722975_c3028a3a43_z.jpg,2,3,World Trade Center Freedom Tower
sadness,http://farm8.staticflickr.com/7382/10616719296_303b63b499_z.jpg,2,3,Lake side Explore Dan Burlacu's photos on Flickr. Dan Burlacu has uploaded 67 photos to Flickr.
sadness,http://farm9.staticflickr.com/8261/8678732222_4fd8cb869f_z.jpg,0,5,TEAR DROP A macro photograph of a single tear drop on an eyelash. 
sadness,http://farm7.staticflickr.com/6201/6092251492_ee9d73a623_z.jpg,0,5,SATURATED NIGHTS Explore YAHSHEIK's photos on Flickr. YAHSHEIK has uploaded 2704 photos to Flickr.
sadness,http://farm8.staticflickr.com/7113/8152310346_268c49057a_z.jpg,2,3,Industry It is amazing to see such and change over my short 28 years in the Hazeltons. From a booming forestry industry when I was a kid to complete closure of a majority of the mills. Left are only worn out gloves and memories of the past. 
sadness,http://farm4.staticflickr.com/3065/2369394771_b632bb640a_z.jpg,1,4,Sadness  All rights reserved
sadness,http://farm4.staticflickr.com/3864/15007664940_12b2e942f2_z.jpg,0,5, 
sadness,http://farm4.staticflickr.com/3522/5745796246_a7c7f43e50_z.jpg,2,3,"Mystery ~ Very Sick ~ Mom Afraid! Sweet Mystery has not been feeling too well the past two weeks.  She was diagnosed with kidney failure (CRF) last August and had barely eaten much over the last two days.  She was uncomfortable and began secluding herself.  I took her to the vet on Friday, May 20.  She has fluid in her abdomen and blood tests revealed that she does have early stage kidney failure but that will not be severe til later on probably a few years from now. She does have fluid in her abdomen.  Fluid retention can be a sign of heart troubles, cancer or something else but Mystery has been having health troubles since August 2010. If it is cancer, then it has had a lot of time to spread.  An x-ray to see what is wrong was taken then later on in June if there is still fluid, perhaps an ultrasound. . She is 15 years old.  If an ultrasound reveals cancer that is operable, such as the spleen then she will need surgery.  Now, Sweet Mystery may have a very uncomfortable and perhaps a short time which I was certainly not expecting.  Perhaps there is a solution, but when Mystery ignores treats like chicken, tuna and salmon that is not a good sign.  Early this Sunday, May 21 just after midnight she ate some chopped up steak.  There is some hope if she can keep this down and digest it as cats cannot go without food for very long.  Had planned to take her in for emergency IV but she was able to eat more then and went in for a check up on Tuesday.  She is my Fur Baby and has been with me as a kitten from three months of age!  Sending my Adorable Girl Healing Rainbows and Hopes of several more years!  Mystery has been back to the vets and received medication for pain and to help remove fluids. Some time in June she will have another check up to see if she still has fluid in the abdomen. It is now June 3rd and in a few days the course of medicine will be finished, then another vet visit.  Many Furry Thanks and Purrs to all for your support and Hopes for Sweet Mystery!"
sadness,http://farm6.staticflickr.com/5174/5473346346_4bcbe73108_z.jpg,2,3,photoshoot Explore cnilson2011's photos on Flickr. cnilson2011 has uploaded 156 photos to Flickr.
sadness,http://farm4.staticflickr.com/3293/2884502037_a16dc4231e_z.jpg,2,3,Beauty and sadness ... View Large On Black  La foto non  mia: l'ho avuta in prestito daTamel Aike per provare un effetto in postproduzione. Qui trovate il collegamento all'originale: www.flickr.com/photos/tamel_aike/2872404306/  This picture is not mine: I have been lent it by Tamel Aike just to try some postproduction effect. Here is the link to original shot: www.flickr.com/photos/tamel_aike/2872404306/   Explore  # 46  del 24/09/2008    
sadness,http://farm4.staticflickr.com/3863/14866749066_0d90a7950b_z.jpg,0,5,"tears I was writting a blog post about my past and it brought up a lot of emotions, I wanted to capture a picture that showed the sadness, so I decided to take some selfies. Don't judge"
sadness,http://farm8.staticflickr.com/7009/6732989899_9c385f452e_z.jpg,2,3,"Thoughts Va por t, amigo. www.goear.com/listen/e386695/holding-my-thoughts-in-my-he..."
sadness,http://farm5.staticflickr.com/4059/4558111560_25d158b6f9_z.jpg,1,4,Bonfim. Cemitrio do Bonfim - Belo Horizonte MG Fotos Tatiana Caju Sexta dia 23/04  ''O outono em Silncio''  www.tatianacaju.com.br
sadness,http://farm9.staticflickr.com/8264/8684356522_b2ca93c489_z.jpg,1,4,flowers_for_the_dead SONY DSC
sadness,http://farm3.staticflickr.com/2668/3777969196_a8a198b604_z.jpg,0,5,b+w from a series of self portraits I did on how I've been feeling about some recent changes in my  life and the loss of my hair.
sadness,http://farm9.staticflickr.com/8356/8336733282_312d70e584_z.jpg,0,5, 
sadness,http://farm8.staticflickr.com/7386/11881902926_d8f8577d9a_z.jpg,2,3,Sad Eyes Explore AlbertoViMa's photos on Flickr. AlbertoViMa has uploaded 98 photos to Flickr.
sadness,http://farm8.staticflickr.com/7181/6923951751_fa3232147a_z.jpg,2,3,Sadness in my eyes Canon Powershot G12
sadness,http://farm8.staticflickr.com/7010/6772148313_026d3d3bfc_z.jpg,2,3,"Celestial Kingston Cemetery is the largest of Portsmouth's three cemeteries. It opened in 1856 and was subsequently extended several times up until 1910. The layout is formal and features tree-lined avenues. The Neo-gothic style twin chapels remain, as do two lodges, one of red brick and another of flint and Portland rubble stone.  More creative angles, thanks to the little G1 and that fold out screen."
sadness,http://farm3.staticflickr.com/2450/3608639592_fe0d7bfc62_z.jpg,1,4,100_7705 Explore deidre92's photos on Flickr. deidre92 has uploaded 191 photos to Flickr.
sadness,http://farm5.staticflickr.com/4017/4279717305_6ebe34fba9_z.jpg,2,3,"Attempted Escape! View On Black  Mount Olivet Cemetery - Nashville, TN.     This grave has a hole in it.  Beneath the slab is approximately a half arm's length of air then it is dirt and sticks (or was it bones?!).  "
sadness,http://farm4.staticflickr.com/3182/2759134528_906e33de5f_z.jpg,2,3,ROWS OF HEROS The section
sadness,http://farm9.staticflickr.com/8341/8171854778_c5a4e44955_z.jpg,0,5,sadness ! Explore 9ale7_92's photos on Flickr. 9ale7_92 has uploaded 209 photos to Flickr.
sadness,http://farm6.staticflickr.com/5027/5673479275_ec8a00476b_z.jpg,1,4,My Art; Sadness Circa '95
sadness,http://farm6.staticflickr.com/5251/5457606295_900da470b8_z.jpg,1,4,Sadness Explore Miss Bite's photos on Flickr. Miss Bite has uploaded 163 photos to Flickr.
sadness,http://farm9.staticflickr.com/8309/8006815168_e5ceecd6cb_z.jpg,2,3,"2012-08-12 Cast iron At the Steenbrugge Municipal Cemetery near Bruges, Belgium cmsen.eghn.org/steenbrugge See all the pics I took at this stunning place: bit.ly/SFlRWj                                "
sadness,http://farm4.staticflickr.com/3174/5869423956_7ebb7c0259_z.jpg,2,3,sadness selfportrait
sadness,http://farm5.staticflickr.com/4092/5121836103_16f3ca7b35_z.jpg,0,5,6 Assignment 4: Halloween
sadness,http://farm4.staticflickr.com/3905/14929759200_670dd1c16c_z.jpg,2,3,"thoughts... [unknown] Rua Augusta, Lisbon, Portugal"
sadness,http://farm5.staticflickr.com/4080/4829237448_dd86bd4e98_z.jpg,1,4,Sadness Explore eric . espinoza's photos on Flickr. eric . espinoza has uploaded 1064 photos to Flickr.
sadness,http://farm6.staticflickr.com/5128/5332931749_40af0a5355_z.jpg,1,4,sadness Explore Militonov's photos on Flickr. Militonov has uploaded 9 photos to Flickr.
sadness,http://farm8.staticflickr.com/7055/7052311943_a3102886cf_z.jpg,1,4,Oestar Pagan Goddess of Fertility and Renewal.  Easter Emotions.
sadness,http://farm4.staticflickr.com/3018/3002220434_b15d8eb91e_z.jpg,0,5,"hold your sadness like a puppet, just keep putting on the play. but everything you do is leading to the point, where you just won't know what to do. and at that moment you may laugh, but there is someone there who will be laughing louder than you. so it's true,  the trick is complete. now you have become everything, you said that you never would be. you're a fool!  you're a fool!"
sadness,http://farm4.staticflickr.com/3525/3964173078_f014071fc2_z.jpg,2,3,doll Explore Bruna La Serra's photos on Flickr. Bruna La Serra has uploaded 465 photos to Flickr.
sadness,http://farm8.staticflickr.com/7389/10764057063_eff621c051_z.jpg,2,3,"""The Pain"" Facebook 108/365"
sadness,http://farm6.staticflickr.com/5167/5297238632_84bd5d68e9_z.jpg,2,3,"Jiufen beautiful little town, nevermind the tourists"
sadness,http://farm8.staticflickr.com/7227/7044765223_f8aab20835_z.jpg,1,4,"the girl who can't be moved Pauline, octobre 2011,  A Meteor Shower "
sadness,http://farm9.staticflickr.com/8153/7428312406_132cc6f7e5_z.jpg,2,3, 
sadness,http://farm6.staticflickr.com/5323/9351399331_cd98229c30_z.jpg,2,3, 
sadness,http://farm8.staticflickr.com/7043/13587664563_925e638f6a_z.jpg,2,3,African immigrant and elderly man sleep in a square.Greece Explore aggelikikoronaiou's photos on Flickr. aggelikikoronaiou has uploaded 1695 photos to Flickr.
sadness,http://farm7.staticflickr.com/6146/5970443463_6315b5b981_z.jpg,2,3,Shame & Sadness Explore CreativCaptures' photos on Flickr. CreativCaptures has uploaded 537 photos to Flickr.
sadness,http://farm9.staticflickr.com/8250/8664834164_3d3cc5c129_z.jpg,1,4,Agony Becomes Unforgettable Seering Emptiness pt. III Explore Isabelle Sais' photos on Flickr. Isabelle Sais has uploaded 315 photos to Flickr.
sadness,http://farm6.staticflickr.com/5120/14240367753_feccf0540d_z.jpg,1,4,"Barras de Bar, vertederos de amor www.youtube.com/watch?v=WZhfr7JYacc"
sadness,http://farm4.staticflickr.com/3702/13707121855_2dcbdc5a0c_z.jpg,0,5,Uni Project Explore molliewhitear's photos on Flickr. molliewhitear has uploaded 57 photos to Flickr.
sadness,http://farm6.staticflickr.com/5262/5794249696_a72f14f78c_z.jpg,2,3,  Explore Elle Gazelle's photos on Flickr. Elle Gazelle has uploaded 119 photos to Flickr.
sadness,http://farm4.staticflickr.com/3936/15630188056_c6d2feb981_z.jpg,1,4,Portait of young boy assignment  
sadness,http://farm7.staticflickr.com/6037/6334508650_8be1aae1b3_z.jpg,2,3,"sadness woman at the window - Kathmandu  This photo is part of the album :  ""Npal""   "
sadness,http://farm8.staticflickr.com/7155/6613035787_5eb2dea1e5_z.jpg,2,3,"WEBsad FACES 158a www.youtube.com/watch?v=DXfDlY5s96A  Conceptual photography project by Daniel Polacek (student of INSTITUTE OF CREATIVE PHOTOGRAPHY OF THE SILESIAN UNIVERSITY). The photographs shows apokalypse atmosphere on faces of some people, who are addicted on webcamera chat."
sadness,http://farm4.staticflickr.com/3695/10986208715_aa28bdc815_z.jpg,0,5,Nmero imperfecto. +
sadness,http://farm6.staticflickr.com/5494/13971767297_71c8d91233_z.jpg,2,3,Sadness Lyon
sadness,http://farm6.staticflickr.com/5613/15208771283_d5574f41ce_z.jpg,1,4, 
sadness,http://farm3.staticflickr.com/2538/5728531979_2e30b0b42a_z.jpg,0,5, 
sadness,http://farm3.staticflickr.com/2899/14520321903_79a3e76c53_z.jpg,1,4,Sadness at cemetery Explore onefootman1's photos on Flickr. onefootman1 has uploaded 200 photos to Flickr.
sadness,http://farm4.staticflickr.com/3674/13180885195_96dbe57419_z.jpg,2,3,Sadness Fotografa de un elecho. La posicin y el da lluvioso inspiran tristeza en la foto.
sadness,http://farm5.staticflickr.com/4098/4940423354_95b897148d_z.jpg,2,3,"memento mori remember you will die  total lack of emo pictures in my status lately. TIME TO GET DEPRESSING PEOPLE.  I've noticed something really weird though...when there's a majority of happy, sunshine-y pictures in my stream, I'm going through a hard time in life and I'm actually not happy at all. When I have a majority of darker pictures like this, it means I'm happy. WEIRD, HUH?  today was suuuuuuuch a good photography day. oh my gosh. I found this location today and i basically went crazy. It was like an abandoned fort built during world war 2 that's pretty much falling to pieces and rotting away. SO COOL. Its like one of those places you just KNOW is haunted.  I was like a little kid finding plastic eggs on easter o_O  one in commeeeeents fooooormspring: www.formspring.me/chaosincolor"
sadness,http://farm8.staticflickr.com/7140/6860380316_1b41b2e194_z.jpg,2,3,sadness PhotoVogue  feel free to follow me on: facebook page blogspot
sadness,http://farm3.staticflickr.com/2737/4119765155_c60bbd1f72_z.jpg,1,4,"Sean Maxey Funeral (Sun Sentinel) Sean Maxey's mother is consoled by a family member at her son's funeral service.  Sean Maxey was the driver in the Coral Springs car wreck last weekend. The service was scheduled for 10 a.m. at St. Elizabeth Ann Seton Church, 1401 Coral Ridge Drive, Coral Springs.  (Shot for Sun Sentinel)  **ALL PHOTOS COPYRIGHT IAN WITLEN. ALL UNAUTHORIZED USAGE IS PROHIBITED. PLEASE CONTACT IAN WITLEN FOR LICENSING AVAILABILITY (ian@theCameraClicks.com)"
sadness,http://farm3.staticflickr.com/2519/3850485849_9038999718_z.jpg,2,3,Sadness Explore karinatwork's photos on Flickr. karinatwork has uploaded 937 photos to Flickr.
sadness,http://farm9.staticflickr.com/8032/7893884268_7db25c74be_z.jpg,2,3,IMG_4290 Explore neveselova's photos on Flickr. neveselova has uploaded 56 photos to Flickr.
sadness,http://farm8.staticflickr.com/7212/7325026540_19c986132b_z.jpg,2,3,"What's this? On May 28, my friend showed me a baby sparrow. This very tiny sparrow was picked up by an elementary school child, and entrusted to my friend. But my friend is not familiar with birds. So she left the sparrow with me.  My family and I took care of this tiny sparrow. We named him ""pi-chan"". Gave some meal, spoke to him, and prepared for comfortable bed.   When I call his name, he always gazed my face. It was very very precious and happy time.  But unfortunately, on the morning of May 31, he's gone to heaven. My family and I were shocked and feeling immeasurable sadness.  I hope that his last days were happy. Thank you pi-chan, we never forget you."
sadness,http://farm8.staticflickr.com/7553/15804755960_5d47e466d3_z.jpg,1,4, 
sadness,http://farm8.staticflickr.com/7288/8743072273_91777e9eaa_z.jpg,2,3,2 Explore OutsidetheBoxImaging's photos on Flickr. OutsidetheBoxImaging has uploaded 89 photos to Flickr.
sadness,http://farm8.staticflickr.com/7006/6386855271_434b8522ce_z.jpg,2,3,Unanswered ~! Q
sadness,http://farm9.staticflickr.com/8348/8185055694_b353b87487_z.jpg,0,5,"_DSC2326 For a college assignment, tried to show poverty"
sadness,http://farm8.staticflickr.com/7498/15556486263_4fe3d48f65_z.jpg,2,3, 
sadness,http://farm4.staticflickr.com/3905/14418213437_684e02074f_z.jpg,2,3, 
sadness,http://farm3.staticflickr.com/2359/5727239649_7e65c11a1c_z.jpg,0,5,Untitled Explore Gabor Kiss' photos on Flickr. Gabor Kiss has uploaded 25 photos to Flickr.
sadness,http://farm4.staticflickr.com/3789/9583822599_275ef579ee_z.jpg,2,3,Sadness Explore Negens' photos on Flickr. Negens has uploaded 277 photos to Flickr.
sadness,http://farm8.staticflickr.com/7340/11216719373_ef2bb3b50d_z.jpg,1,4,"Cimitero Monumentale di Staglieno, Genova The Staglieno Cemetery, Genoa"
sadness,http://farm3.staticflickr.com/2355/5713276702_5b510ac62e_z.jpg,1,4,Untitled ..Said Jon the red nose #3  Soundtrack: Sia- Breathe me (live)
sadness,http://farm5.staticflickr.com/4142/4909810109_cdf85327fc_z.jpg,2,3,A Measure of Sadness Suede
sadness,http://farm8.staticflickr.com/7385/14013666498_d232485b0d_z.jpg,2,3,birth Explore ukraine fabulous. art's photos on Flickr. ukraine fabulous. art has uploaded 56 photos to Flickr.
sadness,http://farm9.staticflickr.com/8442/7830672928_bc0ed8d67a_z.jpg,2,3,Sadness wonder Explore Nuha Othman's photos on Flickr. Nuha Othman has uploaded 90 photos to Flickr.
sadness,http://farm7.staticflickr.com/6198/6124112396_592640ea32_z.jpg,2,3,Mysterious Sadness Explore RyanYahya's photos on Flickr. RyanYahya has uploaded 18 photos to Flickr.
sadness,http://farm4.staticflickr.com/3193/3077557758_8cbe5dd243_z.jpg,2,3,A Day Before Tomorrow 1714 ADBT day 3 and 4 stills
sadness,http://farm8.staticflickr.com/7243/13842820815_81a9098fdc_z.jpg,1,4,sexy sadness Explore paintintheass' photos on Flickr. paintintheass has uploaded 120 photos to Flickr.
