sadness,http://farm3.staticflickr.com/2705/5735353939_0fe078782d_z.jpg,0,5,loss Explore bella marie 85's photos on Flickr. bella marie 85 has uploaded 142 photos to Flickr.
sadness,http://farm4.staticflickr.com/3293/3060870084_aa8a9dbe5d_z.jpg,1,4,IMG_2849 Explore finrod's photos on Flickr. finrod has uploaded 3192 photos to Flickr.
sadness,http://farm5.staticflickr.com/4136/4882167578_535e03be9d_z.jpg,0,5,tears of small sadness Explore andrea n. deverell's photos on Flickr. andrea n. deverell has uploaded 184 photos to Flickr.
sadness,http://farm9.staticflickr.com/8157/7445115010_5d272e234d_z.jpg,1,4, 
sadness,http://farm4.staticflickr.com/3177/2690121976_7615559db3_z.jpg,1,4,008. Explore sheseemscool's photos on Flickr. sheseemscool has uploaded 12 photos to Flickr.
sadness,http://farm5.staticflickr.com/4064/4292635370_ed790aecf0_z.jpg,2,3,Untitled Explore tangerineteeth's photos on Flickr. tangerineteeth has uploaded 2478 photos to Flickr.
sadness,http://farm3.staticflickr.com/2357/2336377998_7aa1295a64_z.jpg,0,5,Sadness II Explore Ben Jamieson Photography's photos on Flickr. Ben Jamieson Photography has uploaded 1670 photos to Flickr.
sadness,http://farm3.staticflickr.com/2812/8937447287_664bd5e385_z.jpg,2,3,adorable sadness Explore rachelsbabies' photos on Flickr. rachelsbabies has uploaded 1234 photos to Flickr.
sadness,http://farm6.staticflickr.com/5532/14631886991_e950282f3b_z.jpg,1,4,A Time Alone Explore DanRWin [ista:danrwin]'s photos on Flickr. DanRWin [ista:danrwin] has uploaded 1832 photos to Flickr.
sadness,http://farm9.staticflickr.com/8530/8648352497_6591dc9899_z.jpg,2,3,42-16604619 Young man in prayerful attitude --- Image by  Royalty-Free/Corbis
sadness,http://farm3.staticflickr.com/2892/8943978842_692f404c91_z.jpg,2,3,Sadness Fabin Olate 
sadness,http://farm6.staticflickr.com/5211/5384110094_4e16309b88_z.jpg,2,3,Le carr carlate The scarlet square All rights reserved - Tous droits rservs  Model : Ambre   Make-up : Emmanuelle Legrain Hairstyle : Jessica Chatelain  Christine Lebrasseur - Photographe   French Website   Christine Lebrasseur Photo Studio     DNA  - Ipernity -  YouTube - JPGMag  - Facebook   
sadness,http://farm6.staticflickr.com/5286/5336626188_1d51ef52ac_z.jpg,2,3,Entre Kalaw et le lac Inle Explore AurelieLollie's photos on Flickr. AurelieLollie has uploaded 18 photos to Flickr.
sadness,http://farm5.staticflickr.com/4094/4735049498_d84789e6c3_z.jpg,0,4,"Sometimes, I wish. When I went to the clinic, I felt putrid and sick. I loathed every inch of my being. I kept repeating to myself, ""Christ forgives, He loves me, He knows me. He will see into my heart and know I am sorry"". It's hypocritical, and so like a sinner.   A man shoved a sign in my face, as he stood outside the clinic walls, and told me I was a murderer.  And I agree with him.  But that doesn't mean this is black and white. I never thought I would be at that place, in that seat, with my boyfriend at my side and a doctor reading off a list of side affects from taking a deadly pill.    My throat was dry and constricted with tears as the doctor instructed me on what to do. I could see it in his eyes that he knew I loved this baby, and I his empathy was etched into his face.  I am consumed entirely with grief.  And as the days went on, I told my poor baby how much I loved him. Sickening, and devastating; but real. I dreamed of holding him in my arms, of cradling him at night, of bright blue eyes and curly chestnut hair.   First steps, first words, first birthdays and Christmas's. I wanted it all.  But I couldn't give him the life it would deserve. And I was to selfish to give him away and have my heart live outside my chest, without me to protect him.  Pro-lifers ask how pro-choicers can live with themselves after it's all said and done?  Well, first...we have to figure out how to live again.  Then rest will take awhile."
sadness,http://farm9.staticflickr.com/8482/8235218348_b5910fcb58_z.jpg,2,3,Sleeping sad rhino Explore Adam Seymour photography's photos on Flickr. Adam Seymour photography has uploaded 66 photos to Flickr.
sadness,http://farm4.staticflickr.com/3268/2759135938_cf9d8d2dba_z.jpg,1,4,ANCHOR AND ROPE Explore Kittie52's photos on Flickr. Kittie52 has uploaded 4370 photos to Flickr.
sadness,http://farm5.staticflickr.com/4037/4660150159_603a20306f_z.jpg,2,3,Sadness LB
sadness,http://farm8.staticflickr.com/7291/9499304189_c68ee3a729_z.jpg,2,3, 
sadness,http://farm3.staticflickr.com/2580/4060061620_232a899ce9_z.jpg,0,5,"Sadness Yet Prevails Mount Olivet Cemetery - Nashville, TN."
sadness,http://farm4.staticflickr.com/3847/14979993279_4b3424d849_z.jpg,1,4,Repost from @tylerhiggs 246/365. #summertimesadness #abstract #human #emotion #sadness #depression #art #illustration #inkart #instaart #instadaily #artists_insta #artist_sharing #artist_features #artist_4_shoutout #drawing #sketching #doodle #penart #art Explore http://xeeme.com/LADYTEREZIE's photos on Flickr. http://xeeme.com/LADYTEREZIE has uploaded 13194 photos to Flickr.
sadness,http://farm9.staticflickr.com/8038/8002860876_43d9776b2a_z.jpg,1,4,Sadness molo.me/p/0yfPFw (Photo taken and uploaded via MOLOME)
sadness,http://farm9.staticflickr.com/8038/8051267743_611e6d4176_z.jpg,2,3,"Sadness abounds These photos are taken from the actual water source in Atangala, Uganda."
sadness,http://farm8.staticflickr.com/7012/6717153579_dae450e3bf_z.jpg,0,5,take sadness away art print sent to me by a friend
sadness,http://farm9.staticflickr.com/8075/8378799583_1c7591ef78_z.jpg,2,3,Sadness           
sadness,http://farm4.staticflickr.com/3570/3649309071_080b6a4f90_z.jpg,1,4,Plaza del Carmen 012 Explore Nite_Owl's photos on Flickr. Nite_Owl has uploaded 4614 photos to Flickr.
sadness,http://farm3.staticflickr.com/2624/3768948303_f1b8679c03_z.jpg,2,3,"The sadness of knowing that there are more stars in the sky and watch them pass, like the wind Explore DRUNK ON SHADOWS' photos on Flickr. DRUNK ON SHADOWS has uploaded 3552 photos to Flickr."
sadness,http://farm4.staticflickr.com/3465/3976117096_18d41a24c9_z.jpg,1,4,melancholy brain this week I was attacked (am being attacked) by a swarm of migraines.  I'm a pretty melancholy guy as it is ... this REALLY puts a damper on my mood.  pain and blindness does that to a guy
sadness,http://farm9.staticflickr.com/8043/8119942254_5a2b1be317_z.jpg,1,4,"Sadness. La fede non ci salva per questo mi confesso con il barman ogni volta che bevo, la vista si appanna ma vedo i drammi che mi porto appresso riflessi nel vetro."
sadness,http://farm8.staticflickr.com/7261/7564844286_e68ddba2aa_z.jpg,0,5,aztec sadness Explore Mademoiselle Ptissire's photos on Flickr. Mademoiselle Ptissire has uploaded 87 photos to Flickr.
sadness,http://farm9.staticflickr.com/8533/8701817977_e722c51778_z.jpg,1,4,"Un Matto Tu prova ad avere un mondo nel cuore  e non riesci ad esprimerlo con le parole.  E alla luce del giorno si divide la piazza: tra un villaggio che ride e te, lo scemo che passa. E neppure la notte ti lascia da solo:  gli altri sognan se stessi, e tu sogni di loro."
sadness,http://farm6.staticflickr.com/5206/5203059428_0046beba7b_z.jpg,2,3,"WEBERWIESE! Productora: HELICPTERO Direccin/Cmara: Nicols Uboldi Asist. direccin/Cmara: Federico Telerman 2do. asist. direccin: Julin Vey DF: Francisco Bouzas Escenografa: Rafael Perczyk, Nahuel Pieiro y Martn Canal Vestuario/fotografa: Neya Ottonello  Filmado en Villa Devoto durante Noviembre del 2010"
sadness,http://farm4.staticflickr.com/3330/3206878822_d17a825706_z.jpg,2,3,Sorrow. Eyes are more accurate witnesses than ears.
sadness,http://farm4.staticflickr.com/3634/3368216504_f536591e51_z.jpg,1,4,The shadow of your smile...    meglio on Black e large ^-^  [ExplorE]
sadness,http://farm8.staticflickr.com/7144/6832959943_e4ceed84b4_z.jpg,1,4,"L'Anti Saint-Valentin -4- J'aime beaucoup photographier la Saint-Valentin...A ma faon  moi. Si pour certains, la Saint-Valentin est prtexte  passer des moments tout tendres, s'offrir chocolat, fleurs ou bijoux, il n'en est pas ainsi pour tout le monde... Il y a les autres... Alors je vous offre l'Anti Saint-Valentin...Une histoire triste et je vous laisse le soin d'y ajouter les paroles que vous voulez  Modle: Johanne Lapointe qui a jou  merveilles les motions dramatiques malgr le froid mordant.  Encore une fois, merci Johanne."
sadness,http://farm3.staticflickr.com/2606/3975952002_5ef2218a2c_z.jpg,1,4,"Dreaming of freedom A child's view from a school outside of Angkor Wat, Cambodia.  These two young boys wanted to be outside playing and not stuck in their dark crowded classroom.  AThailand 553"
sadness,http://farm6.staticflickr.com/5446/9359018224_eab87f9df3_z.jpg,0,5,monu196 Explore [Blackriver Productions]'s photos on Flickr. [Blackriver Productions] has uploaded 11481 photos to Flickr.
sadness,http://farm8.staticflickr.com/7186/14053224302_d90aff98dd_z.jpg,2,3, 
sadness,http://farm9.staticflickr.com/8388/8532985732_105e9bcee5_z.jpg,0,5,"Adults, are like, this mess of sadness and phobias. Explore Alexa_Nikol's photos on Flickr. Alexa_Nikol has uploaded 390 photos to Flickr."
sadness,http://farm3.staticflickr.com/2238/2362673748_89c1bcf208_z.jpg,0,5,SOFFERENZA - SUFFERING Explore mic970's photos on Flickr. mic970 has uploaded 67 photos to Flickr.
sadness,http://farm6.staticflickr.com/5159/5886056871_55a2200d22_z.jpg,0,5, 
sadness,http://farm6.staticflickr.com/5159/7377639682_5cb33b131f_z.jpg,0,5,old man and sadness at the first time he looked pretty worried and staring at those abandoned plastic bottles.... 
sadness,http://farm8.staticflickr.com/7157/6682724177_65abac0649_z.jpg,1,4,Sadness Explore Alysha Michelle Photography's photos on Flickr. Alysha Michelle Photography has uploaded 118 photos to Flickr.
sadness,http://farm8.staticflickr.com/7019/6482875763_1c34ec2533_z.jpg,0,5, 
sadness,http://farm4.staticflickr.com/3500/3898122273_34e9aab755_z.jpg,1,4,"beautiful lady Cimetiere du Pere Lachaise - After spending a considerable amount some time searching for the graves of Jim Morrison, Emile Zola, Balzac, Oscar Wilde, and Delacroix I stumbled upon this woman sitting quietly in her sadness.  Out of respect, I silently photographed her, and she was kind enough to oblige.  When I was moved by beauty of her sadness, I can only imagine at whom she has lost.  Unfortunately I did not ask, and unfortunately she did not say."
sadness,http://farm9.staticflickr.com/8482/8218895362_6ec3d9acbb_z.jpg,2,3,"Ves esa cara de desesperacin? Es simplemente una expresin triste, ahogada en s misma,  en el pozo sin fondo de su alma. Es una mirada desesperada, desgarradora y desgarrada, que ya no sabe qu hacer, si seguir chillando lagrimas de angustia o dejar de intentarlo para siempre.   No es ms que una mirada que pide a gritos de locura que le comprendas y escuches; nada ms. Y que le ayudes. Que le ayudes a superar lo que est viendo y sintiendo. En el pozo sin fondo de su alma.  Que puede que no te sepa explicar qu siente e intuye, y puede que a veces no le entiendas. Pero no te pide nada de eso, simplemente que no le judges.  Porque nadie mejor que esta mirada sabe, lo que hay en el otro lado del pozo sin fondo de su alma.   Inspired by this amazing shot."
sadness,http://farm9.staticflickr.com/8643/16349635292_27d7e4cc07_z.jpg,1,4,Sadness Explore isarib48's photos on Flickr. isarib48 has uploaded 46 photos to Flickr.
sadness,http://farm8.staticflickr.com/7389/10713620043_bd985a6593_z.jpg,2,3,Sadness Explore DJTChill's photos on Flickr. DJTChill has uploaded 483 photos to Flickr.
sadness,http://farm2.staticflickr.com/1188/5159263082_0e013ed530_z.jpg,1,3,Sadness Sadness
sadness,http://farm6.staticflickr.com/5242/5370906517_bc6ea83576_z.jpg,2,3,black eye Explore Kathryn Thomas Photography's photos on Flickr. Kathryn Thomas Photography has uploaded 23 photos to Flickr.
sadness,http://farm8.staticflickr.com/7210/6986111672_616e47d5ba_z.jpg,0,5,"Sensations ... sometimes in the life. Getting tired or feeling alone or ... what you could think just now. Maybe this is the future for our youngs? Taken by my daughter Bruna. Light post processing by me. *** PLEASE, STOP FAVS WITHOUT COMMENTS. THANKS ***"
sadness,http://farm4.staticflickr.com/3916/14185507160_b0f2e09459_z.jpg,2,3,It's time to be emotional No hay nada que valga tanto Como las cosas que llevas dentro As que no las cambies nunca por nada Y jams pierdas la capacidad de emocionarte...  ---   Music to be moved    
sadness,http://farm9.staticflickr.com/8388/8645540120_237be88db8_z.jpg,0,5,Lo sfiorir J. Dugdale inspired
sadness,http://farm8.staticflickr.com/7386/9256426707_4731f7e9e9_z.jpg,1,4,sadness Explore scylla2008's photos on Flickr. scylla2008 has uploaded 891 photos to Flickr.
sadness,http://farm6.staticflickr.com/5250/5265107410_1e45880424_z.jpg,1,4,sweet pleasures 9 Explore IngridKarisImages' photos on Flickr. IngridKarisImages has uploaded 118 photos to Flickr.
sadness,http://farm3.staticflickr.com/2439/3685899402_ee30c3fb26_z.jpg,1,4,"The Sadness Within Sculpture from Malo Island, Vanuatu   I should stop posting so much on the Louvre but I really can't help it! There was just too much to see there and so much to snap. The 2 hours I spent wandering around and enjoying the works of art obviously wasn't enough!    I guess I should take a break from my Paris photos and move on to those from Germany after this post.. haha. (can I resist the temptation of going back to my Paris shots? LOL)    Explore #291, July 4, 2009   "
sadness,http://farm3.staticflickr.com/2420/2455713396_405d94d47f_z.jpg,2,3,"You Dream Flat Tires ""Woman she bounce back easy."" ~The Joni Mitchell Project"
sadness,http://farm5.staticflickr.com/4052/4683643223_a67f02dd47_z.jpg,2,3,Intervencin 010 | El lado oscuro de Niceto por Kelo 70 Segundos antes del KO Intervencin 010 | El lado oscuro de Niceto por Ezequiel Espsito www.flickr.com/kelotraveler
sadness,http://farm9.staticflickr.com/8466/8102332772_0b5bee76f8_z.jpg,2,3,"( Week 5) using non verbal Communication sad motions are shown in many different ways in animation the most popular way is a tear in the eye but there can be many movements from putting your head down or in a animals case thee ears flop down when naturally they are raised.With human charcters they normally show sadness as ,l depending on what is making them cry but just sadness the will frown and look down.Unless it is a really bad incident in which case they will start to tear from the eyes and open there mouth and make a noise.  Some examples of when animals are sad in animation and what they do is when stitch is sad his eyes start to close his ears go down eye brows go in.  0:27 ,0:50 , 1:10 www.youtube.com/watch?v=-sQ0ilYEj-I  An example of how sadness is shown in in human characters is when lilo think stitch dies and lilo is heartbroken and really sad .  1:40 www.youtube.com/watch?v=8_961b5vrME&feature=related  "
sadness,http://farm6.staticflickr.com/5073/14331437845_644bbae161_z.jpg,2,3,Sadness Explore James Marshall Photography's photos on Flickr. James Marshall Photography has uploaded 287 photos to Flickr.
sadness,http://farm4.staticflickr.com/3173/2829214886_b2b4f7a4a5_z.jpg,1,4,Criada Explore ElMarto's photos on Flickr. ElMarto has uploaded 337 photos to Flickr.
sadness,http://farm6.staticflickr.com/5257/5453097977_0a2f56576a_z.jpg,0,5,"Farewell [Explored] Explore - February 17, 2011.  My first one :-)  Thank you all for the comments and faves"
sadness,http://farm3.staticflickr.com/2912/13803077195_a7780fab68_z.jpg,2,3,CD - Sadness Kaoru once again thrown down by the world. Shortly before raging and breaking that rusted cars glass window.
sadness,http://farm9.staticflickr.com/8389/8580927318_f17c53b877_z.jpg,2,3,devastated man Explore Basiarachwalphotography's photos on Flickr. Basiarachwalphotography has uploaded 65 photos to Flickr.
sadness,http://farm5.staticflickr.com/4017/4418563150_673585e319_z.jpg,1,4,Daddy's 005 Explore Lolo2182's photos on Flickr. Lolo2182 has uploaded 1001 photos to Flickr.
sadness,http://farm4.staticflickr.com/3282/2462902456_f6127f6e2e_z.jpg,2,3,sadness Explore dinelleworlddomination's photos on Flickr. dinelleworlddomination has uploaded 1695 photos to Flickr.
sadness,http://farm3.staticflickr.com/2267/5814105269_b6d03e5e72_z.jpg,2,3,* press L
sadness,http://farm6.staticflickr.com/5178/5407788014_3aa087af25_z.jpg,0,5,"Thomas Tristonho (Thom Sadly)  So Paulo, Brazil. 2011  www.thomastristonho.com.br www.oqueetristesapravoce.com.br"
sadness,http://farm9.staticflickr.com/8319/7967937316_90fef69d6d_z.jpg,2,3,"Petey's grave? Contrary to Roadside America's claim, I don't think this is actually Petey from the LIttle Rascals. Petey was a pit bull."
sadness,http://farm8.staticflickr.com/7511/15568931163_f090cc5029_z.jpg,2,3,Dreams of the dreaming Explore noralundberg's photos on Flickr. noralundberg has uploaded 18 photos to Flickr.
sadness,http://farm4.staticflickr.com/3679/11838736195_e24864b655_z.jpg,0,5,"Foreshadowing of sorrow Within a 2 week deadline, I had a task to create 4 images which symbolize a 'heart'. I focused on the emotion of being in love. For example; sorrow, attraction, desire and caring. Once again, I have used Maurizio Anzeri as inspiration because I just love the technique and detail by stitching to create the atmosphere within the image.  As you can see in this image the strength of the lines get the audience to follow down the page, to imitate the movement of sadness with the eyes (to look down).    Robyn McCoy-Hopwood UCAS Number: 111-287-8776 Graphic Communication robynhopwood@hotmail.co.uk "
sadness,http://farm6.staticflickr.com/5192/7225996502_8a6ca57ece_z.jpg,1,4,suicide join my facebook art-paje ^_^ www.facebook.com/zaseshvili !!
sadness,http://farm8.staticflickr.com/7275/7632987204_ca8579985e_z.jpg,0,5,Sadness Explore Jordan_Rey's photos on Flickr. Jordan_Rey has uploaded 49 photos to Flickr.
sadness,http://farm4.staticflickr.com/3148/2945809099_6e96888de6_z.jpg,1,4,Doggie Explore Dragan*'s photos on Flickr. Dragan* has uploaded 339 photos to Flickr.
sadness,http://farm9.staticflickr.com/8519/8559074975_3acdb533ba_z.jpg,1,4,"Paranoia constante, diez millones de errores. Me disculpo si he mentido, si he daado a mi enemigo, qu mas da si gano o pierdo? cada historia es un recuerdo. Cuanta gente pasa por mi vida, caras desconocidas, cuanta ira conquistandome y siempre conquistado.  Esta vida, dice mi madre: es precioso vivirla; esta vida que se descara, que apunta y luego dispara. Y con la mano me limpio si la vida me escupe en la cara y si intenta aplastarme yo soy el primero que ataca, nunca aprend a acerptarlo, ni a manejarlo, me roba el aire y ya no quiero intentarlo... Y cuando el fin se acerque slo ser el principio, tiempo esperando en los renglones nuevos precipicios, mientras esperas tu turno se escribe el guin ms absurdo, nadie te ve pues la escena duro un segundo. Y aun no s quien soy me asusto con mi reflejo, vuelvo a decir las mismas palabras de mi enredada vida y en este juego sin final mi alma se fatiga. Todo parece falso, se vuelve complicado, fcil, amargo y agridulce como el pasado.  Paranoia constante, diez millones de errores; raro soy y lo acepto, y tengo mas de un defecto pero alguien me dijo un segundo perfecto: voy a abrirte la puerta, da una ultima vuelta; y decid esperar, quise quedarme quieto, guardar la vida en fotos y aguantar un nuevo invierno. Una vez ms destruyo lo que toco como siempre; s que pedir perdn no cambiara el dolor que sientes...     El Fin - Tiziano Ferro.   Twitter | Blog | Tumblr | Ask | Instagram "
sadness,http://farm5.staticflickr.com/4093/5449317480_65a0f9230f_z.jpg,2,3,Omaggio alla tristezza tribute to sadness
sadness,http://farm8.staticflickr.com/7574/15605262547_f0e2b964b9_z.jpg,1,4,Plays in loops until it's madness inside my head. #beautiful #art #life #sadness #thinking #forget Explore Habz7's photos on Flickr. Habz7 has uploaded 238 photos to Flickr.
sadness,http://farm3.staticflickr.com/2039/5804847972_59658f4645_z.jpg,2,3,Sadness 0109 Explore AlyssaXsaysXyo's photos on Flickr. AlyssaXsaysXyo has uploaded 72 photos to Flickr.
sadness,http://farm3.staticflickr.com/2828/9256247457_6c5964300a_z.jpg,2,3,"Emotion Playing a mute electric guitar against the wall of an abandoned streetcar station, the man in the photo seems to express a certain sadness through his gazing eyes, a kind he strives to channel through his instrument. Yet, like his mute guitar, the mans struggles in life are heard by few.   If only we could somehow hear the music flow, we might be surprised at the resonance the mans reminiscences of the past brings. "
sadness,http://farm4.staticflickr.com/3357/3317815320_b9bc356b82_z.jpg,1,4,Sad Tears of sadness cause i forced him to come inside... its just too cold out there today
sadness,http://farm8.staticflickr.com/7173/6632979701_05ffbf9c3a_z.jpg,2,3, 
sadness,http://farm4.staticflickr.com/3739/9516293727_d8487e2128_z.jpg,1,4, 
sadness,http://farm4.staticflickr.com/3342/3631496806_3ed16c5838_z.jpg,0,5,"Sadness A statue at the Salt Lake City Cemetery. This was so touching, I am planning on going back and taking a photo of the words engraved on it. Lensbaby composer at F2.8.  View On Black"
sadness,http://farm9.staticflickr.com/8436/7767117764_5e07ece5ba_z.jpg,0,5,Beautiful Sadness Explore Poetic Expressions Photography1's photos on Flickr. Poetic Expressions Photography1 has uploaded 82 photos to Flickr.
sadness,http://farm6.staticflickr.com/5486/12292835116_2f6687986d_z.jpg,2,3, 
sadness,http://farm4.staticflickr.com/3471/3273426240_e853e802e9_z.jpg,1,4,"Lasagna for One These aren't tears of sadness because you're leaving me I've just been cutting onions I'm making a lasagna For one Oh, I'm not crying No"
sadness,http://farm6.staticflickr.com/5176/5406286590_fc12127a1e_z.jpg,2,3,loss fifty nine  I learned this morning that a colleague who had to take her dog to the emergency vet on Sunday has lost her hound. It's an all too familiar scenario for me. I feel for her as I know how difficult it is. She did not come into work today.
sadness,http://farm6.staticflickr.com/5519/12819117473_1a16a1dce9_z.jpg,2,3,"Amnesty International gedenkt der Toten vom Maidan Mehrere Dutzend Aktivisten von Amnesty International und Untersttzer der ukrainischen Opposition haben am Brandenburger Tor in Berlin mit Kerzen, sowie in Reden und mit Liedern den Opfern der Auseinandersetzungen auf dem Maidan in Kiew gedacht. Zudem fordert Amnesty International die Verantwortlichen in der Ukraine auf, die Tter und Verantwortlichen fr die Gewalt zur Verantwortung zu ziehen, sowie die Festgenommenen freizulassen."
sadness,http://farm9.staticflickr.com/8295/7941469154_c3a87bb0b5_z.jpg,2,3, 
sadness,http://farm8.staticflickr.com/7016/6713473397_fe31fd3462_z.jpg,2,3,happy sadness Explore miss.pipedream.'s photos on Flickr. miss.pipedream. has uploaded 1045 photos to Flickr.
sadness,http://farm9.staticflickr.com/8486/8287502262_2619032f6e_z.jpg,2,3,Only new teddy can stop the sadness. Only new teddy can stop the sadness.
sadness,http://farm7.staticflickr.com/6114/6375878175_060bcd9027_z.jpg,2,3,Sadness Explore Dion C. Howard's photos on Flickr. Dion C. Howard has uploaded 135 photos to Flickr.
sadness,http://farm9.staticflickr.com/8035/8006825197_51d3680fe2_z.jpg,2,3,"2012-08-12 Brave At the Steenbrugge Municipal Cemetery near Bruges, Belgium cmsen.eghn.org/steenbrugge See all the pics I took at this stunning place: bit.ly/SFlRWj                                "
sadness,http://farm4.staticflickr.com/3524/3765019484_34d21a730b_z.jpg,1,4,"They say the war is over, but it'll never be home... Explore Lindsaymp's photos on Flickr. Lindsaymp has uploaded 1498 photos to Flickr."
sadness,http://farm3.staticflickr.com/2844/11331325904_a5043e89b7_z.jpg,1,4,Vale of tears Serie Altheia
sadness,http://farm3.staticflickr.com/2934/14549627513_b40f2e3b5b_z.jpg,2,3, 
sadness,http://farm5.staticflickr.com/4111/5097430059_d85deb5903_z.jpg,0,5,"Lost Light: Single flash on a shoot-through umbrella, camera left & above."
sadness,http://farm5.staticflickr.com/4085/5194573992_47af2f37dc_z.jpg,2,3,sadness Explore amiramaxi's photos on Flickr. amiramaxi has uploaded 18 photos to Flickr.
sadness,http://farm8.staticflickr.com/7360/9228093575_37fcc79185_z.jpg,1,4,"Crying little asian girl sitting alone on a playground Crying little asian girl sitting alone on a playground, Outdoor"
sadness,http://farm8.staticflickr.com/7071/7211515132_b3d622f6ec_z.jpg,0,5,"love the work of the artist - This was taken from a postcard. After one year holding to it I contacted the artist and she sold me a bigger copy of large picture. Could any one suggest where I could hang it. I have a great connection with it but there is a sadness that not everyone appreciates, I will try to correct the lighting later."
sadness,http://farm8.staticflickr.com/7361/13912377018_d52b0f9c11_z.jpg,2,3,"If i ever leave this world alive, you be ok  She said im ok im alright you said i would and i am. Ever since YOU LEFT i learned to ok. So when i leave this would tonight that sadness that you feel will subside.  HORodriguez Explore Pekado77's photos on Flickr. Pekado77 has uploaded 158 photos to Flickr."
sadness,http://farm3.staticflickr.com/2912/13959351218_a0803a0593_z.jpg,2,3,Fobia I: La Muerte Explore Dani Jan's photos on Flickr. Dani Jan has uploaded 263 photos to Flickr.
sadness,http://farm8.staticflickr.com/7426/13998357970_3a62771621_z.jpg,1,4,School Assignement - Sadness. Explore tea_hillzy's photos on Flickr. tea_hillzy has uploaded 30 photos to Flickr.
sadness,http://farm4.staticflickr.com/3300/3555188830_f8c537065d_z.jpg,2,3,Sadness Maybe she is sad that sbl is no more...I'm not though : P
